source,title
20minutes.fr,L'actrice Selma Blair parle de son combat contre la dépression et l'anxiété
20minutes.fr,The Cranberries: Le petit ami de Dolores O’Riordan est inconsolable
20minutes.fr,Une star de «Black Mirror» confie avoir été agressée sexuellement
20minutes.fr,L’actrice Jennifer Garner a du mal à refaire sa vie
20minutes.fr,Laverne Cox est indignée par le traitement des transgenres par la police
20minutes.fr,Céline Dion pose complètement nue pour «Vogue»
20minutes.fr,Halle Berry ne veut plus entendre parler d’amour
20minutes.fr,Paris Jackson prône le naturisme
20minutes.fr,Instagram: Un cliché montrant les règles d’une femme censuré deux fois
20minutes.fr,VIDEO. Courtney Love rend un vibrant hommage à Milos Forman
20minutes.fr,Frances Bean Cobain célèbre deux années de sobriété
20minutes.fr,Tyrese Gibson obtient la garde partagée de sa fille
20minutes.fr,"Tyrese Gibson («Fast & Furious»), accusé par son ex d’agression sur leur fille, lui répond"
20minutes.fr,Lady Gaga s'engage dans la lutte contre le cancer
20minutes.fr,"Fin du voyage! Après Steven Gerrard, Frank Lampard prend sa retraite"
20minutes.fr,Irak: Un soldat américain provoque Daesh sur «Pokémon GO»
