source,title
570news.com,"Pistol Annies tackle divorce, complicated women with humour"
570news.com,Steven Yeun takes a leap into Korean cinema with 'Burning'
570news.com,'No answers for me:' Chief says First Nations left out of McMurray fire response
570news.com,Info on drug use was concealed in report on Hernandez death
570news.com,Progress? Gridlock? How midterm vote could affect US economy
570news.com,"GE slashes dividend, takes $22 billion charge in 3Q"
570news.com,"Putin critic fights to remain in Canada, fears for life if sent back to Russia"
570news.com,Ava DuVernay to make Prince documentary for Netflix
570news.com,Shooting reshapes Liberals' apology for 1939 refusal of ship of Jewish refugees
570news.com,New Zealanders turn out to see royals despite rain and wind
570news.com,"WestJet Airlines reports $45.3M Q3 profit, down from $135.9M a year ago"
570news.com,"Air Canada, WestJet latest companies to cut ties to SeaWorld ahead of whale bill"
570news.com,Global wildlife populations dropped by 60 per cent in 40 years: WWF
570news.com,Thousands of Syrians stuck in the desert risk starvation
570news.com,Actress accuses Geoffrey Rush of touching her breast
570news.com,"In the news today, Oct. 30"
570news.com,SNC-Lavalin preliminary inquiry begins in Gadhafi-era fraud and corruption case
570news.com,Alberta Human Rights Commission wants to appeal school prayer spat to top court
570news.com,US election integrity depends on security-challenged firms
570news.com,Man accused of threatening call to public safety minister found not guilty
570news.com,Motion seeks end to Calgary's potential hosting bid for 2026 Winter Olympics
570news.com,Guitarist Jimmy Page looks back at 50 years of Led Zeppelin
570news.com,Work continues in Texas to honour black sailor Doris Miller
570news.com,IBM's $34B Red Hat deal is risky bid to boost cloud business
570news.com,Markets Right Now: Stocks swoon again as tech companies sink
570news.com,American Apparel is staging a comeback with a few twists and a Canadian owner
570news.com,"Canadian crude-by-rail exports rise to new record of 229,544 bpd in August"
570news.com,Hilary Duff and boyfriend announce birth of their daughter
570news.com,Energy giant BP says 3Q earnings more than double
570news.com,Russia releases Pakistani pop singer flying around the world
570news.com,Trump: End birthright citizenship for some US-born babies
570news.com,"Review: 'Bohemian Rhapsody' won't rock you, but Malek will"
570news.com,"Sony quarterly profit rises on games, financial services"
570news.com,"Honda reports rise in profit on cost cuts, healthy sales"
570news.com,US home price gains weaken for 5th straight month
570news.com,3 Asian nations warn citizens not to use marijuana in Canada
570news.com,Recording Academy to honour Willie Nelson
570news.com,Aphria to begin trading on NYSE on Friday under APHA ticker symbol
570news.com,Liberals to establish commission for independent leaders' debates
570news.com,Sarah Henstra wins Governor General's fiction prize for book on campus politics
570news.com,A look at the 14th Amendment's Citizenship Clause
570news.com,"Montreal hit with rotating Canada Post strike; 6,000 workers walk off job"
570news.com,Chamber of Commerce calls for federal funding to stop pine beetle spread
570news.com,Saudi ties to US colleges come under mounting scrutiny
570news.com,Cynthia Nixon among readers at Ursula K. Le Guin tribute
570news.com,Cineplex testing paid Scene Gold loyalty program with extra benefits in Edmonton
570news.com,"US West's abandoned mines hold danger and, for some, thrills"
570news.com,South Sudan rebel leader Machar to return
570news.com,Incumbent B.C. mayor wins election decided by pulling a name out of a box
570news.com,"Private operators to pick up much of B.C.'s Greyhound's routes, but gaps remain"
570news.com,South Sudan rebel leader Machar to return on Wednesday
570news.com,NYC allocates $1.9 million to Louis Armstrong museum
570news.com,SaskPower makes agreement to buy more megawatts from Manitoba Hydro
570news.com,Lion Air crash renews concerns about Indonesia airlines
570news.com,Mexico referendum cancels partly built $13 billion airport
570news.com,Actor John Jarratt appears in Sydney court on rape charge
570news.com,Strong but deep quake rattles New Zealand's North Island
570news.com,Anger toward media spreads into local communities
570news.com,"Janelle Monae on Lauryn Hill, vinyl and 'Dirty Computer'"
570news.com,Colorado lawsuit could ripple through US cannabis industry
570news.com,Manitoba NDP leader's criminal past fair game in legislature: Speaker
570news.com,"Can't always treat everyone the same, commissioner says of straight-pride flag"
570news.com,Lawsuit: Trump misled investors in money-losing company
570news.com,Keith Urban pays tribute to firefighter killed in storm
570news.com,Alberta city honouring four Humboldt Broncos players close to fundraising goal
570news.com,"100s of Oregon 'witches' paddle down river, minus the brooms"
570news.com,US government broadcaster to punish workers for Soros report
570news.com,Government ushers in pay equity legislation for federally regulated workers
570news.com,Debate over recognizing sex work divides Quebec women's federation
570news.com,Cordillera Communications selling all 16 TV stations
570news.com,Singer Candi Staton says she has breast cancer
570news.com,Concert will raise money for Hurricane Florence victims
570news.com,Yazidi refugee woman urges government for help navigating new world
570news.com,"AP Explains: Gab, where Pittsburgh shooting suspect ranted"
570news.com,McConaughey gives back to first responders in Texas visit
570news.com,Celebrity birthdays for the week of Nov. 4-10
570news.com,Suit says New Hampshire lawmaker hit porn film maker
570news.com,Can a holographic screen help a new phone break out?
570news.com,Tyler Perry and Tiffany Haddish sombre at film premiere
570news.com,The Latest: Leicester players visit memorial to Thai owner
570news.com,Iowa library considers options after burning of LGBTQ books
570news.com,NHL partners with MGM to share data for sports betting
570news.com,Bombardier Transportation replaces president of Americas amid project delays
570news.com,Synagogue suspect at courthouse; survivors recall ordeal
570news.com,Transportation Safety Board concerned about 'pervasive' employee fatigue
570news.com,Serbian govt criticized for publishing war criminals' books
570news.com,Crown paints scene of chaos as murder trial begins for alleged Eaton Centre shooter
570news.com,Ronaldo says rape allegation affecting his personal life
570news.com,Bedrock stress factor in fracking-caused earthquakes: study
570news.com,"Yellowknife man fined, grounded for 3 years, flew drone too close to airport"
570news.com,Meghan's wedding gown goes on display at Windsor Castle
570news.com,Crescent Point reports $30.5M Q3 profit compared with a loss a year ago
570news.com,Trans Mountain like Monty Python's dead parrot under Trudeau government: Scheer
570news.com,Study finds LGBTQ characters on network TV hit a record high
570news.com,Worker dies after being pinned by machine at Alberta chemical plant
570news.com,Cirque du Soleil's Saudi Arabia show 'difficult' for founder Guy Laliberte
570news.com,WorkSafeBC report cites safety failures in derailment that killed 3 workers
570news.com,Saudi prince's message may not be enough to repair damage
570news.com,More charges against U.S. man accused of kidnapping Alberta model
570news.com,Astronaut David Saint-Jacques awaits green light for space trip after Soyuz mishap
