source,title
8newsnow.com,"Man barricaded in apartment near Jones and Gowan, Metro says |"
8newsnow.com,Few details in weekend shooting that left teen dead | News
8newsnow.com,"2 people arrested, 2 cited, 1 pepper-sprayed during incident at Centennial High |"
8newsnow.com,"1 person killed in wrong way crash on 215, near Cheyenne |"
8newsnow.com,Yarn Stormers Aim to Class Up Bare Neighborhoods | Arts & Culture
8newsnow.com,Millions spent to control flooding in Las Vegas valley |
8newsnow.com,Metro Police helps elderly couple after alleged thieves ransack home |
8newsnow.com,3 people dead from apparent murder-suicide in northwest valley |
8newsnow.com,Electric Daisy Carnival Lost and Found Offers Second Chances | Environment
8newsnow.com,Arrest made in case of woman found shot to death in apartment |
8newsnow.com,"Report: Woman says boyfriend choked her before she shot, killed him |"
8newsnow.com,Nevada Supreme Court ruling brings ESA program to a standstill |
8newsnow.com,Driver claims she got $200 ticket for putting on lip balm behind the wheel | News
8newsnow.com,Family and friends helping with search for missing swimmer | News
8newsnow.com,Las Vegas Laser Center | Health & Beauty
8newsnow.com,Inmates Moving to North Valley Complex | News
8newsnow.com,Police find woman dead under car in northwest Las Vegas |
8newsnow.com,WARNING: Scammers use NHP and names of charitable groups to seek donations |
8newsnow.com,Sister of teen killed by DUI driver in Huntington Beach crash ‘crused' over his death |
8newsnow.com,At-Risk Schools Partner with Station Casinos | Education & Schools
8newsnow.com,Boom of new business surge in northwestern Las Vegas |
8newsnow.com,Suspect Accused of Beating Woman with Hammer | Crime
8newsnow.com,Nellis Air Force Base's rich history |
8newsnow.com,Ranger offers life-saving advice to Lake Mead boaters | News
8newsnow.com,"Dealership Sees Sales Improving, Moves to New Location | Business"
8newsnow.com,BBB Holds Shredding Event This Weekend | News
8newsnow.com,New program to register home surveillance systems with Metro |
8newsnow.com,"Substitute teacher, assistant coach at Legacy High arrested for sexual acts with student |"
8newsnow.com,Man shot multiple times near Craig and Nellis | News
8newsnow.com,"Police: Fight leads to death, suspect on the loose | News"
8newsnow.com,Record low water levels predicted for Lake Mead | News
8newsnow.com,Clark County issues Declaration of Emergency for Mt. Charleston |
8newsnow.com,City marshals looking for persons of interest in car burglaries | Crime
8newsnow.com,Metro Police looking two men who robbed electronics store | Crime
8newsnow.com,Man in critical condition after being shot by police officer |
8newsnow.com,Expert warns residents about importance of buying flood insurance early | News
8newsnow.com,Man allegedly hit woman with steel rod before barricading self in home |
8newsnow.com,Preliminary Hearing Set for Airman Accused of Murder | News
8newsnow.com,Pedestrian Killed in Accident Near Flamingo and Jones | News
8newsnow.com,Reward offered in killing of 8 mule deer near Mt. Charleston |
8newsnow.com,2 public pools closed after Staph bacteria discovered | News
8newsnow.com,Students get new crosswalk near Wright Elementary | Education & Schools
8newsnow.com,I-Team: UNLV geologists ordered to keep quiet over asbestos | News
8newsnow.com,Small farm owner worries about city's effort to annex county property |
8newsnow.com,Park service warning of Swimmer's Itch at Lake Mead | Health
8newsnow.com,Master Planned Housing Community to be Built in NW Las Vegas | News
8newsnow.com,Wells Fargo offering reward in attempted bank robbery | Crime
8newsnow.com,"6 arrested in connection with carjacking, home invasion crime spree in northwest valley |"
8newsnow.com,Silverstone Golf Course property sold for second time |
8newsnow.com,CCSD opens 6 new schools Monday |
8newsnow.com,Shredding Event Planned for Saturday | Community Spirit
8newsnow.com,I-Team: Ex-officer suffers ill effects of asbestos | News
8newsnow.com,"3 dogs killed in fire, senior man hospitalized |"
8newsnow.com,More pictures of small plane that crashed in golf course pond |
8newsnow.com,"Metro: 4 suspects in 7-Eleven robbery, shooting may be juveniles; surveillance video released |"
8newsnow.com,I-Team: SNWA approves water rate hike | News
8newsnow.com,NV Energy to build $50M solar plant at Nellis Air Force Base | News
8newsnow.com,"Silverstone golf community still in limbo, racking up code violations |"
8newsnow.com,Report: Shooting victims tried to help suspect's distressed mother |
8newsnow.com,'Friendly' suspects target elderly with landscaping ruse | News
8newsnow.com,Voters set record numbers first 2 days of early voting |
8newsnow.com,Centennial Hills Hospital Unveils State-of-the-Art Surgery Scanning System | Health
8newsnow.com,One dead in crash near Flamingo and Rainbow | News
8newsnow.com,More military medical specialists to train at UMC | News
8newsnow.com,Santa at Town Square Offering Reservations | Business
8newsnow.com,"Boy, 11, arrested after gun goes off in classroom | News"
8newsnow.com,"Wolfgang Puck, CCSD Team Up for School Lunch | Education & Schools"
8newsnow.com,First responders mourn attendant's death in ambulance crash |
8newsnow.com,Metro launches program aimed at helping troubled youth | News
8newsnow.com,"Neighbors on guard after homeowner shoots, kills teen home intruder |"
8newsnow.com,Organizers Release EDC Economic Impact Study | Arts & Culture
8newsnow.com,"2 Dead, 3 Injured in Crash on I-15 Near Apex | News"
8newsnow.com,"One dead, 15 others rescued at Lake Mead Sunday | News"
8newsnow.com,Aviation Nation Launches at Nellis | Community Spirit
8newsnow.com,"Coroner IDs woman killed in 9-car-pile-up at Cheyenne, Jones | News"
8newsnow.com,Neighbors react to child's death |
8newsnow.com,Cousins killed days apart in unrelated shootings |
8newsnow.com,Motorcyclist killed in collision in residential area |
8newsnow.com,Man Hit By Car on Flamingo Road | News
8newsnow.com,Southwest condo complex suffers multiple mailbox break-ins | News
8newsnow.com,Car Company Moving Headquarters Closer to Las Vegas Strip | News
8newsnow.com,Metro Police Plans Several Celebrations of National Night Out | Community Spirit
8newsnow.com,Pit bull euthanized following baby's death |
8newsnow.com,"City imposes $97,000 fine on owners of Silverstone golf course |"
8newsnow.com,Boat renters not required to take online boater safety test | News
8newsnow.com,I-Team: Nurse Gets Max Sentence in Child Sex Assault Case | News
8newsnow.com,Surveillance video catches mailbox thieves in the act |
8newsnow.com,"1 killed in fight near Jones, US 95 | News"
8newsnow.com,Family of Alyssa Otremba still seeking justice after 5 years |
8newsnow.com,Fourth of July 2016 fireworks and events |
8newsnow.com,Jimmie Johnson the Favorite for NASCAR Win | Gaming News
8newsnow.com,7-hour police standoff results in arrest of sexual offender | News
8newsnow.com,White House considers Nevada Gov. Sandoval for Supreme Court |
8newsnow.com,Happy Nevada Day! Celebrating the day Nevada was added to the Union |
8newsnow.com,Sale of Land for Senior Housing Proposed | Housing
8newsnow.com,Fatal Bus Stop Crash Driver Appears in Court | News
8newsnow.com,Parents fight to keep Quest Preparatory Academy open |
8newsnow.com,Popular Picnic Areas on Mt. Charleston set to Close | Environment
8newsnow.com,New sensors in remote areas will immediatly alert NV Energy to outages |
8newsnow.com,"Boulder City welcomes the spirit of Christmas; parties, parades, Santa’s train | Events"
