source,title
abcnews.go.com,Rabbi says he won't meet with Trump as synagogue shooting victims' funerals begin
abcnews.go.com,"Halloween can be deadly for pedestrians, traffic study says"
abcnews.go.com,Trump says he plans to end birthright citizenship for babies born to noncitizens
abcnews.go.com,Some top leaders in Congress won't appear with Trump in Pittsburgh
abcnews.go.com,"West's old mines hold danger for some, adventure for others"
abcnews.go.com,Review: Hunter S. Thompson bio tackles late reporter's drive
abcnews.go.com,"Whitey Bulger, notorious Boston mob boss, dies in prison"
abcnews.go.com,3 children killed at school bus stop in Indiana
abcnews.go.com,"Pistol Annies tackle divorce, complicated women with humor"
abcnews.go.com,Beatles release new video for 'Glass Onion' on Apple Music
abcnews.go.com,Guitarist Jimmy Page looks back at 50 years of Led Zeppelin
abcnews.go.com,The Latest: Migrant caravan on the move again
abcnews.go.com,"After Pittsburgh shooting in Mr. Rogers' real-life neighborhood, Squirrel Hill neighbors follow his lead"
abcnews.go.com,Gillum’s rise indicative of discontent Floridians have with Republicans
abcnews.go.com,"Holocaust survivor faces evil, cheats death for second time"
abcnews.go.com,"That's a lot of scratch: The $48,329 allergy test"
abcnews.go.com,The Latest: New iPads embrace facial recognition
abcnews.go.com,Grandfather builds school-bus Halloween costume for 5-year-old who uses wheelchair
abcnews.go.com,"'Ocean's Eleven'-like crew used acrobats, strongmen and techies in bold jewel heists: Authorities"
abcnews.go.com,"Cardi B opens up about fears of motherhood, dreams for her daughter Kulture"
abcnews.go.com,Tyler Perry wants Whoopi Goldberg and Tiffany Haddish to make 'Sister Act 3'
abcnews.go.com,Trump says market is in 'slight pause' because of upcoming midterms
abcnews.go.com,Spain and the Vatican at odds on possible reburial of Franco
abcnews.go.com,Romania marks 3 years since deadly nightclub fire
abcnews.go.com,At least 10 dead as violent storms buffet Italy
abcnews.go.com,"Whitey Bulger, Boston gangster, found dead in prison at 89"
abcnews.go.com,AP All-America Watch: TD-scoring d-tackle; Gophers star WR
abcnews.go.com,Olympian Shaun White apologizes for 'insensitive' Halloween costume
abcnews.go.com,Pakistan set to rule on woman facing death for blasphemy
abcnews.go.com,Time for Penny Hardaway to transfer hoopla into hoop wins
abcnews.go.com,Jury struggling in murder trial of ex-Michigan trooper
abcnews.go.com,Recycle that: Many household items find surprising new lives
abcnews.go.com,Bosnia police move migrants camping near Croatia's border
abcnews.go.com,Big 12 adopts verification of Baylor Title IX reforms
abcnews.go.com,Wide receiver Golden Tate heading from Lions to Eagles
abcnews.go.com,New mom who survived cancer creates 'no breastfeeding zone' sign for delivery room staff
abcnews.go.com,Party held for homeless baby born in wake of hurricane
abcnews.go.com,"Helped by solid earnings, US stock indexes turn higher again"
abcnews.go.com,White deer have unusual home in upstate NY _ old Army depot
abcnews.go.com,Denmark alleges Iran plotted to kill activist on Danish soil
abcnews.go.com,US trial for 'El Chapo' set to begin next month
abcnews.go.com,Coke rides on sales of healthier drinks
abcnews.go.com,Ben & Jerry's unveils Pecan Resist flavor ahead of midterms
abcnews.go.com,Investigation grows as no survivors from plane crash
abcnews.go.com,Man called 'mastermind' of prison riot severed from trial
abcnews.go.com,The Latest: Couple says fatal fall victim captured in selfie
abcnews.go.com,"3 siblings struck, killed by truck at bus stop in Indiana"
abcnews.go.com,Lebanon accuses editor of harming relations with Saudis
abcnews.go.com,F1 driver Ericsson moving to IndyCar with Schmidt Peterson
abcnews.go.com,How close is London to getting an NFL franchise?
abcnews.go.com,US consumer spirits rise to new 18-year high in October
abcnews.go.com,The Latest: Mourners line up for Rosenthal brothers' funeral
abcnews.go.com,Progress? Gridlock? How midterm vote could affect US economy
abcnews.go.com,EU antitrust regulator investigates steel joint venture deal
abcnews.go.com,"Still golden: Biles, Americans roll at world championships"
abcnews.go.com,"Pilot crashes plane into lake, leaves wreckage, hitches home"
abcnews.go.com,Jerry Jones defends Jason Garrett for attending World Series game
abcnews.go.com,Police: Railroad worker concealed involvement in train wreck
abcnews.go.com,Farmers fear it will take years to recover from storm strike
abcnews.go.com,Nick Nurse's long route from pole-vault pit to Raptors coach
abcnews.go.com,Cavs' star Love could miss significant time with foot injury
abcnews.go.com,Court says Hopkins doctor had protection as expert witness
abcnews.go.com,Florida invests $3.5M to finish Everglades highway project
abcnews.go.com,Officer who mistook detective for gunman testifies at trial
abcnews.go.com,Man resentenced to 40 years in parents' 1996 murder
abcnews.go.com,Nevada sportsbooks have record September
abcnews.go.com,Bulgarian authorities bust fraudulent passport scheme
abcnews.go.com,"Harry, Meghan join 'welly wanging' contest in New Zealand"
abcnews.go.com,"James ""Whitey"" Bulger, Boston gangster who was once one of America's most wanted fugitives, found dead in prison at 89."
abcnews.go.com,"Florida man sues Tesla over autopilot feature, crash"
abcnews.go.com,2 men charged after officer chasing them fell to his death
abcnews.go.com,"When NASA engineers enter a pumpkin carving contest, they go big"
abcnews.go.com,Tesla's Musk buys about $10M in company stock
abcnews.go.com,"The Latest: 3 siblings struck, killed by truck at bus stop"
abcnews.go.com,UN demands immediate halt to attacks in Ebola areas in Congo
abcnews.go.com,Harley-Davidson to recall nearly 178K bikes to fix clutches
abcnews.go.com,Greek prosecutor seeks 9 convictions in US tourist's killing
abcnews.go.com,Report: Human error blamed in woman's death after power cut
abcnews.go.com,Whitey Bulger transferred to prison in West Virginia
abcnews.go.com,Seahawks' Mychal Kendricks eligible to play in Week 14 after ban
abcnews.go.com,Philadelphia's decadent 'Wing Bowl' no more after 26 years
abcnews.go.com,Raiders CB Dominique Rodgers-Cromartie announces retirement
abcnews.go.com,Seahawks' Kendricks banned 8 games for insider trading
abcnews.go.com,"'I don't forgive this woman, and she needs help': Black child wrongly accused of grabbing 'Cornerstore Caroline'"
abcnews.go.com,"Lone 18-year-old kills 18 people, many of them teens, in shooting and bomb attack at college, Russia says"
abcnews.go.com,"Death of Roseanne's character from opioids shines light on 'real crisis' in US, says 'The Conners' star"
abcnews.go.com,How this mom revealed to her husband why she's always exhausted is all of us
abcnews.go.com,What's behind Trump's 'Pocahontas' taunt of Warren
abcnews.go.com,"Anheuser-Busch sending 300,000 cans of drinking water to areas ravaged by Hurricane Michael"
abcnews.go.com,Everything we know about Lady Gaga's apparent engagement
abcnews.go.com,"At Vatican, South Korean leader says he's certain of peace"
abcnews.go.com,Russian Orthodox church splits with Orthodoxy's leader in seismic rift over Ukraine
abcnews.go.com,The Latest: Toll in Crimean school shooting rises to 19 dead
abcnews.go.com,Houston Astros players come out in support of 8-year-old scolded for cheering them on
abcnews.go.com,Ruth Bader Ginsburg says she is 'really turned on' by #MeToo movement
abcnews.go.com,"12-year-old Boy Scout killed when car plows into group, suspected driver charged with DUI"
abcnews.go.com,"New Jersey man performed dental work without license or training, authorities say"
abcnews.go.com,Melania Trump says she supports #MeToo movement but accusers need 'really hard evidence'
abcnews.go.com,London whale watchers gather to see Beluga stranded in the River Thames
abcnews.go.com,Trump tells Mattis 'I'm a 100 percent with you'
