source,title
ack.net,Chamber moves Christmas Eve drawing back to 3 p.m.
ack.net,The Inquirer and Mirror
ack.net,Just one day away! I&M Main Street Halloween parade Wednesday
ack.net,Florida county's Republican Party headquarters vandalized by gunfire
ack.net,Usher leads Whalers past Case in Div. 7 South playoff opener
ack.net,Powerful nor'easter expected to reach Nantucket by Saturday morning
ack.net,Flag status: Half-staff for victims of Pittsburgh synagogue shooting
ack.net,Boom in student population may point to need for new middle school
ack.net,Less than a week and counting! I&M Main Street Halloween parade Wednesday
ack.net,Out and about on an Owl Prowl
ack.net,Hospital opposes Question 1 on nurse staffing
ack.net,Hy-Line winter schedule in effect
ack.net,Hy-Line winter schedule starts today
ack.net,Sixteen Things to Do Today on Nantucket
ack.net,Vigil Sunday night at Unitarian Meeting House
ack.net,"Cisco Brewers sells distribution, brewing business for $23 million"
ack.net,Main Street Halloween Celebration Oct. 31/Enter our Candy Contest Today!
ack.net,Young Nantucketers drawn to careers on the water
ack.net,"""Underwater gardening"" restores bay scallop habitat"
ack.net,Nine Things to Do Today
ack.net,Stop & Shop evacuated after suspicious package reported
ack.net,Chamber of Commerce polling community on moving Red Ticket Drawing to noon Dec. 24
ack.net,Flag status: Half-staff Saturday for Hopedale Army veteran
ack.net,Early voting underway on Nantucket
ack.net,Nantucket man pleads guilty to drug charges; sentenced to two and a half years in jail
ack.net,Nantucket man arrested on gun charges following traffic stop
ack.net,Asphalt tanker disabled southeast of Nantucket towed to New York Harbor
ack.net,Vineyard Wind confident it will be producing power by 2021
ack.net,Flag status: Half-staff Sunday for fallen firefighters service
ack.net,Select Board briefed on genetically-altered mice plan
ack.net,Nantucket Citizen Science Weekend kicks off today
ack.net,"Nantucket Bank bought by Rockland Trust, name stays"
ack.net,Nantucket's African Meeting House vandalized with racist graffiti
ack.net,Video: A mid-October Nantucket storm
ack.net,Work on Sagamore Bridge over Cape Cod Canal to wrap up by Friday
ack.net,Essex Road man acquitted of drug distribution charges
ack.net,Peter MacKay leaves Nantucket Cottage Hospital after 33 years
ack.net,Archery deer-hunting season underway on Nantucket
ack.net,Town taking shark presence seriously
ack.net,"Christian Broder, Millie's manager, dies from gunshot wounds"
ack.net,Mid-island bowling alley proposed on Dave Street
ack.net,"Philbrick, Young among Chamber honorees"
ack.net,Momentum grows in grass-roots group opposing Surfside Crossing
ack.net,"Hill Holdgate reelected to Select Board; McClure, Wegner to Planning Board; Iller, Sortevik to School Committee"
ack.net,"Video: Remembering town clerk Catherine Flanagan Stover, overseer of elections"
ack.net,Man convicted of killing Nantucket woman seeks new trial
ack.net,Mice vs. Ticks: The bioethics of genetic modification
ack.net,Editorial: The need for a free press
ack.net,"Islanders advised to be aware of Hurricane Florence, but impact expected to be minimal"
ack.net,Eight Things to Do Today
ack.net,"DPW plans to repair Main Street sidewalks, streets not well received by all"
ack.net,JFK bunker at Tom Nevers may be new museum
ack.net,Nobby Shop closing signifies end of an era
ack.net,Lightning strike starts fire in Middle Tawpawshaw Road home
ack.net,Select Board slaps Wine Fest: Says no to culinary tent at Jetties
ack.net,Steamship Authority website back online
ack.net,Nantucket High School Homecoming week underway
ack.net,Seasonal jet service to Nantucket more robust than ever
ack.net,The Inquirer and Mirror
ack.net,Emotional ceremony honors slain officer's work as youth mentor
ack.net,New dispensary looking for mid-island approval
ack.net,Cozort retiring: Schools on the hunt for new superintendent
ack.net,Keller buys Cauldron: Back to Nantucket roots
ack.net,Planning vote on Old South Road project nears
ack.net,High-surf advisory in effect for Nantucket through Friday
ack.net,Former Whalers continuing football careers on college fields
ack.net,Heinz-Kerry waterfront property on Nantucket sells for $17.5 million
ack.net,MMA celebrates 200th birthday of America's first female astronomer Aug. 1
ack.net,Coastal Conservancy files article to give voters say on SBPF
ack.net,Polpis Road man arraigned on child-rape charges
ack.net,Cyr moves airbnb tax through State House
ack.net,Coastal-flood advisory in effect late tonight
ack.net,Navy to name new combat ship USS Nantucket
ack.net,Worth named interim executive director of Nantucket Conservation Foundation
ack.net,"Catherine Stover, town clerk, gone at 66"
ack.net,"Vito Capizzo, legendary football coach, gone at 78"
ack.net,Kerry-Heinz house on market for $25 million
ack.net,Judge rules Camp Richard belongs to Nantucket Scouts
ack.net,"Like mother, like daughter: School, nursing all in the family"
ack.net,"Brian Glowacki, island funny man, hits his stride"
ack.net,Real-estate sales top $1 billion last year
ack.net,"Walter S. Thompson, 79"
ack.net,Nantucket Memorial Airport restaurant closing at end of year
ack.net,"Concerns, support raised at wind farm hearings"
ack.net,"Ben Stiller, Mike Birbiglia to host 2018 Film Fest Screenwriters Tribute"
ack.net,"Video: Jeff Ross, Island Troubadour"
ack.net,The Inquirer and Mirror
ack.net,STM article aimed at 40B won't have its desired effect
ack.net,One more summer for valet parking in National Grid lot
ack.net,State blocks Land Bank on Miacomet dorm
ack.net,Beatles tribute band special guest at Pops fundraiser
ack.net,Vehicle access to Great Point prohibited
ack.net,National Grid bringing back-up power to the island for the summer
ack.net,"Cowboy's closing, Wicked Island Bakery moving in after Jan. 1"
ack.net,Piping plovers arrive; Great Point still open to vehicles
ack.net,Video: Nantucket Firecracker 5K Time Lapse
ack.net,Video: Nantucket Fourth of July Water Fight
ack.net,Smoke in cabin of Cape Air plane briefly closes Nantucket airport
ack.net,The Inquirer and Mirror
ack.net,Tuesday Public Safety Awareness Day
