source,title
albawaba.com,OPEC's Crude Oil at $75.71 per Barrel
albawaba.com,Nikki Bella Admits She's Not Ready to Start Dating Following Split From John cena
albawaba.com,Smart Dubai and IBM to Offer the First Government-Endorsed Blockchain Platform in the Middle East
albawaba.com,Pakistan Frees 2 Taliban Leaders in U.S. Confidence-Building Step For Peace
albawaba.com,Step Aside America; India Is Entering the Saudi Cinema Market
albawaba.com,"Osn Brings New Seasons of House of Cards, the Last Kingdom, the Gifted and More, Exclusively to Screens Across the Mena Region This November"
albawaba.com,This Is How AI Helps LinkedIn to Connect the Global Workforce
albawaba.com,World of Warcraft Classic Demo Is Cracked and Here's How You Can Play It
albawaba.com,Tabreed Raises $500 Million With New 7 Year Sukuk
albawaba.com,Hilary Duff Gives Birth to a Daughter
albawaba.com,"Connectivity Is Key to Ultimate Convenience, When It Comes to LG Appliances in the Kitchen"
albawaba.com,RAKBANK Goes Fintech
albawaba.com,UAE Ranks First Globally In Islamic Economy
albawaba.com,Abu-Ghazaleh Inaugurates the 1st Scientific Conference for Jordanian Doctorate Holders Association
albawaba.com,Burgan Bank Announces Another Strong Quarter
albawaba.com,Arab Economic Integration Might Be Around the Corner
albawaba.com,"UNICEF Opens School, Kindergarten in Jordan's Zaatari Camp"
albawaba.com,Believe it or Not But Lebanon is Expected to Have New Cabinet in Next 48 Hours
albawaba.com,National Bank of Fujairah Waives Processing Fees on Education Loans During the Najah Exhibition in Abu Dhabi
albawaba.com,Will Saudi Arabia Be Allowed to Keep Its International Telecommunication Union Membership?
albawaba.com,Cleaner Whose Mobile Was on Video Mode in Women Toilet in Dubai Awaits Sentencing
albawaba.com,Michigan Astronomers Reveal Wonders of Milky Way Galaxies
albawaba.com,Olly Murs Tries to Make Things Right With His Twin Brother After Decade-Long Feud
albawaba.com,Alexis Ren Reveals She Has Feelings For Dancing With The Stars Partner Alan Bersten
albawaba.com,UK Chancellor Unveils Commemorative Brexit 50 Pence Coin to Mark Britain's EU Exit
albawaba.com,AI Humanoid Sophia World's First Robot Embarks on World Tour
albawaba.com,iPhone XR Now Available From Ooredoo
albawaba.com,Backroom Deals and a Chinese-made City: Oman is a Diplomatic Linchpin
albawaba.com,Federal Tax Authority’s Board of Directors Adopts Budget for 2019
albawaba.com,Iraq Has New Cabinet But Without Women
albawaba.com,Man Sentenced to 10 Years for Fatally Stabbing Wife in Dubai
albawaba.com,Ayatollah Khamenei Calls for Better 'Passive Defense' Against Enemies
albawaba.com,Rohingya Genocide in Myanmar Still Ongoing - Burma Rights Group
albawaba.com,Western-Backed 'White Helmets' Seek False Flag Chemical Attack in Syria's Aleppo - Russian Sources
albawaba.com,Is Celeste Barber One of the Most Hated by Hollywood Stars?
albawaba.com,1st Emirati-Made Satellite Launched into Space From Japan's Space Centre
albawaba.com,Trumps Ironclad Supporters in Congress Say Even Tougher Sanctions on Iran Needed
albawaba.com,Why are Black Americans Joining the ‘Blexit’ Movement?
albawaba.com,Israel Appoints Woman as Ambassador in Cairo
albawaba.com,China-UAE Conference on Islamic Banking & Finance to Kick Off in November With Huge Global Participation
albawaba.com,10-Year Anniversary Sees Zain Saudi Arabia Record Its Best-Ever Quarterly Net Profit of SAR48 Million
albawaba.com,81-Year-old Algeria's Bouteflika to Re-Run for President in 2019
albawaba.com,Saudi 'Rijal Alma' Gets Ready for UNESCO’s World Heritage List
albawaba.com,"Japan's Princess Ayako Marries Commoner, Must Leave Imperial Household"
albawaba.com,PLO Calls for ICC Probe Into Killing of 3 Children in Israeli Strike on Gaza
albawaba.com,German Chancellor Merkel to Give up CDU Leadership After 18 Years
albawaba.com,"Iran, Azerbaijan, Turkish Foreign Minister Hold 6th Trilateral Meet in Istanbul"
albawaba.com,Irish Schoolgirl Dresses Up as Her Idol Mo Salah for Halloween
albawaba.com,Saudi Launches Support Center for SMEs
albawaba.com,Asian Football Federation Signs Major Marketing Deal
albawaba.com,Taste For Power Allures Clinton as She Could Still Run for President in 2020
albawaba.com,"In 1st UAE Official Visit, Israeli Minister Visits Sheikh Zayed Grand Mosque in Abu Dhabi"
albawaba.com,Syrian Opposition Welcome Results of 4-Nation Summit in Istanbul
albawaba.com,A Concert Celebrating The Life of Mac Miller is to be livestreamed on Wednesday
albawaba.com,"'Illusion', Sleight of Hand to Rob Bank But he is Quickly Caught by Abu Dhabi Police"
albawaba.com,Saudi Agents Assaulted Dissident Outside Harrods London Only Two Months Ago
albawaba.com,Women Whipped With Boyfriend for Being 'Too Close' in Indonesia's Aceh
albawaba.com,Saudi Arabia’s Top Prosecutor in Istanbul Courthouse Over Khashoggi Murder
albawaba.com,Millions of Shia Pilgrims Descend on Iraq's Karbala for Arbaeen
albawaba.com,Adele Tops The Richest British Celebrity Under 30 for a 3rd Year
albawaba.com,2019 Nissan Patrol Makes It Way To Nissan Al Babtain Showrooms
albawaba.com,Why is Twitter is Thinking About Killing 'Like' Button?
albawaba.com,Aramco Still Pushing for Careers for Women in Saudi
albawaba.com,UN Calls on Riyadh to Stop Execution of Six Minors
albawaba.com,Qatar's National Museum to Open on National Day
albawaba.com,Bank Sohar Serves Thousands With One Minute Mobile Banking Solution
albawaba.com,Woman Stops Traffic & Takes Off Hijab in Middle of Busy Tehran Square
albawaba.com,'Unstable' Woman in Sharjah Killed After Injuring 5 Other Females
albawaba.com,Jordan Teachers Body Defends Education Ministry in Dead Sea Tragedy
albawaba.com,Priyanka Chopra Believes Respect is Important in a Relationship
albawaba.com,Syrians in Golan Heights Protest Municipal Elections Israel Plans to Hold in Occupied Territory
albawaba.com,'Halloween' Movie Tops The Box Office For a Second Week
albawaba.com,UAE Launches KhalifaSat Successfully Into Outer Space
albawaba.com,Hyundai Invests in Human Intuition Technology for Self-Driving Cars
albawaba.com,Wish Partners With Local and International Organizations to Host Exhibition at Summit
albawaba.com,Work on Oman’s $130 Million Barka Marina Project Kicks Off
albawaba.com,"Egypt's Parliament Cracks on Political Islamists, Muzzling Their Websites"
albawaba.com,Tottenham 0 Manchester City 1: Mahrez Settles Ragged Wembley Showdown
albawaba.com,Indonesian Aircraft Crashes Into Sea With 188 Passengers Killed
albawaba.com,UK Cabinet Refuses to Grant Citizenship to Family of Bashar Assad's Uncle
albawaba.com,Breaking: Woman Blows up Herself in Central Tunis
albawaba.com,Cat Steals Fashion Show in Istanbul
albawaba.com,Mahrez Leads African Stars’ Tribute to Late Leicester City Chairman
albawaba.com,"Father Sells 10-Day-Old Baby for $5,772 in China"
albawaba.com,Frankenstein: Making of a Monster Through Electricity
albawaba.com,Kanye West Wants Four More Children
albawaba.com,Turkish FM Calls on Saudi Arabia to Reveal 'All Truth' of Khashoggi Murder
albawaba.com,Iraqi Rapper Narcy Shares His Latest Collaboration With Lebanese Band Mashrou' Leila
albawaba.com,Sheikh Salman Al Khalifa Inaugurates New AFC Headquarters in Kuala Lumpur Tomorrow
albawaba.com,Masry Stick with Coach Hossam Hassan Despite Resignation
albawaba.com,Kim Kardashian's fans Comment on Her Fake Derriere in Her Latest Photoshoot
albawaba.com,Israel to Supply India With $777-Million Missile Defense Systems
albawaba.com,Cardi B Says Her Daughter is a Present From God
albawaba.com,'Sun Alignment' of Ramses Statute in Egypt Celebrated With 3000 Tourists
albawaba.com,Israel Upset at Jordan Stand to Cancel Annexes in 1994 Peace Treaty
albawaba.com,From Brain Surgery to Sports Community Guru: Story of Saudi Sawsan Abdullah
albawaba.com,The Rock Shares a Sweet Video of Him and 6 Months Old Daughter
albawaba.com,Turkey's New Oil Refinery to Reduce Its Trade Deficit by $1.5 Billion
albawaba.com,DED to Strengthen Awareness of Services Offered by BRL to Businessmen at flydubai VIP Lounge
albawaba.com,The Weekend Avoids on-Stage Possible Fatal Injury
