source,title
anorak.co.uk,Spurs Balls: Dele Alli commits himself to the club
anorak.co.uk,After Pittsburgh Jews advised to build militarised homeland to deter attacks
anorak.co.uk,‘Disgusting’ and ‘greedy’: what they said about Leicester City owner Vichai Srivaddhanaprabha
anorak.co.uk,After Pittsburgh the internet bans Gab
anorak.co.uk,After Pittsburgh the righteous and fair blame the Jews
anorak.co.uk,Southampton student leader regrets vow to destroy art painted by Jewish ‘white man’ Sir William Rothenstein
anorak.co.uk,Arsenal vow never to let player contracts run down to final year
anorak.co.uk,Philip Green and my part in his downfall
anorak.co.uk,US Marine Corps draws huge Sky Penis
anorak.co.uk,The British #MeToo and other #iBelieve witch-hunts
anorak.co.uk,The death of bingo halls
anorak.co.uk,Crown Prince Mohammed bin Salman vows to find Jamal Khashoggi killers
anorak.co.uk,Bob Marley features on League of Ireland side Bohemians’ new kit
anorak.co.uk,"Pipe Bombs, Donald Trump and the surge in Demophobia"
anorak.co.uk,Julian Cole: after five years of waiting police sacked for lying over paralysed man
anorak.co.uk,"The Peoples’ March was futile: 700,000 demand the impossible"
anorak.co.uk,Chelsea’s Ross Barkley gets rid of his tattoos
anorak.co.uk,Police escape and race riots averted as Huddersfield rapists jailed
anorak.co.uk,Women fight over the wonderful Ant McPartlin
anorak.co.uk,I Was Big Bird: Caroll Spinney retires from Sesame Street
anorak.co.uk,Julian Cole Truth Campaign: Family want to know who broke his neck?
anorak.co.uk,Saudi Arabia ‘dressed Jamal Khashoggi look-alike in dead man’s Western clothes’
anorak.co.uk,The Civilian Action Trining Program protects Snowflake police from bad words and thoughts
anorak.co.uk,Chow Yun-fat has $714 million to give away
anorak.co.uk,Talking balls: Manchester United sale to Saudi Arabia is on-ish
anorak.co.uk,Aaron Ramsey transfer balls: Everton ready to trump Liverpool and Man United for Arsenal player
anorak.co.uk,Manchester United balls: De Gea flowers amongst the rubble of Mourinho’s collapsing house
anorak.co.uk,Reasons to love Emery: Arsenal got rid of Wilshere
anorak.co.uk,Fugitive Daley Smith lets Madeleine McCann do his PR
anorak.co.uk,"Transfer balls: Manchester United chase Koulibaly, Arsenal take Malcolm on loan from Arsenal and Chelsea underpay Hazard"
anorak.co.uk,Transfer balls: Hazard to Manchester United because he loves Chelsea
anorak.co.uk,This explains Donald Trump’s tweets
anorak.co.uk,Brexit 1 Nick Clegg 0: Facebook seduces Mr EU to Leave for California
anorak.co.uk,Manchester United: De Gea talks contracts amid Juventus rumours
anorak.co.uk,Manchester United: De Ge talks contracts amid Juventus rumours
anorak.co.uk,Arsenal fans lament the loss of their shares to a heartless Kroenke
anorak.co.uk,Saudi Arabia to buy Manchester United – good press guaranteed
anorak.co.uk,Transfer balls: Manchester United to lose de Gea and Real want Pochettino from Spurs
anorak.co.uk,Clickbait balls: Everton and Liverpool both boast the Premier League’s best goalkeeper
anorak.co.uk,Transfer balls: Martial wants to stay at Manchester United
anorak.co.uk,Terry Butcher on England: ‘surgical .. incisive and deadly’
anorak.co.uk,Woman born a man sets world record in first race at world cycling championships
anorak.co.uk,Brexit 1-0: mature student waves adieu to insignificant Englanders
anorak.co.uk,New Spurs stadium Daniel Levy suite and NFL shop almost ready to open
anorak.co.uk,Punters at Ohio haunted house subjected to mock-rape attack
anorak.co.uk,Manchester United feared losing Luke Shaw on a free
anorak.co.uk,"Manchester United Balls: Mourinho sacked today, tomorrow or the next day"
anorak.co.uk,Hate crimes keep on rising as more victims sought
anorak.co.uk,"Transfer balls: Manchester United, Spurs and Chelsea in a ‘bidding war’ for Ake"
anorak.co.uk,Manchester United balls: Mourinho ‘sacked today’ as board back their man
anorak.co.uk,Innocence unproven in the Brett Kavanaugh witch hunt
anorak.co.uk,"Transfer balls: Manchester City’s Foden to Dortmund, Hazard’s Chelsea dream and Manchester United want Ake"
anorak.co.uk,Grenfell fraudster Jenny McDonagh spent stolen money on a huge dildo
anorak.co.uk,Manchester United captain apologises for calling for Mourinho to be sacked
anorak.co.uk,Ivan Gazidis: the towering force who took Arsenal from 1st to 6th
anorak.co.uk,Liverpool’s Salah wins and Ronaldo goes missing at FIFA Best awards
anorak.co.uk,Myra Lewis Williams: ‘When I Was Jerry Lee Lewis’ 13-Year-Old Wife’
anorak.co.uk,Julian Cole: after five years of waiting police sacked for lying over paralysed man
anorak.co.uk,10 reasons why Ivanka Trump should be US Ambassador to the United Nations
anorak.co.uk,"Rotherham: What the police did with teenage ‘prostitutes’, Pakistani men and complicit councillors"
anorak.co.uk,Whatever happened to Dzhambulat Khotokhov the world’s biggest child?
anorak.co.uk,Cambridge University’s Best Bums Contest Is Almost As Fun For Students As Page 3
anorak.co.uk,The 20 Greatest Codas In Popular Music: The Song Goes From Average To Anthem
anorak.co.uk,Four places where you can still see Jimmy Savile on the BBC
anorak.co.uk,Oscar Pistorius murder trial: Reeva Steenkamp’s death is a comic strip
anorak.co.uk,Madeleine McCann: the couple who heard a child crying at night and went to help
anorak.co.uk,Britain’s Worst Cycle Lanes: Photos of That Olympics Legacy In Action
anorak.co.uk,Aberdeen receptionist accidentally sends entire office sexy email meant for fiance
anorak.co.uk,"Prince Andrew sex scandal: Sarah Ferguson, prostitutes and what the sex slave’s lover saw"
anorak.co.uk,Fame Adacemy Meets X Factor: Alex Parks And Joe McElderry Are Learning To Write Songs
anorak.co.uk,Liverpool fans Sean Cox remain in a ‘dire’ state as man accused of attack stands trial
anorak.co.uk,Rick Stein is missing: the greatest obituary to a man of mystery
anorak.co.uk,Madeleine McCann stars in a sick Facebook quiz and audience growth campaign
anorak.co.uk,XX-Factor’s Stereo Kicks Casey Johnson Had Sex Twice A Night: Come Back Fiona Wright
anorak.co.uk,Has Chloe Moretz turned Daily Mail writers into paedos?
anorak.co.uk,Gay Cake bakers rejoice: Supreme Court say bakery was right to refuse to make gay wedding cake
anorak.co.uk,Snooker Champion Jimmy White Was Hooked On Crack And The ‘Devil’s Dandruff’
anorak.co.uk,Abu Hamza’s Family Deserve All The British Benefits They Can Get
anorak.co.uk,The world’s longest chip is not a cheating French Fry
anorak.co.uk,Derek Acorah says Madeleine McCann will be reincarnated as Cheryl Cole’s baby
anorak.co.uk,Jimmy Savile: If only he’d swung his axe like Jimmy Page at Lori Maddox
anorak.co.uk,Hillsborough: 96 Liverpool Fans Killed By ‘A Slum Sport Watched By Slum People In Slum Stadiums’
anorak.co.uk,In 1976 Top of The Pops Feartured Legs & Co Dancing To Lalo Schifrin’s Theme From Jaws
anorak.co.uk,17 Famous Faces Who Were Expelled From School
anorak.co.uk,What’s wrong with Hereford’s Freedom Church?
anorak.co.uk,Palace police mistake Prince Andrew for terrorist as burlgar pays for a private tour
anorak.co.uk,Emily Thornberry And Labour Hate ‘White Man’s Gulch’
anorak.co.uk,10 famous people and good causes Spurs’ Gareth Bale can sue when he owns the love heart hand gesture
anorak.co.uk,Eugenie and Jack Brooksbank order the drinks and leave us with the bill
anorak.co.uk,The Truth About The 796 Dead Babies In Tuam Galway: Catholic Bashers Ignore The Facts
anorak.co.uk,American Family Association leader says Hurricanes and bushfires are God ‘spanking’ gay humanity
anorak.co.uk,Name the BBC staff who let Jimmy Savile attack children and hired rebel ‘paedo’ John Peel
anorak.co.uk,Esther Rantzen: If Jimmy Savile doesn’t bury her husband’s daughter might
anorak.co.uk,Not News: Paul Gascoigne Wears His ‘Beloved Blue Dressing Gown’ To Put Out The Rubbish
anorak.co.uk,Chelsea Balls: John Terry ‘Takes A Pay Cut’ To Reduce Ticket Prices And Hell Freezes Over
anorak.co.uk,Sam Wollaston Is The Witless Antidote To Clive James’ TVGuardian
anorak.co.uk,Barack Obama is no Trayvon Martin – he’s a hypocritcal version of George Zimmerman
anorak.co.uk,Jon Venables: Ralph Bulger’s new book sheds light on James Bulger’s killer
anorak.co.uk,Manchester United: When Assistant Manager Jimmy Murphy Took Over From Matt Busby In 1958
anorak.co.uk,Oh No! Major Character From Family Guy Gets Killed Off!
