source,title
aol.com,12-year-old girl who died chasing her dog onto highway will be buried alongside her beloved pet
aol.com,President Donald Trump says he'd be 'very happy' to run against Hillary Clinton in 2020
aol.com,Kindness of strangers: A day in the life of the migrant caravan in Mexico
aol.com,Couple horrified after finding hidden camera in Carnival Cruise ship bedroom
aol.com,Inside Klay Thompson's and the Warriors' record-breaking night
aol.com,Thousands of US troops could be sent to Mexico border: source
aol.com,"From Beyoncé to Ruth Bader Ginsburg, Check Out These Dogs In Halloween Costumes"
aol.com,Why Joe Giudice's deportation won't play out on 'Real Housewives' (Exclusive)
aol.com,87-year-old man who broke his hip en route to buy Mega Millions ticket wins in hospital pool
aol.com,White woman fired after video of her harassing her black neighbor goes viral
aol.com,The 20 most haunted hotels in America
aol.com,10 Kendra Scott pieces we're loving right now
aol.com,Profession to Passion: How one lawyer left a corporate firm to start baking pies
aol.com,Synagogue suspect in court; survivors recall ordeal
aol.com,Mail bomb suspect in court Monday as CNN reports fresh package
aol.com,"Kellyanne Conway suggests 'late-night comedians' promoting 'anti-religiosity' to blame for synagogue shooting, and Twitter's not having it"
aol.com,From Law to Pies From Law to Pies
aol.com,Report: Prince William tried to steal Prince Harry's spotlight with a new haircut
aol.com,Best Bites: Dracula's Dentures
aol.com,Meghan Markle is welcomed to Auckland with 'Suits' theme song
aol.com,Charlize Theron transforms into Megyn Kelly on the same day NBC host's show gets canceled
aol.com,Meghan Markle's BFF Jessica Mulroney is a new fashion contributor for 'Good Morning America'
aol.com,Top 10 pet Halloween costumes sold on eBay
aol.com,Soviet-era moon fragments could reach $1 million at N.Y. auction
aol.com,Duchess Meghan just pulled a total Kate Middleton move
aol.com,Meghan Markle criticized for 'too' relaxed pose in New Zealand by etiquette experts
aol.com,Wall Street falls on fresh China tariff worries
aol.com,Dancing With the Stars week 6 recap: Which couple didn't 'eek' out a pass?
aol.com,3 ways to reduce heating costs this winter
aol.com,eBay expert reveals the hottest toy of this Holiday season
aol.com,"What It’s Worth: $250,000"
aol.com,Celebrate the Red Sox's World Series win with a new pair of sneakers
aol.com,"North Carolina student dies in shooting, fellow student held"
aol.com,Browns fire Hue Jackson in his third year as coach
aol.com,Stacey Dash reignites feud with Chelsea Handler at black conservative event
aol.com,Melania Trump welcomes trick-or-treaters to the White House in Bottega Veneta coat
aol.com,'The Voice' Contestant Moves Mariah Carey to Tears
aol.com,Meet Hero Pittsburgh Rabbi Who Saved Congregants
aol.com,"Lena Dunham admits addiction, reveals she is 6 months sober"
aol.com,Bob Saget Marries Kelly Rizzo in Beach Wedding
aol.com,'The Voice' Coaches Talk Moment When They Made It
aol.com,Hilary Duff Welcomes Baby Girl
aol.com,Whoopi Goldberg Reminisces About 'Ghost'
aol.com,'The Talk' Rocktober Lip Sync War
aol.com,Divers Carve Halloween Pumpkins Underwater
aol.com,Sofia Vergara Beats Out Kaley Cuoco and Ellen Pompeo for Highest-Paid TV Actress
aol.com,Cacio e Pepe Is The Easiest Dinner Imagineable
aol.com,The Best Celebrity Halloween Costumes of All-Time
aol.com,"Celebs Share Their Scariest, Spookiest Stories"
aol.com,Cute and Crazy Pet Costumes
aol.com,Venice May Be Sinking
aol.com,Toxic Waste Mac & Cheese
aol.com,Julia Roberts explains why she shouldn't star in rom-coms anymore (Exclusive)
aol.com,Meghan Markle Shares Leftover Cake With Kids
aol.com,Dog Loves Jumping into Piles of Leaves
aol.com,Boy Talks About Being Brave After Shots
aol.com,Engineers At NASA Apparently Take Pumpkin Carving Very Seriously
aol.com,Jimmy John’s Founder Surprises Driver With New Car
aol.com,A Look at PA Shooting Suspect’s Hateful Messages
aol.com,Makeup Artist Creates Terrifying Peeling Face
aol.com,The 9 Most Haunted Places in America
aol.com,Ina Garten Talks About Her 'Engagement Chicken' and How It Helped Prince Harry and Meghan Markle
aol.com,Dogs Doing the Snoot Challenge Is the Cutest Trend
aol.com,Tiny living in a motor home is a luxurious dream
aol.com,Terrifying Pumpkin Carving
aol.com,Playful kitten takes on remote control dinosaur
aol.com,Bulldogs Show Off Their Halloween Costumes
aol.com,Kitten Shoves Dog's Face out of Cat Flap
aol.com,Best Cat Fails of the Week
aol.com,Cat Tries to Snuggle Cozily With Friends
aol.com,Cat Hilariously Tries to Drink Water
aol.com,Biscuit 'N Gravy Pie Is What Brunch Was Made For
aol.com,Cats Acting Like Dogs
aol.com,What 1-Day of Eating for a Healthy Gut Looks Like
aol.com,National Cat Day
aol.com,Prince Harry is literally Prince Philip's twin in this 1957 throwback photo
aol.com,Pocahontas descendant: Elizabeth Warren should 'apologize' for Native American ancestry claims
aol.com,Carl's Jr. wants the name of its latest burger in The Merriam Webster dictionary
aol.com,Best Bites: Chorizo sage mac and cheese baked in a squash
aol.com,Profession to Passion: Wall Street businessman turned in his suit to make pizza
aol.com,6 Halloween costumes that are already in your closet
aol.com,Trend Report: 15 pieces of leopard print to add to your wardrobe
aol.com,"Priyanka Chopra, Anna Wintour, Ashley Graham and more attend the 12th Annual Golden Heart Awards"
aol.com,"Pregnant Hilary Duff tries ""The Maternity Salad"" from infamous LA eatery Caioti --legend says it will induce labor within hours"
aol.com,Ancient Viking ship found buried just 20 inches below ground on Norwegian farmland
aol.com,"Wall Street jumps more than 2 percent after earnings, data"
aol.com,Best Bites: Oreo acorn balls
aol.com,Princess Charlotte is a 'replica' of the queen in Princess Eugenie's wedding photos
aol.com,7 watches everyone is wearing this fall
aol.com,CNN: Saudis preparing to acknowledge journalist Khashoggi died after interrogation 'went wrong'
aol.com,Senators asks Google to explain delay in disclosing vulnerability
aol.com,Cancer survivor says store manager told him to cover disfigured face: 'I've never been treated like that'
aol.com,Tech item to keep your family safe while surfing the web
aol.com,Best Bites: Pumpkin spice waffles
aol.com,Ex-Intelligence committee staffer pleads guilty to lying to FBI about leaks to reporters
aol.com,Best Bites: Overnight success: Overnight blueberry waffle bake
aol.com,Police officer urges parents not to buy gun-shaped phone case for children in viral post
aol.com,4 people injured in shooting at business in Madison suburb
aol.com,Best Bites: Weeknight meals one-pot chicken parm pasta
aol.com,A tiny firehouse station in Georgia is an innovator's dream home
