source,title
bellingcat.com,"Dali, Warhol, Boshirov: Determining the Time of an Alleged Photograph from Skripal Suspect Chepiga"
bellingcat.com,Did Far-Right Internet Chatter Inspire An Arson Attack on Refugees in Toronto?
bellingcat.com,Joseph Mifsud: Rush for the EXIF
bellingcat.com,Corrupt Latin: How Orthography Revealed Corruption in Kyrgyzstan
bellingcat.com,From Memes to Infowars: How 75 Fascist Activists Were “Red-Pilled”
bellingcat.com,Second Skripal Poisoning Suspect Identified as Dr. Alexander Mishkin
bellingcat.com,Examining CCTV Videos of the Saudi Consulate in Istanbul Connected to Khashoggi’s Disappearance
bellingcat.com,Iran: New SAM Site At Mashhad
bellingcat.com,"Full report: Skripal Poisoning Suspect Dr. Alexander Mishkin, Hero of Russia"
bellingcat.com,“There Is No Future Left in Syria”: A Conversation With a Family of Refugees
bellingcat.com,"How to Prevent, Identify and Address Vicarious Trauma — While Conducting Open Source Investigations in the Middle East"
bellingcat.com,305 Car Registrations May Point to Massive GRU Security Breach
bellingcat.com,Skripal Suspect Boshirov Identified as GRU Colonel Anatoliy Chepiga
bellingcat.com,Skripal Suspects Confirmed as GRU Operatives: Prior European Operations Disclosed
bellingcat.com,Use of Ricin: Is This Amateur Hour?
bellingcat.com,Bellingcat is Hiring – Editor – Applications Closed
bellingcat.com,Russia Ramps Up Chemical Weapon Disinformation Leading-Up to Idlib Offensive
bellingcat.com,Skripal Poisoning Suspect’s Passport Data Shows Link to Security Services
bellingcat.com,"How to Identify Burnt Villages by Satellite Imagery — Case-Studies from California, Nigeria and Myanmar"
bellingcat.com,Signs of Cluster Munition Use as Military Activity in Idlib Intensifies
bellingcat.com,Fuel to the Fire: Satellite Imagery Captures Burning Oil Tanks Libya
bellingcat.com,"First ISIS, then Iraq, now Israel: IDF Use of Commercial Drones"
bellingcat.com,Indonesia Submarine Quay and Pier Damaged During Tsunami
bellingcat.com,How to Collect Sources from Syria If You Don’t Read Arabic
bellingcat.com,The Battle of Idlib Opens with the Bombing of Medical and Rescue Facilities
bellingcat.com,The Straight-Edge Neo-Nazi Group that Attacked a Ukrainian Roma Camp
bellingcat.com,"New York, Washington, and San Francisco September and October Workshop Details Announced"
bellingcat.com,What the OPCW-FFM Report on the Saraqib Chlorine Attack Tells Us About the Douma Chemical Attack
bellingcat.com,How to Use and Interpret Data from Strava’s Activity Map
bellingcat.com,The OPCW Fact Finding Mission Confirms More Sarin and Chlorine Use in Syria
bellingcat.com,"For the Third Time This Year, Chlorine is Used as a Chemical Weapon in Douma, Damascus"
bellingcat.com,"Sentinels, Saeqehs and Simorghs: An Open Source Survey of Iran’s New Drone in Syria"
bellingcat.com,American-Made Bomb Used in Airstrike on Yemen Wedding
bellingcat.com,Creating an Android Open Source Research Device on Your PC
bellingcat.com,UAV Infrastructure Noted at the UAE’s al-Safran Airbase
bellingcat.com,The Russian Ministry of Defence Publishes Screenshots of Computer Games as Evidence of US Collusion with ISIS
bellingcat.com,"Schrödinger’s Strike: Who Hit These Buildings in Raqqa, Syria?"
bellingcat.com,A Spark in the Dark – Scottish Limited Partnerships and the UK Government’s Faltering Transparency Initiative
bellingcat.com,Fifteen Months of Death: Pro-Government Casualties of the Syrian Civil War
bellingcat.com,"After Strava, Polar is Revealing the Homes of Soldiers and Spies"
bellingcat.com,Why are Nerve Agents so Difficult to Make?
bellingcat.com,How to Digitally Verify Combatant Affiliation in Middle East Conflicts
bellingcat.com,Hayat Tahrir al-Sham Attempting to Consolidate Power Ahead of Idlib Offensive
bellingcat.com,How to Archive Open Source Materials
bellingcat.com,Anatoliy Chepiga Is a Hero of Russia: The Writing Is on the Wall
bellingcat.com,Exposing the Past Anti-Semitic Tweets of the Man Crowdfunding a “Giant Sadiq Khan Balloon” to Fly Over London
bellingcat.com,Methodology: How we Tracked the Illegal Shipment of Sarin Precursor from Belgium to Syria
bellingcat.com,Did Drones Attack Maduro in Caracas?
bellingcat.com,Full Report: Russian Officers and Militants Identified as Perpetrators of the January 2015 Mariupol Artillery Strike
bellingcat.com,Anatomy of a Russian Chemical Weapons Lab Lie
bellingcat.com,Who Attacked the Hodeidah Hospital? Examining Allegations the Saudi Coalition Bombed a Hospital in Yemen
bellingcat.com,What to Watch Out For in the Upcoming OPCW FFM Report on the Douma Chemical Attack
bellingcat.com,What Werfalli Did — Haftar’s Commander Continues Executions in Defiance of ICC Arrest Warrant
bellingcat.com,Florida Trump Flash Mobs Organized by the Russian “Troll Factory”
bellingcat.com,Colangelo’s Sock Puppets? Open Source Sleuthing Methods in Recent NBA Scandal
bellingcat.com,Additional London 5 Day Workshop Announced for July and US Workshop News
bellingcat.com,British Intelligence Report Confirms Russian Military Origin of MH17 Murder Weapon
bellingcat.com,Iran Relocates Radar and Expands UAV Airfield on Qeshm
bellingcat.com,"Ukrainian Far-Right Fighters, White Supremacists Trained by Major European Security Firm"
bellingcat.com,Did Turkey Bomb Afrin’s General Hospital?
bellingcat.com,The Other Foreign Fighters: An Open-Source Investigation into American Volunteers Fighting the Islamic State
bellingcat.com,Environmental Activists Halt Construction at Armenian Gold Mine
bellingcat.com,Revelations and Confirmations from the MH17 JIT Press Conference
bellingcat.com,Tankspotting: T-90As in the Donbass
bellingcat.com,New Objects Identified in Europol’s “Stop Child Abuse” Crowdsourcing Campaign — Third Update
bellingcat.com,Online Campaign to Identify “Erdoğan’s Bodyguards” Following Assault
bellingcat.com,How to Scrape Interactive Geospatial Data
bellingcat.com,Syrian Forces Bombard Eastern Ghouta with Chemical Weapons for the Fourth Consecutive Time since the Beginning of 2018
bellingcat.com,“No Safe Spaces on the Flat Earth” – Emergent Alt-Right Inspired Flat Earth Online Communities
bellingcat.com,Is the Idlib Offensive coming?
bellingcat.com,"The Baltic Way: Sedition, Propaganda and Discontent in Latvia"
bellingcat.com,Buk Launch Site Data in the Dutch Safety Board’s MH17 Investigation
bellingcat.com,Russia’s Version of the Navy SEALs May Be Fighting in Ukraine
bellingcat.com,Reports of New Improvised Chemical Weapons Used by the Syrian Air Force
bellingcat.com,Manual Reverse Image Search With Google and TinEye
bellingcat.com,Belgium Illegally Shipped 96 Tonnes of Sarin Precursor to Syria
bellingcat.com,Types of Islamic State Drone Bombs and Where to Find Them
bellingcat.com,"ISIS Had a Social Media Campaign, So We Tracked Them Down"
bellingcat.com,Anatomy of a Russian ‘Troll Factory’ News Site
bellingcat.com,"An Open Letter to Lars Klevberg, The Norwegian Film Institute and Arts Council Norway"
bellingcat.com,Posts Tagged: 2016 Election
