source,title
besttechie.com,Everything you need to know about Samsung’s Unpacked 2018 event
besttechie.com,How to choose the best smart home assistant for you
besttechie.com,Review: Bitdefender Internet Security 2019
besttechie.com,8 must know cryptocurrencies in 2018 according to investors
besttechie.com,5 key things everyone should know about BI and data science in 2018
besttechie.com,7 best laptops for stock trading in 2018
besttechie.com,The most secure consumer smartphones of 2018
besttechie.com,5 best Forex trading platforms for online traders in 2018
besttechie.com,The best smartphones for gaming in 2018
besttechie.com,Software Development Trends Your Company Should Be Following In 2016
besttechie.com,CES 2018: the 5 best pet gadgets from this year’s show floor
besttechie.com,"Branding in 2018 and beyond: no, you can’t ignore its importance"
besttechie.com,Report: Facebook gives out the most $100k signing bonuses in tech
besttechie.com,The future of analytics: predictions for data analytics in 2019
besttechie.com,Review: 24″ 1080p LED 144hz Refresh Rate Gaming Monitor from Monoprice
besttechie.com,Mobile games in 2018 may rival console-based games
besttechie.com,Pandora comes to Xbox 360 and PS3 as an HTML 5 Web app
besttechie.com,10 strategies to effectively curate content in 2018 and grow your audience
besttechie.com,Samsung Galaxy Note 4 Available on Oct 17
besttechie.com,The best Black Friday deals on iOS and Mac apps for 2017
besttechie.com,How to watch the 2018 FIFA World Cup
besttechie.com,5 Windows 10 Security Features You Should Be Using
besttechie.com,10 Must Have Accessories for Xbox One and Playstation 4
besttechie.com,Nickelodeon and Comedy Central apps come to the Xbox 360
besttechie.com,How do Americans feel about online privacy in 2018?
besttechie.com,What you need to know to start a software development company in 2018
besttechie.com,Why marketers plan to invest more in video marketing in 2018 (and why you should too)
besttechie.com,Paypal and eBay to Split in 2015
besttechie.com,How to avoid getting penalized by Google in 2018
besttechie.com,Here are the digital marketing strategies you need to know for 2018
besttechie.com,8 highlights from 2018’s E3 Gaming Expo
besttechie.com,The key takeaways from WWDC 2018
besttechie.com,The most expensive smartphones released in 2017
besttechie.com,Lycos Is Planning A Comeback In 2013 With A New Search Engine
besttechie.com,A look at the growing popularity of eSports in 2018
besttechie.com,Last Month’s Adobe Security Breach May Have Surfaced 150 Million Records of User Data
besttechie.com,"The State of Handheld Gaming Systems, Early 2018"
besttechie.com,Hands down the best smartphones of 2017
besttechie.com,5 social media trends to watch for in 2018
besttechie.com,Best Buy Selling Surface Pro 1 at $500 this Weekend: Is It Worth It?
besttechie.com,"Tumblr Founder Now $250 Million Richer. USV Sees A 5,000% Return."
besttechie.com,"iPhone 5S Arriving September 20, Featuring New Hardware and iOS 7"
besttechie.com,The Best Techie Holiday Gifts Under $100
besttechie.com,"Samsung Galaxy S4 Pre-orders for AT&T Start April 16, Priced at $249"
besttechie.com,Carbonite Eliminates 200GB Throttling Cap In Response to Our Article
besttechie.com,Under Armour says data breach affected about 150 million MyFitnessPal accounts
besttechie.com,10 recruiting hacks to help you hire better and faster in 2018
besttechie.com,Review: Audials Music Rocket 2017
besttechie.com,The best gaming laptops in 2016
besttechie.com,The state of hiring and job hunting in 2018 is beyond frustrating
besttechie.com,Mobile Gaming Revenue Expected to Exceed Console Revenue in 2015
besttechie.com,"Exclusive look: 21 year old TED speaker’s new book, 3 Billion Under 30"
besttechie.com,"Telltale’s The Walking Dead: Season 2, Episode 1 Hits PC, Mac, PS3, Xbox 360 and iOS"
besttechie.com,Cloudflare’s 1.1.1.1 DNS service will protect and speed up your internet
besttechie.com,"Malwarebytes’ Anti-Malware Finds Over 32,000 Infections On A Single Computer."
besttechie.com,"Mozilla to Release Firefox 4, 5, 6, and 7 in 2011"
besttechie.com,"Xbox Live memberships work on One and 360, support multiple accounts"
besttechie.com,LG Teases A Round Smartwatch To Combat The Moto 360
besttechie.com,Holiday Gift Guide 2013: Musician Edition
besttechie.com,Samsung in Talks to Acquire SmartThings for $200M
besttechie.com,4:57.69: New World Record Set for Super Mario Bros.
besttechie.com,"Microsoft makes Surface Pro price cut permanent, introduces refurbished Surface RTs for $199"
besttechie.com,To infinity and beyond! My plans for 2018
besttechie.com,Amazon Buys Twitch for $970M
besttechie.com,‘Hitman: Absolution’ Free on Xbox 360 Without Xbox Live Gold [UPDATE]
besttechie.com,"Destiny Diary, Issue 9: Xur Location and Items for 4/3-4/5; Weekly Strike Info"
besttechie.com,Time Warner Cable App Launches for Xbox 360 with Access to 300 Channels
besttechie.com,How I Got A 100% Sales Close Rate for My SaaS Startup
besttechie.com,Holiday Gift Guide 2013: Games Edition
besttechie.com,"Google Indexes 80,000 Printers That You Can Print To From Anywhere"
besttechie.com,Sept. 20 release date for iPhone 5C more solid after Case-Mate leak
besttechie.com,Microsoft Band Announced for $199
besttechie.com,"Nokia announces the Lumia 625, their largest smartphone yet"
besttechie.com,What We Learned About Virtual Reality At CES 2016
besttechie.com,"There Are Tech Interns Making $7,000 Per Month"
besttechie.com,"Verizon Wireless to Add 250 MB, $20 per Month Data Plan"
besttechie.com,Review: LaCie Porsche Design P’9223 Slim SSD
besttechie.com,5 e-commerce trends you should embrace in 2017
besttechie.com,"Gear VR to Cost $199, But No Galaxy Note 4 Included"
besttechie.com,"Destiny Diary, Issue 14 for 5/15-5/17: Patch 1.2.0, Xur’s Goods, and Weekly Strikes"
besttechie.com,1st Nintendo Smartphone Game Slated for Late 2015
besttechie.com,"BlackBerry announces the BlackBerry 9720, a smartphone stuck in 2011"
besttechie.com,"iPhone 5C coming from Apple on Sept. 20, priced at $99"
besttechie.com,Report: Amazon Releasing Game Console in 2014 for Less than $300
besttechie.com,"Hulu Shows Growth In 2012, But Is It Enough To Save The Company?"
besttechie.com,The Best Worst CES Pitch 2016
besttechie.com,"Drync, “Shazam For Wine,” Secures $900,000 In Funding"
besttechie.com,Year In Review: The Biggest Tech Acquisitions In 2012
besttechie.com,Self-Driving Cars Could Give You Back More Than 100 Hours Per Year
besttechie.com,How 5G networks will shape the tech industry in 2018
besttechie.com,What Recession? 2010 Holiday Sales Were Higher Than Expected.
besttechie.com,Apple Signs TSMC Deal for iPhone and iPad Processors Starting In 2014
besttechie.com,"Babblr Crashes After Launch, Scrambles to Raise $50,000"
besttechie.com,Verizon to Sell LG Watch Urbane for $349
besttechie.com,Netflix Trials $6.99 Standard Definition Streaming Plan with New Subscribers
besttechie.com,The best Chrome extensions of 2016
besttechie.com,The best 5 Android apps in 2016
besttechie.com,BestTechie 2012 Holiday Gift Guide
besttechie.com,"MTV app lands on Xbox 360, provides on-demand access to shows"
besttechie.com,"Destiny Diary, Issue 15 for 5/22-5/24: House of Wolves!"
