source,title
bgr.in,Lenovo Z5 Pro to reportedly feature AI-enhanced dual cameras with 24-megapixel and 16-megapixel sensors
bgr.in,"Uber, Ola drivers’ strike in Mumbai enters second week; no end in sight to commuters' woes"
bgr.in,"Xiaomi to soon launch Mi AirDots, an affordable alternative to Apple AirPods: Report"
bgr.in,OnePlus 6T: new device renders and images leak out confirming the design and specifications
bgr.in,"Nokia 6.1 Plus to get Android 9 Pie update soon, HMD Global completes beta test"
bgr.in,"Apple iPhone XS Max beats Google Pixel 3 XL in performance, reveals speed test video"
bgr.in,"Paytm Maha Cashback Sale: Offers on smartphones, PCs, consumer electronics, and more"
bgr.in,YouTube up and running after suffering temporary outage around the world
bgr.in,"Samsung Galaxy A9 (2018) with 4 cameras announced: Specifications, features"
bgr.in,Xiaomi Mi MIX 3
bgr.in,Samsung Galaxy Tab S4 10.5
bgr.in,OnePlus has teamed up with Reliance Digital to target Tier-2 cities
bgr.in,Asus Mobile Phones
bgr.in,"Nokia 8.1 spotted on Geekbench; Nokia 6.1 to get Android Pie soon, company confirms"
bgr.in,Google Glass app to help autistic kids
bgr.in,"Vivo Z3 with gradient design, option of Snapdragon 670 and Snapdragon 710 chipset launched in China"
bgr.in,Apple iPad Pro 128GB (LTE)
bgr.in,Government to shut down MTNL among other sick PSUs
bgr.in,"Lava Iris X8 vs Xiaomi Redmi Note 4G vs Yu Yureka: Prices, specifications, features compared"
bgr.in,Realme 2 Pro Review: The New Mid-Range Killer?
bgr.in,Reliance Jio's 4G LTE Wi-Fi service soft launched in Gujarat: Report
bgr.in,"Xiaomi Mi Note launched, featuring 5.7-inch display, Snapdragon 801 chipset, 13-megapixel camera: Specifications and features"
bgr.in,"""F**k You, Xiaomi"" - A great price for a great phone isn't enough if you don't respect your customers"
bgr.in,"Apple dropped several health-oriented features in Watch due to inconsistent performance, may add them later: WSJ"
bgr.in,Asus Zenfone Max M1 (ZB556KL)
bgr.in,"Facebook, Google, Twitter and other social networks will have to host web servers in India: Centre to SC"
bgr.in,"Security firm claims Mi 4 comes preinstalled with malware, Xiaomi suggests it bought counterfeit product [confirmed]"
bgr.in,IRCTC online ticket booking: Your easy guide to book Indian Railways train tickets online
bgr.in,Xiaomi Redmi 6 Pro Review: A curious mix of old and new
bgr.in,Micromax teases the Canvas Turbo while unveiling Hugh Jackman as its new brand ambassador
bgr.in,"On Steve Jobs' second death anniversary, Tim Cook tells employees he'd have been proud of them"
bgr.in,Xiaomi Mi LED TV 4 Pro sale at 12PM today; here’s all you need to know
bgr.in,World Emoji Day: Here are the 8 most popular emojis used on Tinder in India
bgr.in,"Apple takes on Android tabs in India, offers iPad mini for Rs 4,999 down"
bgr.in,Idea Cellular Durga Puja offer: How to get 10GB extra data for 7 days during Pujo season
bgr.in,Hyderabad becomes Uber's third city in India
bgr.in,"Xiaomi Redmi 6 Pro vs Asus Zenfone Max Pro M1 vs Honor 9N vs Samsung Galaxy J6: Price, specifications and features compared"
bgr.in,Google Pixel 3 and Pixel Slate to new Chromecast: Here’s what to expect from the Google event tonight
bgr.in,Saregama Carvaan Mini 2.0 Review: A time machine that fits in your pockets
bgr.in,"Realme 2 Pro will have waterdrop-style notch and Snapdragon 660 SoC, confirms CEO Madhav Seth"
bgr.in,"Reliance Jio plans to offer 100 Mbps broadband plan bundled with VoIP calling at Rs 1,000"
bgr.in,"5 free Android games to play this weekend: Idle Racing GO, Standoff 2, and more"
bgr.in,OnePlus 3 and OnePlus 5 series Android 9 Pie updates will take some time: CEO Pete Lau
bgr.in,"Online flight ticket deals: Indigo, AirAsia offer air tickets starting at just Rs 999"
bgr.in,Flipkart has sold the highest number of smartphones in a day in India.
bgr.in,Google Pixel 3 teaser page now live on Google Store ahead of October 9 launch
bgr.in,"OnePlus 6 to be available for Rs 29,999 from October 10 during Amazon Great Indian Festival"
bgr.in,BSNL one step closer to pan-India 4G rollout as DoT approves spectrum allocation
bgr.in,"Xiaomi Mi 4 announced, featuring a 5-inch 1080p display and Snapdragon 801 quad-core processor"
bgr.in,"Lenovo ThinkPad E480 and E580 launched in India: Price, specifications and features"
bgr.in,Motorola One Power first sale on Flipkart at 12PM: Everything you need to know
bgr.in,Honor 8 Pro available at just Re 1: Here's how you can get your hands on one
bgr.in,"Smartphones launching this month: Google Pixel 3, OnePlus 6T, Huawei Mate 20, Nokia 7.1, Oppo K1 and more"
bgr.in,Assassin’s Creed Odyssey First Impressions: More polished than the Origins
bgr.in,Xiaomi Mi Note 4 likely to launch alongside Mi MIX 3 on October 15
bgr.in,"Samsung may launch a smartphone with four cameras on October 11, hints invitation"
bgr.in,"Huawei Grand Sale, Vivo V11 Pro Sale, Samsung cashback offers and other deals on Amazon India"
bgr.in,"Samsung Galaxy Tab S4 gets certified by FCC, might debut at IFA 2018"
bgr.in,Google Pixel event officially announced for October 9 in New York; Google sends invites
bgr.in,"Idea Cellular completes merger with Vodafone India after NCLT approval, becomes India’s largest telco with 408 million active users"
bgr.in,"How to check your EPF balance online, view statement and download passbook"
bgr.in,"Xiaomi Mi A2, Redmi 5A, Nokia 6.1 Plus to go on sale today: Price, specifications, features"
bgr.in,MediaTek is set to bring 5G chips to budget smartphone segment
bgr.in,Airtel may regain top position in terms of revenue within 2-3 quarters: Report
bgr.in,Rovio's Angry Birds are seeking a nest in India
bgr.in,Pixel 3 pre-orders kick off on October 9; Google teases new color options
bgr.in,WhatsApp to reportedly allow external Stickers download; could launch separate 'WhatsApp Stickers' app
bgr.in,"Micromax Canvas 3 Android Smart TV launched on Flipkart: Price, specifications"
bgr.in,Microsoft is working on ‘Your Phone’ Windows 10 app to mirror phone content to your PC
bgr.in,Samsung Galaxy J8 Review: An upper-affordable smartphone
bgr.in,"LG V40 ThinQ render leaks, shows triple camera setup and a button for Google Assistant"
bgr.in,"Vivo Y97 specifications and price surface online; MediaTek Helio P60 SoC, 4GB RAM rumored"
bgr.in,How to set up and use Google Pay for cashless transactions and bill payments
bgr.in,"Xiaomi Mi TV 4 Pro, 4A Pro and 4C Pro don’t support Netflix, here’s why"
bgr.in,"Moto X4 32GB variant gets a price cut, now costs Rs 13,999"
bgr.in,How to link Aadhaar with your BSNL mobile number with a phone call
bgr.in,Google Duplex is real and public testing begins this summer: Report
bgr.in,"Xiaomi to sell 40,000 Redmi 1S units on September 2, over 100,000 have already registered"
bgr.in,"Vodafone Idea reveals new look with new website, after completion of merger"
bgr.in,"You can now pay electricity, landline, and other utility bills using Amazon Pay balance"
bgr.in,"No, Erebus is not the code name for the Sony PlayStation 5"
bgr.in,It is the first Samsung device to come with three cameras at the back.
bgr.in,"LG Candy budget smartphone with 5-inch HD display, 2GB RAM launched in India for Rs 6,699"
bgr.in,OnePlus 6T to come sans 3.5mm headphone jack; OnePlus aims for improved battery life
bgr.in,How to verify your Aadhaar linked mobile number and email ID
bgr.in,"OnePlus updated Bullets Wireless launch, Huawei Mate 20 to have square camera setup, Pixel 3 XL might not have a notch, and more: Daily News Wrap"
bgr.in,"OnePlus 6T India launch on October 17, leaked invitation reveals"
bgr.in,Apple Maps is getting overhauled in a big way
bgr.in,"Apple MacBook Air available with a cashback of up to Rs 8,500: Here's how to get it"
bgr.in,Huawei P20 and Mate 10 series confirmed to get Android 9 Pie update soon
bgr.in,"Samsung Galaxy S8, Galaxy S4 catch fire while driving, revive concerns around exploding battery"
bgr.in,Xiaomi ecosystem brand Huami could launch new smartwatches on September 17
bgr.in,Chandrayaan-2 to be launched in January 2019: ISRO Chief
bgr.in,Sony MP-CD1 Mobile Projector Review: Convenience is its defining keyword
bgr.in,"Bharti Airtel challenges Idea Cellular with Rs 289 prepaid plan, offers unlimited voice and 1GB data"
bgr.in,"Apple iPhone XR, iPhone XS, and iPhone XS Max: Here’s how much they cost in India"
bgr.in,PUBG Mobile 0.8.0 coming soon: Here's what to expect
bgr.in,"Airtel refreshes first recharge (FRC) prepaid plans for new customers, now offers up to 126GB data"
bgr.in,"Apple iPhone 2018: Specifications, features, launch date, and more"
bgr.in,Watch Reliance JioTV and JioCinema on PC and laptop; Here's a step-by-step guide
