source,title
bleedingcool.com,"Image Comics Launches Vindication in January From MD Marie, Carlos Miko and Dema Jr."
bleedingcool.com,Now the KGBeast Shoots Bruce as Mark Buckingham and Andrew Pepoy Surprise-Draw Tomorrow’s Batman #57
bleedingcool.com,"Check Out the Latest Video Game Releases for October 16-22, 2018"
bleedingcool.com,Breath of the Wild Style Open World Pokemon Game Possibly “Still on the Cards”
bleedingcool.com,"Dracula Series Coming to BBC, Netflix from Sherlock Team"
bleedingcool.com,What is This Yu-Gi-Oh! Thing the Kids Go On About Anyway? – Part Two
bleedingcool.com,"Avengers 1,000,000 BC Minimates Now Available at Walgreens"
bleedingcool.com,"Where In the World Has Poison Ivy Gone, DC Comics?"
bleedingcool.com,Free On Bleeding Cool: The Wailing Blade #1 From Comixtribe
bleedingcool.com,Simon Pegg on Amazon’s The Boys (The Bleeding Cool Interview)
bleedingcool.com,"Titans Star Says Batman is a Killer, Keeping Show True to Zack Snyder’s Vision"
bleedingcool.com,Destiny 2 Glitch Could Confirm Next Expansion Location
bleedingcool.com,"Foot-Loving Cliff Chiang Draws Ten Feet for Uncanny X-Men #1 Variant, But Marco Djurdjevic Draws None"
bleedingcool.com,Barry Will Tell Iris About Wally in January’s Flash Annual
bleedingcool.com,Undertaker OGN Reveals Why Knox County Mayor Kane Set Fire to Home [Spoilers]
bleedingcool.com,C.W. Cooke and Devils Due Ink a TV/Movie Deal With Adam Ripp for Solitary
bleedingcool.com,Constantine and Batman Team Up in January; Will Everyone Keep Their Pants On?
bleedingcool.com,Six Foot Officially Releases Dreadnought on Steam
bleedingcool.com,Hearthstone Confirms Balance Changes Rolling Out This Week
bleedingcool.com,The Pentagon Unleashes Gerard Butler on the Washington Press Corps
bleedingcool.com,Dick Grayson is Now Called Ric Grayson as Fabian Nicieza Joins Scott Lobdell on Nightwing #51
bleedingcool.com,Halloween Tiki Mug Available Today From Mondo
bleedingcool.com,"Charmed Season 1 ‘Pilot’ Review: A Strong Start That Honors, Updates Original Series"
bleedingcool.com,Rockstar Devs Reportedly Working 100 Hour Weeks on Red Dead Redemption 2
bleedingcool.com,Could We See a Penis in Constantine: City of Demons – The Movie’s R-Rated NYCC Premiere?
bleedingcool.com,U.K.’s National Videogame Museum Opens Permanently in November
bleedingcool.com,Marvel’s Infinity Wars to Go On for Infinity Issues
bleedingcool.com,The Walking Dead s09e02 ‘The Bridge’ Builds Season 9 Tension Effectively (REVIEW)
bleedingcool.com,"Peter Dinklage Talks Post-Game of Thrones Life, and Tyrion’s Final Day"
bleedingcool.com,Cloak & Dagger Relaunched After Only 6 Issues as Cloak & Dagger: Negative Exposure
bleedingcool.com,Arcen Games Announces AI War 2 Launching on Early Access
bleedingcool.com,Battlefield V Hypes New Trailer Coming Tomorrow with Mark Strong
bleedingcool.com,Marvel Editor Jordan White Confirms Cyclops is the Best X-Man for #XMenMonday
bleedingcool.com,"Marvel Unlimited Stealth-Adds Classic Claremont New Mutants, Amazing Adventures, More"
bleedingcool.com,The #metoo & #timesup Panel at NYCC: Is it Time for Comic Creators to Unionize?
bleedingcool.com,Everlast is Producing Exclusive Street Fighter Fragrances
bleedingcool.com,A Sneak Peek Inside Cosmic Ghost Rider #5 from Donny Cates at NYCC
bleedingcool.com,"HBO’s Watchmen: Damon Lindelof “Remix” Series Releases New Teaser Image, Logo"
bleedingcool.com,Destiny 2’s Festival of the Lost Event Starts Tomorrow
bleedingcool.com,Dragon Quest XI Receieves a New Update With Bug Fixes
bleedingcool.com,‘Outlander’: Wanna Hear Caitriona Balfe’s Sam Heughan Impression?
bleedingcool.com,Sony Reveals New Gameplay for Ghostbusters World Mobile Game
bleedingcool.com,Diamond’s Steve Geppi Cosplays as The Godfather
bleedingcool.com,Win Deadpool 2 Shirt Signed By Manchester United’s Michael Carrick with Bleeding Cool
bleedingcool.com,You May Not ‘Color Your Own X-Men’ Any More – But Why?
bleedingcool.com,What a Post-Wedding Colossus Looks Like (Astonishing X-Men #14 Spoilers)
bleedingcool.com,Poznan Game Arena 2018 Reports a New Attendee Record
bleedingcool.com,The Gifted 2×02 Review: People Have Doubts in ‘unMoored’
bleedingcool.com,Heroes of the Storm: HGC Western Clash 2018 – Grand Finals
bleedingcool.com,Dark Horse Team Cloud 9 has Flipped the Script on League of Legends Worlds
bleedingcool.com,Chilling Adventures of Sabrina: Your Guide to Greendale’s Saints and Sinners
bleedingcool.com,George A. Romero’s Road of the Dead to be Published as a Comic by IDW
bleedingcool.com,Speculator Corner: The Two Hottest Comics From X-Men Apocalypse? (SPOILERS)
bleedingcool.com,Poe Dameron to Go on Trial for Mutiny at San Diego Comic-Con
bleedingcool.com,"The First Fandemic Tour Show Will Now be Sacramento in June, with Norman Reedus, Jeffrey Dean Morgan and More"
bleedingcool.com,The Saga of Nightwing’s Ass Continues with Dick the Stripper in Nightwing #38
bleedingcool.com,Wolverine and Jubilee X-Men Statue Pack Coming From Kotobukiya
bleedingcool.com,"LATE: Now Doom Patrol #11 Slips Into April 2018, Five Months Late"
bleedingcool.com,Scott Deckert Joins the Cast of Venom
bleedingcool.com,RUMOR: Some Interesting Story Details For “Silver And Black”
bleedingcool.com,Breaking: Jeff Lemire Writing Hawkman Found With Bryan Hitch And Kevin Nowlan For #DCMetal
bleedingcool.com,A Third Bit of Avengers Fight As One: Doctor Strange and Ghost Rider
bleedingcool.com,"Siren Season 1, Episode 4 Preview: The Military Has a Mermaid Problem; Ryn’s on the Run"
bleedingcool.com,John Oliver Victorious: Lawsuit Against Last Week Tonight Dismissed
bleedingcool.com,DC Comics Variant Covers In August – From Yanick Paquette To Neal Adams To Stjepan Sejic
bleedingcool.com,Holocaust-Denying Star Wars Cosplay Designer Stands With White Nationalist-Rallying Supergirl Cosplayer
bleedingcool.com,Has A Lost Print Of London After Midnight Been Found?
bleedingcool.com,LEGO DC Super-Villains Looks More and More Promising
bleedingcool.com,Marvel Still Figuring Out Math Thing As Iron Man And Deadpool Legacy Numbers Explained
bleedingcool.com,First Details on Elite Dangerous: Beyond- Chapter Four Revealed
bleedingcool.com,When Dr. Bunsen Honeydew Wrote A Letter To NASA And Offered Them Beaker For A Mars Mission
bleedingcool.com,New Image from Upcoming Jason Statham Shark Movie ‘The Meg’
bleedingcool.com,Rereading The Courtyard In The Light Of Neonomicon
bleedingcool.com,Alan Moore’s Newly Discovered First Published Work Sells For Over $5100
bleedingcool.com,"Flash Season 4, Episode 13 Recap: True Colors"
bleedingcool.com,Pillars of Eternity II: Deadfire Explains How Ships Work in New Backer Update
bleedingcool.com,Latest Far Cry 5 Update Fixes Co-Op and Arcade Issues
bleedingcool.com,New Image from Creed II with Adonis Ready for a Fight
bleedingcool.com,Warriors Orochi 4 Shows Off Nu Wa in Latest Character Trailer
bleedingcool.com,An Updatable List Of The 52 DC Titles For September
bleedingcool.com,Talking All Things Star Wars Resistance With Writer Brandon Auman
bleedingcool.com,"David Tennant, An Actual Scotsman, To Play Scrooge McDuck In Ducktales Reboot"
bleedingcool.com,"Exclusive Comics At C2E2, AfterShock, DC, IDW, Zenescope And Many More"
bleedingcool.com,"Kate McKinnon, Cecily Strong Skewer Brigitte Bardot, Catherine Deneuve in #MeToo Segment on SNL’s Weekend Update"
bleedingcool.com,Sherlock Frankenstein And The Legion Of Evil #1 Review: What Happened To Black Hammer?
bleedingcool.com,Ant-Man Movie – Who Is Darren Cross?
bleedingcool.com,Marvel Comics Trademarked “Hail Hydra” A Day After Hail-Hydra.Com Made The News
bleedingcool.com,Shadow Of The Colossus’ 79 Gold Coin Relics Achievement Revealed
bleedingcool.com,Alan Moore To Headline James Randi Benefit With Richard Dawkins
bleedingcool.com,"DC Comics Give Second Prints For Dark Knight III, Super Sons And Kamandi"
bleedingcool.com,The X-Files Origins: Dog Days Of Summer #1 Review: Mini Mulder And Scully Are Just Getting Started
bleedingcool.com,"A New Jim Henson’s Storyteller Comic, Fairies, From Matt Smith, Benjamin Schipper, Tyler Jenkins And Celia Lowenthal"
bleedingcool.com,Is Political Fatigue Over at DC Comics? Superman Smashes the Ku Klux Klan with Gene Luen Yang
bleedingcool.com,Tony Isabella Is Against A Black Lightning/Static Shock Crossover
bleedingcool.com,8 Months Later – The All-New All-Different Marvel Universe
bleedingcool.com,EXCLUSIVE: Tony Scott To Direct Mark Millar And Steve McNiven’s Nemesis [UPDATE 2]
bleedingcool.com,"Aladdin Has Started Shooting, Will Smith Posts A Behind-The-Scenes Picture"
bleedingcool.com,Did Tom King And Mikel Janin Just Retell Another Ending To The Killing Joke In Batman #29? (SPOILERS)
