source,title
capedcrusades.com,Harley Quinn Makes Relationship Status Less Complicated
capedcrusades.com,Weapons Of Suicide Squad At WB Studio Tour
capedcrusades.com,New Batman Arkham Game In Development?
capedcrusades.com,How Many Riddler Trophies Are In Arkham Knight?
capedcrusades.com,Life-Size Harley Quinn Statue!
capedcrusades.com,Review of Dr. Travis Langley’s Batman and Psychology
capedcrusades.com,Injustice 2: Supergirl vs. Wonder Woman
capedcrusades.com,How Long Is Suicide Squad Extended Cut?
capedcrusades.com,10 Actors Who Could Play CW’s Batman
capedcrusades.com,Sean Young REALLY Wanted To Be In Tim Burton’s Batman
capedcrusades.com,Avengers of Justice: Farce Wars Already Contender For Worst Superhero Movie Ever
capedcrusades.com,10 Actors Who Could Play CW’s Batman
capedcrusades.com,Batman: The Animated Series Now Available on Amazon Prime
capedcrusades.com,Director’s Cut Of Batman v Superman Length Confirmed
capedcrusades.com,Gotham Exists In Supergirl?
capedcrusades.com,Batman v Superman: What Makes The Ultimate Cut ‘R’?
capedcrusades.com,Leslie Thompkins to be Gordon’s Love Interest on ‘Gotham’??
capedcrusades.com,Jerome back for season 3 of Gotham?
capedcrusades.com,How Batman v Superman Should Have Ended
capedcrusades.com,The Four Most Underrated Batman Stories
capedcrusades.com,Batman v Superman Watches!
capedcrusades.com,Gotham: Has The Ventriloquist Shown Up?
capedcrusades.com,Scott Snyder: Gotham Is Us
capedcrusades.com,Batman: Return To Arkham Comparison
capedcrusades.com,Spoilers: Batman v Joker in Justice League Darkseid War
capedcrusades.com,Gotham: Lori Petty Explains Her Role
capedcrusades.com,Homemade Batcave!
capedcrusades.com,Bat-Birthdays: Happy Birthday 1960s Batman TV Series!
capedcrusades.com,Why Poison Ivy is ‘Ivy Pepper’ in ‘Gotham’
capedcrusades.com,Warner Bros. Releasing 25th Anniversary Edition Of Tim Burton’s Batman
capedcrusades.com,Justice League: Who Is The Leader?
capedcrusades.com,Batman Day Sale On Sony & Microsoft Consoles!
capedcrusades.com,Batman v Superman Fan Edit Makes Superman More Responsible
capedcrusades.com,Gotham: Bruce Wayne’s Doppleganger
capedcrusades.com,Gotham: Batgirl Will Be Addressed
capedcrusades.com,Detective Comics: Who Is Colony?
capedcrusades.com,Gotham Gets 3 Emmy Nominations
capedcrusades.com,Crazy Joker Snickers Commercial
capedcrusades.com,Gotham: The Glass Owl
capedcrusades.com,10 Ridiculous Batman Villains That Should Be In The Movie
capedcrusades.com,Gotham: Jerome Planned To Return In Season 4
capedcrusades.com,53 Most Badass Batman Moments Of All Time
capedcrusades.com,Director’s Cut Of Batman v Superman Getting Theatrical Release?
capedcrusades.com,Warner Bros. Replacing Glitched Batman: The Complete TV Series
capedcrusades.com,Superman vs… Harley Quinn?
capedcrusades.com,10 Things Batman Fans Can Look Forward To In 2016
capedcrusades.com,Rumor: Suicide Squad Had Huge Production Issues
capedcrusades.com,DC Collectibles Suicide Squad Harley Quinn Statue!
capedcrusades.com,Your Last Chance to Pre-Order Batman 75 Pop! Vinyl
capedcrusades.com,This Insane Batman Theory will Change Your Life
capedcrusades.com,Ranking Animated Adaptations: The Penguin
capedcrusades.com,Batwoman Cosplay Mask for Sale on Etsy
capedcrusades.com,Does Morena Baccarin Prefer Marvel Or DC?
capedcrusades.com,First Clip From Justice League vs. Teen Titans
capedcrusades.com,Ranking Animated Adaptations: The Penguin
capedcrusades.com,Batman Unlimited: Mech vs. Mutants Coming This Year
capedcrusades.com,First Look at ‘Batman: Endgame’!
capedcrusades.com,Catwoman Arkham City Cowl from GCFX
capedcrusades.com,Check Out Variant Covers For Book 3 Of Dark Knight III
capedcrusades.com,Top 5 Favorite Batman Villains
capedcrusades.com,Batman Merchandise: Batman Style Tutu
capedcrusades.com,Batman v Superman & Man Of Steel Limited Edition Box Set
capedcrusades.com,Batman Gotham Cityscape Chess Set
capedcrusades.com,This BTAS Joker Bust Seems Fishy…
capedcrusades.com,Batman Meets Shredder In Batman/Teenage Mutant Ninja Turtles #3
capedcrusades.com,Batman The Animated Series Print Posters
capedcrusades.com,"Every Batman and Superman actor, ranked"
capedcrusades.com,Ranking every Batman and Superman movie
capedcrusades.com,Harley Quinn Is Coming To Gotham
capedcrusades.com,Bizarre Bat-Book – Batman: The Abduction review
capedcrusades.com,New Gotham Photo Definitely Implies Jerome Is Joker
capedcrusades.com,Exclusive Review: Rifftrax’s ‘Batman Takes Over’!
capedcrusades.com,Batman Fights Kaiju In Batman & The Night Of The Monsters
capedcrusades.com,Preview: Batgirl & The Birds Of Prey #5
capedcrusades.com,The Women Of Suicide Squad
capedcrusades.com,"Every Batman and Superman actor, ranked"
capedcrusades.com,Ridley Scott Would’ve Given Batman v Superman A “Good Story”
capedcrusades.com,Justice League Mock Draft
capedcrusades.com,DC Doing Day-Long YouTube Stream September 2nd
capedcrusades.com,Scott Snyder Teases Batman Heavy Rock Metal Opera With Greg Capullo
capedcrusades.com,Suicide Squad: Property of Joker Satin Robe From ThinkGeek
capedcrusades.com,Ben Affleck Talks Biggest Challenge Of Playing Batman
capedcrusades.com,Susan Eisenberg Talks Batman & Wonder Woman
capedcrusades.com,Suicide Squad Trailer Remade In Fallout 4
capedcrusades.com,Gotham Preview: Season 3 Episode 14 – The Gentle Art Of Making Enemies
capedcrusades.com,Gotham & Camren Bicondova Up For Saturn Awards
capedcrusades.com,Batgirl Should Come To Supergirl
capedcrusades.com,10 Actors Who Could Play CW’s Batman
capedcrusades.com,Make Your Own Batarang!
capedcrusades.com,Gotham: Bruce Wayne Seeks Control
capedcrusades.com,Batgirl & Birds Of Prey Rebirth #1 Preview
capedcrusades.com,New Justice League Ride Coming To Six Flags Over Georgia
capedcrusades.com,Batman: Arkham Underworld Trailer
capedcrusades.com,Nightmare Fuel: Batman/Two-Face Play Arts Kai Figure!
capedcrusades.com,Gotham: Season 3 Episode 7 – The Red Queen Synopsis
capedcrusades.com,Hot Toys Batman Arkham Asylum Joker Figure
capedcrusades.com,The Only Backpack Fit For Batman!
capedcrusades.com,Batman v Superman: Geoff Johns discusses Martha Scene
capedcrusades.com,10 Actors Who Could Play CW’s Batman
capedcrusades.com,10 Actors Who Could Play CW’s Batman
