source,title
channel4.com,How many people earn less than the Living Wage?
channel4.com,Chancellor cuts taxes as he pledges austerity is ending
channel4.com,Have the Conservatives “nurtured” the NHS?
channel4.com,Stat Wrap: Mexican Grand Prix
channel4.com,Has Philip Hammond smashed his deficit target?
channel4.com,Man accused of Pittsburgh synagogue shootings appears in court
channel4.com,Far-right populist Jair Bolsonaro elected Brazilian President
channel4.com,Angela Merkel to step down as German Chancellor in 2021
channel4.com,The Secret Life of the Zoo Episode 1 Clips
channel4.com,What do those on universal credit think of the Chancellor’s announcement of more funding?
channel4.com,Men guilty of sexually exploiting teenage girls in Rotherham
channel4.com,Leicester City owner’s family lay wreaths after deadly helicopter crash
channel4.com,View from the Pit Lane: Mexican GP
channel4.com,The First: Interview with Natascha McElhone who plays Laz
channel4.com,Leicester City owner feared on board in helicopter crash
channel4.com,Chancellor says budget only applies if Brexit deal happens
channel4.com,Mexico migrant caravan continues to US border
channel4.com,Pittsburgh synagogue shooting: 11 people killed and suspect charged with murder
channel4.com,Black History Month: the politics of racial representation
channel4.com,Budget 2018: Chancellor announces cash boost for high street
channel4.com,War correspondent Malcolm Brabant’s mental health decline captured in new documentary
channel4.com,The First press pack
channel4.com,Tandoori Salmon Salad
channel4.com,Debenhams reveals record annual losses
channel4.com,Beef & Maple Stew
channel4.com,Fiery Pumpkin Pancakes
channel4.com,Goat hunting controversy
channel4.com,Former assistant Zelda Perkins to Harvey Weinstein on non-disclosure agreements and parliamentary privilege
channel4.com,Treacle Tart
channel4.com,Home Secretary apologises for DNA tests on immigrants
channel4.com,Student death inquest: Ed Farmer died from ‘toxic effects’ of alcohol
channel4.com,John McDonnell: ‘reverse tax cuts for the rich’
channel4.com,Street crime and murders soaring in Brazil
channel4.com,An act of terror in Pittsburgh
channel4.com,Halloween Vodka Cocktails
channel4.com,Multiple fatalities at Pittsburgh synagogue shooting
channel4.com,Prime Minister meets backbenchers over Brexit deal
channel4.com,Why is Nottingham the hardest place in UK for young people to find employment or training?
channel4.com,Topshop billionaire Sir Philip Green denies allegations of ‘unlawful sexual or racist behaviour’
channel4.com,Hain criticised for naming Green in parliament
channel4.com,Lord Hain defends decision to name Sir Philip Green in Parliament
channel4.com,Thousands of council staff strike over equal pay in Glasgow
channel4.com,Dominic Grieve QC MP on Lord Hain criticism
channel4.com,Universal credit causing ‘unacceptable hardship’
channel4.com,Man arrested in connection with US mail bombing campaign
channel4.com,Cabinet saw ‘sharp’ exchanges on Brexit
channel4.com,SU2C raises biggest total ever - £24.6 million
channel4.com,What do drill musicians make of MPs’ violent rhetoric? Watch the music video
channel4.com,Pressure grows on Saudi Arabia over Khasoggi death
channel4.com,Scientists warn of Brexit brain drain
channel4.com,May says 95% of Brexit deal agreed with EU
channel4.com,Trump pulls out of cold-war era nuclear weapons pact
channel4.com,The parents separated from their children at the US border
channel4.com,Afghan elections marred by more deadly violence
channel4.com,Funding cuts forcing drug rehabilitation centres to close
channel4.com,CCTV footage appears to show Khashoggi double
channel4.com,The Hondurans seeking a better life in US
channel4.com,Theresa May’s perfect storm
channel4.com,"Packages containing explosives sent to homes of Obama, Clinton, and to CNN"
channel4.com,Ryanair faces backlash over racist incident on flight
channel4.com,"S2, E2: David Baddiel"
channel4.com,Stepfather responds to former Tory MP’s ‘pathetic cretin’ tweet
channel4.com,Pittsburgh’s terror attack
channel4.com,Turkey’s Erdogan calls Khashoggi death ‘savage murder’
channel4.com,"Series 2, Episode 1: Michael Moore"
channel4.com,UK businessman takes out injunction against Daily Telegraph over harassment allegations
channel4.com,Brazil presidency: Hard-right candidate Bolsonaro leads polls
channel4.com,View from the Pit Lane: US GP
channel4.com,May to address Tory MPs amid leadership challenge speculation
channel4.com,Liam Payne & Louis Tomlinson complete SU2C Celebrity Gogglebox line-up
channel4.com,Bolton in Moscow for nuclear talks
channel4.com,Police officers sacked after arrested man left paralysed
channel4.com,Danny and Dani Dyer to join the Celebrity Gogglebox sofa for SU2C
channel4.com,Dele Alli and Eric Dier to join the Celebrity Gogglebox sofa for SU2C
channel4.com,Attacks on rough sleepers ‘should be treated like hate crime’
channel4.com,Abbey Clancy & Peter Crouch join Celebrity Gogglebox sofa for SU2C
channel4.com,The First: Interview with executive futurist Amy Webb
channel4.com,Channel 4 commissions Moon Landing Live
channel4.com,More bombs sent to prominent Trump critics
channel4.com,The First: Interview with Hannah Ware who plays Sadie
channel4.com,The First: Interview with Beau Willimon
channel4.com,The First: Interview with executive producer Jordan Tappis
channel4.com,Scotland rolls out alternative to Universal Credit
channel4.com,SAS: Who Dares Win - SU2C Celebrity Special
channel4.com,Brexit: What The Nation Really Thinks
channel4.com,Inside Rio’s Cracolandia – amid Brazil’s dramatic political shift
channel4.com,China opens world’s longest sea bridge
channel4.com,Meet the Democrat challenging political conventions in Texas
channel4.com,MEPs condemn Facebook after data breach
channel4.com,Russell T Davies Explores 21st Century Gay Life in New Drama for C4
channel4.com,One Direction fans vent anger over Channel 4 documentary
channel4.com,Channel 4 to launch new digital service All 4
channel4.com,The Great Car Con: Channel 4 Dispatches
channel4.com,Channel 4 to explore the world of Extreme Brat Camps in the US
channel4.com,Grayson Perry reveals artworks as part of Channel 4 series on identity
channel4.com,Award-winning actors read war poetry for More4's Remembrance Weekend
channel4.com,Second YouTube star accused of sexual assault by fans
channel4.com,C4 Documentary reveals brand new research on Richard III's skeleton
channel4.com,Catastrophe a new C4 comedy created by Rob Delaney and Sharon Horgan
channel4.com,Gogglebox interview with Julie Malone
