source,title
couriermail.com.au,Police yet to speak to witnesses who saw ‘highly agitated’ men at Wangetti Beach
couriermail.com.au,"Family, the most overrated institution"
couriermail.com.au,Aussie faces jail over urinating dogs incident
couriermail.com.au,Clive Palmer claims MP Cathy O’Toole defamed him
couriermail.com.au,Queensland’s massive production dive
couriermail.com.au,Engineering construction work up in Queensland: Deloitte report
couriermail.com.au,Thousands of tadpoles filmed swimming in Brisbane vacant lot
couriermail.com.au,"Ergon ripping off farmers on power bills, says Littleproud"
couriermail.com.au,The Joh Tapes offer insight into Queensland’s history
couriermail.com.au,New hard line approach to workplace health and safety
couriermail.com.au,Queensland Rail services excluded from punctuality results
couriermail.com.au,State Greens MP Michael Berkman wants to ban coal mining in the Galilee Basin
couriermail.com.au,"‘Rapist’ stabbed to death, dragged behind car"
couriermail.com.au,Taxpayers fork out $1.3m for overstaying Comm Games coaches and athletes
couriermail.com.au,Royal tour: Meghan Markle and Prince Harry charm New Zealand
couriermail.com.au,"Australia’s sputtering World Cup defence can be revived, starting with series against South Africa"
couriermail.com.au,Would I have killed my rapist given the chance?
couriermail.com.au,Behind the scenes at Une Piece photoshoot with Bree Warren
couriermail.com.au,Cindy Palmer pays tribute to daughter three years after death
couriermail.com.au,Monster truck show organiser claims medical officers booked but never turned up
couriermail.com.au,The Front Row: Wayne Bennett follows in the footsteps of Jack Gibson as league phenomenon
couriermail.com.au,Annastacia Palaszczuk to join thousands at Red Rose rally
couriermail.com.au,Jackie Trad accuses Opposition of racism after comparison to former Saddam Hussein propaganda boss
couriermail.com.au,Man accused of killing housemate in brawl pleads not guilty to manslaughter
couriermail.com.au,True Blue Crew planning Australia Day convoy on Sunshine Coast
couriermail.com.au,PSMA Australia maps the country’s buildings and finds Queensland on top with solar panels and swimming pools
couriermail.com.au,Man charged after allegedly ramming police cars at Coomera
couriermail.com.au,Government yet to implement CCC recommendations
couriermail.com.au,Brisbane startup Maxwell Plus uses technology in fight against cancer
couriermail.com.au,Toyah Cordingley murder: Mystery family could hold key to capture of 24-year-old’s killer
couriermail.com.au,"Two-year-old girl, pregnant woman hurt in driveway accident"
couriermail.com.au,"Fees from pirate funds Henry Morgan, Benjamin Hornigold under scrutiny"
couriermail.com.au,"Mother, son involved in chocolate dispute told they face arrest, time behind bars"
couriermail.com.au,Researchers want residents to track brush turkeys with an app
couriermail.com.au,Major change to Brisbane parking permits
couriermail.com.au,Vicious mall brawl caught on CCTV
couriermail.com.au,Luxury nine-storey apartment block approved for Woody Point foreshore
couriermail.com.au,Wallaby attack pushes call to shut dog beaches on Bribie Island
couriermail.com.au,Queensland police investigating incident at Brisbane monster truck show
couriermail.com.au,Public can provide feedback on government plans to overhaul Petrie roundabout
couriermail.com.au,LNP Brisbane City councillors face potential conflict of interest
couriermail.com.au,"Mitchell Services 2018 AGM: contract renewals topping 10%, touch up again over pay disclosure"
couriermail.com.au,Late night cyclist due to face same court he allegedly urinated on
couriermail.com.au,Huge petition to stop clearing in suburban refuge
couriermail.com.au,Aurizon leaders’ judgment questioned after court finds against the rail operator
couriermail.com.au,Ben Barba and Cowboys pick up pace in pre-season preparations
couriermail.com.au,Time running out for exotic birds in small seaside town
couriermail.com.au,Rats of Tobruk make special appearance at commemorative service
couriermail.com.au,Businesses rail against parking limits and meters
couriermail.com.au,Gamble vying for more NRL call ups with Wests Tigers in 2019
couriermail.com.au,Logan Council staff pay deal includes domestic violence leave
couriermail.com.au,Teenage girl guilty of indecently assaulting eight-year-old cousin
couriermail.com.au,Comedian and columnist Mel Buttle nominated for AACTA Award
couriermail.com.au,"Drones, robotics and 3D printing all on offer for Moreton Bay students"
couriermail.com.au,Halloween 2018: Where to trick or treat in Brisbane
couriermail.com.au,Howard Smith Wharves announces Mr Percival’s bar is the new place to be
couriermail.com.au,Brisbane City Council backs LGAQ plan for cut of speed camera cash
couriermail.com.au,"Severe thunderstorms to bring heavy rainfall, flash flooding"
couriermail.com.au,Family seeks legal advice over Mt Gravatt monster truck show crash
couriermail.com.au,Dumped Liberal MP Jane Prentice may run as independent
couriermail.com.au,The Western Bulldogs baseball club’s Little League Rams win on the last play of the game
couriermail.com.au,Nudgee College First XV winger Jangala Bennet has signed a two year deal with the Cronulla Sharks
couriermail.com.au,US midterm elections are test for Donald Trump’s leadership
couriermail.com.au,How LeBron James’ signing with the Los Angeles Lakers forced LaVar Ball to shut his mouth
couriermail.com.au,Corporate Travel Management had warning of short selling probe
couriermail.com.au,Quest newsletter: Sign up for local news straight to your inbox
couriermail.com.au,At least two months of planning went into VGI Partners’ ambush of Corporate Travel Management at the weekend
couriermail.com.au,"GoodStart 2018 earnings: says occupancies rise, bucking industry trends"
couriermail.com.au,Domino’s North Lakes was robbed early Sunday morning and police are asking for help
couriermail.com.au,"Man accused of child grooming, rape, granted bail"
couriermail.com.au,Hank and Lily speak out after Bride and Prejudice debut
couriermail.com.au,Latest emails reveal ETU sent Mark Bailey dossiers on power chiefs
couriermail.com.au,Springwood Video set to close next month
couriermail.com.au,Highrise city schools are on the horizon
couriermail.com.au,EDITORIAL: Great tradition of cricket deserves much better
couriermail.com.au,Parents key to lifting weight burden from kids
couriermail.com.au,Childhood immunisation rates a ‘national disgrace’
couriermail.com.au,"Opinion: Adding 2750 staff will improve Centrelink waiting times, says Minister"
couriermail.com.au,Bullets identify keys to taking Wildcats down in Perth Arena
couriermail.com.au,Quade Cooper takes a shot at Brad Thorn on way to Melbourne Rebels
couriermail.com.au,Police appeal for help to identify motorbike after child hurt in hit and run
couriermail.com.au,Supercars legend Craig Lowndes at peace with his decision to retire
couriermail.com.au,Perth Wildcats plan to turn up the defensive heat against the Brisbane Bullets
couriermail.com.au,Big clean-up after molasses truck rolls at Mount Tyson
couriermail.com.au,Queensland racing strike on cards as racing industry lobbies for bigger cut of POC tax haul
couriermail.com.au,Buns in the oven ready for special visitors
couriermail.com.au,Johnathan Thurston says new Cowboys recruit Ben Barba can emulate North Queensland hero Matt Bowen
couriermail.com.au,Education emerges as powerhouse driving Brisbane’s CBD
couriermail.com.au,Queensland Parliament votes to decriminalise abortion
couriermail.com.au,Brisbane traffic: RACQ’s roadmap to keep southeast Queensland moving
couriermail.com.au,Brisbane Roar finds no room for former Socceroos defender Luke DeVere
couriermail.com.au,Corey Oates ends speculation over his Broncos future by agreeing to a new deal
couriermail.com.au,Sam Stosur feels Williams made sexism claim at wrong time
couriermail.com.au,"Max Brenner wound up, but brand may yet be resurrected"
couriermail.com.au,Dreamworld inquest: Extra week will take hearings right up to Christmas
couriermail.com.au,Abortion debate: Mark McArdle criticises both sides for behaviour
couriermail.com.au,How you can help historic Morningside school rebuild
couriermail.com.au,CCC chief in integrity crisis over throwaway remark
couriermail.com.au,School discrimination hurts more than just kids
couriermail.com.au,Greater Springfield house prices could fall after landmark court ruling
