source,title
crimefeed.com,Bus Driver Suspended For Letting Monkey Steer Bus Full Of Passengers
crimefeed.com,He Left To Go To The Bathroom & Never Came Back: Where Is Michael Vanzandt?
crimefeed.com,"Cold Case Solved When Teen, Missing For 7 Years, Found Dead In Cabin Chimney"
crimefeed.com,Watch: Hero Dad Tackles Perv Taking Upskirt Pics Of Daughter At Target
crimefeed.com,Wife Of Texas Church Shooter Who Killed 26: “I Will Love Him Always”
crimefeed.com,The Murder Castle: Inside The Hotel Of Horrors Built By H. H. Holmes
crimefeed.com,Did Orson Welles Kill The Black Dahlia? How One Celebrity Conspiracy Theory Won’t Die
crimefeed.com,"Sex, Cash & 5 Shots To The Back Of A State Trooper’s Head"
crimefeed.com,Murderous Moms: Did Silly String Send Darlie Routier To Death Row?
crimefeed.com,Aspiring Actress Adea Shabani Disappears From Her Hollywood Home
crimefeed.com,"Abused Kids Say New Mexico Compound Was Terror School, Missing Boy Died There"
crimefeed.com,Arrest Affidavit: Natalie Bollinger Gave No Indication She Planned To Take Her Own Life
crimefeed.com,Female “Serial Killer” Who Murdered Her Husband AND Her Boyfriend Is Competent To Stand Trial
crimefeed.com,Could Golden State Killer Suspect Joseph DeAngelo Have More Victims Out There?
crimefeed.com,“He Accused Me Of Just Regretting Some ‘Rough Sex'”: Rape Survivor Abby Honold
crimefeed.com,Sara Russell Of Texas Arrested For Mailing Meth To Killer In Prison (OMG Mug Shot!)
crimefeed.com,Person Of Interest Sought In Strangulation Of Ex-Playboy Model Christina Carlin-Kraft
crimefeed.com,"Man Sentenced To Death For “Animalistic” Torture, Murder Of 8-Year-Old Boy He Thought Was Gay"
crimefeed.com,Suspect In Bike-By Murder Of George Bush’s Doctor Has killed Himself
crimefeed.com,5 Facts About The Legal Dream Team That Got O.J. Simpson Acquitted
crimefeed.com,Lorenzo Gilyard: “The Kansas City Strangler” Who Got Caught 10 Years After He Stopped Killing
crimefeed.com,"Dad Did Not Call 911 After His Son, 8, Ate Meth From Cereal Bowl & Died"
crimefeed.com,How Is Your State Ranked On The List Of States With The Most Psychopaths?
crimefeed.com,A Woman’s Quest For Her Birth Mother Reveals A Horrifying Murder
crimefeed.com,Genealogy DNA Helps Crack 1987 Cold Case Murder Of Young Couple In Washington
crimefeed.com,5 Mysterious Missing-Persons Cases You May Not Have Heard About In The News
crimefeed.com,Flakka Is Coming: 5 Things You Should Know About Florida’s Frightening New Drug Of Choice
crimefeed.com,What Prompted This Mom Of Four To Butcher Her Children In 1978? The Bizarre Case Of Gail Trait
crimefeed.com,Where Are “The Springfield Three”? Women Disappeared Without A Trace In 1992
crimefeed.com,"What Happened To Robyn Gardner? After Natalee Holloway, Another American Woman Disappears In Aruba"
crimefeed.com,"Ex-Marine Serial Killer, Convicted Of 3 Illinois Murders, Found Guilty Of 5 In California"
crimefeed.com,Michael Peterson & The “Staircase Murder”: Was It All Just About The Money?
crimefeed.com,"Belgian Clown & Yodeling Sidekick Allegedly Murder Ex In Front Of Her Kids, Livestream Standoff"
crimefeed.com,"A Look Back At Serial Killer Arthur Shawcross, “The Genesee River Killer”"
crimefeed.com,Florida Mom Who Dragged 4-Year-Old Daughter Into River Is Charged With Murder
crimefeed.com,Could This Texas Home Health Care Nurse Be A Serial Killer?
crimefeed.com,Twisted Sisters: The Mass Murder That Shocked A Small Oregon Town
crimefeed.com,"Another Stairwell, Another Body: Michael Peterson’s First “Staircase Murder”"
crimefeed.com,"Maximum Risk Sex Offender Violates Parole, Takes Maximum Scary Mug Shot [Pic]"
crimefeed.com,Was The Shotgun “Suicide” Of DJ Fickey Actually A Murder Over A Woman?
crimefeed.com,Shelbey Thornburgh: Was This Aspiring Model’s Killer Caught On Camera?
crimefeed.com,"“Disappeared”: Tyarra Williams, 19, Went Missing In 2016 — Can You Help Find Her?"
crimefeed.com,“I’m Going To Barbecue The Child Molesters”: Man Allegedly Tried To Burn 4 Sex Offenders To Death
crimefeed.com,Who Was Ottis Toole? Henry Lee Lucas’ Degenerate Sidekick & Adam Walsh’s Killer
crimefeed.com,Interview: The New “Empire On Blood” Podcast Is “Serial” On Crack
crimefeed.com,Outrageous Footage Of Brittany Burke Crashing Through Ceiling At Reddi Mart
crimefeed.com,Professor Accused Of Killing Wife & Daughter With “Gas-Filled Yoga Ball”
crimefeed.com,"11 Years Later, What’s Happening In The Madeleine McCann Investigation?"
crimefeed.com,Which 10 Professions Do You Think Boast The Most Psychopaths?
crimefeed.com,Cold Case: Man Arrested In Connection With Murder Of 13-Year-Old Girl In 1986
crimefeed.com,Wanda Barzee Released From Prison Despite Elizabeth Smart’s Pleas That She’s A “Danger”
crimefeed.com,The “Goth Girl Murder” & Other Similar Cases: Why Being An Outsider Can Be Deadly
crimefeed.com,Leonard Lake and Charles Ng: Psycho Serial Killers Undone By Shoplifting
crimefeed.com,NJ Grandmother Dies After Electric Company Cut Off Power To Her Home
crimefeed.com,Zookeeper “Joe Exotic” Charged In Murder-For-Hire Plot Of An Animal-Rights Activist
crimefeed.com,Former FBI Profiler Candice DeLong Explains Why It’s Never “Normal” When Women Kill
crimefeed.com,Killer Twins: It’s Double Trouble When Identical Siblings Turn Deadly
crimefeed.com,Woman Gets 7th DUI In 7th State After Trying To Fill Her Car With Kerosene
crimefeed.com,Evil Genius: The 2003 “Pizza Bomber” Bank Heist & The Black Widow Who Blew It All Up
crimefeed.com,Damien Echols Of The West Memphis Three Debuts “High Magick” Art Exhibit
crimefeed.com,"FBI Agents Are At The Alleged Golden State Killer’s Sacramento House, Neighbors React"
crimefeed.com,“Convicting A Murderer”: New Doc Series Will Show Steven Avery Case From Prosecution POV
crimefeed.com,EXCLUSIVE: “Atlanta Monster” Host Opens Up About His Talks With Serial Killer Wayne Williams
crimefeed.com,Mom & Dad Charged In Connection With The Murder Of Their 5-Year-Old Autistic Son
crimefeed.com,UPDATE: The “Dating Game Killer” Too Ill To Be Extradited To Face New Murder Charge
crimefeed.com,Westley Allan Dodd Begged For Execution: “The Thoughts Of Killing Children Are Exciting To Me”
crimefeed.com,The Wonderland Murders: Detectives Hunt Killer Of 2 Altruistic Women In The Pacific Northwest
crimefeed.com,My Friend Dated “Dirty John” Meehan … But I Busted Him
crimefeed.com,Can You Help Find Who Murdered & Burned Playboy Model Paula Sladewski?
crimefeed.com,Henri Désiré Landru: France’s Seductive Serial Killer
crimefeed.com,Author Nikki Meredith Opens Up About Her Relationship With The Manson Family Women
crimefeed.com,"Crime History: Bernhard Goetz, NYC’s “Subway Vigilante,” Opens Fire in 1984"
crimefeed.com,Will Newly Released Crime Scene Photos Help Solve Cold 1958 Murder Case?
crimefeed.com,"As Cops Close In, Suspect In 1974 “Satanic” Church Murder Of Arlis Perry Kills Himself"
crimefeed.com,Gone Without A Trace: 10 People Who Have Been Missing For 10 Years Or More
crimefeed.com,Mom Punishes Son By Dressing Him Up In Drag And Posting Pics On Facebook
crimefeed.com,“Sugar Town”: Did Cops Fake The “Suicide” Of Handcuffed Suspect Victor White III?
crimefeed.com,Did Lizzie Borden Really Kill Her Father & Stepmother With An Ax?
crimefeed.com,"Hart Family Cliff Crash: 6 Children Feared Dead, Plunge May Have Been Intentional"
crimefeed.com,"D’oh! Thief Uses Play-Doh To Block Camera, Leaves Perfect Fingerprint For Cops"
crimefeed.com,Police Have A Suspect In “The Doodler” Serial Killer Cold Case
crimefeed.com,“Disappeared”: Virginia Trans Teen Sage Smith Vanished Without A Trace
crimefeed.com,"A Look Back At Ira Einhorn, The “Unicorn Killer”"
crimefeed.com,The Ghoulish & Unforgettable Crimes Of Murderer & Grave-Robber Ed Gein
crimefeed.com,Female Admirers Flood Parkland Shooter Nikolas Cruz With Love Letters & Sexy Pics
crimefeed.com,The Girl In The Basement: A Look Back At The Torture And Murder Of 16-Year-Old Sylvia Likens 51 Years Later
crimefeed.com,Wife Punishes Cheating Husband By Snipping Off His Penis With Pair Of Scissors –Twice!
crimefeed.com,Former NFL Star Charged With Raping & Attempting To Rape 4 Women Over 50
crimefeed.com,Barbara Walters Presents American Scandals: Could The Menendez Brothers Get A Retrial?
crimefeed.com,Canadian “Cannibal Killer” Luka Magnotta’s Obsession With “Barbie Killer” Karla Homolka
crimefeed.com,"Cops: Mom, 92, Fatally Shot Son, 72, Who Wanted To Put Her In Assisted Living"
crimefeed.com,"Accused Incest Dad Denies Sex With Daughter, Says He Just Gave Her Cup Of His Semen"
crimefeed.com,"Death of a Centerfold: Model, Actress, and Playboy Playmate Dorothy Stratten’s Murder 36 Years Later"
crimefeed.com,Bugsy Siegel: Who Killed The Mobster Who “Invented” Las Vegas?
crimefeed.com,Did A Horror Film Inspire The 1974 Texas Taxidermist Massacre?
crimefeed.com,The Mysterious Death Of Journalist Dorothy Kilgallen
crimefeed.com,The Honolulu Strangler: “Breaking Homicide” Tracks A Serial Killer In Hawaii
crimefeed.com,"Michael Peterson: Stolen Valor, A Secret Sex Life, 2 Dubious Deaths — & Freed From Prison?"
crimefeed.com,Murder Most Fowl: Did An Owl Commit The Michael Peterson “Staircase Murder”?
crimefeed.com,What Type Of Person Stages A Crime Scene?
