source,title
csmonitor.com,Melissa McCarthy turns to drama in ‘Can You Ever Forgive Me?’
csmonitor.com,US sanctions against Hezbollah and Iran hurt Shiite militias
csmonitor.com,A better way to view the migrant caravan
csmonitor.com,Four October movies you should see this month
csmonitor.com,US territory slammed by strongest storm to hit US this year
csmonitor.com,Symbolic mega-bridge connects Hong Kong to mainland
csmonitor.com,"As Brazil votes, Bolsonaro fans are hungry for a hero"
csmonitor.com,‘Climate kids’ seek action – and await their day in court
csmonitor.com,Control of House may hinge on ‘Panera moms’ in the suburbs
csmonitor.com,What mail bombs say – and don’t say – about political discourse
csmonitor.com,Malaysia raises concern over plastic waste from developed countries
csmonitor.com,"Florida man charged in mail-bomb scare, ending nationwide manhunt"
csmonitor.com,Can Idaho wolves shed their 'big bad' reputation?
csmonitor.com,How a post-Khashoggi US 'correction' on Saudi relations could unfold
csmonitor.com,African praise of Saudi Arabia highlights diplomatic pressures
csmonitor.com,"Amid 2018 rancor, O’Rourke’s optimism stood out. But can he keep it civil?"
csmonitor.com,Community building: Chicago experiment links libraries and apartments
csmonitor.com,"For Iran's women's movement, progress is slow. But it's progress."
csmonitor.com,Why Americans are talking less and less about ‘love’ and ‘kindness’
csmonitor.com,Syria frees Japanese journalist after three years captivity
csmonitor.com,"As caravan wends its way north, Mexico walks a fine line"
csmonitor.com,"Democrats rake in big bucks from small donors, but effect is unpredictable"
csmonitor.com,Evangelical support gives Brazil's Bolsonaro votes in unlikely places
csmonitor.com,Political violence and its antidote
csmonitor.com,Trailer parks face rising rents. This one's residents found a way out.
csmonitor.com,Overdose deaths in US from opioid epidemic levels off
csmonitor.com,"In China, newly discovered dinosaur bones rewrite history"
csmonitor.com,"Palestinian activist, Ahed Tamimi, takes her cause abroad"
csmonitor.com,"Meanwhile in ... Berlin, three new rabbis have made history"
csmonitor.com,NATO chief doesn't expect arms race despite US threats
csmonitor.com,Navajo Nation looks to Zumba and taxes to curb obesity
csmonitor.com,Vulnerable voting machines cause concern in Congo
csmonitor.com,Iraq tries a new approach to filling cabinet positions: open to all via online platform
csmonitor.com,Flashbacks from 2016 put Democrats on notice – and on edge
csmonitor.com,Person detained in connection with mail bombs
csmonitor.com,"Migrant caravan, increasing in size, treks north through Mexico"
csmonitor.com,Trump threatens to cut Central American aid as caravan approaches US
csmonitor.com,Rent control on ballot as California seeks a fix for housing costs
csmonitor.com,"With new evidence, pressure mounts against Saudis after Khashoggi's killing"
csmonitor.com,Human Rights Watch report highlights torture at the hands of Palestinians
csmonitor.com,How Syrian refugees strain – and strengthen – Jordan
csmonitor.com,Cities like Buffalo feel brunt of refugee cuts
csmonitor.com,Contest for GOP House leadership lays bare Republican divisions
csmonitor.com,Borrowed words spice up English
csmonitor.com,"After charity sex-abuse scandal in Liberia, a storm of anger, guilt, and grief"
csmonitor.com,Why a nuclear-arms pact can save Europe
csmonitor.com,"‘Nationalist’: A president takes a mantle, then shows he means it"
csmonitor.com,Florida's tight gubernatorial race gains momentum
csmonitor.com,'Anne Frank's Diary' is a profoundly moving graphic presentation of the classic
csmonitor.com,A new candidate class: schoolteachers running for office
csmonitor.com,A soft way to reform global trade
csmonitor.com,He’s no saint – but Roger Stone insists he’s innocent of Russia collusion
csmonitor.com,Risk of a new civil war? Today 'us and them' differs from 1850s.
csmonitor.com,Election postponed in Kandahar after attack on security meeting
csmonitor.com,Why tsunamis are so difficult to predict
csmonitor.com,Will increasingly indoorsy Canadians answer the call of the wild?
csmonitor.com,"In Alamo redesign, renewed battles over who gets to tell stories of Texas"
csmonitor.com,Readers write: Thoughts on new Heart of the News section
csmonitor.com,"In China, melting glaciers are a visible reminder of climate change"
csmonitor.com,"In ‘The Guilty,’ a police dispatcher races against time"
csmonitor.com,Identity politics on the ropes in Iraq?
csmonitor.com,"With new tech and opportunity, African agriculture gets a makeover"
csmonitor.com,States and feds unite to ensure election security in midterms
csmonitor.com,"Behind affirmative action divide, a common disdain for discrimination"
csmonitor.com,White House strains US-China relations with tough trade and combative words
csmonitor.com,Poverty plagues forgotten agricultural communities in California
csmonitor.com,Pope Francis to consider opening the priesthood to married men
csmonitor.com,Keeping Italy in Europe’s nest
csmonitor.com,"As large Honduran caravan enters Mexico, Trump warns migrants to turn back"
csmonitor.com,Would US quitting the INF treaty rekindle a big-power arms race?
csmonitor.com,'The Kindergarten Teacher' is worth seeing for Maggie Gyllenhaal’s performance
csmonitor.com,"Reporter's Notebook: On edge of Sahara, camel is what's for dinner"
csmonitor.com,King Tut on exhibit as views of antiquities evolve
csmonitor.com,"Readers write: Scottish phrases, more photos, reading habits, learning about the Amazon"
csmonitor.com,How Stacey Abrams has gotten within one point of Georgia governor’s mansion
csmonitor.com,'Pride' thrusts Jane Austen into 21-century Bushwick
csmonitor.com,Offshore drilling to begin in federal Arctic waters off Alaska
csmonitor.com,Guilty verdicts will help NCAA prosecute unethical recruitment practices
csmonitor.com,'American Prison' presents a highly disturbing insider's view of a private prison
csmonitor.com,"After #MeToo, state legislatures make changes"
csmonitor.com,US businesses begin to increase services for deaf people
csmonitor.com,The Other Side
csmonitor.com,Getting to know our spirituality
csmonitor.com,Deep sanity
csmonitor.com,Rise above political polarization
csmonitor.com,A Soul-filled life
csmonitor.com,"Loaves, fish, and … cherry tomatoes"
csmonitor.com,"What are you watching? Readers recommend 'Black Panther,' 'The Treasure of the Sierra Madre'"
csmonitor.com,A superpower we all truly have
csmonitor.com,"Meanwhile in ... Afghanistan, fans are rejoicing over what’s being called the 'fairy tale' success story of the country’s cricket team"
csmonitor.com,'In the Hurricane's Eye' puts Revolutionary War conflict the Battle of the Chesapeake back in its deserved spotlight
csmonitor.com,Water pollution threatens Mandaean religious practices in Iraq
csmonitor.com,New hires reflect NHL's move toward including women
csmonitor.com,"To fight corruption, Kenyans study integrity"
csmonitor.com,"Miles inland, rural counties still digging out after hurricane Michael"
csmonitor.com,Pompeo in Riyadh as Saudis face increasing backlash over missing journalist
csmonitor.com,"Fleeing violence, Honduran migrant caravan enters Guatemala en route to US"
csmonitor.com,Venezuelan fans welcome new baseball season amid national crisis
csmonitor.com,All for one? How key undecided senators may approach Kavanaugh vote
csmonitor.com,"As affordable housing crisis deepens, states begin to take action"
