source,title
deadspin.com,"Baseball's Weirdest Team Makes A Weird GM Hire, But Maybe A Smart One Too"
deadspin.com,Ty Montgomery Says He Wasn't Sure If He Was In The End Zone
deadspin.com,Ass Team Of The Week: Eli Manning And The New York Giants Will Break You
deadspin.com,Dominique Rodgers-Cromartie Retires Rather Than Keep Playing For The Raiders
deadspin.com,Ref Kicks Dildo At Bills Game
deadspin.com,Steph Curry Is Still Unreal
deadspin.com,Shaun White Earns Distinction For First Awful Celebrity Halloween Costume of 2018
deadspin.com,Boxer Throws Punches At His Own Cornerman After Losing Fight
deadspin.com,David Price Has Earned Some Peace And Quiet
deadspin.com,Patriots Knocked Down A Solid Notch Or Two By Devastating Fan Sign
deadspin.com,Joe Lacob's Attempt To Hose Oakland Taxpayers Out Of $40 Million Rejected By Arbitrator
deadspin.com,"Steve Pearce Had A Long, Strange Trip To World Series MVP"
deadspin.com,Even The Mighty Premier League Must Bow Before The Power Of America's Stupidest Sport
deadspin.com,"Regis Prograis, The Swamp Creature, Is Evolving"
deadspin.com,"What The Fuck, Warriors"
deadspin.com,Report: Prison Drug Use May Have Contributed To Aaron Hernandez's Death By Suicide
deadspin.com,Barcelona Crushed Real Madrid And The Endless Cycle Of Death And Rebirth Begins Anew
deadspin.com,Larry Fitzgerald Spiked The Ball To Get Back At His Garbage Son
deadspin.com,Ben Simmons Is Going To Need To Shoot At Some Point
deadspin.com,China And Russia Are Back On Top Of Men's Gymnastics
deadspin.com,"Browns Don't Stop At Firing Hue Jackson, Shitcan Todd Haley, Too [Update]"
deadspin.com,The Browns Have Finally Fired Hue Jackson [Update]
deadspin.com,Boban Marjanovic Can Ferociously Dunk By Just Kinda Leaning Back
deadspin.com,Ty Montgomery Went Rogue
deadspin.com,The Situation In Post-LeBron Cleveland Has Become Very Grim Very Quickly
deadspin.com,Interception Machine Jameis Winston Gets Benched For Ryan Fitzpatrick
deadspin.com,"Rick Pitino Wants To Coach In The NBA, Just As I Would Like To Harness The Terrifying Power Of The Oort Cloud"
deadspin.com,Mike Francesa Spends A Full Minute Trying And Failing To Pronounce Matt Vasgersian's Name
deadspin.com,Soccer Guy Gets Yellow Card For Celebrating Goal By Proposing To His Girlfriend
deadspin.com,"Eric Reid Explains Why He Called Malcolm Jenkins A ""Neo-Colonialist"""
deadspin.com,"Activists Display Huge ""Trans People Deserve To Live"" Banner During World Series"
deadspin.com,"""Evolution"" Was The Night WWE's Women Deserved. It Also Kicked Ass."
deadspin.com,"Adam Vinatieri Breaks NFL's All-Time Points Record, Receives Weird Congratulatory Video From Morten Andersen"
deadspin.com,The Goddamn Red Sox Won The Goddamn World Series
deadspin.com,Dave Roberts Helped The Red Sox Grind The Dodgers Into Dust
deadspin.com,The Steelers Went Full-Rutgers And Forgot To Field This Safety Punt
deadspin.com,Fitzmagic (Sort Of) Returns After Jameis Winston Gets Benched For Throwing Four Interceptions
deadspin.com,Leicester City Owner Aboard Helicopter That Crashed Outside Stadium After Match [UPDATE]
deadspin.com,Iowa's Mascot Got Rocked In The Beans By An Errant Pass
deadspin.com,Seahawks Ice Game With Punter’s Ballsy Fourth Down Run
deadspin.com,Seahawks Do Impressive “Batter Charges The Mound” Touchdown Celebration
deadspin.com,Report: The Browns' Coaching Mess Might Require A Clean-Up
deadspin.com,The International Gymnastics Federation Bans Cat Makeup For Gymnasts
deadspin.com,Tasha And Jordan Schwikert Sue the USOC And USAG For Enabling Larry Nassar's Years Of Abuse
deadspin.com,Walker Buehler Is A Goddamn Stud
deadspin.com,"After Roman Reigns's ""Raw"" Moment, Where Is The Line In WWE?"
deadspin.com,"Fergie's Ex-Husband Calls Out That ""Prick"" Draymond Green For Laughing At Her Dreadful Rendition Of The National Anthem"
deadspin.com,There’s Gonna Be A Live Deadcast Party In Nashville And Y’all Are Invited!
deadspin.com,"Mike Gundy And Tom Herman Cook Up Some Beef, Then Quickly Throw It Away"
deadspin.com,Cavaliers Quickly Put Tyronn Lue Out Of His Post-LeBron Misery
deadspin.com,Simone Biles Gets A Vault Named After Her Just 24 Hours After Going To The ER For A Kidney Stone
deadspin.com,"Woof, The Thunder Really Cannot Make A Bucket"
deadspin.com,The Only Thing Left To Do Is Yell About The World Series
deadspin.com,Mail Bombing Suspect Appears To Be Incoherently Passionate About Youth Soccer
deadspin.com,Suspected Mail Bomber Cesar Sayoc Has Sports Takes
deadspin.com,Damian Lillard Scored 34 Points In A Half And Blamed It On A Heckler
deadspin.com,Florida State Got Whomped
deadspin.com,Report: The Broncos' Ownership Situation Is Getting Messy
deadspin.com,Not Even A Kidney Stone Can Stop Simone Biles
deadspin.com,Dolphins Gifted Red Zone First Down On Highly Suspect Illegal Contact Penalty
deadspin.com,Donovan Mitchell Woke Up And Lit Up The Rockets
deadspin.com,"Despite His Insistence, Kirk Minihane Does Not Seem Ready To Return To His Radio Show"
deadspin.com,Race-Baiting Troll Phil Mushnick Is Really Reaching For Excuses To Be Racist Now
deadspin.com,The NFL Actually Fired An Official
deadspin.com,Idiots Are Giving Aliya Mustafina So Much Shit For Returning To Competition After Having A Baby
deadspin.com,La Liga Willing To Go To Court Over Barcelona's Match In The U.S. After FIFA Announced Its Opposition
deadspin.com,"Hell Yeah, Clemson Scored A Fat Man Touchdown"
deadspin.com,Does Robin Lopez Have Teeth In His Hair? An Investigation
deadspin.com,Hawks Owner Tony Ressler: I Was A Big Dumb Idiot But Now I'm All Better
deadspin.com,"Wake Forest's Matt Colburn Runs All Over Louisville, Who Pulled His Scholarship In 2015"
deadspin.com,Normal Joe Flacco Bought A Mattress From Sean Payton's Brother Down The Jersey Shore
deadspin.com,Daryl Morey Is Daring Tom Thibodeau To Say No
deadspin.com,Iowa's Punter Connects With A Walk-On Defensive End For This Fat Man Touchdown
deadspin.com,Juventus President Says He Divined Cristiano Ronaldo's Innocence By Looking Into His Eyes
deadspin.com,Bucks Owner Wes Edens Is Being Subpoenaed In The Wall Street Sex Dungeon Lawsuit
deadspin.com,Why Didn't The Raiders See If They Could Get More For Khalil Mack?
deadspin.com,Fucking Max Muncy Won The Longest World Series Game In History
deadspin.com,The Warriors Don't Give A Shit About Fergie's Feelings
deadspin.com,"Jaguars Players Arrested, Released After ""Misunderstanding"" Over $64,000 London Bar Tab"
deadspin.com,NFL Admits Helmet Hit That Baker Mayfield Complained About Should Have Been Penalized
deadspin.com,Leicester City's Daniel Amartey Stretchered Off After Horrific Leg Injury [WARNING: GRAPHIC]
deadspin.com,Dolphins Improvise Delightful New Way Of Advancing Upfield
deadspin.com,The Horror Of Tony Saunders's Arm Break
deadspin.com,A Taxonomy Of Calls For Unity In The Hardcore Scene
deadspin.com,Reports: Indians Warned Red Sox Of Astros Employee Who Took Photos Of Dugout In ALDS
deadspin.com,"Report: Mike Leach Called Pac-12 Official ""A Total Coward"" In Series Of Texts About Player Safety"
deadspin.com,Big Fucking Shock: The NFL's Move To L.A. Looks To Be A Financial Disaster
deadspin.com,"Fan Robs Jose Altuve Of Game-Tying Dinger, Or Maybe Robs Mookie Betts Of Spectacular Catch"
deadspin.com,"Ellen DeGeneres, Drunk With Power, Tries To Set Up Naomi Osaka With Michael B. Jordan"
deadspin.com,Kevin Durant's Brother's Instagram Comment Definitely Means That Kevin Won't Re-Sign With The Warriors
deadspin.com,Kristi Toliver Becomes First Active WNBA Player To Join NBA Coaching Staff
deadspin.com,"Bad Newspaper Photoshop: Manny Machado Apparently Needs Emergency Shoulder Surgery, Probably Not Worth $300M"
deadspin.com,"Craig Counsell Pulled His Game 5 Starter After One Batter, On Purpose"
deadspin.com,ESPN President Jimmy Pitaro Delivers Hollow Speech About Sticking To Sports
deadspin.com,The Packers' All-Out Blitz Won The Day
deadspin.com,"Whatever The Hell Jaylen Brown Did To Joel Embiid Here, It Ruled"
deadspin.com,David Ortiz Went Nuts In The Studio For Jackie Bradley Jr.'s Grand Slam
deadspin.com,Five-Foot-Six Tony Kemp Saves Multiple Runs With A Full Extension Catch At The Wall
deadspin.com,"Maryland Football Parents Are Organizing Against ""Narcissistic Sociopath"" DJ Durkin's Potential Reinstatement"
deadspin.com,The Texans' Red-Zone Offense Is Enough Of A Reason To Fire Bill O'Brien
