source,title
edition.cnn.com,How the founder of America's trendiest salad spot stays healthy while traveling
edition.cnn.com,National Counterterrorism Center has not concluded there is a foreign terror connection
edition.cnn.com,The package at Wasserman Schultz's office was addressed to Eric Holder
edition.cnn.com,Looking for great American architecture? Focus on these four cities
edition.cnn.com,Ai Fukuhara: From tearful toddler to Japan's table tennis queen
edition.cnn.com,Can Rafael Nadal's mind conquer his ailing body in 2015?
edition.cnn.com,Where is the world's busiest airport?
edition.cnn.com,Superyachts show off their best sides in drone movies
edition.cnn.com,Gino Bartali: The man who helped save Italy's Jews
edition.cnn.com,"Quidditch is real, and it wants to go pro"
edition.cnn.com,Drybar: The $50 million business built on hot air
edition.cnn.com,Going Global in 2015: 10 start-ups to watch
edition.cnn.com,DryBath: How to keep clean without using a drop of water
edition.cnn.com,Elizabeth Meyer recalls 'Armageddon battle' to restore Endeavour
edition.cnn.com,How football unlocked the heart of a boy with autism
edition.cnn.com,"French Open: Yannick Noah - Tennis icon, rock star, celebrity dad"
edition.cnn.com,Surreal 'boats-on-wheels' race across the Nevada Desert
edition.cnn.com,Does formula mystery help keep Coke afloat?
edition.cnn.com,"Suits you, Sir! Spanish soccer team wears tuxedo kit"
edition.cnn.com,Syria conflict: Kicking for hope in Zaatari refugee camp
edition.cnn.com,Zara Phillips targets Olympic gold with baby Mia by her side
edition.cnn.com,Inside the mind of a caddy: The bag men behind the world's top golfers
edition.cnn.com,Inter Milan owner Erick Thohir: Why Italian football needs to change -- or 'die'
edition.cnn.com,California Chrome: Will long wait for Triple Crown end at Belmont?
edition.cnn.com,'Miracle' club Eibar a blueprint for soccer's future?
edition.cnn.com,'Silk Road' railways link Europe and Asia
edition.cnn.com,Would you wear this to work? Power dressing beyond shoulder pads
edition.cnn.com,Sonny Bill Williams: Islam brings me happiness
edition.cnn.com,Opinion: Draghi needs to realize ECB's gas pedal is already on the floor
edition.cnn.com,Christensen: We are living the capitalist's dilemma
edition.cnn.com,Patrick Reed in hot water over foul-mouthed rant in China
edition.cnn.com,Tom Daley: Olympic diver reveals he is in a gay relationship
edition.cnn.com,Who are the real winners and losers of the 2014 World Cup?
edition.cnn.com,Introducing the world's next tallest building -- which also cleans the air
edition.cnn.com,Financial Fair Play: Manchester City and PSG punished
edition.cnn.com,UEFA's new 'League of Nations' - Do you understand it?
edition.cnn.com,The Masters: Why the man who designed Augusta died in poverty
edition.cnn.com,Iranian official on nuke deal: 'We did not agree to dismantle anything'
edition.cnn.com,'Female Pele' Marta seeks fair deal for women's soccer
edition.cnn.com,AC Milan pair Kevin Constant and Nigel de Jong subjected to racist abuse
edition.cnn.com,The 'Lion City' roars: How tiny nation packs big economic punch
edition.cnn.com,Ex-North Carolina State hero Lorenzo Charles dies in crash
edition.cnn.com,Davos: All you need to know to be a delegate
edition.cnn.com,Mario Balotelli: Police probe racist abuse directed at Liverpool striker after tweet
edition.cnn.com,NFL or the Olympics? Carlin Isles turns to prayer to decide his future
edition.cnn.com,Michael Phelps suspended by USA Swimming for six months
edition.cnn.com,Former Barcelona coach Tito Vilanova dies at age of 45
edition.cnn.com,Jennifer Lopez to skip World Cup opener in Brazil
edition.cnn.com,Venus Williams: The champion trying to slam Sjogren's syndrome
edition.cnn.com,Hot to trot: The secrets and superstitions of jockey fashions
edition.cnn.com,Bali bombings: How a rugby club emerged stronger from its darkest hour
edition.cnn.com,All you need to know to be a Davos delegate
edition.cnn.com,World Cup scandal! The unbelievable plot to eliminate Brazil
edition.cnn.com,Catch a train from the sky! How vertical travel could transform your commute
edition.cnn.com,"Lucy Li, 11, becomes youngest U.S. Women's Open qualifier"
edition.cnn.com,"World's oldest marathon man, 102, can't imagine life without running shoes"
edition.cnn.com,The President's club: How golf took over the White House
edition.cnn.com,'Horse quidditch' seeks place in Olympics
edition.cnn.com,U.S. tycoon Gene Haas wants to race to billions with Formula One team
edition.cnn.com,Annette Fredskov: A marathon a day made me stronger
edition.cnn.com,John Daly seeks help after sinking to new PGA Tour low
edition.cnn.com,World Cup 2014: FIFA's bus slogans cause misery and mirth on social media
edition.cnn.com,Valentino Rossi: MotoGP's 'Doctor' seeks appointment with destiny
edition.cnn.com,Quick sand: Welcome to Irish beach racing at Laytown
edition.cnn.com,"World Cup 2022: FIFA executive panel debates Qatar heat, workers' rights"
edition.cnn.com,Stem cell transplant 'very encouraging' for type 1 diabetes
edition.cnn.com,Kentucky Derby: Favorite California Chrome is racing on a rock star's dream
edition.cnn.com,Space pioneer Gordon Cooper dies
edition.cnn.com,United States downs Ghana 2-1 in World Cup thanks to Brooks' goal
edition.cnn.com,Interactive: How Fukushima changed world's attitudes to nuclear power
edition.cnn.com,"Three hockey enforcers die young in four months, raising questions"
edition.cnn.com,'You are either with us or against us'
edition.cnn.com,The world's biggest rogue traders in recent history
edition.cnn.com,"Privacy is dead, and social media hold smoking gun"
edition.cnn.com,"Guilty of sex with student, teacher avoids prison"
edition.cnn.com,Ceremony closes 'Ground Zero' cleanup
edition.cnn.com,Baseball Hall of Famer Tony Gwynn dies
edition.cnn.com,D-Day historian: 'Ryan' not best war film
edition.cnn.com,"U.N. chief: Hunger kills 17,000 kids daily"
edition.cnn.com,Living in a cage in Hong Kong
edition.cnn.com,8 easy ways to boost your car's value
edition.cnn.com,Independent probes of Clinton Administration cost nearly $80 million
edition.cnn.com,Mom finds kidnapped daughter six years later
edition.cnn.com,Mechanic sucked into jet engine
edition.cnn.com,"Born with half a brain, woman living full life"
edition.cnn.com,"Feeling lethargic, moody, tired, fat? It could be your thyroid"
edition.cnn.com,Owners: Dog treats killed our pets
edition.cnn.com,Keep your joints healthy: A complete guide to staying strong
edition.cnn.com,Computer disk drives from WTC could yield clues
edition.cnn.com,T.R. Knight reveals why he left 'Grey's Anatomy'
edition.cnn.com,Teamwork helped miners survive underground
edition.cnn.com,SKIN DEEP: Dying to be white
edition.cnn.com,Comedian Gilbert Gottfried fired as voice of Aflac duck
edition.cnn.com,Study: Some types of candles may pollute indoor air
edition.cnn.com,Text of Bush's address
edition.cnn.com,What doctors don't tell you about C-sections
edition.cnn.com,"Harrods unveils Diana, Dodi statue"
edition.cnn.com,Roberts: 'My job is to call balls and strikes and not to pitch or bat'
edition.cnn.com,Pope's Islam comments condemned
edition.cnn.com,Will the 'Age of America' end in 2016?
