source,title
english.chosun.com,Stranded Korean Tourists Start Returning from Typhoon-Hit Saipan
english.chosun.com,U.S. Envoy to N.Korea Expresses Confidence About Denuclearization
english.chosun.com,Chrysanthemum Fest in Changwon Highlights Colorful Autumn
english.chosun.com,Far-Right Candidate Wins Brazil's Presidential Election
english.chosun.com,Germany's 'Iron Lady' Begins Descent After Coalition's Electoral Setback
english.chosun.com,Xiaomi to Launch New Smartphone in Korea Next Month
english.chosun.com,"KOSPI Closes Below 2,000 for 1st Time Since 2016"
english.chosun.com,Thousands in Rome Protest City's Neglect
english.chosun.com,British Soccer Club Owner and Four Others Dead in Helicopter Crash
english.chosun.com,"Japan, India Leaders Build Ties Amid Trade, Security Worries"
english.chosun.com,189 People Feared Dead After Plane Crash in Indonesia
english.chosun.com,Footballer Jang Hyun-soo Faces Punishment for Fake Draft-Exemption Documents
english.chosun.com,2 Koreas Complete Disarmament in Joint Security Area
english.chosun.com,"Istanbul to Unveil New Airport, Seeks to be World's Biggest"
english.chosun.com,Chinese Spy Jet Enters Korea's Air Identification Zone Again
english.chosun.com,U.S. Authorities: Mayhem at Pittsburgh Synagogue a 'Hate Crime'
english.chosun.com,Access to Daycare Centers Encourages Having More Kids
english.chosun.com,Mattis Stresses Need for 'Transparent' Probe into Khashoggi Killing
english.chosun.com,GM CEO Mulls Visit to Korea
english.chosun.com,Gunsan Bakery Tops Drivers' Favorite Eateries
english.chosun.com,Park Gyeol Wins 1st KLPGA Title After 4 Years
english.chosun.com,Top Court to Issue Ruling on Wartime Forced Labor Claims Against Japanese Firm
english.chosun.com,Seoul City to Expand Free Meals to High Schools
english.chosun.com,BTS to Have Joint Performance with Charlie Puth in Incheon Next Month
english.chosun.com,"Japan, China Work to Elevate Ties Despite Differences"
english.chosun.com,U.S. Authorities Arrest Person in Connection with Bomb Mailings
english.chosun.com,Supreme Court to Rule on Wartime Forced-Labor Suit
english.chosun.com,Millennial Families Change Consumption Patterns
english.chosun.com,Thousands Move Abroad to Escape Their Debts
english.chosun.com,Boy Band EXO to Unveil New Album Next Month
english.chosun.com,Dodgers’ Ryu Hyun-jin Suffers Loss in 1st World Series Appearance
english.chosun.com,Korea-Japan Relations Chill Further
english.chosun.com,Commemorative Coins Honor Legendary Singer Cho Yong-pil
english.chosun.com,UN Expert on Human Rights Welcomes Thaw on Korean Peninsula
english.chosun.com,Korean Economy Faces Long Doldrums
english.chosun.com,Trump: Saudi Crown Prince Bears Ultimate Responsibility for Dissident's Killing
english.chosun.com,"NYTimes: China Listens to Trump Cellphone Calls, Tries to Sway Policy"
english.chosun.com,Remains of S.Korean War Dead Found in DMZ
english.chosun.com,Hyundai Suffers Huge Drop in Profits
english.chosun.com,Ko Jin-young Named LPGA's Rookie of the Year
english.chosun.com,Google Abandons Planned Berlin Office Hub
english.chosun.com,Bangtan Boys Steal the Show at Awards Ceremony
english.chosun.com,U.S. Stocks Rebound Strongly
english.chosun.com,Women Take Top Posts as Ethiopian Politics Evolve
english.chosun.com,U.S. Nuclear Envoy Stephen Biegun in S.Korea for Talks on N.Korea
english.chosun.com,N.Korea's Economy Is Shrinking
english.chosun.com,Excitement Builds Among Opera Fans Ahead of Plácido Domingo Performance in Seoul
english.chosun.com,Retired U.S. General Says War with China Likely in 15 Years
english.chosun.com,KOSPI Hits Fresh Record Lows Every Day
english.chosun.com,Seoul Taxi Fares to Rise Drastically
english.chosun.com,"Mailed Bombs Draw Condemnations, Finger-Pointing"
english.chosun.com,Moon Signs Inter-Korean Military Pact into Law
english.chosun.com,Rampant (2018)
english.chosun.com,KOSPI Hits Fresh Low
english.chosun.com,Fuel Taxes to Be Slashed 15% Next Month
english.chosun.com,Samsung to Offer 5G Smartphones
english.chosun.com,Figure Skater Cha Jun-hwan Wins Bronze Medal at ISU Grand Prix in Canada
english.chosun.com,"N.Koreans Continue to Work in China, Russia Despite UN Sanctions"
english.chosun.com,N.Korean Sub Movement in East Sea Detected by Satellites
english.chosun.com,Unification Minister to Meet with N.Korean Defectors
english.chosun.com,CL Featured in Black Eyed Peas' New Song
english.chosun.com,Gov't Spent W10 Billion on Inter-Korean Liaison Office
english.chosun.com,Gov’t to Toughen Penalties for Drunk Drivers
english.chosun.com,Number of Long-term Jobseekers Hits Record High
english.chosun.com,Black Pink Sign Deal with U.S. Music Label
english.chosun.com,Factory Owners to Visit Kaesong Industrial Park Next Week
english.chosun.com,Major Banks Earn More Than W16 Trillion in Interest Income
english.chosun.com,100 Tons of Banned Goods Exported to N.Korea
english.chosun.com,Indian PM Wins Seoul Peace Prize
english.chosun.com,Generals from 2 Koreas to Meet on Friday
english.chosun.com,Smartwatch Competition Heats up
english.chosun.com,"Lotte Chief Pledges Massive Investment, Job Creation"
english.chosun.com,Celebrity Lawyer Jailed for Faking Court Documents
english.chosun.com,"BMW to Recall Another 65,000 Cars Over Engine Fires"
english.chosun.com,TV Personality Jung Joon-young to Open Restaurant in Paris
english.chosun.com,New Top-Range iPhone Priced at Nearly W2 Million
english.chosun.com,NATO Begins Largest Exercise Since Cold War
english.chosun.com,Ryu Hyun-jin Starts World Series Game in 1st for Korean Pitcher
english.chosun.com,Korea Becomes 1st Country to Export $100 Billion in Semiconductors
english.chosun.com,Stopgaps Can't Hide Gov't's Failed Job Policy
english.chosun.com,Moon Is Jumping the Gun by Ratifying Cross-Border Agreements
english.chosun.com,Korea Rises to 53rd on FIFA World Rankings
english.chosun.com,"Earphones, E-Cigs Banned from College Entrance Exam"
english.chosun.com,Naver's Profits Plummet
english.chosun.com,Korea Sees More Foreign Visitors in September
english.chosun.com,Investment in Start-ups Hits Record High
english.chosun.com,French Actor Vincent Cassel to Appear in Korean Film
english.chosun.com,Figure Skater Kim Ye-lim to Compete at Junior Grand Prix Final
english.chosun.com,New Version of Genesis Luxury Sedan Features 3D Dashboard
english.chosun.com,Spicy Korean Instant Noodles Prove Popular in the Americas
english.chosun.com,U.S. Warns Seoul Over N.Korea Sanctions
english.chosun.com,Birthrate Falls for 29th Month Running
english.chosun.com,Korean Women Have 1st Child 4.4 Years Later Than Global Average
english.chosun.com,LG Household and Healthcare Sets Quarterly Sales Record
english.chosun.com,Businesses Urge U.S. to Exempt Korea from Punitive Tariffs
english.chosun.com,Hundreds of Yemenis Granted Temporary Stay
english.chosun.com,Chu Sang-mi's Film Highlights Poland's Help for Korean Orphans
english.chosun.com,BOK Slashes Growth Projection to 6-Year Low
english.chosun.com,Mnuchin Pulls U.S. out of Saudi Investment Conference
english.chosun.com,Canada OKs Marijuana for Recreational Use
