source,title
freep.com,Resorts in Jamaica are facing a 'historic' sexual assault problem
freep.com,Why has Detroit Lions' Kenny Golladay disappeared in last 2 weeks?
freep.com,NFL power rankings: How far do Detroit Lions drop after Seahawks loss?
freep.com,Detroit Free Press endorsements 2018: How the editorial board makes its picks
freep.com,Suspect in Pennsylvania triple homicide arrested in Detroit
freep.com,"Halloween 2018: Metro Detroit trick-or-treat times, weather info"
freep.com,Michigan football has a chance to quiet naysayers over final stretch
freep.com,"Luxury in a pickup: Massaging seats, alligator-patterned leather"
freep.com,Mitch Albom: Detroit Lions take one step back against Seahawks
freep.com,Blake Griffin makes Detroit Pistons watchable & interesting — for now
freep.com,Burning body found in vacant lot on Detroit's west side
freep.com,Michigan is enduring one of the gloomiest Octobers ever
freep.com,Michigan State football can still reach Big Ten title game. Here's how
freep.com,Race to replace ousted Macomb clerk Karen Spranger gets quirky
freep.com,Prosecutor: Woman beat boyfriend's son to death out of frustration
freep.com,Michigan football offer would be a dream come true for Blake Nelson
freep.com,Metro Detroit to host vigils this week after Pittsburgh shooting
freep.com,Michigan State's Tom Izzo on secret scrimmage with Gonzaga
freep.com,Detroit Lions' Golden Tate: I'm not going anywhere at NFL trade deadline
freep.com,How Chase Winovich made Michigan football's revenge tour a rally cry
freep.com,Dwane Casey: Detroit Pistons let down fans with effort vs. Celtics
freep.com,Michigan State's Tom Izzo has lineup mostly set for exhibition opener
freep.com,DNA's Detroit-themed movies will screen for free at Bel Air cinema
freep.com,These Michigan rivers might get the long-lost Arctic grayling
freep.com,Detroit Lions' best hope at playoffs? Win division for 1st time since 1993
freep.com,They did it! 2014 Detroit Tigers finally win World Series
freep.com,Detroit Red Wings' Martin Frk: 'It's hard for me right now'
freep.com,What you need to know about 'America's Got Talent' auditions in Detroit
freep.com,Vice President Mike Pence issues dire warning to Michigan Republicans
freep.com,Michigan football’s Jim Harbaugh previews Penn State
freep.com,"Dispatch from Squirrel Hill, Pa.: Dread in a peaceful place"
freep.com,CityLab Detroit gets nerdy in talk about how data can help cities
freep.com,Michigan State football's Mark Dantonio previews Maryland
freep.com,Final arguments made at ex-trooper's trial in Detroit ATV Taser death
freep.com,Michigan football: Here's what Jim Harbaugh said ahead of Penn State
freep.com,Police examining unauthorized spending at Eastern Michigan University faculty union
freep.com,Jim Harbaugh: Nothing to add 'at this time' on Michigan State pregame
freep.com,Brenda Jones launches write-in campaign for U.S. Rep John Conyers' seat
freep.com,"Michigan State's Nick Ward, Xavier Tillman winning battle of bulge"
freep.com,Vigil in Detroit for Pittsburgh synagogue shooting victims
freep.com,We're so close to Election Day 2018: Let's get caught up
freep.com,Big Ten power rankings: Where is Michigan State? Michigan still No. 1?
freep.com,The 10 bestselling vehicles in metro Detroit might surprise you
freep.com,"Duggan hails Detroit's new scooters, says lots more on the way"
freep.com,"College Football Playoff rankings to be unveiled: Time, TV, more info"
freep.com,New Bedrock renderings show snazzier Hudson's skyscraper
freep.com,"Detroit Red Wings vs. Columbus Blue Jackets: What to watch for, game info"
freep.com,Detroit Lions' Matt Patricia defends using Ameer Abdullah on returns
freep.com,Detroit Pistons' Dwane Casey on approaching Celtics rematch
freep.com,New renderings of Hudson's Site in Downtown Detroit
freep.com,Michigan football has no update on Rashan Gary's status for Penn State
freep.com,"Michigan State basketball vs. Northern Michigan: Time, TV, game info"
freep.com,"Michigan State basketball goals: Win Big Ten, national championship"
freep.com,Michigan State didn't let muck of Michigan loss change its expectation
freep.com,Michigan football's path to Big Ten title game: What has to happen
freep.com,"Detroit Red Wings talk confidence, Michael Rasmussen"
freep.com,Why Detroit Red Wings rookie Michael Rasmussen could land bigger role
freep.com,"Upper Peninsula fire departments getting much-needed gear, equipment"
freep.com,Detroit Lions' Matt Patricia on consistency from defense
freep.com,"Michigan State football stock watch: Jalen Nailor, Matt Dotson emerge"
freep.com,Report: Fiat Chrysler reconsidering move of Ram production from Mexico
freep.com,Detroit Lions grades: Special teams get F for meltdown vs. Seahawks
freep.com,Michigan State's Rocky Lombardi 'brought a little extra' vs. Purdue
freep.com,Teens plead guilty in rock-throwing death on I-75
freep.com,No-fee kiosks let you pay fines owed to 36th District Court
freep.com,"Projecting the 2019 Detroit Tigers lineup, rotation"
freep.com,"From Kenya to East Lansing, Michigan State's Justine Kiprotich finds success"
freep.com,"Detroit Red Wings earn first home win of season over Dallas Stars, 4-2"
freep.com,"Detroit Lions stock watch: Ameer Abdullah, Teez Tabor plummet"
freep.com,Greta Van Fleet notches top-selling album in the U.S. in opening week
freep.com,"Michigan State 23, Purdue 13: Photos from East Lansing"
freep.com,Kiss farewell tour to hit Little Caesars Arena in March
freep.com,Ferndale vigil mourns synagogue attack in Pittsburgh
freep.com,"Detroit Lions weren't 'focused at all' in losing to Seahawks, 28-14"
freep.com,Is relationship a rebound?
freep.com,Vigil held at Jewish Ferndale cultural center
freep.com,Detroit Lions' Damon Harrison feasts in debut — and should get better
freep.com,New renderings released for Hudson's Site
freep.com,"Readers call for less hate, fewer guns after synagogue massacre"
freep.com,The Michigan Rant: Wolverines walk the walk vs. Michigan State
freep.com,Michigan high school football playoffs: District championship schedule
freep.com,Matt Patricia: Russell Wilson controlled the game
freep.com,Detroit Red Wings 'going to sleep well' after win over Dallas
freep.com,What led to Detroit Lions pitiful showing vs. Seattle Seahawks?
freep.com,U.S. government: Mercedes owners got recall notices too late
freep.com,Michigan State's Felton Davis III presents test for Michigan football
freep.com,"Mike Clark, best known for 'Drew and Mike Show,' dies at 63"
freep.com,Why I’m rooting for Michigan to beat Michigan State
freep.com,Detroit Pistons coach Dwane Casey's system offers 'no boundaries'
freep.com,Detroit Tigers mailbag: Where is the first baseman of the future?
freep.com,How do Detroit Lions replace Jamal Agnew? Start with Brandon Powell
freep.com,Winless Detroit Red Wings: 'We have to show some pride in here'
freep.com,How Dwane Casey's response to N-word helped fuel rise: It was 'big time'
freep.com,Michigan still unsure if Rashan Gary will play at Michigan State
freep.com,Halftime: Michigan football's missed opportunities keep Maryland in the game
freep.com,Michigan deer hunters should watch for bovine tuberculosis
freep.com,Michigan's Jim Harbaugh on rivalry trash talk: 'We could all use a break'
freep.com,John James admits swastika in TV ad was a mistake
freep.com,"Detroit Red Wings' Dennis Cholowski scores in NHL debut, season opener"
freep.com,Detroit Lions' Kenny Golladay becoming great before our eyes
