source,title
gadgets.ndtv.com,Realme C1 Review: Budget Phone With Big Battery
gadgets.ndtv.com,7 Phone Camera Hacks For Better Videos And Photos
gadgets.ndtv.com,Era Of Audio Nirvana And Screen-Free Tech Toys
gadgets.ndtv.com,"7 Amazing Games You Can Play Offline On Android, iPhone, iPad, And iPod Touch"
gadgets.ndtv.com,10 Phones We're Looking Forward To Before 2018 Is Over
gadgets.ndtv.com,World's First Quad-Camera Phone
gadgets.ndtv.com,Honor 8X
gadgets.ndtv.com,Paving The Roadmap To 5G
gadgets.ndtv.com,Nokia 5.1 Plus USER REVIEWS AND RATINGS
gadgets.ndtv.com,Nokia 3.1 Plus Review: Impressive Budget Smartphone?
gadgets.ndtv.com,Is iOS 12 Really Faster Than iOS 11? Speed Test On iPhone SE
gadgets.ndtv.com,"iPhone Xs, Xs Max Launched In New Gold Finish"
gadgets.ndtv.com,"Apple To Launch New iPhones Today: Price, Specifications, And More"
gadgets.ndtv.com,Vivo V11 Pro Review: A Solid All-Rounder Smartphone?
gadgets.ndtv.com,Xiaomi Mi Band 3 Review: It Does A Lot More Now!
gadgets.ndtv.com,"Oppo F9 Review: Looks Good, But What About Performance?"
gadgets.ndtv.com,"Nokia 8 Sirocco, Nokia 7 Plus, Nokia 6 (2018), Nokia 1, Nokia 8110 4G Feature Phone Announced at MWC 2018: Event Highlights"
gadgets.ndtv.com,Redmi Y1
gadgets.ndtv.com,Honor 9N
gadgets.ndtv.com,"Honor 10 Review: Camera, Performance, Battery Life, and More"
gadgets.ndtv.com,Microsoft Surface Laptop Review: Is Surface Better As A Laptop Than Tablet?
gadgets.ndtv.com,Redmi Note 5 Pro
gadgets.ndtv.com,Flipkart Big Shopping Days Sale Best Deals and Offers Today: Highlights
gadgets.ndtv.com,"Samsung Galaxy A8+ (2018) Review: Camera, Specs, Verdict, And More"
gadgets.ndtv.com,Redmi Y1 Lite
gadgets.ndtv.com,Poco F1 vs OnePlus 6 vs Asus ZenFone 5Z: Mid-Range Powerhouses Compared
gadgets.ndtv.com,Amazon India Prime Day Sale Live Updates: The Best Deals Right Now
gadgets.ndtv.com,"OnePlus 6 Unboxing and First Look: What's Inside, Accessories, and More"
gadgets.ndtv.com,Xiaomi Mi A2 vs Nokia 7 Plus: Which One's Better Value?
gadgets.ndtv.com,"UMANG App With Digilocker, Income Tax, Passport, CISF Services, And More"
gadgets.ndtv.com,"Realme 2 Pro Unboxing And First Look: Price, Specs, Features, And More"
gadgets.ndtv.com,"Vivo V11 Pro Unboxing And First Look: Specs, Camera, Price, And More"
gadgets.ndtv.com,Huawei Nova 3 Review: Can It Compete With OnePlus 6 And Asus ZenFone 5Z?
gadgets.ndtv.com,Age Of Empires: Definitive Edition - All Cheat Codes
gadgets.ndtv.com,"Samsung Galaxy S9, Galaxy S9+ With Face Recognition Unveiled at MWC 2018: Event Highlights"
gadgets.ndtv.com,"Mi A2 Review: The New Best Phone Under Rs 20,000?"
gadgets.ndtv.com,"Redmi Y2 Review: Best Selfie Phone Under Rs 10,000?"
gadgets.ndtv.com,How Amazon Delivers Packages In One Of The Most Remote Corners Of India
gadgets.ndtv.com,Samsung Galaxy Note 9 Review: Is Bigger Always Better?
gadgets.ndtv.com,MIUI 10 Global Beta ROM: How To Download And Install On Your Xiaomi Phone
gadgets.ndtv.com,John Bayne on the Corning Gorilla Glass Story
gadgets.ndtv.com,OnePlus 6 vs Vivo X21: Which Is The Better Phone Overall?
gadgets.ndtv.com,Redmi Note 5 Pro vs Nokia 6 (2018)
gadgets.ndtv.com,Amazon Prime Music in India: How To Get Started
gadgets.ndtv.com,Honor 9i
gadgets.ndtv.com,INDIA Techie Nation - Rajiv & Vikram's Verdict On The Best From The CES
gadgets.ndtv.com,"OnePlus 6 Review: Camera, Battery Life, Performance, and More"
gadgets.ndtv.com,Google I/O 2018: JBL Link Bar Soundbar First Look: Built-in Android TV and Google Assistant
gadgets.ndtv.com,Oppo F9 Pro USER REVIEWS AND RATINGS
gadgets.ndtv.com,"Xiaomi Mi Pad 4: Specs, Features, Camera, And Everything Else You Need To Know"
gadgets.ndtv.com,Harman Kardon Allure Smart Speaker Powered By Alexa Review
gadgets.ndtv.com,"iPhone XS, iPhone XS Max Launched: Price in India, Specs, and More"
gadgets.ndtv.com,"Google Reply First Look: How To Download, How To Use"
gadgets.ndtv.com,"Nokia X5 (Nokia 5.1 Plus): Camera, Specs, Price, And Everything Else We Know So Far"
gadgets.ndtv.com,mPassport Seva App
gadgets.ndtv.com,Dell Inspiron 27 7775 AIO PC Review
gadgets.ndtv.com,"Asus ZenFone 5Z vs OnePlus 6: Camera, Performance, Battery, And More Compared"
gadgets.ndtv.com,OnePlus 6 Red Edition Unboxing: What's New And What's Different?
gadgets.ndtv.com,"iPhone XS, iPhone XS Max First Look"
gadgets.ndtv.com,How To Side-Load Apps On Xiaomi Mi LED Smart TV 4
gadgets.ndtv.com,LG G7+ ThinQ vs OnePlus 6: Is This LG's Big Comeback?
gadgets.ndtv.com,"Nokia 6.1 Plus Unboxing and First Look : Price, Specs, Cameras, and More"
gadgets.ndtv.com,"iOS 12 Public Beta: How To Download And Install On Your iPhone, iPad And iPod Touch"
gadgets.ndtv.com,Vivo Nex Review: Phone With Truly Full-Screen Display And Hidden Camera
gadgets.ndtv.com,Operation Grim Sky: What To Expect From The Latest Rainbow Six Siege DLC
gadgets.ndtv.com,Samsung Galaxy J8 Review: Do You Get What You Pay For?
gadgets.ndtv.com,WhatsApp And YouTube On Jio Phone: Hands-On Impressions
gadgets.ndtv.com,Xiaomi Redmi Note 5 Pro vs Xiaomi Mi A1: Battle Of Equals!
gadgets.ndtv.com,5 Budget Apple AirPods Alternatives Tested: Are They Worth Buying?
gadgets.ndtv.com,"Samsung Galaxy J6 Unboxing and First Look, Price in India, Specifications, and More"
gadgets.ndtv.com,"Best Phones Under Rs 10,000 (July 2018 Update)"
gadgets.ndtv.com,"How To Use AirPods With Android Phones: Pairing, Check Battery Levels, And More"
gadgets.ndtv.com,"Samsung Galaxy A6+ Review: Camera, Battery Life, Performance, And More"
gadgets.ndtv.com,iPhone XR First Look: Check Out The Most Affordable 2018 iPhone
gadgets.ndtv.com,Gadgets to Convert Your HDTV Into a Smart TV
gadgets.ndtv.com,Microsoft Surface Go Budget Windows 10 Tablet First Look
gadgets.ndtv.com,How To Download The Data WhatsApp Has On You
gadgets.ndtv.com,"Xiaomi Mi MIX 2 Review: Edge-to-edge display, Camera, Specs, and More"
gadgets.ndtv.com,"Samsung Galaxy A6+ Unboxing, First Look, Specifications, and Features"
gadgets.ndtv.com,"iBall Compbook Premio v2.0 Review: Windows 10 Laptop Under Rs 20,000"
gadgets.ndtv.com,HTC U12 Life First Look
gadgets.ndtv.com,"Lenovo Yoga Book C930, Yoga C630 WOS, ThinkPad X1 Extreme First Look"
gadgets.ndtv.com,Review Of The Nokia 6.1 & Must Have Apps For FIFA World Cup 2018
gadgets.ndtv.com,"Best Camera Phones Under Rs 15,000"
gadgets.ndtv.com,"Apple WWDC 2018 Keynote Highlights: iOS 12, macOS Mojave, watchOS 5 Unveiled"
gadgets.ndtv.com,Honor 7S Review: Challenger To The Redmi 6A
gadgets.ndtv.com,Jio Phone With Unlimited 4G Data Launched By Mukesh Ambani at Reliance AGM: Highlights
gadgets.ndtv.com,"Lenovo Thinkpad X280 Unboxing And First Look: Price, Specs, And More"
gadgets.ndtv.com,Xiaomi Redmi Note 5 Pro Gaming Performance Review: Can It Play Heavy Games?
gadgets.ndtv.com,"""We Need To Fix Huge Trust Deficit With Tech Right Now"": Prannoy Roy"
gadgets.ndtv.com,"Moto G6 Unboxing and First Look: Price, Specifications, Camera, And More"
gadgets.ndtv.com,"Xiaomi Mi Max 3: Specs, Features, Camera, And Everything Else We Know So Far"
gadgets.ndtv.com,"360 Daily: HTC U12+ Launched, MIUI 10 Launch Date Revealed, And More"
gadgets.ndtv.com,Xiaomi Redmi Note 5 vs Redmi Note 5 Pro: What's the Difference?
gadgets.ndtv.com,Xiaomi Redmi 6A Review: Best Choice For Shoe-String Budgets?
gadgets.ndtv.com,Editor Ji - An App That Brings Together AI and Human Intelligence
gadgets.ndtv.com,Microsoft Surface Go Budget Windows Tablet: Everything You Need To Know
gadgets.ndtv.com,"Best Phones With 18:9 Display Under Rs. 20,000"
gadgets.ndtv.com,Honor 7C Review: Better Than The Realme 1?
gadgets.ndtv.com,The Most Expensive iPhone?
