source,title
geeky-gadgets.com,Price Drop Deal: Obior Unlimited Website Building & Hosting Lifetime Subscription
geeky-gadgets.com,Star Wars Battlefront II General Grievous update rolls out
geeky-gadgets.com,New McLaren Speedtail Hypercar shown off on video
geeky-gadgets.com,Cold Pursuit action thriller movie starring Liam Neeson
geeky-gadgets.com,Last Minute Deal: Save 98% on the awesome Complete Adobe Mastery Bundle Lifetime Access
geeky-gadgets.com,Nybble open source robotic kitten
geeky-gadgets.com,New OnePlus 6T smartphone now available to pre-order from Vodafone
geeky-gadgets.com,"The Abyss, No Man’s Sky update adds underwater adventures"
geeky-gadgets.com,Falcon simulator chair for racing and flight sim immersion
geeky-gadgets.com,"You can now buy the new Mercedes GLE in the UK, prices start at £55,000"
geeky-gadgets.com,Shuttle XPC Barebone XH310 and XH310V mini PC systems unveiled
geeky-gadgets.com,BiteMinder angling wireless bite alarm
geeky-gadgets.com,New NoiseAware Airbnb sensor detects parties and more
geeky-gadgets.com,Jaguar F-Type Chequered Flag limited edition announced (Video)
geeky-gadgets.com,Porsche explains all Porsche 911 derivatives in new video
geeky-gadgets.com,iPhone XR gets torture tested (Video)
geeky-gadgets.com,LattePanda Alpha macOS 10.14 mini PC Hackintosh
geeky-gadgets.com,Logitech Capture webcam app makes vlogs and live streams easy
geeky-gadgets.com,New OnePlus 6T shown off on video
geeky-gadgets.com,Apple’s iPhone XR gets durability tested by SquareTrade (Video)
geeky-gadgets.com,Apple’s iPhone XR gets taken apart by iFixit (Video)
geeky-gadgets.com,Red Hydrogen One smartphone lands on AT&T November 2nd
geeky-gadgets.com,Double Mag magnetic cable with power delivery
geeky-gadgets.com,New iPad Pro icon confirms no home button and more
geeky-gadgets.com,Fallout 76 PC Beta system requirements confirmed for tomorrows launch
geeky-gadgets.com,Save 49% on the awesome AXUM Gear True Wireless Earbuds
geeky-gadgets.com,reCAPTCHA v3 human detector removes jumbled text and image clicks
geeky-gadgets.com,Price Drop Deal: Stone River eLearning Lifetime Membership
geeky-gadgets.com,Project Gold Porsche 911 Sells for €2.7 Million
geeky-gadgets.com,Apple’s iOS 12.1 software update should land tomorrow
geeky-gadgets.com,LiTTT Snap easy to build LED strip lighting and controller
geeky-gadgets.com,"Aura desktop high speed scanner raises over $550,000"
geeky-gadgets.com,Red Dead Redemption 2 app reveals possible PC VR version
geeky-gadgets.com,New Apple Mac Mini 2018 officially launches from $799
geeky-gadgets.com,Fallout 76 not coming to the Nintendo Switch
geeky-gadgets.com,Double Tap R2 modular Bluetooth headphones
geeky-gadgets.com,Microsoft smartphone Xbox controller under development?
geeky-gadgets.com,3G Raspberry Pi Smartphone
geeky-gadgets.com,This is the new McLaren Speedtail Hypercar
geeky-gadgets.com,Avengers 4 trailer is coming this year
geeky-gadgets.com,Panasonic 8K camera with “organic” sensor
geeky-gadgets.com,Digital Desktop Thermoformer from just $419
geeky-gadgets.com,Antec Torque open-air PC case €379
geeky-gadgets.com,Long Journey Home open world “rogue-like” RPG game
geeky-gadgets.com,IBM is buying Red Hat for $34 Billion
geeky-gadgets.com,Learn more about genetics with the proPCR wireless gradient PCR
geeky-gadgets.com,New 30 minute Anthem gameplay trailer
geeky-gadgets.com,SHIVR 3D noise cancelling headphones from $119
geeky-gadgets.com,New OnePlus 6T live images leaked ahead of official unveiling
geeky-gadgets.com,Be Quiet! Pure Power 11 Series PC power supplies introduced
geeky-gadgets.com,New Apple iPad Pro 2018
geeky-gadgets.com,PIXL magnetic building blocks hit Kickstarter
geeky-gadgets.com,Twin Mirror gameplay trailer released by Life Is Strange creators
geeky-gadgets.com,New OnePlus 6T rumored to cost £499 in the UK
geeky-gadgets.com,Samsung reveals more details about its Developer Conference
geeky-gadgets.com,Roush Performance F-150 Packs 650hp
geeky-gadgets.com,iPhone XR gets taken apart on video
geeky-gadgets.com,new Apple MacBook Air unveiled
geeky-gadgets.com,Nissan Motorsports Project Clubsport 23 Heads to SEMA 2018
geeky-gadgets.com,PlayStation inspired furniture and more
geeky-gadgets.com,New OnePlus 6T gets torture tested (Video)
geeky-gadgets.com,Apple’s iOS 12.1 software update expected later today
geeky-gadgets.com,PlayStation Classic mini console games confirmed by Sony
geeky-gadgets.com,"Maid of Sker first-person stealth, survival horror launching Q3 2019"
geeky-gadgets.com,NVIDIA Shield TV receives Alexa Skills support
geeky-gadgets.com,New Hive Home View outdoor security camera
geeky-gadgets.com,Sharkoon Skiller SGM2 RGB gaming mouse €18
geeky-gadgets.com,Apple Store goes offline ahead of iPad Pro and Mac Event
geeky-gadgets.com,Nokia 5.1 Plus headed to Australia November the 2nd
geeky-gadgets.com,Sunday Deals: save 97% on the Complete Six Sigma Training & Certification Bundle
geeky-gadgets.com,Every iPhone XR color gets unboxed (Video)
geeky-gadgets.com,This is the new OnePlus 6T smartphone
geeky-gadgets.com,Apple Watch Series 4 ECG features may work outside of the US
geeky-gadgets.com,Apple’s iPhone XR gets drop tested (Video)
geeky-gadgets.com,The Boba Fett Star Wars movie is not happening
geeky-gadgets.com,Bethesda assures us that Fallout 76 is not pay-to-win
geeky-gadgets.com,Save 25% on the Platinum Sonic Toothbrush & USB Sanitizing Case
geeky-gadgets.com,Samsung is expanding its Thunderbolt 3 support
geeky-gadgets.com,"Last Minute Deal: Complete Adobe Mastery Bundle Lifetime Access, Save 98%"
geeky-gadgets.com,Price Drop Deal: Get the VPNSecure Lifetime Subscription for just $19.99
geeky-gadgets.com,IBM acquiring Red Hat for $34 billion
geeky-gadgets.com,New Wireframe games magazine launched by the Raspberry Pi Press
geeky-gadgets.com,Gadgets and Technology News
geeky-gadgets.com,Get the awesome CrowPi Raspberry Pi Accessory Kit
geeky-gadgets.com,Samsung Galaxy A6s smartphone announced in China
geeky-gadgets.com,Google Maps gets a new follow places feature
geeky-gadgets.com,Sunday Deals; Save 90% on the Task Pigeon Business Plan Lifetime Subscription
geeky-gadgets.com,Portable laser engraver with 1500 mW laser
geeky-gadgets.com,"ADATA XPG SX8200 Pro SSD, GAMMIX S5 SSD, and GAMMIX D30 DDR4 memory introduced"
geeky-gadgets.com,DIY Audio Spectrum Analyzer kit
geeky-gadgets.com,emit Smartwatch launches via Kickstarter
geeky-gadgets.com,Warframe Fortuna expansion arrives next month
geeky-gadgets.com,"HP Spectre x360 13 and 15 inch laptops now available from $1,150"
geeky-gadgets.com,Lenovo Yoga Chromebook C630 now available from Best Buy from $699
geeky-gadgets.com,Marvel’s Spider-Man The Heist DLC now available to download
geeky-gadgets.com,Official Raspberry Pi TV HAT launched for £20
geeky-gadgets.com,Updated 2019 Audi R8 Debuts
geeky-gadgets.com,mui wooden smart home control panel
geeky-gadgets.com,Microsoft Surface Pro 6 teardown by iFixit
geeky-gadgets.com,Wild Cats 3D MKII high resolution 3D scanner from £245
