source,title
gizmodo.co.uk,"These Strictly Stars Tangoed to The Doctor Who Theme, Somehow"
gizmodo.co.uk,Lego's Life-Size Bugatti Chiron is Going on a Small Tour of London
gizmodo.co.uk,"OnePlus 6T Specs Leak Yet Again, Leaving No Surprises For Monday"
gizmodo.co.uk,OnePlus 6T vs OnePlus 6: What's Changed Since May?
gizmodo.co.uk,All Aboard the Tube Trainers: Adidas Reveals London Underground Shoes
gizmodo.co.uk,"After Sprout and Candy Cane Flavours, Tesco's Camembert Crisps Just Sound Boring"
gizmodo.co.uk,"There Are More Tiger Types Than We Thought, New Genetic Analysis Reveals"
gizmodo.co.uk,EAT Has Done a Funny Christmas Food
gizmodo.co.uk,"BBC 6 Music is Basically the Best Radio Station Ever, Says YouGov Survey"
gizmodo.co.uk,"Huawei Mate 20 Pro Review: Finally, a Phone That Stands Out for All the Right Reasons"
gizmodo.co.uk,"Gizmodo UK's Halloween Hub of Horrors 2018: Petrifying Pumpkins, Frightful Films and Creepy Costumes"
gizmodo.co.uk,Wireless Charging Still Isn't Fast Enough for the OnePlus 6T
gizmodo.co.uk,Scottish Island Has Electricity All Day Now
gizmodo.co.uk,Government Plans £400m Tax Raid on Tech Giants
gizmodo.co.uk,"The PS4 Finally Has a Super Customisable Controller, and It Is Excellent"
gizmodo.co.uk,Ed Sheeran Doesn't Want a Lego Ed Sheeran Any More
gizmodo.co.uk,"Surprise, Surprise, There's a New iPad Pro Coming Too"
gizmodo.co.uk,Samsung is Also Working on Folding-Screen Laptops
gizmodo.co.uk,"45,000 Dead People Rehoused to Make Room for HS2"
gizmodo.co.uk,"Hey Look, There's a New MacBook Air on the Way"
gizmodo.co.uk,Next-Gen Surgeons Can Barely Use a Pair of Scissors
gizmodo.co.uk,This Adorable Animation Shows How John Boyega Got Cast in Star Wars
gizmodo.co.uk,Y Combinator Is Funding Some Seriously Wild Ideas For Sucking Carbon Out of the Air
gizmodo.co.uk,This 30-Second Lost Boys Animation is Just the Greatest
gizmodo.co.uk,Halloween's Extra Spooky With Michael Jackson's Thriller Played On Outdated Zombie Technology
gizmodo.co.uk,Health Experts Want Petrol and Diesel Cars Off Sale by 2030
gizmodo.co.uk,Scotland's Refurbished Trains Still Shit on the Tracks
gizmodo.co.uk,"The OnePlus 6T May be Coming to Three After All, But Not for a While"
gizmodo.co.uk,"The Boba Fett Movie is Apparently Dead, Just Like Boba Fett"
gizmodo.co.uk,Government Plans Special Brexit 50p
gizmodo.co.uk,Lorry Driver Uses Bridge to Slice Roofs Off Range Rovers
gizmodo.co.uk,The OnePlus 5 and 5T Finally Get an Update With Project Treble Support
gizmodo.co.uk,An Attack On Titan Movie Is Coming From the Director of It
gizmodo.co.uk,Let's Make the World Wide Web a National Monument
gizmodo.co.uk,Dakota North Became a Marvel Comics Cult Classic Because it Put Style Above Everything Else
gizmodo.co.uk,Group FaceTime is Finally Coming to Apple Devices Courtesy of iOS 12.1
gizmodo.co.uk,OnePlus Tapping Game Exceeds One Tap for Everyone on Earth
gizmodo.co.uk,Three Will be Stocking Xiaomi Devices From 9th November
gizmodo.co.uk,Stingy London Landlord Forces Renter to Pay Electricity in Old Pound Coins
gizmodo.co.uk,Lego Ideas is Running a Competition for You to Build a Creator 3-in-1 Add-on
gizmodo.co.uk,The Red Dwarf Blu-Ray Box Art is Smegging Beautiful
gizmodo.co.uk,"The New Palm Phone is Coming to the UK, With Vodafone Getting Timed Exclusivity"
gizmodo.co.uk,OnePlus 6T Full Specs and Price Leak Days Before Launch
gizmodo.co.uk,AO and Acer Team Up to Offer the Best in Next-Gen Laptops
gizmodo.co.uk,"Bragi's Lawsuit Continues, Asks Court to Block OnePlus's 'Dash' Products That are No Longer On Sale"
gizmodo.co.uk,Vegan Irn-Bru Sandwiches Exist Now
gizmodo.co.uk,Lidl Tries to Dethrone Mulled Wine With Plum and Cinnamon Gin
gizmodo.co.uk,"Regulators Slap Facebook with £500,000 Fine Over the Cambridge Analytica Scandal"
gizmodo.co.uk,The OnePlus 6T Has a Less-Good In-Screen Fingerprint Scanner
gizmodo.co.uk,I Watched Three Hours of Smartphone Teleshopping So You Never Have To
gizmodo.co.uk,Jeremy Clarkson Still Hates Electric Cars
gizmodo.co.uk,People Faint More on the Tube on Mondays
gizmodo.co.uk,"Joker Can't Help Itself, Casts Young Bruce Wayne"
gizmodo.co.uk,How NASA Found That Freaky Viral Iceberg
gizmodo.co.uk,Xiaomi is Officially Coming to the UK
gizmodo.co.uk,"Apparently Everything Needs AI These Days, Even the Vibrators"
gizmodo.co.uk,Internet-Famous Gay Penguin Couple Welcomes New Chick Into the World
gizmodo.co.uk,That Adorable Baby Octopus Is Actually a Pea-Sized Killer
gizmodo.co.uk,Up to 50 Debenhams Stores to Close
gizmodo.co.uk,"""Being Tall"" is the New Cancer Likelihood Trigger"
gizmodo.co.uk,Deliveroo Will Bring You KFC in the Queue for Red Dead Redemption 2
gizmodo.co.uk,Arrow's Return Actually Gave Us a Delightful Twist
gizmodo.co.uk,Lego Masters Series 2 Date Announced - and It's Really Soon
gizmodo.co.uk,Here's the Fashionable Source of Doctor Who's Iconic Outfit
gizmodo.co.uk,The Head Writer of Rick and Morty is Creating a New Animated Star Trek Series
gizmodo.co.uk,YouTube Scientist Creates Runaway Greenhouse Effect in DIY Polytunnel
gizmodo.co.uk,The 26-30 Railcard Will Be Available Nationwide By The End of the Year
gizmodo.co.uk,"After Massive Breach, Facebook Says Hackers Didn’t Use Your Login to Access Third-Party Apps"
gizmodo.co.uk,"Seven Tips, Tricks and Apps to Help Clean Up Your Mac or PC"
gizmodo.co.uk,Confront Your Christmas Demons With the Black Mirror Festive Annual
gizmodo.co.uk,"The Colour-Changing, Hexagonal Vortex on Saturn Just Surprised Scientists Again"
gizmodo.co.uk,Frack Quakes Take Lancashire Site Offline After Only a Week
gizmodo.co.uk,We Might Not Get That Samsung Folding Phone 'Til June 2019
gizmodo.co.uk,Did the Release of the iPhone Cause Millennials to Move Back in With Their Parents?
gizmodo.co.uk,The Best Place to Work in the UK is... Slough. Again.
gizmodo.co.uk,New Details Emerge About the Samsung Galaxy S10 and Folding Phone
gizmodo.co.uk,Microsoft Says It's Fixed That Windows 10 October Update Bug That Mass-Deleted Entire Directories
gizmodo.co.uk,Here's The Full List of Games on the Upcoming PlayStation Classic
gizmodo.co.uk,"Google, Facebook, Apple, Microsoft and Even More Tech Companies Caught Spying For the US NSA (Updated)"
gizmodo.co.uk,HMV's New MP3 Download App Breaks Through Apple's Walled Garden (Updated)
gizmodo.co.uk,21 of the Best Cases to Guard Your Samsung Galaxy S5
gizmodo.co.uk,Microsoft Delays Latest Version of Windows 10 After Reports of Mass File Deletion
gizmodo.co.uk,Three's 3G Data Network Is Having Serious Issues Today (Updated)
gizmodo.co.uk,Banksy's Predictable Criticisms of Capitalism Continue With Self-Shredding Painting
gizmodo.co.uk,Instagram Tests Feature That Shares Your Location History With Facebook
gizmodo.co.uk,Asteroid Discovery Boosts Evidence for Planet Nine
gizmodo.co.uk,A Casting Agency Is Booking A Crowd Of Protesters For The Emir of Qatar's Visit To Downing Street [Updated]
gizmodo.co.uk,A Third Probe Landed on Asteroid Ryugu—but It Had Just 16 Hours to Live
gizmodo.co.uk,"Appeals Court Upholds CRISPR Patent, Potentially Ending Bitter Dispute"
gizmodo.co.uk,17 Things You Can Do in OS X Yosemite That You Couldn't Do in Mavericks
gizmodo.co.uk,"Police Raid Home of Couple Who Raised £310,000 on GoFundMe for Homeless Man"
gizmodo.co.uk,6 Ways Google Chrome Changed the Way We Web
gizmodo.co.uk,iPhone Vs Android: Gizmodo UK Reveals The Mobile Preferences Of The England World Cup Team
gizmodo.co.uk,Glacier Named After Prominent Geologist Renamed Following Sexual Harassment Scandal
gizmodo.co.uk,Julian Assange Steps Down From Position as WikiLeaks Editor-In-Chief
gizmodo.co.uk,"Samsung's New Phone Has FOUR Rear Cameras, Says Leak"
gizmodo.co.uk,Tiny Gecko Makes 'a Bazillion' Phone Calls From Inside Hawaiian Animal Hospital
gizmodo.co.uk,Elon Musk Says He's Building a Tiny 'Submarine' to Rescue Thai Soccer Team Trapped in Cave
gizmodo.co.uk,"Dick Grayson Meets His Replacement in This Short, Delightful Clip From Titans"
gizmodo.co.uk,Chris Evans Sure Makes it Sound Like He's Done With Captain America
