source,title
guardianlv.com,Hartsfield-Jackson International Airport All Clear After Investigating Suspicious Package
guardianlv.com,Trump Fanatic Cesar Sayoc Charged With Mailing Bombs [Video]
guardianlv.com,"SMS Marketing Is the Latest Great Marketing Tool, but There Are Downsides"
guardianlv.com,LACMA Presents Rauschenberg’s ‘1/4 Mile’ Opus
guardianlv.com,"Skirball Exhibit Explores Ruth Bader Ginsburg, aka the Notorious RBG"
guardianlv.com,Jamal Khashoggi Was Likely Targeted for Execution
guardianlv.com,‘Dear Evan Hansen’ Provides Uplifting Look at Teen Traumas and Despair
guardianlv.com,The Asociación de la Cultura Hondureña en Chicago Changes Lives
guardianlv.com,‘First Man’ and the History of Space [Spoiler Alert]
guardianlv.com,Irish Myth Gave Birth to the Scary Jack-O-Lantern
guardianlv.com,Senator Susan Collins Receives Threats of Death and to Have Her Honorary Degree Rescinded
guardianlv.com,Tyler Ford Picks Up BCA Award
guardianlv.com,Microchipping Humans in Sweden Foreshadows Revelation [Video]
guardianlv.com,Janice Wesen Nevada AD34 Candidate Assures Voters She Represents Them
guardianlv.com,Kanye West Plays Russian Roulette With His Health
guardianlv.com,Giant Human Skeletons Discovered in Wisconsin?
guardianlv.com,Twin NBA Players Share Everything Including Bank Accounts
guardianlv.com,FDA Approving Genetically Modified Food Which Shortens Lifespan
guardianlv.com,Facebook Causes Depression New Study Says
guardianlv.com,Fireball Cinnamon Whisky Recalled Over Chemical Ingredient [Update]
guardianlv.com,Microsoft Clip Art Retires and Gives Way to Bing Images
guardianlv.com,China Experiment in Permaculture Offers World Hope
guardianlv.com,‘Criminal Minds’ Star Arrested for Grand Felony Theft
guardianlv.com,Hospitals Using Essential Oils to Boost Productivity and Health (Video)
guardianlv.com,Jacob Zuma – How Many Wives Are Enough?
guardianlv.com,Cameron Diaz and Benji Madden of ‘Good Charlotte’ Getting Married Tonight
guardianlv.com,UFO Raw Footage Documented by Scientists [Video]
guardianlv.com,Hawaii and Alaska Tourism May Be Affected by Volcanic Activity
guardianlv.com,HCHBB’s Anna Shannon Shuts Down GoFundMe Account After Fan Outrage
guardianlv.com,College Football: Worst Coach in America
guardianlv.com,The Modern Princess [Interview With Author Early Jackson]
guardianlv.com,Angela Merkel’s Conservatives Defeated in Election
guardianlv.com,Arctic Ice Cap Growing at Tremendous Rate
guardianlv.com,Boxing Day History and Traditions
guardianlv.com,Golden Globes: Who Loved George Clooney the Most?
guardianlv.com,Pope Francis: 12 Remarkable Facts
guardianlv.com,Dr. Myles Munroe and Family Killed in Plane Crash (Updated)
guardianlv.com,Autism Can Be Treated With Medical Marijuana
guardianlv.com,The Worlds Top 15 Conspiracy Theories of All Time
guardianlv.com,Christie Brinkley Turns 60 With Stunning Swimsuit Cover
guardianlv.com,Global Warming Causing Iceland to Rise
guardianlv.com,Signal Jammers Can Now Be Tracked Anywhere
guardianlv.com,Smoking Hookah One Hour May Equal 100 Cigarettes
guardianlv.com,Bullying Advocate Sam Biddle Faces Promotion
guardianlv.com,Sleep Deprivation and Mindfulness Meditation
guardianlv.com,Oregon Coast Sand Dunes to Be Preserved
guardianlv.com,"Missing Oklahoma Family, Demons and Drugs"
guardianlv.com,Fukushima Radiation Hits US West Coast
guardianlv.com,Influenza and the Elderly
guardianlv.com,Lanzarote Art in Nature: A Visit to the César Manrique Foundation [Video]
guardianlv.com,Citizen Four: Disturbing Documentary (Review and Trailer)
guardianlv.com,"Myles Munroe, Jr. Speaks Publicly About Tragic Death of Parents"
guardianlv.com,Christie’s Record-Breaking Art Auction in New York
guardianlv.com,Blood Sugar: Foods That Help to Reduce the Level
guardianlv.com,Whitehouse.gov Interferes With Vaccine Petition Numbers (Update)
guardianlv.com,"British Pathé Uploads 85,000 Historical Videos to YouTube [Video]"
guardianlv.com,Fibromyalgia Mystery Finally Solved!
guardianlv.com,Foot Reflexology For Simple Self-Healing
guardianlv.com,School Shooting Thwarted in Salt Lake City
guardianlv.com,Utah and Other States Make Death Penalty Changes
guardianlv.com,Oil Pulling the Miracle Habit?
guardianlv.com,Skid Row’s Sebastian Bach Gets Engaged to New Girlfriend [Video]
guardianlv.com,"Mass Murder in Small Missouri Town Leaves Eight Dead, 42 to Mourn"
guardianlv.com,NeNe Leakes Son Arrested and Ordered to Rehab
guardianlv.com,Teenage Girl Is Dead After Consuming Red Bull Energy Drink
guardianlv.com,California: Ground Zero for Fukushima Radiation?
guardianlv.com,India Reminded of Its History and Homosexuality
guardianlv.com,Colorado Residents Looking at Pot Tax Rebate
guardianlv.com,Kim Kardashian Boob Job and Lipo to Add Fat to her Butt Says Ex
guardianlv.com,Breastfeeding throughout History: Some Interesting Facts
guardianlv.com,Garth Brooks Sings About Divorce from Trisha in ‘The Call’
guardianlv.com,‘Martin’ Returns to Fox in 2015 With Ashanti as Gina?
guardianlv.com,‘Alaskan Bush People’ Brown Family Faces PFD Fraud Charges
guardianlv.com,Flu Vaccine Ingredients – What Is Injected Into the Body?
guardianlv.com,"KKK Member Walks up to Black Musician in Bar-but It’s Not a Joke, and What Happens Next Will Astound You"
guardianlv.com,Argentina Was Hitler’s Final Home According to FBI Files – Part I
guardianlv.com,UFO Sightings Increase – Canadian Defense Minister Says US Must Discuss
guardianlv.com,Islam Creates Monsters Says Psychologist
guardianlv.com,Tequila May Lower Blood Pressure
guardianlv.com,RHOA Kenya Moore and Sherri Shepherd Beef Explodes on Twitter
guardianlv.com,Brazil World Cup and Sex Tourism
guardianlv.com,Belfie Queen Jen Selter Has the Most Famous Butt in the World [Video]
guardianlv.com,Walgreens Sued for Negligence in Vicodin Overdose Death
guardianlv.com,Commercial Chicks Hot and Sassy
guardianlv.com,Immigration Reform Is a High Priority
guardianlv.com,Kidney Stones – How Watermelon can help
guardianlv.com,Kate Middleton: Is Mom the New JR?
guardianlv.com,Education and Equality Rising for Women in the Middle East
guardianlv.com,Stuttering Children More Intelligent According to New Study [Video]
guardianlv.com,Porn Star at Age 79 in Japan
guardianlv.com,How Women Dominate the Film Editing World
guardianlv.com,New Study Confirms Turmeric Can Benefit Diabetes
guardianlv.com,Facebook Founder Zuckerberg’s Asperger’s Problem
guardianlv.com,Medical Cannabis Treats Autism
guardianlv.com,"Human Appearance: How Will Technology Affect the Way We Look in 100,000 Years?"
guardianlv.com,Dental Care with Coconut Oil
guardianlv.com,Minnesota Man Who Killed Two Teens During Robbery Convicted of Murder
guardianlv.com,Bananas Are Clones From the Stone Age
guardianlv.com,Can the Moon Affect Healing?
guardianlv.com,"Nelson Mandela, Death, Dishonesty and Denial"
