source,title
heavy.com,Jimmy Butler Trade Rumors: Latest on Future of Timberwolves Star
heavy.com,When Was the Last Time the Bucks Started 7-0?
heavy.com,"Dylan Gonzalez, Josh Gordon’s Girlfriend: 5 Fast Facts You Need to Know"
heavy.com,Sharice Davids: 5 Fast Facts You Need to Know
heavy.com,Kyle Jaenke Annis Accused of Jayme Closs Home Burglary
heavy.com,Courtland Sutton Fantasy: It’s His Time to Shine in Denver
heavy.com,13 Best Personalized Christmas Ornaments 2018 (Updated!)
heavy.com,‘Dancing With the Stars’ Season 27 Spoilers & Elimination Predictions
heavy.com,Mariah Carey Joins ‘The Voice’ 2018 Judges
heavy.com,Whitey Bulger Dead: Boston Mobster Killed in Prison
heavy.com,Journal of the Reef Exotic Quest Is Apparently Time-gated
heavy.com,Is Alexis Ren Dating DWTS Partner Alan Bersten?
heavy.com,13 Best Cheap Christmas Decorations for 2018 (Updated!)
heavy.com,Demaryius Thomas Fantasy Value After Texans Trade
heavy.com,Toronto Raptors Roster & Starting Lineup Against Milwaukee Bucks
heavy.com,Contestant Cody Ray Raymond Quits ‘The Voice’
heavy.com,‘The Voice’ Season 15 Teams: 2018 Knockout Contestants
heavy.com,Indiana Trick or Treating Times Change Due to Rain
heavy.com,Stephen Curry’s Message to Klay Thompson Before Breaking Record
heavy.com,Kansas City Chiefs Have Interest in Janoris Jenkins
heavy.com,Can Congress Overturn an Executive Order by the President?
heavy.com,‘A Very Wicked Halloween’ Special Time & Channel
heavy.com,David and Cecil Rosenthal: A Tribute to the Tree of Life Victims
heavy.com,"Jerry Jones Discusses Confidence in Dak Prescott, Amari Cooper"
heavy.com,Rob Gronkowski’s Girlfriend Camille Kostek Goes Topless in Australia
heavy.com,Cooper Kupp Injury: A Week 9 Return Is Realistic
heavy.com,Patriots’ Bill Belichick Shoots down Rumors of Josh Gordon Punishment
heavy.com,Josh Allen Injury: When Will Bills Quarterback Return to Play?
heavy.com,WATCH FULL Cardi B Rant About Nicki Minaj’s Podcast
heavy.com,"Douglas Glenn Cyr, Whitey Bulger’s Son: 5 Fast Facts You Need to Know"
heavy.com,Injury Update: When Will Giannis Antetokounmpo Return?
heavy.com,"For Their Second Matchup in a Week, How Will the Pistons Adjust to the Celtics?"
heavy.com,Bills’ LeSean McCoy Addresses Trade Rumors Ahead of the Deadline
heavy.com,Sony Michel Injury: When Will Patriots Running Back Return to Play?
heavy.com,15 Best Chilling Adventures of Sabrina Gifts for Xmas 2018
heavy.com,"Fantasy Football Start ‘Em, Sit ‘Em: Week 9 Predictions"
heavy.com,WWE Survivor Series 2018: Matches & Predictions
heavy.com,TJ MCConnell Wears ‘#StrongerThanHate’ Shoes Amid Violent News Week
heavy.com,Tiaundra Kae Christon: 5 Fast Facts You Need to Know
heavy.com,Derrick Rose Wants to Win Sixth Man of the Year
heavy.com,WATCH: Klay Thompson Breaks NBA Record for Threes in a Game
heavy.com,Could James Conner’s Big Game Force Steelers’ to Deal Le’Veon Bell?
heavy.com,Halloween Trick or Treating Laws & Age Limits 2018
heavy.com,Dallas Mavericks Roster & Starting Lineup Against the Spurs
heavy.com,Red Dead Redemption 2 Fence Locations
heavy.com,New Orleans Pelicans Roster & Starting Lineup Against Denver Nuggets
heavy.com,UCF Proves College Football Playoff Still Has Its Flaws
heavy.com,NFL Trade Deadline: Cowboys’ Amari Cooper Deal Impacting Moves?
heavy.com,James Harden Injury Update: Will Harden Suit Up Against the Trailblazers?
heavy.com,"WATCH: Brandon Ingram Impresses in His Return, Lakers Lose to Timberwolves"
heavy.com,Milwaukee Bucks Roster & Starting Lineup Against Toronto Raptors
heavy.com,44 Best Birthday Gifts for Her: The Ultimate List (2018)
heavy.com,12 Best Toys for Tweens: Your Ultimate List (2018)
heavy.com,‘Mr. Feeny’ Scares Burglar Away From His California Home
heavy.com,Raiders’ Bruce Irvin Trade Rumors: Asking Price for Defensive End
heavy.com,"NFL Power Rankings Week 9 2018: Chiefs, Saints & Rams Impress"
heavy.com,Ahsoka & Padme Found in Battlefront 2 Files
heavy.com,Obi-Wan & Geonosis Revealed in New Battlefront 2 Trailer
heavy.com,Super Smash Bros Ultimate Direct November Predictions
heavy.com,Former Clemson Quarterback Kelly Bryant Undecided on Future
heavy.com,Browns Fire OC Todd Haley Shortly After Firing HC Hue Jackson
heavy.com,Twitter Reacts to Ryan Fitzpatrick Being Named Starter Again
heavy.com,Hue Jackson Has Historically Bad NFL Win Percentage After Browns Firing
heavy.com,"Kat Taylor, Tom Steyer’s Wife: 5 Fast Facts You Need to Know"
heavy.com,"Diablo 3 Switch: Release Date, Amiibo, Multiplayer & More"
heavy.com,"Halloween Trick or Treating 2018 Times, Hours & Weather Changes"
heavy.com,13 Best Kids Christmas Sweaters: Your Ultimate List (2018)
heavy.com,Rose Mallinger: A Tribute to the Pittsburgh Synagogue Shooting Victim
heavy.com,Klay Thompson Reveals Stephen Curry Said to ‘Go Get’ His Record
heavy.com,Josh Gordon Fantasy: Patriots WR Was Expected to Be Benched
heavy.com,LeBron James Gets Trolled on Twitter After Red Sox World Series Win
heavy.com,Robert Bowers & Gab: 5 Fast Facts You Need to Know
heavy.com,Packers Rip Ty Montgomery for Decision That Led to Game-Losing Fumble
heavy.com,20 Best Womens Ugly Christmas Sweaters (2018)
heavy.com,Report: Baker Mayfield Won’t Miss Hue Jackson
heavy.com,WWE Evolution 2018: Reactions & Review
heavy.com,DraftKings Picks & Optimal Lineup for Patriots vs. Bills Showdown
heavy.com,"Stephanie Carafa, Mayor’s Daughter, Had Sex With Student, Cops Say"
heavy.com,Jatwan Craig Cuffie Is Butler High School Shooting Suspect
heavy.com,10 Best Matching Family Christmas Pajama Sets (2018)
heavy.com,50 Best Christmas Gifts for Her: The Ultimate List (2018)
heavy.com,Best Sinnoh Pokemon in Pokemon Go: Tier List
heavy.com,YouTube Went Down for Millions Around the World
heavy.com,Natalie Mayflower Sours Edwards: 5 Fast Facts You Need to Know
heavy.com,BET Hip Hop Awards 2018 Performers & Presenters
heavy.com,Raheem Cole Dashanell Davis: Man Accused of Murdering North Carolina State Trooper
heavy.com,Spider-Man PS4’s ‘The Heist’ DLC Introduces 3 New Suits
heavy.com,Raiders’ Derek Carr Trade Rumors: Giants and QB a Potential Perfect Fit?
heavy.com,"Andrea Zetts Ryan, Tim Ryan’s Wife: 5 Fast Facts You Need to Know"
heavy.com,Bucks vs Hornets Live Stream: How to Watch Game Online
heavy.com,Hitman 2 Will Let You Kill Sean Bean
heavy.com,5 Call of Duty: Black Ops 4 Blackout Beginner Tips
heavy.com,How to Unlock the Haunted Forest in Destiny 2
heavy.com,Raiders Website Created to Countdown Until Jon Gruden’s Contract Ends
heavy.com,Where to Catch Chatot & Carnivine in Pokemon Go
heavy.com,"Ezekiel Elliott, Conor McGregor Hit the Club after Cowboys Win"
heavy.com,Chrystal Vega: 5 Fast Facts You Need to Know
heavy.com,Tinashe & Brandon Armstrong on ‘Dancing with the Stars’
heavy.com,Texas vs Oklahoma Live Stream: How to Watch Online Without Cable
heavy.com,"Morgan Happ, J.A. Happ’s Wife: 5 Fast Facts You Need to Know"
