source,title
heraldscotland.com,Niall McGinn says Aberdeen have to receive 50/50 split of tickets for Betfred Cup final against Celtic
heraldscotland.com,Blair: Scotland want to wipe out the pain of thumping loss against Wales
heraldscotland.com,John McAuslin: 'The emphasis throughout the Budget was confirming to the world that Britain remains open for business'
heraldscotland.com,SNP urged to suspend councillor in 'anti-Semitism' row
heraldscotland.com,Budget did little to allay Brexit fears for Glasgow vending firm
heraldscotland.com,The Scottish play that earned the scorn of Brazil's new right wing president returns to Edinburgh
heraldscotland.com,Budget 2018: Chancellor unveils raft of measures designed to tackle problem debt
heraldscotland.com,Neil Mackay: We must no longer shrink from the deadly threat of the far right
heraldscotland.com,Tom Gordon: Ruth Davidson's happy event is also a test for her party
heraldscotland.com,Oliver Bozanic hoping to get one over on his old pals Tom Rogic and Brendan Rodgers again
heraldscotland.com,Space mining entrepreneur sees little in Budget to get young people onto the property ladder
heraldscotland.com,"30,000 march through Glasgow calling for increase in teachers’ pay"
heraldscotland.com,Poorest university students saddled with largest debts
heraldscotland.com,Craig Gordon: This Hearts side could be as good as mine - but my Celtic will still win at Murrayfield
heraldscotland.com,"Betfred Cup win would cap Hearts' journey back to top, says Steven Naismith"
heraldscotland.com,Nation pays tribute as one family remembers four lost sons
heraldscotland.com,Celtic-mad Arthur Graham let head rule his heart when signing for Aberdeen
heraldscotland.com,Steve Clarke calls on Scottish clubs to invest UEFA windfall in goal-line technology
heraldscotland.com,Margaret Taylor: Women on banknotes have the power to improve society
heraldscotland.com,Why Kilmarnock are even better than last season
heraldscotland.com,Budget 2018: Crieff Hydro boss calls for politicians to respect tourism industry
heraldscotland.com,Frost and snow forecast for weekend as Arctic air sweeps in
heraldscotland.com,Graeme Shinnie hoping Aberdeen end up having the last laugh over semi-final ticket uptake against rivals Rangers
heraldscotland.com,Scotland's murder rate back to low of 1976
heraldscotland.com,SNP suspends member over 'anti-Semitic' blog
heraldscotland.com,Thousands of teachers expected to march in Glasgow over pay
heraldscotland.com,Celtic enjoyed magnificent cup run but Danny McGrain still mystified why the final was too often a game too far
heraldscotland.com,Chef Brian Maule: Grilled Mackerel
heraldscotland.com,Budget 2018: Income tax difference between Scotland and England set to grow
heraldscotland.com,Letters: Shame on the Tories and the SNP for leaving families in poverty
heraldscotland.com,Revealed: The failed bid to block DUP leader Arlene Foster's Orange Order event
heraldscotland.com,Budget: Hammond turns to toilet humour as Brexit Britain prepares to go down the pan
heraldscotland.com,Philip Hammond accused of applying 'sticking plaster' to broken welfare reforms
heraldscotland.com,Sturgeon urged to probe SNP links to 'anti-Semitic' blogpost
heraldscotland.com,Budget 2018: What does UK Budget actually mean for Scotland?
heraldscotland.com,Right deal will be double dividend
heraldscotland.com,"Brexit effect concern as think tank reveals 40,000 Glasgow area jobs linked to EU trade"
heraldscotland.com,Living wage increase is just not enough say Scots poverty campaigners
heraldscotland.com,Mark Smith: The other picture of a woman and a dead animal that tells the real story of hunting in Scotland
heraldscotland.com,Idris Elba in Glasgow for film shoot
heraldscotland.com,Craig Levein: Hopefully I won't leave Murrayfield at half time this time
heraldscotland.com,Celtic still sweating on Scott Brown as Brendan Rodgers reveals extent of midfielder's discomfort
heraldscotland.com,Philip Hammond accused of 'short-changing' Tay investment project
heraldscotland.com,Paul Hutcheon: the SNP's support from public sector workers is under huge strain
heraldscotland.com,"No deal Brexit, a Budget wrecker says Chancellor"
heraldscotland.com,Working for pennies a minute: the merciless reality of employment in modern Scotland
heraldscotland.com,Rape Crisis Centres to receive extra funding
heraldscotland.com,Trading Places: Barclays hires former VP as wealth management director
heraldscotland.com,Investors buoyed by Glasgow office market
heraldscotland.com,Analysis: Rationing risk if private patients become a cash cow for NHS
heraldscotland.com,Glasgow office revamp reaches final weeks
heraldscotland.com,EY growth faster in Scotland than in UK as a whole
heraldscotland.com,Crystal Palace midfielder James McArthur retires from international football to prolong his career
heraldscotland.com,Kinghorn: Scotland aim to right our wrongs against Wales
heraldscotland.com,"Bliss, bliss, bang, bang: 13 of the best bonfire nights in Scotland"
heraldscotland.com,Despair for Glasgow Warriors as Munster grab last-minute winner
heraldscotland.com,Scottish air passenger duty changes ‘could reduce public service funding’
heraldscotland.com,Alan Gordon: Valuations must eventually reflect the remarkable surge in the leisure and hospitality property sector
heraldscotland.com,Chief executive of Scotland’s exam body set to retire
heraldscotland.com,Doddie Weir: It's a good time for Scottish rugby
heraldscotland.com,"Concrete actions needed to end austerity, Finance Secretary says"
heraldscotland.com,Stunning photographs from around Scotland showing the country in its autumn glory
heraldscotland.com,Calls for SNP to suspend Glasgow councillor accused of shouting sectarian remarks
heraldscotland.com,"Scotland's MPs are 'critical' in fight for a second Brexit referendum, says Labour peer"
heraldscotland.com,New call for music festivals to play more works by female composers
heraldscotland.com,Letters: The BBC is more Scottish than STV
heraldscotland.com,Spooky places to go guising in Scotland
heraldscotland.com,Tory interim leader Jackson Carlaw brands SNP in Glasgow an ‘abject failure’
heraldscotland.com,Keith Bruce: Outlaw King...and the Braveheart comparisons
heraldscotland.com,Back to the future for Doyle as athletics action focuses on Cumbernauld Cross Country
heraldscotland.com,Zebre 34 Edinburgh 16: Richard Cockerill's side let 10-point half-time advantage slip away
heraldscotland.com,"Call for investigation into 8,500 private patients treated on NHS Scotland"
heraldscotland.com,Want to get your foot on the property ladder? Here’s how
heraldscotland.com,Litigation & funding remain active in construction sector
heraldscotland.com,Kieran Tierney insists Celtic have 'no excuses' for their latest defeat on the road in Europe
heraldscotland.com,Scottish Tory leader Ruth Davidson gives birth to baby boy
heraldscotland.com,Kevin McKenna: Leader of Glasgow City Council needs to show officials she is real boss
heraldscotland.com,A-Z of Outlander: Everything you need to know about the hit TV show
heraldscotland.com,What to look out for in Philip Hammond’s latest Budget
heraldscotland.com,Lord Adonis: Scottish Labour should lead the way in calling for a Brexit vote
heraldscotland.com,Weekend days out: The 10 Spookiest Places to Visit Across Scotland
heraldscotland.com,"Obituary - Janis Claxton, choreographer and teacher who won Herald Angel for innovative zoo project"
heraldscotland.com,Malky Mackay: Hamilton will reap long-term benefits from their involvement in the UEFA Youth League
heraldscotland.com,Joanna Blythman's verdict on Konkana in Edinburgh
heraldscotland.com,Labour win Coatbridge by-election amid SNP infighting
heraldscotland.com,Donald Trump's Turnberry media conference interrupted by Nazi golf ball pranks
heraldscotland.com,Celtic and Hearts League Cup semi-final set to be moved to Murrayfield in a sensational twist
heraldscotland.com,Solid start as John Souttar settles into life as a Scotland player
heraldscotland.com,"Obituary - Lord Stewartby, pre-eminent expert on Scottish coins who donated his collection to the Hunterian"
heraldscotland.com,Celtic striker Moussa Dembele gives Brendan Rodgers a timely boost ahead of AEK Athens game
heraldscotland.com,Navy’s flagship HMS Ocean sold to Brazil for £84 million
heraldscotland.com,New Hibernian midfielder Mark Milligan says Australian team-mate Jamie Maclaren played a part in his move
heraldscotland.com,Tributes paid to Silly Wizard folk legend Andy M Stewart
heraldscotland.com,BBC Switch Off campaign goes viral - but is the publicly funded broadcaster really biased?
heraldscotland.com,Ian McConnell: Brexiters try to hide elephant but who do they think they are kidding?
heraldscotland.com,"Football on TV: Where to watch Hibs v Celtic, Rangers v Hearts and more this weekend"
heraldscotland.com,"Obituary - Fenella Fielding, actress and star of Carry On Screaming"
heraldscotland.com,John Hughes licking his lips at prospect of seeing Scott Arfield versus Scott Brown clash
heraldscotland.com,"Obituary - Lindsay Kemp, mime artist, choreographer, dancer and teacher"
heraldscotland.com,Eros Grezda determined to get up to speed as quickly as possible at Rangers
