source,title
huzlers.com,7 Arrested After Retirement Home Raided By FBI For Running Elderly Fight Club
huzlers.com,Florida Man Accidentally Burns Home Down After Lighting Nike Shoes On Fire In Protest Of Nike’s Colin Kaepernick Ad
huzlers.com,Man Kills His Best Friend For Not Saying “No Homo” After 10-hour Anal Session
huzlers.com,"After Nearly 18 Years, Tupac Shakur Now 43, Comes Out Of Hiding!"
huzlers.com,Man Freed After Outliving 99-Year Prison Sentence For Horse Theft
huzlers.com,BREAKING: Jake From State Farm Found Dead In Apartment Bedroom
huzlers.com,"Creator of ""Flappy Bird"" Commits Suicide After Taking Down Game From App Stores (Several Worldwide Suicides Follow)"
huzlers.com,AriZona Tea Exposed By FDA For Using Human Urine In Products; Will Be Taken Off Shelves
huzlers.com,Man Dies From Electrocution While Testing New Sex Doll
huzlers.com,"BREAKING: Drake Cries As He Admits His Father, Dennis Graham, Writes All His Music"
huzlers.com,"""P.O.P, Hold It Down"" Woman Donna Goudeau Murdered In Prison"
huzlers.com,Camping only a holiday if your house is worse than a tent
huzlers.com,Barefoot 22-Year-Old Flower Child Steps Out Of Byron Bay Cafe And Hops Into 2017 Audi A4
huzlers.com,Leaders of ISIS and Al Qaeda Puzzled Why Trump Has Not Invited Them to White House
huzlers.com,Man cooks meat at barbecue but does sod all else
huzlers.com,"Universal Credit cheaper way to kill the poor than building gas chambers, says Jacob Rees-Mogg – The Rochdale Herald"
huzlers.com,Study: Best way to stop bad guy with gun actually good guy with lawn dart
huzlers.com,8 Touching Pics Of Celebrities And Their Dads
huzlers.com,I'm Sick of Apologizing for Being White When There's So Many Other Things I Should Be Apologizing For
huzlers.com,Report: Lee Greenwood's 'God Bless The USA' Plays Soviet Anthem When Reversed — Duffel Blog
huzlers.com,Piers Morgan was brutally owned on his own TV show and people can't get enough of it
huzlers.com,Ten baby names if you want your child to hate you
huzlers.com,Is being a cougar still a thing? Because I’m pretty sure I am one if so
huzlers.com,EDL and Britain First arguing who is and isn’t racist is best 17 seconds you'll spend today
huzlers.com,"""I Grew Up Pretty Rough"" Says Man With Suspiciously Straight Teeth"
huzlers.com,"After Approving 'Trump Baby' Balloon, Muslim Mayor Gets Dose Of Own Medicine"
huzlers.com,Johnny Sins Accused Of Sexual Harassment By 8 Women
huzlers.com,Meghan Markle’s NEW HUSBAND . . . Is Gonna Be BALD LIKE HIS BROTHER Soon!! (Close Up PICS)
huzlers.com,(Exclusive Sonogram Photo) Serena Williams Is Pregnant With Drake's Baby
huzlers.com,Chyna’s Boyfriend Got Chain SNATCHED . . . Goons Want Chyna To ‘F*CK’ To Get It Back!!
huzlers.com,Government to ignore expert advice on drug laws and instead base policy on series 9 & 10 of Grange Hill
huzlers.com,Woman who makes pouty face has no idea she looks like an idiot
huzlers.com,Asian Woman Kindly Corrects Bigot With the More Accurate Racial Slur
huzlers.com,Builder does eight-hour day for charity
huzlers.com,How is Trump planning to be a dick in the UK?
huzlers.com,Reformed Child Psychopath Somehow Turned Out OK After Drowning 47 People
huzlers.com,Black Voters Just Gave Trump-Hating Liberals The Last News They Ever Expected
huzlers.com,"""I Could Never Work In An Office"" Says Man Who's Never Worked In An Office"
huzlers.com,Corbyn left shaken after David Miliband announces return to UK politics
huzlers.com,Military To Stop Adding Saltpeter to Chow — Duffel Blog
huzlers.com,"Beautiful: When Their Deaf Daughter Started Digging A 200-Foot Pit In Their Backyard, These Parents Just Assumed It Was A Deaf Thing"
huzlers.com,"Queen Furious As ""Disrespectful"" Meghan Markle Disgraces Royal Family In Public"
huzlers.com,List: Countries of Europe Ranked by Civility (1939-1945)
huzlers.com,"The Ultimate Fan: This Woman Spent $200,000 On Plastic Surgery In Order To Look Like Beyoncé’s Head"
huzlers.com,"New Ballot Initiative Proposes Dividing California Into Tiny Bits, Feeding It To Sharks"
huzlers.com,Celebrate Juneteenth by Venmoing All Your Black Friends $50
huzlers.com,3 Years Ago He Hated Gay People. Today He’s A Completely Different Person. Still Pretty Weird That He Used To Hate Gay People Though.
huzlers.com,Man Who Hasn’t Watched Soccer In 4 Years Unimpressed By Tunisian Right Back’s Performance Last Night
huzlers.com,Mums compare their pictures with Kate Middleton 7 hours after giving birth and they're wonderful
huzlers.com,Bungle DEVASTATED after sex tape leaked onto the Internet
huzlers.com,Uh-Oh: Self-Checkout Kiosks Across The Country Just Started Protesting For A $15 Minimum Wage
huzlers.com,Democrats Fail to Block Donald Trump’s Nomination to the Supreme Court
huzlers.com,Lorry driver cuts journey time by FIVE SECONDS after overtaking fellow lorry driver
huzlers.com,Young men rent a yacht and it sinks by excess of prostitutes
huzlers.com,OUTRAGE at secondary school after girl sent home for looking TOO PRETTY in uniform
huzlers.com,"CNN's April Ryan & Ghetto Mayor Threaten Sarah With 'Fist Fight,' They Get Knocked Out"
huzlers.com,Man Frequently Compared To Hitler Recognizes Jerusalem As Israel's Capital
huzlers.com,Cardinals President Michael Bidwill Supports SCOTUS Nominee Through Cardinals Twitter Account Despite Telling Players To Stick To Sports
huzlers.com,Top UN Inspector: Assad Not Responsible For Chemical Weapons Attack
huzlers.com,"De Niro Bans Trump From Every 'Nobu Restaurant,' POTUS Gives Him Nasty Surprise"
huzlers.com,"David Hogg Boasts About His ""Love,"" Kyle Kashuv Condemns Him With His Own Words"
huzlers.com,Facebook Mum DEVASTATED to discover she isn’t first woman to ever have a fucking baby
huzlers.com,"Recording Emergencies On Your Phone Instead Of Helping, A Guide"
huzlers.com,Hispanic Democrat Calls Out Own Party For Lying About Family Separation At Border
huzlers.com,Evolutionist Proves Mennonites are Descended from Abes – The Daily Bonnet
huzlers.com,"As Justice Kennedy Retires, Nation Takes Moment To Thank God Hillary Clinton Not President"
huzlers.com,"As Justice Kennedy Retires, Nation Takes Moment To Thank God Hillary Clinton Not President"
huzlers.com,Theresa May Slams Trump For Separating Migrant Kids — Then Her Dirty Secret Comes Out
huzlers.com,Donald Trump 'clarifies' what he said about Russia – our favourite 19 responses online
huzlers.com,Liberals Cringe As Maxine Waters Makes Nasty Threat To Trump Supporters
huzlers.com,Acosta Screams 'Sarah Sanders Must Be Stopped' After She 'Kicks His Butt' On Live TV
huzlers.com,"Black giraffe was 'acting suspiciously', claims Breitbart"
huzlers.com,"Liberal Singer Spreads Lie About Gun Owners, Patriots Embarrass Him With Facts"
huzlers.com,How To Stay Up Really Late For No Other Reason Than Ruining Tomorrow
huzlers.com,Dublin Bus To Be Revamped Perfectly Without Any Issues
huzlers.com,Which dreadful personality type are you?
huzlers.com,Teenager trapped in dad band jam session
huzlers.com,Trump & Putin Recouple On Love Island
huzlers.com,Waiter Can’t Disguise Fact He Doesn’t Give A Shit
huzlers.com,Black Death distances itself from UKIP
huzlers.com,Lego Introduces New Sharper Bricks That Instantly Kill You When You Step On Them
huzlers.com,People loved ScotRail's response to this idiot because it was just perfect
huzlers.com,BREAKING: NFL Passes Rule Requiring Teams To Stand For National Anthem Or Else Be Fined
huzlers.com,Government reintroduces DEATH PENALTY for people who park across two spaces in ASDA
huzlers.com,Petition started to get Theresa May DEPORTED to Jamaica
huzlers.com,Andy Stanley Checks Himself Into Theological Rehab
huzlers.com,Florida Man Arrested For Tranquilizing And Raping Alligators In Everglades
huzlers.com,"Birdman Admits Lil Wayne Is a Homosexual Who Is In Love With Drake (The Reason Why Drake Wrote ""Doing It Wrong"")"
huzlers.com,Bill Nye The Science Guy Arrested For Manufacturing And Selling Illegal Drugs
huzlers.com,Dez Bryant Has Been Banned From The NFL After Testing Positive For LIGMA
huzlers.com,WWE Legend The Undertaker Found Dead In Texas Home
huzlers.com,Florida Man Arrested For Hanging On Traffic Light And Sh*tting On Cars Passing Underneath
huzlers.com,"Inmates Played ""Look At Me"" While They Raped XXXTentacion's Alleged Murderer"
huzlers.com,"Rapper 'Slim Jesus' Killed In Drive-By Shooting And Later ""Crucified"""
huzlers.com,59 People Die of Marijuana Overdose in Colorado and Washington After Legalization
huzlers.com,Buzz Aldrin Admits Apollo 11 Moon Landings Were FAKE and Simply A Set (See Tweet)
huzlers.com,Babysitter On Crystal Meth Eats 3-Month-Old Toddler
