source,title
independent.ie,Deadly storms hit large parts of Italy
independent.ie,A stray cat accidentally crashed a fashion show runway in Istanbul
independent.ie,Weaker pound helps push FTSE 100 higher amid European jitters
independent.ie,Notorious gangster James ‘Whitey’ Bulger found dead in prison
independent.ie,Neymar says Kylian Mbappe must 'respect the schedules' after Thomas Tuchel drops PSG star for lateness
independent.ie,John Aldridge: One man must come good for Liverpool if they want to seriously challenge Man City
independent.ie,Chelsea coach Marco Ianni fined by FA for celebration against Manchester United
independent.ie,"'There will be no second referendum', Theresa May tells Norway as citizens' rights post-Brexit agreed"
independent.ie,Germany's deadliest post-war serial killer: nurse admits murdering 99 patients with lethal injections
independent.ie,Red Dead Redemption 2 review: The western for a new generation
independent.ie,Who was gangster James 'Whitey' Bulger?
independent.ie,Watch: Ireland's sensational score in Grand Slam game at Twickenham nominated for Try of the Year
independent.ie,Britain’s grime scene suffering because of ‘institutionalised racism’
independent.ie,Work begins on five schools affected by structural issues
independent.ie,New Metrolink plans delayed further
independent.ie,Apple's new iPad Pro suggests iPhone users may soon need to get a new charger
independent.ie,Kate Middleton eases her way back into work with casual ensemble - and a blazer worth nearly €800
independent.ie,High Court orders extradition of construction company director to UK in connection with £5m tax fraud
independent.ie,What it feels like... to be a ghosthunter in Ireland - Paranormal investigator on tracking spirits
independent.ie,Infamous Boston gangster James 'Whitey' Bulger found dead in prison
independent.ie,Judge to decide if woman in vegetative state should be moved to care home
independent.ie,Thousands flee as fatal typhoon hits Philippines
independent.ie,Man attacked 'heroic' pensioner who tried to stop him stealing from collection box
independent.ie,New Zealand PM Jacinda Ardern speaks of 'real empathy' for pregnant Meghan Markle during 'tiring time' of royal tour
independent.ie,Ulster appoint Edinburgh’s managing director Jonny Petrie as their new CEO
independent.ie,In Pictures: Venice under water as storms batter Italy
independent.ie,'It's a difficult decision' - Padraig Harrington reacts as European Tour confirm Saudi Arabia will host 2019 event
independent.ie,Westport-owned workwear manufacturer Portwest investing €6.24m to expand its Australian operations
independent.ie,Man caught with €195k of drugs 'stored cannabis in wheelie bins'
independent.ie,Convicted sex offender to be sentenced for 'acts of gross indecency' with mentally impaired man
independent.ie,Deadly storms hit large parts of Italy and leave Venice under water
independent.ie,"Apple launches new lighter, smaller MacBook Air - and a new Mac Mini desktop computer"
independent.ie,Indonesian crash jet 'flew with unreliable speed readings' the day before tragedy
independent.ie,Man accused of murdering mum-of-two further remanded in custody
independent.ie,Teacher struck off after allegedly taping schoolgirls' mouths with Sellotape
independent.ie,Russia’s only aircraft carrier damaged in crane accident at dock
independent.ie,Consortium of Irish firm Roadbridge and Spanish group FCC confirmed as main contractor for new Dublin Airport runway
independent.ie,I can fit back into my wedding suit – Graeme Swann on Strictly weight loss
independent.ie,High Court declines to overturn €650k reduction to solicitor's fees to client
independent.ie,Mike Brown dropped from England squad for first time in Eddie Jones era ahead of Springboks visit
independent.ie,How many steps? Paul Pogba mocks himself as he goes to his car
independent.ie,WATCH: Dogs show off their talents for Halloween 'Tricks For Treats' at DogsTrust
independent.ie,Couple died in Yosemite fall ‘while taking selfie’
independent.ie,Strictly star Stacey Dooley promises to dance this weekend despite injury
independent.ie,I just knew what way to go: Jimmy Page looks back at 50 years of Led Zeppelin
independent.ie,Paul Lambert pleads with Ipswich fans not to judge him on past 'success or failure'
independent.ie,Prue Leith avoids repeat of Bake Off spoiler blunder ahead of final
independent.ie,Rob Kearney a doubt for Argentina and New Zealand as Leinster confirm Fergus McFadden will be out for four months
independent.ie,WATCH: Irish celebrities immortalised as miniature statues made from monkey nuts
independent.ie,Comment: GAA have to get used to a greater AFL exodus
independent.ie,Trump says he plans to push executive order to end birthright citizenship
independent.ie,Roman Kemp to host Takeshi’s Castle with guest appearance from dad Martin
independent.ie,Harry Winks: Tottenham's schedule of three games in five days is 'ridiculous'
independent.ie,Bid to identify plane crash victims as search continues off Indonesia
independent.ie,Irish jewellery firm Chupi enters US market with pop-up at iconic Macy's department store
independent.ie,Teacher (24) charged with defilement of teenage student
independent.ie,WATCH: The creative way to make use of monkey nuts this Halloween
independent.ie,German ex-nurse accused of killing 100 patients tells court charges largely true
independent.ie,"WATCH: Apple launches new lighter, smaller MacBook Air"
independent.ie,The Simpsons to axe Apu? Indians have their say
independent.ie,eir Sport to broadcast Ireland v Italy clash for free on YouTube and Facebook
independent.ie,Nato and Russia hold drills in same area off Norway amid rising tension
independent.ie,US agriculture chief says no plan to extend farm aid to offset tariffs
independent.ie,GAA have to get used to a greater AFL exodus
independent.ie,Republic of Ireland and Northern Ireland set to launch historic joint-bid to host U21 European Championship
independent.ie,Bake Off’s Terry thanks fans for their support in emotional message
independent.ie,Watch: HP's new-and-improved Sprocket could beat off its PC peers in Christmas sales
independent.ie,Apple launches new MacBooks
independent.ie,Pictured: 'Urban curtain' to be displayed in capital for major climate summit
independent.ie,Revealed: Tribute game in honour of the late Liam Miller raised €1.5m for his family and a host of good causes in Cork
independent.ie,Analytics firm among Dublin tech startups benefiting from €2.25m enterprise investment
independent.ie,Bodyguard star Anjli Mohindra: I almost gave up after Corrie turned me down
independent.ie,Corrie’s Sally Dynevor wants Helen Flanagan to return
independent.ie,Strictly’s Neil Jones asks for ‘positivity’ after appearance with wife Katya
independent.ie,Injured toddler settles €10k action after ambulance rolled backwards into tree
independent.ie,Dele Alli signs new six-year contract with Tottenham
independent.ie,Pathologist gives evidence at Kenneth O'Brien murder trial
independent.ie,Gomez singer Tom Gray: Major record labels are not developing new artists
independent.ie,James McClean will not be wearing poppy for upcoming Stoke fixtures
independent.ie,'It's a bit annoying to see it so successful' - Sue Perkins on life after the Great British Bake Off
independent.ie,Judge grants Katie Price time to broker deal with taxman
independent.ie,Pep Guardiola: Manchester City must improve to be a real contender
independent.ie,Dublin Airport awards main contract for 320m euro runway
independent.ie,Fears that boxing will be axed from the Olympics ease after CAS clear Serik Konakbayev to contest AIBA presidency
independent.ie,In Pictures: Presidential Election 2018 in 30 images
independent.ie,Little puppy Loki has an 'arrow' escape after swallowing toy the length of his body
independent.ie,Watch as baby Gentoo penguin takes its first swim at London Aquarium
independent.ie,Ireland's Nations League task gets a little easier as Gareth Bale ruled out of Wales visit
independent.ie,Princess Margaret and Jennifer Lawrence dresses to go on show at the V&A
independent.ie,Ireland’s self-sufficiency in beef reaches 683%
independent.ie,Hard Brexit could ground UK flights for three weeks but Ryanair would survive - Michael O'Leary
independent.ie,'Gardaí sent 22km to crime as local station bypassed' - Rural Garda boundaries are 'helping criminals to get away'
independent.ie,Crow banger brought into witness stand as evidence in Kerry murder trial finishes
independent.ie,Comment: There is no place in our Constitution for a blasphemy offence for which no one will be convicted - it's a sham
independent.ie,Only 53 BVD-positive animals remain in Ireland - see where they are
independent.ie,I feel rested and ready to work again – Wenger sets sights on January return
independent.ie,Larmour warns Euro rivals there's a lot more to come from Leinster
independent.ie,In pictures: Game of Throne's queen Natalie Dormer joins George Clooney in new Nespresso campaign
independent.ie,AIB customers using Google Pay or Apple Pay can get a Brown Sugar haircut for 1c this weekend
independent.ie,All of Meghan Markle's show-stopping looks during the royal tour Down Under
