source,title
independent.co.uk,"Nature is dying, so what will it take for our leaders to do something about it?"
independent.co.uk,Trump wants to use an executive order to override the 14th Amendment. Here's why that won’t work
independent.co.uk,A consultation on plastic waste isn’t good enough Philip Hammond – the public want action now
independent.co.uk,Cristiano Ronaldo is now the most-followed person on Instagram
independent.co.uk,Neymar says Kylian Mbappe must 'respect the schedules' after Thomas Tuchel drops PSG star for lateness
independent.co.uk,How Philip Hammond has managed to avoid his Budget unravelling
independent.co.uk,"Celebrate New Year’s Eve twice with £20,000 flight from Tokyo to Las Vegas"
independent.co.uk,NFL confirms four London games in 2019 season
independent.co.uk,South Dakota inmate Rodney Berget makes joke moments before execution by lethal injection
independent.co.uk,The IFS is right – Philip Hammond took a big gamble with the economy in his Budget
independent.co.uk,James McClean calls for respect after confirming he will not wear a poppy for upcoming Stoke fixtures
independent.co.uk,Julian Assange: WikiLeaks founder loses legal fight against Ecuador and must now clean up after his cat
independent.co.uk,Chelsea team news: Eden Hazard expected to miss Derby EFL Cup tie
independent.co.uk,How a record surge in young voters changes everything we thought we knew about the midterms
independent.co.uk,Trump Pittsburgh visit - live: Victim's family rejects offer to meet President and First Lady as Squirrel Hill community holds first funeral
independent.co.uk,Budget 2018: Environmental groups condemn lack of commitment to tackle climate change and wildlife declines
independent.co.uk,Lionel Messi: La Liga could rename Player of the Year award after Barcelona star
independent.co.uk,If the government wants to save NHS money while saving lives it should tackle deep vein thrombosis
independent.co.uk,Benjamin Mendy will not be punished for swipe at Erik Lamela in Manchester City win at Tottenham
independent.co.uk,Khashoggi murder: Turkish and Saudi prosecutors clash over investigation into journalist's death
independent.co.uk,Mike Pence causes controversy with 'Christian rabbi' at prayer for synagogue shooting victims
independent.co.uk,The end of austerity has ended already. It lasted 19 hours and 40 minutes
independent.co.uk,"Apple event: New MacBook Air, iPad Pro and Mac Mini unveiled – everything you need to know"
independent.co.uk,FA fine Marco Ianni £6000 for gesture to Jose Mourinho that sparked Chelsea vs Manchester United melee
independent.co.uk,Ben & Jerry's releases new anti-Trump flavour 'Pecan Resist'
independent.co.uk,Samantha Jones: British woman charged with murder after husband stabbed to death in Malaysia
independent.co.uk,Santiago Solari set to take charge of first Real Madrid match but can only remain as interim for two weeks
independent.co.uk,Grenfell Tower fire: Father found out his son had died from news report
independent.co.uk,Dogs: Trailer for new Netflix documentary series will make everything better
independent.co.uk,Philip Hammond claims he's brought an end to PFI. If only that were the truth
independent.co.uk,Hillary Clinton is just as delusional as Trump if she thinks she can appeal to the twisted morality of his supporters after Pittsburgh
independent.co.uk,"Coffee costs the average British person £303 a year, survey claims"
independent.co.uk,Home Office blocks US resident from entering UK to see daughter stricken by advanced ovarian cancer
independent.co.uk,Travel blogger who warned against dangerous selfies dies 'taking cliff edge photo'
independent.co.uk,Jon Bon Jovi criticises Kim Kardashian for becoming famous by 'making a porno'
independent.co.uk,"Halloween 2018: The best celebrity costumes, from Harry Styles to Rita Ora"
independent.co.uk,English and Welsh couples could soon be allowed to get married outside
independent.co.uk,Carey Mulligan says film sets are 'limiting' environments for working mothers
independent.co.uk,Familiar foes fight it out for supremacy – but it's Novak Djokovic who has the edge over Rafa Nadal
independent.co.uk,"Cara Delevingne, Emma Watson and Lily Cole among richest UK celebrities aged 30 and under"
independent.co.uk,Kell Brook confirms split from Dominic Ingle but denies they've fallen out ahead of ring return
independent.co.uk,Venice is sinking and the elite does nothing – is civil disobedience the only way to make governments listen on climate change?
independent.co.uk,10 best gifts for 1-year-olds
independent.co.uk,Emotional Frank Lampard ‘honoured’ to manage Derby against Chelsea in Stamford Bridge League Cup tie
independent.co.uk,PewDiePie begs fans to help him defeat T-Series to remain most-subscribed YouTube channel
independent.co.uk,Brexit: Theresa May rules out holding another referendum despite mass Final Say protest
independent.co.uk,"9 of the best anti-Trump songs, from Janelle Monae to Kendrick Lamar"
independent.co.uk,Bride-to-be mocked for having guests compete for spot in bridal party
independent.co.uk,Learn to Live: Vanessa Kirby calls on Theresa May to support children left traumatised by war
independent.co.uk,"Home Office 'not being straight' with MPs over border security after no-deal Brexit, Labour's Yvette Cooper says"
independent.co.uk,John McDonnell defends decision to support Philip Hammond's tax cuts amid Labour backlash
independent.co.uk,"Tokyo garden loses £175,000 as attendant 'too scared to charge foreign tourists after one shouted at him'"
independent.co.uk,Family sues Sacred Heart University after daughter dies following pancake-eating contest
independent.co.uk,"Trump hits Stormy Daniels with over $300,000 in legal fees as NDA lawsuit continues"
independent.co.uk,Budget 2018: Hammond faces backlash for saying funding for schools will buy ‘little extras’ like whiteboards
independent.co.uk,Red Bull in turmoil as Daniel Ricciardo and Max Verstappen turn on team and each other
independent.co.uk,"Infamous Boston gangster Whitey Bulger killed in jail aged 89, reports say"
independent.co.uk,Mobile phone insurance provider Liberty fined £5.3m for unfairly rejecting claims
independent.co.uk,"MacBook Air: Apple reveals new, entirely redesigned version of its small laptop"
independent.co.uk,"It’s True, It’s True, It’s True: All-female play based on rape trial of Artemisia Gentileschi strikes uncanny chord a year on from #MeToo"
independent.co.uk,Pittsburgh shooting: Late night hosts respond to ‘tragic and sickening’ synagogue murders
independent.co.uk,"Edson Da Costa: Force used against young black father who died after police restraint was 'proportionate', watchdog finds"
independent.co.uk,Tyson Fury lifts lid on Anthony Joshua sparring session and confrontation ahead of Deontay Wilder fight
independent.co.uk,Migrant caravan - live: Pentagon to deploy thousands of troops as migrants fleeing poverty heads towards US border
independent.co.uk,Great British Bake Off shares emotional handwritten letter from Terry
independent.co.uk,10 best women's gloves and wrist warmers for winter 2018
independent.co.uk,Tottenham vs Manchester City: Pep Guardiola tells champions they must improve despite beating Spurs
independent.co.uk,England bowlers given reminder of the task at hand in challenging first day of preparations against Sri Lanka
independent.co.uk,New domestic violence shelter in New York to offer refuge for victims and their pets
independent.co.uk,Cornwall council puts vulnerable teenager in tent after he became homeless
independent.co.uk,Louis CK tells crowd he 'needs an income' during first advertised show since scandal
independent.co.uk,Russia’s only aircraft carrier damaged while undergoing repairs as floating dry dock sinks
independent.co.uk,Dec Spelman on the tragic death of Scott Westgarth: ‘I will carry it around with me forever’
independent.co.uk,Manchester City's excellent defence is nothing new but still has room for improvement
independent.co.uk,Budget 2018: Police Federation accuses Philip Hammond of 'prioritising potholes' over crime
independent.co.uk,New Apple emojis: iPhone and iPad users get 77 brand new emoji with iOS 12 update
independent.co.uk,9 best Christmas family pjama sets
independent.co.uk,"Halloween 2018: Ten of the scariest horror films of all time, from The Exorcist to The Blair Witch Project"
independent.co.uk,Evans Cycles sold to Mike Ashley’s Sports Direct as part of pre-pack administration
independent.co.uk,Mike Brown dropped from England squad for first time under Eddie Jones ahead of South Africa test
independent.co.uk,Air Power: Where is Apple's iPhone charging mat? Another event passes without long-awaited announcement
independent.co.uk,All Boeing 737 Max planes to be inspected by Indonesian authorities following Lion Air crash
independent.co.uk,Brexit: Britain and Norway agree deal to protect citizens' rights in event of no-deal
independent.co.uk,Budget 2018: Austerity still not over for government departments warns Institute for Fiscal Studies
independent.co.uk,Brexit: Car maker Bentley warns no-deal outcome would damage profits and could lead to plant shutdown
independent.co.uk,School bus driver plunges into flooded road after ignoring warning signs
independent.co.uk,Massive Attack announce 21st anniversary Mezzanine tour for 2019
independent.co.uk,Sonos x Hay: Smart speakers finally launched in array of new colours
independent.co.uk,Chancellor Philip Hammond's classically Tory budget casts him as Robin Hood in reverse
independent.co.uk,Turkey and Saudi Arabia alarm the West by backing Islamist extremists the Americans had bombed in Syria
independent.co.uk,Fulham vs Arsenal player ratings: Alexandre Lacazette and Lucas Torreira mastermind 5-1 thrashing
independent.co.uk,Brexit timetable: Key dates for final steps towards leaving EU
independent.co.uk,'White nationalist' from infamous Charlottesville protest now reportedly studying at LSE
independent.co.uk,Brett Kavanaugh confirmed: Donald Trump says ‘women outraged’ over Supreme Court pick’s treatment
independent.co.uk,Vladimir Putin calls poisoned Russian spy Sergei Skripal 'simply a traitor and a scumbag'
independent.co.uk,Brexit uncertainty sees UK patients cut from heart attack drug trial
independent.co.uk,China hails state TV reporter for 'slapping Tory' at party conference
independent.co.uk,Jose Mourinho press conference - as it happened: Manchester United boss previews Newcastle clash
independent.co.uk,Cardiff Half Marathon: Two runners die after collapsing at finish line
independent.co.uk,Russian military plane disappears near Syria with 14 on board
