source,title
iol.co.za,"PICS, VIDEO: Durban's strong winds uproot trees"
iol.co.za,Cell C to help City with Wi-Fi expansion across the metro
iol.co.za,Kidnapped toddler reunited with mother
iol.co.za,Verulam 'rape cat' euthanised
iol.co.za,Life behind bars for Richards Bay rapist
iol.co.za,WATCH: Tiffany Haddish on why she won't date Drake
iol.co.za,Dean Elgar close to ton as Titans fight back against Lions
iol.co.za,Pete Mihalik's son stable following father's execution
iol.co.za,"Traffic signs, direction to police stations 'invaded' by penis enlargement ads"
iol.co.za,"WATCH: Solly Msimanga inspects Centurion, Laudium sinkholes"
iol.co.za,Zimbabwe targets $700m from controversial payment tax
iol.co.za,PICS: Joe Jonas dresses as fiancée Sofie Turner's GoT character for Halloween
iol.co.za,"I want to be a part of it, says Santiago Solari on managing Real Madrid fulltime"
iol.co.za,Maimane slams councillors who use 'racial victimhood' to hide corruption
iol.co.za,Why students need more ‘math talk’
iol.co.za,Higher consumer spending boosts Mastercard's profit beat
iol.co.za,Nehawu says it rejects planned 'job bloodbath' at SABC
iol.co.za,Amcu killings: Charges withdrawn against five suspects as trial date set
iol.co.za,KZN bombings: State's request to reopen case in accused's bail bid denied
iol.co.za,UJ academic invited to join the WEF Global Future Council on Cybersecurity
iol.co.za,Bok coach: Pressure will be there for Ivan and Embrose at Twickenham
iol.co.za,KZN residents urged to 'heed' warnings following storm alert
iol.co.za,"Ivanka Trump, Jared Kushner celebrate pal Hugh Jackman's 50th birthday"
iol.co.za,"Nortjé takes six wickets, but Moore, Ackermann put Warriors in control against Knights"
iol.co.za,Trump says he plans to scrap birthright citizenship
iol.co.za,We need to reaffirm family and faith to halt SA's moral meltdown
iol.co.za,5 minutes with: 'Queer Eye' star Antoni Porowski
iol.co.za,British Airways Boeing 787-8 Dreamliner one of the reasons for new Durban route
iol.co.za,Cleaner Beachfront needed with new flight routes to Durban
iol.co.za,Dele Alli commits long-term future to Tottenham with six-year deal
iol.co.za,Fired up Abbott excited to be back in Durban
iol.co.za,Ariella set to go home after 16th radiation treatment for tumor
iol.co.za,Museum's Huangshan Mountain exhibition enchants locals and tourists alike
iol.co.za,Victory for women's rights as ConCourt confirms land ownership ruling
iol.co.za,"Woman blows herself up, wounds 8 police officers and a civilian"
iol.co.za,Suspect in Pete Mihalik 'hit' seen 'fleeing the scene in a grey VW Polo'
iol.co.za,There aren't enough jobs in Africa for population
iol.co.za,What to do with your ‘dead’ car battery
iol.co.za,Emirates introduces biometric systems at Dubai airport
iol.co.za,"Chiefs coach Solinas: I don’t change my defenders according to how Pirates, Wits or Sundowns play"
iol.co.za,Lena Dunham to write Syrian refugee story for Spielberg
iol.co.za,Mzansi Super League: R10 million in prize money up for grabs
iol.co.za,Sequel to the movie Crazy Rich Asians on the cards
iol.co.za,Kia's enhanced Grand Sedona MPV touches down in SA
iol.co.za,Turkey pressing Saudi Arabia to reveal who sent Khashoggi killers
iol.co.za,EasyJet makes progress with electric aircraft plan
iol.co.za,GET THE LOOK: Celeb sunglasses trends
iol.co.za,'I was forced to have sex with 100 Asian men by the age of 16'
iol.co.za,Football star Andile Jali released on bail after alleged row with wife
iol.co.za,Five dangers on Cape Town Metrorail trains
iol.co.za,Strong winds shut down Durban harbour operations
iol.co.za,Police officer fingered in fiery Durban house arson
iol.co.za,1 in 3 American adults eat fast food on any given day
iol.co.za,OPINION: De Lille should not be clinging to power
iol.co.za,Shallcross Operations Control Centre set up to fight crime
iol.co.za,"Jabba, gone but not forgotten"
iol.co.za,Vernon Philander brings up his 50 in rescue act with Malan for Cape Cobras
iol.co.za,Pharrell Williams sends warning to Donald Trump
iol.co.za,This quadriplegic painter discovered his talent through tragedy
iol.co.za,Social relationships key to improving learning in schools: Study
iol.co.za,Cape Town comedians band together to raise funds for #KhayelitshaFire victims
iol.co.za,"Still more to come out, says author of The Lost Boys"
iol.co.za,OnePlus 6T unveiled - see specs and more
iol.co.za,"OPINION: SA urgently needs leadership, but currently has too little"
iol.co.za,"Pep on Wembley pitch: If the grass is good, then Lamela scores for Spurs"
iol.co.za,Suspect arrested in connection with Pete Mihalik hit
iol.co.za,Unpaid EPWP workers protest outside Durban city hall
iol.co.za,How the motor code of conduct will benefit you
iol.co.za,Schumacher still F1's greatest of all time: Hamilton
iol.co.za,Apple expected to unveil iPads with facial recognition
iol.co.za,Buses stand idle as council set to adopt Bowmans report
iol.co.za,"Phoenix father to be sentenced for strangling son, 7, in park"
iol.co.za,KSIA thrilled with UK direct flight
iol.co.za,Outgoing chair of SA chapter of BRICS Business Council hails achievements
iol.co.za,"Eddie Jones unsure about England captain, loose trio for Bok Test"
iol.co.za,"Sentencing for Phoenix father who strangled son, 7, in park"
iol.co.za,Nigerian police open fire on Shiite Muslim protesters in Abuja
iol.co.za,Check out this 1.1kg emerald that was just discovered
iol.co.za,Ariana Grande's brother says she's 'slowly on the mend'
iol.co.za,Social Development MEC Albert Fritz helps Cape fire victims
iol.co.za,"Intel says more women, African-Americans in workforce after diversity push"
iol.co.za,'Crazy Rich Asians' team heads to China for sequel
iol.co.za,"Man finds ex lover with new boyfriend, fires shots at her and robs the man"
iol.co.za,Watch the #HHPMemorial live
iol.co.za,Stench leads to discovery of 7 decomposed bodies at Vlakfontein house
iol.co.za,KZN health launches national cancer campaign
iol.co.za,Marikana Amcu killings: Accused to apply for bail
iol.co.za,"Red Hat jumps, IBM shares dip on cloud mega-merger"
iol.co.za,Netherlands prepares to be EU financial trading hub after Brexit
iol.co.za,Anti-gay US pastor Steven Lee Anderson may visit SA again
iol.co.za,Why Melania Trump's pith helmet was not just a hat to block the sun
iol.co.za,"I was there that morning, says co-accused in #HannahCornelius case"
iol.co.za,"IAAF ‘very confident’ of new rules, expect court to reject Caster Semenya’s challenge"
iol.co.za,"It hasn't sunk in yet, says Cape Town’s latest Olympic sprint champ"
iol.co.za,SA mining production slumps 9.1% in August - StatsSA
iol.co.za,"Fani Madida, Neil Tovey pay tribute to Kaizer Chiefs boss Kaizer Motaung on his birthday"
iol.co.za,Alleged looter claims VBS cash was return on investment
iol.co.za,Kanye West brought Yeezys as gifts to White House but can Trump keep them?
iol.co.za,"SA needs a formula for bold progress to promote investment, growth and jobs"
iol.co.za,This is the posh uMhlanga house where Cheryl Zondi was kept
