source,title
jacksonville.com,Doug Marrone says his bye week evaluations will start with himself
jacksonville.com,South Dakota executes inmate who killed prison guard in 2011
jacksonville.com,"If parents get deported, who gets their children?"
jacksonville.com,Mayo researchers working on vaccines to treat - possibly prevent - breast cancer
jacksonville.com,Gab: The web site where Pittsburgh shooting suspect ranted
jacksonville.com,Jacksonville man faces possible death penalty after being found guilty of 2 murders in 2014
jacksonville.com,"Trick-or-treat safely with new Florida sex offender locator app, warnings and more Halloween safety"
jacksonville.com,"FHSAA votes to pass new classification, playoff structure"
jacksonville.com,Trump and Obama to campaign in Florida during final week
jacksonville.com,Pat Dooley: Can Florida get back on track after Georgia?
jacksonville.com,"Gene Frenette: Halfway through the season, Jaguars signal start of post-mortem"
jacksonville.com,"ESPN's GameDay, SEC Network's SEC Nation, get Florida-Georgia off to a rowdy start"
jacksonville.com,Gene Frenette: Power 5 elitists should actually be rooting for UCF perfection
jacksonville.com,Call Box: Coin club still going strong after 71 years
jacksonville.com,"North Florida Land Trust buys 2,300 acres of 'critical' conservation land for $5.4 million"
jacksonville.com,"When Florida elects a CFO, it's also choosing the state's top arson investigator"
jacksonville.com,Ten things to know about Sunday's Eagles-Jaguars game in London
jacksonville.com,World War II trainers join Blue Angels at weekend air show
jacksonville.com,"Director hired, upgrades planned as Jacksonville Arboretum & Gardens nears 10th anniversary"
jacksonville.com,Jaguars Notebook: Jalen Ramsey leading beaten-up secondary
jacksonville.com,Jaguars Notebook: Career day for kicker Josh Lambo in loss
jacksonville.com,Orlando lawyer organizing UCF 'takeover' of ESPN GameDay
jacksonville.com,Identity crisis: Jaguars lose sight of who they are in loss to Philadelphia Eagles
jacksonville.com,Bomb suspect was cash-strapped ex-stripper devoted to Trump
jacksonville.com,"Jaguars two-minue drill: Led by OLB Whitney Mercilus, Texans' defense dominates"
jacksonville.com,"Brown, Harvin lead Florida-Georgia Hall of Fame Class of 2018"
jacksonville.com,Tim Tebow love of Florida-Georgia goes back to Pop Warner days
jacksonville.com,Jacksonville police 'very visible' at Florida-Georgia game
jacksonville.com,Jaguars QB Blake Bortles vows to remain 'fearless' despite recent skid
jacksonville.com,'Sense of community' will be palpable at Longest Table event Nov. 14 in downtown Jacksonville
jacksonville.com,Bouye will miss Sunday's game vs. Eagles because of calf injury
jacksonville.com,Florida-Georgia 2018: Glance at Saturday's game in Jacksonville
jacksonville.com,Blake Bortles will remain the Jaguars' starting QB despite Sunday's benching
jacksonville.com,Jacksonville family business finding fans for Party Shack rentals
jacksonville.com,Biden campaigns in Jacksonville for Democratic ticket
jacksonville.com,Former Jaguars QB Byron Leftwich takes over offensive coordinator job with Arizona Cardinals
jacksonville.com,ACC Notebook: Burns racing up the career FSU sack list
jacksonville.com,Gene Frenette: Franks-Mullen dynamic working well for Gators
jacksonville.com,Ex-NFL player out of prison after 18 years for murder plot
jacksonville.com,Jaguars Four Downs: QB Blake Bortles taking 'all the starter reps' this week in practice
jacksonville.com,Jacksonville man gets 10 years in prison for sexual abuse of woman on Carnival cruise
jacksonville.com,Live coverage: Former VP Joe Biden visits UNF with Bill Nelson and Andrew Gillum
jacksonville.com,Bomb found at philanthropist George Soros' suburban home
jacksonville.com,Jaguars notebook: Jaguars continue to struggle with turnovers
jacksonville.com,"Mark Woods: In 2018 America, a twisted idea of toughness"
jacksonville.com,"Americans say they want alternatives to opioid prescription, Mayo study finds"
jacksonville.com,"To keep your blood pressure in check, brush and floss your teeth..."
jacksonville.com,"Volleyball playoffs: BK, Fleming, Bartram, Episcopal among Wednesday winners"
jacksonville.com,Gene Frenette: Battle-tested Gators get edge over favored Georgia
jacksonville.com,Sheriff adds manpower for Florida-Georgia game after shooting near stadium
jacksonville.com,"Jacksonville's violent weekend leaves dead and wounded, but neighbors say the site of the worst gunfire is usually ""quiet"""
jacksonville.com,"Call Box: Wonderwood resort gave its name to road, bridge and lake"
jacksonville.com,"Bulldog, Gator fans ready for the big game"
jacksonville.com,Jacksonville man gets 25 years in prison on heroin charges
jacksonville.com,Jaguars' offensive scoreless streak continues
jacksonville.com,Caravan at Mexico-Guatemala border shrinks as migrants cross
jacksonville.com,Guest conductor Matthew Halls at home with JSO’s ‘Bachtoberfest’
jacksonville.com,"Governor hopefuls DeSantis, Gillum spar in second debate"
jacksonville.com,Florida-Georgia 2018: Momentum has been hard to break in this series
jacksonville.com,Fowlie's OT winner lifts Icemen past Atlanta
jacksonville.com,"Jaguars place OT Will Richardson on injured reserve, add RB Carlos Hyde"
jacksonville.com,FBI and Parent Academy conduct Jacksonville seminars on smartphone safety for children
jacksonville.com,"Crude pipe bombs sent to Obama, Clintons, CNN; no injuries"
jacksonville.com,Experts: Bomber likely left behind trove of forensic clues
jacksonville.com,Former Putnam School Board member carries 'I Stole' sign as part of court agreement on grand theft case
jacksonville.com,Why many Americans don't plan to vote in November
jacksonville.com,Sandy Hook shooter's belongings ordered released to public
jacksonville.com,Florida preparing to face two Georgia QBs
jacksonville.com,Fierce Hurricane Willa bears down on Mexican resort area
jacksonville.com,City issues permit for Florida-Georgia party at Landing
jacksonville.com,On the Road: A sign of the time for Girvin Road
jacksonville.com,Carlos Hyde hopes to bring 'angry' running to Jaguars' sluggish offense
jacksonville.com,"Remorseful, elderly bank robber sentenced for Clay heist"
jacksonville.com,Trump calls on media to end 'hostility' after thwarted bombs
jacksonville.com,Jacksonville pancreatic cancer survivor hopes to inspire others: 'Never let anyone take away your hope'
jacksonville.com,Marrone trying new motivational tactics to help get his team back on track
jacksonville.com,Suspicious package addressed to Robert DeNiro
jacksonville.com,Jacksonville woman jailed after bank card of shooting victim used after his death
jacksonville.com,Child dead in St. Augustine fire
jacksonville.com,"Cosby judge rejects bid for new trial, sentencing hearing"
jacksonville.com,Mother and boyfriend jailed after Jacksonville 5-year-old dies
jacksonville.com,Jaguars trade for Cleveland running back Carlos Hyde
jacksonville.com,VP Mike Pence coming to Jacksonville Thursday to campaign for Ron DeSantis
jacksonville.com,Mayor wonders about small town's ability to survive Michael
jacksonville.com,Lawyer: Man accused of threats to kill senators has dementia
jacksonville.com,They're coming to our city: ESPN's GameDay to air from Georgia-Florida for the first time in 13 years
jacksonville.com,Immunotherapy scores a first win against some breast cancers
jacksonville.com,Early voting for general election begins Monday
jacksonville.com,"Jaguars Four Downs: QB Blake Bortles ready for crowd noise, seeing old friend"
jacksonville.com,Volunteers across Jacksonville repair disabled veteran's historic Springfield home
jacksonville.com,Woman's naked body beneath bridge is being investigated as a Jacksonville murder
jacksonville.com,Critically endangered western lowland gorilla gives birth at Jacksonville Zoo
jacksonville.com,"Addicted to opioids, Jacksonville man says physical therapy saved him"
jacksonville.com,At least 13 undrafted free agents headed to Jaguars
jacksonville.com,Jaguars display offensive show against Patriots without injured Leonard Fournette
jacksonville.com,"Jacksonville Jaguars getting wins, ratings, apparel sales and props"
jacksonville.com,POW remembrance event to raise awareness of Cecil Field POW/MIA Memorial
jacksonville.com,Jacksonville restaurant owners plead guilty to illegal immigrant charges
jacksonville.com,"Jaguars promote running back from practice squad, release veteran receiver"
jacksonville.com,Jumbo Shrimp agree extension with city through 2033
