source,title
kmov.com,Reports: Notorious mob boss Whitey Bulger killed in prison
kmov.com,2 suspects on the loose after woman carjacked at gunpoint in the Central West End
kmov.com,"Missing Illinois professor, husband feared dead; son charged"
kmov.com,2 suspects charged after Washington Park officer's fatal fall from PSB during chase
kmov.com,Do your homework before heading to the polls or it could take you nearly 30 minutes to fill out a ballot
kmov.com,3 students in custody after assistant principal attacked in viral video
kmov.com,"St. Louis County celebrating Halloween by having safety centers, handing out candy"
kmov.com,Smell from consumer economics classroom causes concern at Eureka High School
kmov.com,News 4 Investigates: How a major retailer was making personal information easily accessible
kmov.com,Driver of van dies after driving into parked semi
kmov.com,Driver of SUV dies after driving into parked semi at tire shop
kmov.com,Biden to attend Get Out the Vote rally with McCaskill in Bridgeton
kmov.com,Walmart's plan to win the holidays: Faster checkouts and a simpler website
kmov.com,Video of fight at South County high school goes viral
kmov.com,"17-year-old charged after he strangled, shot at 16-year-old girlfriend, police say"
kmov.com,4 dead in violent Monday in St. Louis City
kmov.com,People fall ill at Eureka High School; crews check for carbon monoxide
kmov.com,"Southern Illinois University starts marijuana, hemp research"
kmov.com,"Missing man with dementia talked about moving to Florida, Mississippi, police say"
kmov.com,Trump to campaign for Hawley in Missouri on night before Election Day
kmov.com,Mother of missing Missouri 4-year-old seeks public's help
kmov.com,"Crash causing major delays, lane closures on WB I-270 in North County"
kmov.com,16 and 17-year-old involved in North City shooting
kmov.com,Hazelwood East and Riverview Gardens cut ribbons on new student health centers
kmov.com,Forecast prompts Missouri city to move trick-or-treating to tonight
kmov.com,Boy in wheelchair gets amazing Halloween surprise
kmov.com,Man walks around naked following car crash in Alabama
kmov.com,Grinch arrives before Halloween as thief puts Alton Christmas display in jeopardy
kmov.com,Officer killed in fall from Poplar Street Bridge
kmov.com,SNEAK PEEK: A look at the newly renovated Soldiers Memorial
kmov.com,Sen. Graham headlines campaign event for Josh Hawley
kmov.com,"Retired Sgt. dies after being shot near Tower Grove Park: 'He was a very good person, a very wonderful personality'"
kmov.com,Robbers may be targeting victims from specific age group in St. Louis City
kmov.com,Former St. Louis police chief files suit against driver in crash that killed his wife
kmov.com,72 hours in America: Three hate-filled crimes. Three hate-filled suspects.
kmov.com,Retired police Sgt. dies after being shot near Tower Grove Park
kmov.com,"Retired officer 'unconscious, barely breathing' after being shot near Tower Grove Park"
kmov.com,Junior high school student told police he brought gun to school to ‘scare other students’
kmov.com,Red Sox beat Los Angeles to win World Series
kmov.com,Did you feel it? Earthquake confirmed in southeast Missouri
kmov.com,Backstoppers assisting family of Washington Park officer who died after falling off PSB during chase
kmov.com,Local woman says sister was blocks away from Pittsburgh synagogue shooting
kmov.com,Indonesia's Lion Air flight crashes into sea with 189 on board
kmov.com,Retired officer shot near Tower Grove Park during attempted robbery
kmov.com,"St. Louis man, 27, among two killed in shooting"
kmov.com,MISSING: St. Louis County police search for man with intellectual disabilities who did not take medications with him
kmov.com,"Report: Lion Air flight crashed into sea, 188 passengers, crew on board"
kmov.com,Man with intellectual disabilities found safe
kmov.com,Cardinals add Stubby Clapp and Jeff Albert to coaching staff
kmov.com,Reward for information about missing boy raised to $11K
kmov.com,"Toys for Tots to work with Grade 8 Car Culture to hold 'biggest' toy drive, car show in St. Louis"
kmov.com,MISSING! Police search for missing boy who disappeared from Jefferson City home
kmov.com,Missing West County woman with dementia found
kmov.com,Belleville apartment destroyed by two-alarm blaze
kmov.com,Trump falsely says NYSE opened day after Sept. 11 attacks to justify holding rally after Pittsburgh shooting
kmov.com,Firefighter injured battling Belleville apartment fire
kmov.com,"Retired officer 'unconscious, barely breathing' after being shot during near Tower Grove Park"
kmov.com,“He died for what he lived for”; Community mourn death of Metro East Officer killed from 50 ft fall
kmov.com,Police search missing West County woman with dementia
kmov.com,“He died for what he lived for”; Community mourns death of Metro East Officer killed from 50 ft fall
kmov.com,Hate crime charges filed in Pittsburgh synagogue shooting that left 11 dead
kmov.com,Officer dies after falling off on-ramp to PSB during struggle with 2 suspects
kmov.com,Annual 'Gives Kids A Smile' event provides free dental services to over 400 local kids
kmov.com,1 dead after flash fire in south St. Louis home
kmov.com,Student dies after fight ends in gunfire at NC high school
kmov.com,Cathedral Basilica parishoners react to the Pittsburgh synagogue shooting
kmov.com,Metro West Fire Protection District issues scam warning
kmov.com,"2 stabbed in Jefferson Co., suspect in custody, charged after running from police"
kmov.com,"Tarasenko scores twice, Blues beat Blackhawks 7-3"
kmov.com,"2 stabbed in Jefferson Co., suspect in custody after running from police"
kmov.com,St. Louis police identify retired sergeant killed in shooting
kmov.com,Affton School District considering changing start times
kmov.com,Double homicide investigation underway in North City
kmov.com,Teen killed in North County drive-by Sunday evening
kmov.com,"Retired officer 'unconscious, barely breathing' after being shot during attempted robbery near Tower Grove Park"
kmov.com,Man gunned down while walking down street in North County
kmov.com,"1 dead, 1 injured after gas stove explodes in south St. Louis home"
kmov.com,Idaho Fish and Game commissioner pressured to resign after bragging about killing a family of baboons
kmov.com,2 injured after gas stove explodes in south St. Louis home
kmov.com,The bacteria culprit in your child's packed lunch
kmov.com,Cherokee Nation faults Elizabeth Warren on DNA test results
kmov.com,"Paul Allen, Microsoft co-founder, dies at 65"
kmov.com,"Mom throws 1-year-old on ground after neighbor refuses to give her beer, police say"
kmov.com,"Same-sex penguin couple cares for foster egg, gets 'engaged'"
kmov.com,San Francisco murals vandalized with pro-Trump messages
kmov.com,Harper Yeats will have traveled to all 50 states this week. She's only 5 months old
kmov.com,"Ohio woman allegedly embezzled $180,000 from youth baseball organization"
kmov.com,'I wish we would have more time'; residents of Fenton hotel told to get out
kmov.com,Photo: Home sliced in half as tree crashes through mobile home
kmov.com,Man associated with Boy Scouts accused of 'deviate sexual intercourse' with child
kmov.com,Foundation spreads kindness to remember bullied teen who committed suicide
kmov.com,Murder charges filed in killing of 87-year-old man in Alton
kmov.com,Van crashes into pole at gas station in Creve Coeur
kmov.com,Plan moving forward to build new port along Mississippi River
kmov.com,Man killed by flash floods while on his honeymoon in Costa Rica
kmov.com,Illinois ranked 13th most vulnerable state to identity theft in study
kmov.com,U.S.'s first crowdfunded store coming to St. Louis
kmov.com,Crews free driver trapped in overturned semi-truck in Sunset Hills
kmov.com,Siri Shortcut lets you secretly record interactions with police
kmov.com,House Springs man dies after calling 911 to report a car on top of him
