source,title
latimes.com,Apple unveils lighter MacBook Air and revamped iPad Pro
latimes.com,These Orange County supermoms weren't very politically active. Now they're a major force fighting Trump in the midterm election
latimes.com,"When a woman wants an abortion but can’t get it, the children she already has suffer the consequences"
latimes.com,Ben Silverman's Propagate acquires Electus — his former shop — and a stake in Artists First management company
latimes.com,A brazen job scam exposes an employment crisis in India
latimes.com,The rise and fall of Megyn Kelly and what it says about the state of the media
latimes.com,"'Whitey' Bulger, the notorious Boston mobster found secretly living in Santa Monica, dies at 89"
latimes.com,Cartoon Network is opening its first hotel
latimes.com,A chat with Kathleen Zellner — the attorney who has 'Making a Murderer' devotees talking
latimes.com,Anti-Semitic incidents are surging across the U.S. Here are the numbers
latimes.com,Body found in trash bin at Anaheim condo complex prompts homicide investigation
latimes.com,"Police search for man suspected of beating, stabbing an 89-year-old having breakfast with church group"
latimes.com,"Disney's Cars Land at Halloween, where weird is welcome and the characters find new storylines"
latimes.com,Lawsuit seeks to overturn plan that would allow taller buildings along the Metro Expo Line
latimes.com,"In Georgia gubernatorial race, Stacey Abrams has a real chance to make history"
latimes.com,Keep an eye on California's down-ballot races — they could shape the state's politics and policy for years to come
latimes.com,Review: Phil Collins is back on the road. But does he know why?
latimes.com,Metrolink train crashes into bus stalled on tracks in San Bernardino; no serious injuries reported
latimes.com,Is winter coming for Southern California's housing market? Sales are falling and price cuts are more common
latimes.com,"After the Tree of Life shooting, my children will grow up less secure than their parents"
latimes.com,"Cities in north Orange County step up with housing for homeless, with Santa Ana leading the way"
latimes.com,'Global warming is nonsense' and the 'tax scam is a massive middle finger' to families: House candidates on the issues
latimes.com,Angels hire Doug White as pitching coach
latimes.com,Investigation into source of suspicious device in Pasadena led to arrest of Glendale man on drug warrants
latimes.com,"If other countries can balance human rights and border security, so can the United States"
latimes.com,Here are the candidates running for statewide office in California
latimes.com,"In deepest red Orange County, a blue flame of hope flickers in Newport Beach"
latimes.com,Ava DuVernay plans to make Prince film with 'love and great care'
latimes.com,"Russia's only aircraft carrier, in port for upgrades, is damaged in dock accident"
latimes.com,Suit says New Hampshire lawmaker struck partner in porn film project
latimes.com,"Lakers falter again in the stretch, losing to Minnesota 124-120"
latimes.com,"Soccer! LAFC staggers into playoffs, Galaxy collapse and a European leagues update"
latimes.com,"Trump didn't deliberately encourage the Pittsburgh gunman, but his rhetoric obviously isn't helping"
latimes.com,Will Angela Merkel's departure leave liberal democracy leaderless in a growing authoritarian jungle?
latimes.com,Lavon Bunkley of Gardena Serra is closing in on another Robert Woods record
latimes.com,Don't blame Angelenos for resisting the homeless shelters they voted to fund
latimes.com,Rent control is not intended to protect tenants paying artificially low leases for decades
latimes.com,GE slashes dividend and reveals bigger investigation by U.S. regulators
latimes.com,A not-so-elementary guide to Sherlock Holmes' London
latimes.com,Mistrial declared in case of Pomona officers charged in teenager's violent arrest
latimes.com,Lace up your snow boots for winter rail adventure in Alaska
latimes.com,"Stocks rise, helped by solid corporate earnings"
latimes.com,Netflix led the streaming industry's $55-million spending on ads in the summer
latimes.com,Antarctica scientist allegedly stabs colleague for spoiling the endings of books
latimes.com,USC fires offensive line coach Neil Callaway; Clay Helton to take over play-calling
latimes.com,Rare Inuit portraits by Henri Matisse displayed for first time in the U.S.
latimes.com,"Anti-vaccine stupidity returns, as measles cases rise and California parents evade the law"
latimes.com,How much does a cable box really cost? The industry would prefer you don't ask
latimes.com,Today: Border Security or Political Ploy?
latimes.com,U.K. targets tech giants with a digital services tax that starts in 2020
latimes.com,Review: Raúl de Nieves' bedazzled mosaics and fantastical little friends at Freedman Fitzpatrick
latimes.com,"In Montecito, a coastal Spanish villa on 84 acres seeks $16 million"
latimes.com,"Two years after it started, San Diego declares end to deadly hepatitis A outbreak"
latimes.com,Breeders' Cup draw isn't kind to Accelerate and other favorites
latimes.com,"Snap CEO hired chief business officer, then changed his mind two days later"
latimes.com,Carnival to transform one last ship as $2-billion upgrade of its fleet nears end
latimes.com,The big spenders behind the effort to repeal California’s bail reform
latimes.com,"Jet.com throws lifeline to Blue Apron, whose stock jumps 11%"
latimes.com,Lena Dunham's Klonopin detox was 'the most hellacious acid trip you've ever had'
latimes.com,Federal government identifies 14 additional children separated at border
latimes.com,Frustration leads to walkout by Hoover High students
latimes.com,Explore Malta's ancient landmarks and fish markets on easy-paced tour
latimes.com,Small screen gamble pays off for DreamWorks Animation
latimes.com,"One of the best chefs in Los Angeles just opened a sports bar next to the LAFC stadium, with foosball"
latimes.com,Brandon Ingram makes up for lost time in return to Lakers
latimes.com,Undefeated Rams in the market for a productive edge rusher
latimes.com,Uber driver accused of raping unconscious girl he picked up is declared a fugitive
latimes.com,The president refuses to take responsibility for his dangerous rhetoric
latimes.com,What we learned in NHL last week: The league is betting on the future of gambling to increase revenue
latimes.com,Thoughts from Dr. Joe: A ‘La Vita Nuova’ moment in a glorious setting
latimes.com,How a summer trip to Miami forged the Clippers' chemistry
latimes.com,NBA: Klay Thompson breaks record with 14 threes
latimes.com,"Santa Ana winds to howl, blowing away spooky fog before Halloween"
latimes.com,Elon Musk buys $10 million in Tesla stock on the open market
latimes.com,"Essential California: Orange County supermoms, a political force to be reckoned with"
latimes.com,Glendale man arrested in connection with suspicious device detonated in Pasadena
latimes.com,Murrieta Valley vs. San Clemente is TV game this week
latimes.com,Boston-L.A. World Series struck out looking for Fox
latimes.com,Man dies after yacht and sportfishing boat collide off San Diego coast
latimes.com,College football: Urban Meyer says he’ll be back at Ohio State
latimes.com,Balboa Island’s in the scream
latimes.com,Chaminade linebacker Blake Antzoulatos is having a standout season
latimes.com,What happens when they don't?
latimes.com,Pageant of the Monsters features ‘Raiders of the Lost Art’
latimes.com,Uber driver accused of raping a minor declared a fugitive after missing court date
latimes.com,"Chargers' Joey Bosa isn't ready to return from injury, but he's 'getting close'"
latimes.com,The Valley Line: LCF Chamber members still feeling the love for ‘Top Gun’
latimes.com,"At two critical moments, analytics failed the Dodgers. Now they face an 0-2 World Series deficit"
latimes.com,"On Oahu, people with physical or cognitive disabilities become surfers with an assist from this group"
latimes.com,Michael Myers' childhood home draws 'Halloween' tourists to South Pasadena for a chance to step into Haddonfield
latimes.com,Wear LACMA taps SoCal brands Wolk Morais and ALSO for its fall 2018 art-meets-fashion mash-up
latimes.com,"Jonah Hill returns to his West L.A. stamping ground for his directorial debut, 'Mid90s'"
latimes.com,Residents erupt in anger at Garcetti's town hall for planned homeless shelter in Venice
latimes.com,EU and Britain say they'll take more time to hammer out Brexit deal
latimes.com,Legacy of style: New book series celebrates residential architects of SoCal’s golden era
latimes.com,Round trip to San Francisco from LAX on Southwest is $96 from now through late winter
latimes.com,U.S. serviceman is killed in Ukraine during NATO drills that included California National Guard unit
latimes.com,How a Newport Beach doctor fell from reality TV star to suspected serial rapist
latimes.com,L.A. City Councilman Mitchell Englander shakes down his campaign donors on his way out of City Hall
latimes.com,Treasury Secretary Mnuchin still plans to attend Saudi anti-terror finance meeting after Khashoggi disappearance
