source,title
leaderpost.com,"RCMP suspect impaired driving in highway crash that killed 3, injured baby"
leaderpost.com,Taman's Take: Late hit on Saskatchewan Roughriders quarterback Zach Collaros was a disgrace
leaderpost.com,Sask. government's green efforts getting little notice
leaderpost.com,Scientists call for halt in stem-cell trial over alleged data fabrication
leaderpost.com,Canadiens Game Day: Alexander Radulov returns to Bell Centre with Stars
leaderpost.com,Dog shot by Regina police dies from suspected liver ailment
leaderpost.com,"AltaGas shares fall as it eyes $1.5B in asset sales, cancels dividend program"
leaderpost.com,Recycle that: Many household items find surprising new lives
leaderpost.com,"'Not a Cold War situation': As West and Russia both hold military drills off Norway, NATO chief expects 'respectable' behaviour"
leaderpost.com,"Canada Post strike hits Montreal, with 6,000 workers walking off the job"
leaderpost.com,AP FACT CHECK: Trump off track on birthright citizenship
leaderpost.com,Standoff ends in Regina neighbourhood
leaderpost.com,Party held for homeless baby born in wake of hurricane
leaderpost.com,Trump says he will use executive order to end birthright citizenship for children of non-citizens in U.S.
leaderpost.com,"Latest: Crews hunt for bodies of Illinois professor, husband"
leaderpost.com,Kansas militia men blame Trump's rhetoric for planned attack
leaderpost.com,Trial begins for sports radio voice Craig Carton
leaderpost.com,"Pilot crashes plane into lake, leaves wreckage, hitches home"
leaderpost.com,Florida invests $3.5M to finish Everglades highway project
leaderpost.com,JETS SNAPSHOTS: Who’s the daddy?...Laine knows what he wants to improve on…Trading places…Perreault recalls Liiga experience
leaderpost.com,"Two months after vote, gridlock has Swedish neo-Nazi-linked party hoping for new election"
leaderpost.com,Trump to visit a Pittsburgh scarred by violence at synagogue
leaderpost.com,"Abstaining from pot improves memory, ability to learn in young users: study"
leaderpost.com,Officer who mistook detective for gunman testifies at trial
leaderpost.com,The Latest: UN rights chief asks Saudis to tell site of body
leaderpost.com,"Florida man sues Tesla over autopilot feature, crash"
leaderpost.com,Jury struggling in murder trial of ex-Michigan trooper
leaderpost.com,Progress? Gridlock? How midterm vote could affect US economy
leaderpost.com,Info on drug use was concealed in report on Hernandez death
leaderpost.com,Dogs drop in league and national ranks
leaderpost.com,Seahawks' Kendricks banned 8 games for insider trading
leaderpost.com,UN demands immediate halt to attacks in Ebola areas in Congo
leaderpost.com,Bestselling Chinese novelist Louis Cha dies at age 94
leaderpost.com,EU antitrust regulator investigates steel joint venture deal
leaderpost.com,US trial for 'El Chapo' set to begin next month
leaderpost.com,"The Latest: 3 siblings struck, killed by truck at bus stop"
leaderpost.com,2 men charged after officer chasing them fell to his death
leaderpost.com,Report: Human error blamed in woman's death after power cut
leaderpost.com,Work continues in Texas to honour black sailor Doris Miller
leaderpost.com,F1 driver Ericsson moving to IndyCar with Schmidt Peterson
leaderpost.com,Inter Pipeline adds seven terminals in the U.K. and Netherlands in $354M deal
leaderpost.com,"Helped by solid earnings, US stock indexes turn higher again"
leaderpost.com,The Latest: Casket arrives for first funeral after massacre
leaderpost.com,Greek prosecutor seeks 9 convictions in US tourist's killing
leaderpost.com,Huron Heat pay it forward with acts of kindness in the community
leaderpost.com,"With mobile pay, you can go without a wallet at checkout"
leaderpost.com,Bulgarian authorities bust fraudulent passport scheme
leaderpost.com,Ambit Energy Canada Expands Service in Alberta
leaderpost.com,NFL to play 4 regular-season games in London next year
leaderpost.com,Ben & Jerry's unveils Pecan Resist flavour ahead of midterms
leaderpost.com,Lebanon accuses editor of harming relations with Saudis
leaderpost.com,Motown Soul coming to Sarnia
leaderpost.com,Whitey Bulger transferred to prison in West Virginia
leaderpost.com,The Latest: White House has debated birthright citizenship
leaderpost.com,'Rage' against elite: Centrist leaders losing Europe's favour
leaderpost.com,Natixis Investment Managers Summit to Feature Five Former Heads of State or Government
leaderpost.com,"Japanese spinning tops tell stories, aim for playfulness"
leaderpost.com,"3 Indiana children struck, killed by truck at bus stop"
leaderpost.com,Former Merkel rival joins race to head German leader's party
leaderpost.com,Dish gardens bring gardening inside for the winter
leaderpost.com,Nordson EFD Introduces Dial-A-Dose and Posi-Dose Animal Health Dosing Syringes
leaderpost.com,Americans to get access to shorter UK airport passport line
leaderpost.com,Trend Micro Research Exposes Risk of Supply Chain Attacks to Water and Energy Systems
leaderpost.com,European tech leaders warn against EU digital services tax
leaderpost.com,Fiat Chrysler profits hit by charges for diesel probe
leaderpost.com,Court in Russia's North Caucasus overturns land swap deal
leaderpost.com,"Hurricane Oscar speeding north, brings high surf to Bermuda"
leaderpost.com,US home price gains weaken for 5th straight month
leaderpost.com,UK demonstrators press Uber ahead of key legal fight
leaderpost.com,Officials thwarted Iranian assassination plot in Denmark
leaderpost.com,"GE slashes dividend, takes $22 billion charge in 3Q"
leaderpost.com,Solitario Announces Drilling Will Begin on Its Florida Canyon Zinc Project
leaderpost.com,Spain says Vatican to help with discreet reburial of Franco
leaderpost.com,"Presenting ""A Grandparents Recital"""
leaderpost.com,"'Alberta has made Legal Aid a priority': NDP, government spar over Legal Aid funding after Alberta boost"
leaderpost.com,"Action is needed now to halt cataclysmic decline in global wildlife, says WWF report"
leaderpost.com,White deer have unusual home in upstate NY - old Army depot
leaderpost.com,Man dies after shooting in quiet south Regina neighbourhood
leaderpost.com,"Labour groups hold massive rally, call on province to take 3.5% wage cut out of negotiations"
leaderpost.com,Janssen Presents Positive Long-Term Efficacy and Safety of SYMTUZA® (D/C/F/TAF) in Treatment-Naïve Adults with HIV-1
leaderpost.com,Fan Expo Regina not returning in 2019
leaderpost.com,Woman found guilty of smoke inhalation murder appealing conviction
leaderpost.com,'It's a big day': Reginans journey to Eden to buy legal marijuana
leaderpost.com,RCMP ask for help finding missing Fort Qu'Appelle man with 'vulnerable medical condition'
leaderpost.com,"Search for missing woman expanded to Alberta, Saskatoon"
leaderpost.com,Immigrant artist connects with themes of homelessness and heart
leaderpost.com,Rob Vanstone: It was a treat to spend time with one Regina Pats booster
leaderpost.com,Sask. farmers finally getting back in fields to finish harvest
leaderpost.com,Gov. Gen. Julie Payette inspires during first official visit to Saskatchewan
leaderpost.com,New Saskatchewan wind power facility to be operational by 2021
leaderpost.com,"Campbell Tartans, Miller Marauders win Regina 3A high school soccer titles"
leaderpost.com,Roughriders' Charleston Hughes apologizes for 'embarrassing' situation involving impaired-driving charge
leaderpost.com,Residents line up to buy legal marijuana
leaderpost.com,Changes caused by marijuana law may yet be down the road
leaderpost.com,Mandryk: Moe should move next Saskatchewan election to spring of 2020
leaderpost.com,"Paddock can't save Pats, who fall 4-0 to Chiefs"
leaderpost.com,"Rocanville man charged with impaired driving, stolen property"
leaderpost.com,Regina's Riley Woods has found a new home with the Spokane Chiefs
leaderpost.com,Fransaskois songstress Annette Campagne pens songs for healing
leaderpost.com,New trade deal shields internet companies from liabilities
