source,title
marijuanastocks.com,Is the Latest Marijuana Stock Market Correction Signaling a Time to Buy?
marijuanastocks.com,Marijuana Stocks See Major Price Correction
marijuanastocks.com,Future Farm Technologies Inc. (FFRMF) Announces NexTech’s CSE Trading Date of…
marijuanastocks.com,Aphria Inc. (APHQF) to commence trading on the NYSE on November 2
marijuanastocks.com,Namaste Technologies Inc. (NXTTF) Signs Supply Agreement with Maple Leaf Green World Inc.
marijuanastocks.com,Marijuana Stocks: Recreational VS Medical
marijuanastocks.com,Do These Marijuana Stocks Have Intrinsic Value?
marijuanastocks.com,Marijuana Stocks Update: This Could Be Just The Beginning
marijuanastocks.com,Namaste Technologies Inc. (NXTTF) Signs Patient Services Agreement with Buds2go.ca
marijuanastocks.com,The Reason For the Marijuana Stock Slump
marijuanastocks.com,Marijuana Stocks Bounce Back From Hard Hit
marijuanastocks.com,How One Marijuana Stock Is Leveraging The Full Scope Of Cannabis 2.0
marijuanastocks.com,Marijuana Stocks And Potential Export to the U.S.
marijuanastocks.com,Marijuana Stock Market Sees Correction Throughout the Space
marijuanastocks.com,These Marijuana Stocks Are Changing the Game
marijuanastocks.com,Marijuana Stocks to Look At Before the End of the Year
marijuanastocks.com,"The Supreme Cannabis Company, Inc. (SPRWF) launches 7ACRES, a leading brand of High-End Cannabis™ Flower"
marijuanastocks.com,"Biome Grow Inc. (BIO.CN) Introduces Ontario-based brand, Great Lakes Cannabis"
marijuanastocks.com,"Hemp, Inc. (HEMP) CEO Featured on Uptick Newswire’s Stock Day Podcast About the Growing Industrial Hemp Industry"
marijuanastocks.com,Are These Marijuana Stocks Next to List on a Large U.S. Exchange
marijuanastocks.com,Wayland Group (MRRCF) Receives Receipt for Final Prospectus for Previously Announced Bought Deal Financing
marijuanastocks.com,Aurora Cannabis Inc. (ACBFF) Receives First Cannabis Import Permit from Polish Ministry of Health
marijuanastocks.com,The Green Organic Dutchman Holdings Ltd. (TGOD.TO) (TGODF) Acquisition Announce Execution of Arrangement Agreement
marijuanastocks.com,Marijuana Stocks: Are We Ready For The #BTFD Moment?
marijuanastocks.com,These Marijuana Stocks Have a Strong Correlation With Canadian Legalization
marijuanastocks.com,Emblem Corp. (EMMBF) finalizes agreement to launch Emblem Germany in joint venture with Acnos Pharma
marijuanastocks.com,Marijuana Stocks Update: Is History Ready To Repeat Itself?
marijuanastocks.com,Reliq Health Technologies Inc. (RQHTF) Announces Changes to Management Team
marijuanastocks.com,"Cannabis Science, Inc. (CBIS) Re-Appoints Mr. Melvin Foote to Its International Government Affairs Board"
marijuanastocks.com,Organigram Holdings Inc. (OGRMF) celebrates successful first week of legalization
marijuanastocks.com,The Marijuana Stocks With High Expectations Throughout Years End
marijuanastocks.com,The Biggest Cannabis Stocks to Benefit From Recreational Legalization
marijuanastocks.com,Today is The Big Day For Legal Cannabis In Canada
marijuanastocks.com,These Marijuana Stocks Are Running the Market
marijuanastocks.com,Ancillary Businesses Dominate the Marijuana Stock Market
marijuanastocks.com,"Vitality Biopharma, Inc. (VBIO) Receives $8.5 Million Common Stock Financing"
marijuanastocks.com,Mid-Cap Cannabis Stocks Take Over the Market
marijuanastocks.com,Canada’s Impact On The Marijuana Market After Going Legal
marijuanastocks.com,Marijuana Stocks Become A Top Priority On Wall Street: One Stands Out
marijuanastocks.com,The Green Organic Dutchman Holdings Ltd. (TGOD.TO) (TGODF) Appoints Sean Bovingdon as Chief Financial Officer
marijuanastocks.com,Why Should Cannabis Be Legalized?
marijuanastocks.com,American Green (ERBB) to Hold Shareholder Meeting
marijuanastocks.com,Novus Acquisition (NDEV) MedPlan Issues Next Level Strategy
marijuanastocks.com,Marapharm Ventures Inc. (MRPHF) Congratulates Canada – First G7 nation to legalize adult-use of cannabis
marijuanastocks.com,"MassRoots, Inc. (MSRT) CEO joins Uptick Newswire’s Stock Day Podcast"
marijuanastocks.com,"Biome Grow Inc. (BIO) PEI Brand, Red Sands Craft Cannabis Co."
marijuanastocks.com,Pure Global Cannabis Inc. (PURE) (PRCNF) Adds Chief Medical Officer to Core Team
marijuanastocks.com,"Integrated Cannabis Company, Inc. (ICNAF) to Acquire Assets of Colorado-Based Cannabis Innovator, Critical Mass Industries, LLC"
marijuanastocks.com,Aphria Inc. (APHQF) celebrates the start of the adult-use cannabis market in Canada
marijuanastocks.com,CannTrust Expands Global Reach and Access To Asia-Pacific Region as Cannatrek’s Cornerstone Investor
marijuanastocks.com,Choom™ (CHOO.CN) (CHOOF) receives cultivation license from Health Canada
marijuanastocks.com,Aurora Cannabis Inc. (ACBFF) Celebrates Adult Consumer Legalization in Canada
marijuanastocks.com,The Green Organic Dutchman Holdings Ltd. (TGOD.TO) (TGODF) Continues to Build Top-Level Management Team
marijuanastocks.com,Wayland Group (MRRCF) Releases Portfolio of Brands & Receives Sales License from Health Canada for Expansion Site
marijuanastocks.com,"MassRoots, Inc. (MSRT) Releases 2018 Marijuana Initiative Overview"
marijuanastocks.com,MassRoots (MSRT) Presentation Now Available for On-Demand Viewing
marijuanastocks.com,Biome Grow (BIO.CN) Announces Listing on the Frankfurt Stock Exchange under symbol 60TA
marijuanastocks.com,"Marijuana Stock: Leafbuyer Technologies, Inc. (LBUY) Adds Two Board Members as Growth Continues"
marijuanastocks.com,Organigram Holdings Inc. (OGRMF) Closes Sale of Trauma Healing Centres to Harvest Medicine
marijuanastocks.com,CannTrust Holdings Inc. (CNTTF) and Kindred Launch Sales Team in Canadian Recreational Cannabis Market
marijuanastocks.com,Marijuana Stocks Readying for First Nationwide Recreational Legalization
marijuanastocks.com,Biome Grow Inc. (BIO.CN) IS INVESTING IN ATLANTIC CANADIAN CANNABIS SECTOR
marijuanastocks.com,Cannabis Growth Opportunity Corporation (CGOC) Announces Milestone Events Within Its Private Portfolio
marijuanastocks.com,Do Cannabis Health Products Live Up to the Hype?
marijuanastocks.com,Relevium Technologies Inc. (RLLVF) Announces Strategic Investment in Leading Pediatric Cannabis Company
marijuanastocks.com,"Novus Acquisition and Development, Corp. (NDEV) Signs Agreement with Alloy Insurance Services"
marijuanastocks.com,The Green Organic Dutchman Holdings Ltd. (TGOD.TO) (TGODF) Announces C$75 Million Bought Deal
marijuanastocks.com,Choom™ (CHOOF) Announces Inclusion to the Horizons Marijuana Life Sciences ETF
marijuanastocks.com,GTEC Holdings Ltd. (GGTTF) Signs Agreement to Become Exclusive Cannabis Supplier
marijuanastocks.com,Cannabis Stocks to Watch As the Market Moves Forward
marijuanastocks.com,Cannabis Continues to Lead Investing Trends
marijuanastocks.com,Maricann Group Inc. (MRRCF) Announces Intent to Change Name to Wayland Group Corporation
marijuanastocks.com,Cannabis Stocks Make a Comeback
marijuanastocks.com,The Green Organic Dutchman Holdings Ltd. (TGOD) (TGOD.TO) receives medical sales license from Health Canada
marijuanastocks.com,A Bullish Case For This Pot Stock: Integrated Cannabis Company (ICNAF) (ICAN)
marijuanastocks.com,Marapharm Ventures Inc. (MRPHF) assembles advisory board to accelerate its strategic action plan
marijuanastocks.com,Marijuana Stocks Could Benefit from Donald Trump Stand In Support For Federal Cannabis Reform
marijuanastocks.com,Emblem Corp. (EMMBF) to supply British Columbia and Saskatchewan markets with high quality cannabis
marijuanastocks.com,GTEC Holdings Ltd. (GTEC.V) (GGTTF) Announces First Retail Cannabis Stores Scheduled to Be Operational in 2018
marijuanastocks.com,Aphria Inc. (APHQF) Commends UK Government on Medical Cannabis Legalization
marijuanastocks.com,Prepare For A Boom In Pot Stocks
marijuanastocks.com,CannTrust Holdings Inc. (CNTTF) Introducing Peak Leaf™ – New cannabis brand inspired by the power of nature
marijuanastocks.com,How the Biggest Downfalls For Cannabis Might Be Its Upsides
marijuanastocks.com,The Stock Market Dropping Can’t Stop Marijuana Rising
marijuanastocks.com,Marijuana Stocks: Do I Need To Get My Trading App Ready At The Border
marijuanastocks.com,"Tilray, Inc. (TLRY) Strengthens Presence in Latin America with Acquisition of Alef Biotechnology"
marijuanastocks.com,Marijuana Stocks & Why You Should Be Watching ETF’s Rebalance
marijuanastocks.com,Marijuana Stock IPO’s Are On Fire: Add This Company To The List
marijuanastocks.com,Lifestyle Delivery Systems Inc. (LDSYF) Announces Release of Escrowed Securities and Issues Finder’s Shares
marijuanastocks.com,Canopy Rivers Inc. (RIV.V) Announces Significant Increase in Health Canada Licensed Infrastructure
marijuanastocks.com,These Cannabis Stocks Are Looking Toward the Future
marijuanastocks.com,Enertopia Corporation (ENRT) Files for Permit with BLM for Phase one Drilling
marijuanastocks.com,Small-Cap Cannabis Companies Continue to Show Promise
marijuanastocks.com,The Green Organic Dutchman (TGOD) (TGODF) Provides Update on Operations
marijuanastocks.com,Marijuana Stocks Newsletter: Prepare For A Boom In Pot Stocks
marijuanastocks.com,What Voting Will Look Like for Cannabis in the U.S.
marijuanastocks.com,The Green Organic Dutchman Holdings Ltd. (TGOD) (TGODF) to Provide Dividend of TGOD Acquisition Corporation Rewarding Shareholders
marijuanastocks.com,Legalizing Recreational Cannabis Brings New Investors Into the Market
marijuanastocks.com,Pure Global Acquires State-of-the-Art Cannabis Oil Extraction and High-Speed Robotic Filling Equipment
marijuanastocks.com,Marijuana Stocks Resilient to Market Drop
