source,title
medium.com,"USA has clear photos of UFOs pursued by military pilots, says renowned researcher"
medium.com,"As violent attacks on front-line communities surge, let’s be clear about accountability and “both sides”"
medium.com,10 Bizarre Gifts Given To The Royal Family
medium.com,10 Reasons Not to Worry About Being a Good Public Speaker
medium.com,KGB’s Top Secret documents describe “Extraterrestrial races” that have visited the Earth
medium.com,UFO on Jupiter : Images released by NASA shows a huge UFO on Jupiter
medium.com,Handling Action’s No Match errors in Dialogflow: Three strikes and you’re out
medium.com,The New Netflix Stethoscope Native App
medium.com,VIDEO OF AZ PLASMA ENTITY- UFO OR EVIDENCE OF BLUE BEAM HOLOGRAM?
medium.com,Your Next Pair of Shoes Might Be Made by HP
medium.com,Inventor Who Has Developed A Device That Lets Any Car Drive 100 Miles Per Gallon Mysteriously Dies
medium.com,10 Insane Royal Secrets You Won’t Believe!
medium.com,DDI Blockchain Weekly (October 22nd-28th)
medium.com,Good Work Is Enough
medium.com,"Fans, Players and Professionals"
medium.com,Building TheLiberators.com: Integrate And Release Often
medium.com,3 powerful lessons I learned from other entrepreneurs
medium.com,Open-Zeppelin Escrow smart contract
medium.com,Announcing Project Atlas — A vision for a cloud-native gaming future
medium.com,Yeshu Agarwal joins LCX as Chief Technology Officer
medium.com,What do you want (and are you sure you don’t already have it)?
medium.com,Stateful Widgets be gone: Stateful Builder
medium.com,Berlin Summit Part 1 — Web3 for dummies!
medium.com,Mahatma and The Blockchain
medium.com,The leap into freelance design
medium.com,Business model innovation: How exponential technologies can be disruptive in your industry
medium.com,You Need To Know These Symptoms of Inner Peace
medium.com,Automating a Lego Tower Bridge Model
medium.com,Making burger history: Randy Garutti ’97 grew a global brand from an NYC food stand
medium.com,What a Life of Travel Feels Like
medium.com,Country Profile ZIMBABWE
medium.com,4 Things It’s OK Not to Be Thankful for This Year
medium.com,How I Racked Up Millions Of Views On LinkedIn
medium.com,Trump’s Caravan Hysteria Led to This
medium.com,90% of the battle is won when we solve the XY Problem in Product Management
medium.com,War: A Future Fiction
medium.com,Project MNMS: A Note From The Creator
medium.com,The Struggle of Starting At 0 and Why So Many Quit
medium.com,Python Open Source of the Month (v.Oct 2018)
medium.com,How I take an idea and turn it into a product
medium.com,Proper way to talk to seduce everybody (Vidéo & Podcast)
medium.com,7 Super Quick Digital Marketing Tips
medium.com,Life Hack: X-out Your To-do List For Good
medium.com,Introducing the new CDP Portal for Single Collateral Dai
medium.com,Best Online Photography Classes
medium.com,Why Web Development is Key to the Success of Modern Business
medium.com,Chief Technical Officer as a Service Concept
medium.com,How (properly) wasting time at work increases productivity
medium.com,Machine Guns Are Coming to a Bar Near You
medium.com,The Principles Of Early-Stage Product Development
medium.com,Out of the City and Into the ‘Burbs
medium.com,Secrets of Intellectual Property Protection
medium.com,Data Science and Machine Learning Interview Questions and Solutions
medium.com,100 Brilliant Women in AI Ethics to Follow in 2019 and beyond
medium.com,Introducing AloeStackView for iOS
medium.com,"DDEX+MakerDAO, An Intro to Decentralized Leveraged Trading"
medium.com,What Computers Do
medium.com,Starbucks and the Cost of Innovation
medium.com,Nebraska Tops List In Fiscal Health Ranking
medium.com,How many functions do you have?
medium.com,Cloud Wars Forcing Irrational Open Source Takeovers
medium.com,Hungry for power
medium.com,Dear community! – Datarius Сryptobank – Medium
medium.com,Recommendations for IP address failover for high availability on Google Compute Engine
medium.com,What Happens When You Decide To Be Brave?
medium.com,Getting Started on GCP: Billing Accounts
medium.com,What the New Apple Watch’s EKG Means for the Future of Consumer Wearables and Healthcare
medium.com,Freestyle Marketing: the power to inspire and build relationships
medium.com,How Cloud Computing Services can transform your Business?
medium.com,3 Strategies to Hack Twitter for Your ICO
medium.com,"Safe Haven’s pooling service: Thorblock, uses Arkane as their wallet provider"
medium.com,Top 10 Altcoins’ Secrets to Success
medium.com,Apple and Tim Cook’s Magnum Opus
medium.com,What the Internet Does to Bad Ideas
medium.com,The Overwhelming Hugeness of Climate Change
medium.com,Datalab + BigQuery = fast! dataset queries to build Image file repository
medium.com,What Happens to Religion When We Find Extraterrestrial Life?
medium.com,My One-Year Journey As A Computer Science Student on Medium (From 0–4000 Views)
medium.com,Bowsette: memes and fandom culture under late capitalism
medium.com,Setup Guide for fastai part1 v3 (fastai 1.0) on Google Cloud Platform with $0.2/hour in 5 minutes
medium.com,Using Chrome Dev Tools with Google Cloud
medium.com,Using Google Group and Google Cloud IAM Effectively for Education
medium.com,Customizing Kubernetes Logging (Part 1)
medium.com,StarkWare Industries
medium.com,Wrapping Google Cloud Functions HTTP Triggers in Endpoints
medium.com,Investors are pumping money into TV measurement startups hoping to stop Facebook and Google from stealing the $70 billion TV ad market
medium.com,The .NET Framework is Done!
medium.com,How Microsoft rewrote its C# compiler in C# and made it open source
medium.com,Mapping Israel’s Digital Health Ecosystem
medium.com,Want a Better Pitch?
medium.com,Why building your own Deep Learning Computer is 10x cheaper than AWS
medium.com,A short primer on how to Lose Weight — What to Eat and When to Eat
medium.com,Why I Use NodeJS for Basically Everything I Do.
medium.com,One Small Step for the Web…
medium.com,Ethereum 2.0 — Who’s building it?
medium.com,Digital Exile: How I Got Banned for Life from AirBnB
medium.com,What I Hope to Learn from the Tech Giants
medium.com,Why Our Super Bowl Ad Failed
medium.com,All Lyft Rides Are Now Carbon Neutral
medium.com,The Eagle and The Condor — From Standing Rock with Love (working title)
