source,title
moneyweek.com,The message from the Budget: this one’s for the little people
moneyweek.com,Paul Allen: the genius who made Microsoft
moneyweek.com,Business must battle the Green surge
moneyweek.com,Watch out for next week’s Budget
moneyweek.com,HIKMA PHARMACEUTICALS PLC Share Price [ HIK ]
moneyweek.com,"It’s hard to believe, but Britain’s economy doesn’t look too bad right now"
moneyweek.com,Iceland’s deep freeze – and thaw
moneyweek.com,Italy’s debt crisis could be far messier than the Greek drama ever was
moneyweek.com,"With the magic gone from the stockmarkets, investors must focus on reality"
moneyweek.com,Bentayga V8: Bentley’s brutish off-roader
moneyweek.com,Three holidays for nature lovers
moneyweek.com,"Pensions are for your retirement, not for a rainy day"
moneyweek.com,Philippines ready to rise again
moneyweek.com,The real threat to our global economic and political order
moneyweek.com,Three passive funds that offer growth and safety
moneyweek.com,Here’s what to expect from today’s Budget
moneyweek.com,Money makers: brewing Dane on a Rick-roll
moneyweek.com,A stellar vinous treat like no other
moneyweek.com,Ryanair loses altitude
moneyweek.com,Keep it in the family when passing on your estate
moneyweek.com,Good news for everyone as housebuilding finally enters the 21st century
moneyweek.com,Slowdown to slump fears for China
moneyweek.com,Food for thought: investing in the future of food
moneyweek.com,David Rosenberg: nothing beats the Fed
moneyweek.com,INMARSAT PLC Share Price [ ISAT ]
moneyweek.com,Germany: Europe’s lopsided powerhouse
moneyweek.com,Scrapheap beckons for Universal Credit
moneyweek.com,Profits in the pipeline
moneyweek.com,Patisserie Valerie: the Great British rake-off
moneyweek.com,London: the world’s stockmarket
moneyweek.com,The cookie crumbles for Luke Johnson
moneyweek.com,The red flags that tell you stocks are set for a slide
moneyweek.com,Trouble at the top of the market
moneyweek.com,"Five questions for… Nakul Sharma, CEO of Hostmaker"
moneyweek.com,Interest rates are rising – time to change strategy
moneyweek.com,The effect of low-skilled immigration on Britain’s productivity
moneyweek.com,A hard Brexit may already be in the price – here’s what to buy if it is
moneyweek.com,MITCHELLS & BUTLERS Share Price [ MAB ]
moneyweek.com,Book of the week: The Future of Capitalism
moneyweek.com,Properties with orangeries and conservatories
moneyweek.com,Why higher taxes look inevitable
moneyweek.com,"No classic, but an enjoyable read"
moneyweek.com,Porn star’s lawyer to US president?
moneyweek.com,Big fund launches from big names
moneyweek.com,Fresh challenge to Weis
moneyweek.com,The return of Cool Britannia
moneyweek.com,Sipps sued over scams
moneyweek.com,What The Bonfire of the Vanities teaches you about fees
moneyweek.com,Building your own dream home
moneyweek.com,From Acropolis Now to Arrivederci Roma – get ready for the next big euro panic
moneyweek.com,The charts that matter: the market is on the turn
moneyweek.com,BMW X5: a punchy and refined SUV
moneyweek.com,Investing in healthcare innovation
moneyweek.com,The British software sector stars investors should buy now
moneyweek.com,All aboard for three amazing railway journeys
moneyweek.com,Alisa Zotimova: a happy ending for a failed Russian actress
moneyweek.com,Take steps to avoid your portfolio doing “a Valerie”
moneyweek.com,Albert Edwards: investors are facing the four horsemen of the apocalypse
moneyweek.com,Don’t rush into equity release
moneyweek.com,Blind eye turned to dodgy dosh
moneyweek.com,How small businesses can attract the talent
moneyweek.com,A tough week for investors
moneyweek.com,Book in the news: the death of US democracy?
moneyweek.com,Think before deferring your state pension
moneyweek.com,Brexit: bordering on the impossible
moneyweek.com,Bruising in Bavaria for troubled Merkel
moneyweek.com,Wine of the week: a mind-blowingly sensual Spanish red
moneyweek.com,Betting on politics: a Senate battle in Arizona
moneyweek.com,We’ve spent our entire lives in a massive economic anomaly
moneyweek.com,What’s next for US stockmarkets?
moneyweek.com,Mazda’s MX-5 roars back with even more power
moneyweek.com,"Macron reshuffles cabinet, not policies"
moneyweek.com,What makes a successful fund manager?
moneyweek.com,It’s time to reshape our beleaguered housing market
moneyweek.com,How on earth are we going to get rid of all of this debt?
moneyweek.com,Silver and platinum are both very cheap – how long can that last?
moneyweek.com,Guaranteed annuity rates: a bonus not to be missed
moneyweek.com,Gold has been so bad that it’s now starting to look good
moneyweek.com,How Brexit will hit sterling
moneyweek.com,"Should you buy Smithson, Terry Smith’s new investment trust?"
moneyweek.com,TED BAKER PLC Share Price [ TED ]
moneyweek.com,Pesky Fish: how an app for fresh fish landed investors
moneyweek.com,This rosé blew me away
moneyweek.com,The charts that matter: a short-lived panic – or something deeper?
moneyweek.com,Why it’s worth holding a bit of gold in your portfolio
moneyweek.com,How to avoid being ruined by nasty stockmarket surprises
moneyweek.com,Poland’s remarkable progress bodes well for its stocks
moneyweek.com,The charts that matter: US bonds make a break for it
moneyweek.com,The changes sweeping the Gulf provide opportunities for investors
moneyweek.com,Two funds to profit from Asia’s love for smartphones
moneyweek.com,Save into your pension while you can
moneyweek.com,Good news! Wages are finally rising for everyone
moneyweek.com,Ten years on: the biggest driver of the 2008 financial crisis has only got worse
moneyweek.com,We’ve just seen the biggest merger deal in gold mining history
moneyweek.com,"In the future, no one will own a car. Here’s why and what it means for investors"
moneyweek.com,Turkey’s coming default will shake the world
moneyweek.com,The biggest economic change in the last ten years that no one talks about
moneyweek.com,Jair Bolsonaro: the Trump of the Tropics set to lead Brazil
moneyweek.com,"Art, tech stocks and the financial canary’s last gasp"
moneyweek.com,Give packaged bank accounts a chance
