source,title
money.cnn.com,Arrow DWA Tactical ETF
money.cnn.com,Anfield Universal Fixed Income ETF
money.cnn.com,Economic Worries Are Making Themselves Known Across The U.S. Markets
money.cnn.com,iPath® Series B Bloomberg Nickel Subindex Total Return ETN
money.cnn.com,When should I sell my mutual funds?
money.cnn.com,Top strategist: Saudi tensions keeping oil prices elevated
money.cnn.com,The case for rotating out of major tech stocks
money.cnn.com,Bernstein Global Research Fund
money.cnn.com,"Corporate America, not banks, could cause the next recession"
money.cnn.com,A. O. Smith Corp
money.cnn.com,Gamers Delight: A New E-Sports ETF Is Here
money.cnn.com,BMW will shutter Mini factory for a month because of Brexit risks
money.cnn.com,"The First Robotics ETF Reaches 5-Year Anniversary, $2B Under Management"
money.cnn.com,Bitcoin is ready to grow again. Here's why
money.cnn.com,Reliable Sources: President Trump helps out Fox's Sean Hannity before rally
money.cnn.com,Reliable Sources: Kavanaugh gives unprecedented interview to Fox's Martha MacCallum
money.cnn.com,Emmys viewership hits an all-time low
money.cnn.com,Julie Chen officially leaves 'The Talk'
money.cnn.com,"10 years after the crisis, some investors are still scared of stocks"
money.cnn.com,"Walgreens knew its profit forecast was wrong but didn't tell investors, SEC says"
money.cnn.com,Trump 'not happy' with the Fed for raising interest rates
money.cnn.com,JCPenney is now without a CEO or a CFO
money.cnn.com,Reliable Sources: Calm before the Kavanaugh storm
money.cnn.com,Richard Parsons named 'interim chairman' of CBS board
money.cnn.com,European banking still has a massive money laundering problem
money.cnn.com,What trade war? Dow hits record high
money.cnn.com,SiriusXM is buying Pandora in $3.5 billion deal
money.cnn.com,Invesco International Dividend Achievers ETF
money.cnn.com,iShares North American Natural Resources ETF
money.cnn.com,China says it will never use its currency as a weapon in the trade war
money.cnn.com,Argentina currency crisis is no joke
money.cnn.com,iShares Core S&P Mid-Cap ETF
money.cnn.com,Julie Chen leaving 'The Talk' after husband Les Moonves exits CBS
money.cnn.com,5 businesses Rupert Murdoch loved and lost
money.cnn.com,Bob Woodward's 'Fear' is the fastest selling book since 'Go Set a Watchman'
money.cnn.com,Art of the sale: When should you sell a stock?
money.cnn.com,The CEO of one of India's biggest banks is being forced out
money.cnn.com,Jack Ma: Trade war has killed my pledge to create 1 million US jobs
money.cnn.com,Audi unveils an electric SUV and it's taking deposits now
money.cnn.com,Shares in China's Tesla rival Nio soar more than 75% in a day
money.cnn.com,Meet the Web's favorite finance professor
money.cnn.com,Tilray is having a wild week. Is this a bubble for cannabis stocks?
money.cnn.com,Aston Martin falls 5% in London IPO
money.cnn.com,Warren Buffett's favorite bank isn't like the others
money.cnn.com,Vanguard Short-Term Inflation-Protected Securities Index Fund ETF Shares
money.cnn.com,Jack Ma: US-China trade war could last 20 years
money.cnn.com,Why Russian trolls may be more excited that the NFL is back than you are
money.cnn.com,Vanguard Small-Cap Value Index Fund ETF Shares
money.cnn.com,Comcast won a dramatic auction for Sky. But its investors aren't happy
money.cnn.com,Jeff Bezos's rocket company beats out spaceflight veteran for engine contract
money.cnn.com,Bob Woodward's 'Fear' debuts at No. 1
money.cnn.com,Viewers gathered around the TV in high numbers for Ford-Kavanaugh hearing
money.cnn.com,Amazon wants Alexa everywhere
money.cnn.com,Chesapeake Energy sells assets to China at a 'discount'
money.cnn.com,SEC sues Elon Musk for his allegedly misleading tweets
money.cnn.com,Bitcoin is back! Price surges again
money.cnn.com,Should J.C. Penney close 300 more stores?
money.cnn.com,Facebook is spending $1 billion on its first data center in Asia
money.cnn.com,Tesla in turmoil: Stock plunges after executive shakeup
money.cnn.com,"AT&T, fresh off its WarnerMedia deal, unveils new advertising business"
money.cnn.com,Aston Martin thinks it's worth as much as Ferrari. It'll soon find out
money.cnn.com,ETrade's new ad campaign: worse than the baby?
money.cnn.com,India struggles to find the answer to its slumping currency
money.cnn.com,Elon Musk agrees to pay $20 million and quit as Tesla chairman in deal with SEC
money.cnn.com,Saudi Arabia will issue its first tourist visas in 2018
money.cnn.com,Saudi Arabia invests $1 billion in potential Tesla rival
money.cnn.com,Stocks: 2013 is one for the record books.
money.cnn.com,Why Samsung's billionaire chief is headed to North Korea
money.cnn.com,"Les Moonves is out at CBS after harassment allegations, corporate battle"
money.cnn.com,"Zello, offline chats and push alerts: How to stay connected during Hurricane Florence"
money.cnn.com,Why the Dow loves Tuesday
money.cnn.com,China is the world leader in drones. US drone makers want to change that
money.cnn.com,"Chipotle's 'Burrito boom' continues, but prices are going up"
money.cnn.com,Meg Whitman has rescued HP
money.cnn.com,Premarket: 6 things to know before the bell
money.cnn.com,"Robot dogs are coming, but they may be destined for the unemployment line"
money.cnn.com,"CNN's Julia Chatterley on emerging market risk, trade tensions and her new show"
money.cnn.com,Why you don't need to buy extra car rental insurance
money.cnn.com,Is the tech stock rally coming to an end?
money.cnn.com,False White House explosion tweet rattles market
money.cnn.com,"Will Les Moonves leave with $0, $120 million, or something in between?"
money.cnn.com,"There's no way to avert the next financial crisis, warn former regulators from 2008 meltdown"
money.cnn.com,Chinese investment in the United States dropped 36% last year
money.cnn.com,Should Pizza Hut be sold?
money.cnn.com,You're even less likely to win Powerball than you think
money.cnn.com,'Tired of Snapchat's excuses': Snap tumbles on scathing report
money.cnn.com,Nadella blunder worse than any of Ballmer's
money.cnn.com,"'The Big Bang Theory' actors get $25,000 an hour"
money.cnn.com,High-profile VC Mary Meeker departs firm to start her own
money.cnn.com,Russia's RT risks new UK probe over Salisbury suspects interview
money.cnn.com,Germany repatriates $31 billion in gold from Paris and New York
money.cnn.com,America is now the world's largest oil producer
money.cnn.com,Nu Skin surges as China's regulators barely rap knuckles
money.cnn.com,Team Trump says NBC News edited Holt's exclusive interview. Here's the truth
money.cnn.com,Trains and planes are booming. That's good news for the economy
money.cnn.com,Breaking down the costs
money.cnn.com,You're fired. Stock rises. Wall Street loves layoffs
money.cnn.com,"Facebook rallies 30%, logs best day ever"
money.cnn.com,'CBS This Morning' host Norah O'Donnell on sexual misconduct: 'This has to end'
money.cnn.com,SolarCity IPO shines
