source,title
nbcbayarea.com,NFL Rumors: Broncos Close to Trading WR Demaryius Thomas to Texans
nbcbayarea.com,"De'Aaron Fox Questionable, Iman Shumpert Out for Kings Vs. Magic"
nbcbayarea.com,"Derek Carr, Jon Gruden Able to Run Raiders' Attack With Improved O-line Play"
nbcbayarea.com,"Kevin Durant Loves Basketball More Than Ever, 'it's Making My Life Better'"
nbcbayarea.com,Gangster Whitey Bulger Found Dead at W.Va. Prison: Sources
nbcbayarea.com,Warriors Have Combined 2015 and 2017 to Create an All-devouring 2019
nbcbayarea.com,Raiders CB Dominique Rodgers-Cromartie Announces Retirement
nbcbayarea.com,"Return of Vanderdoes, Ellis Could Help Raiders Defense"
nbcbayarea.com,Steph Curry Named Western Conference Player of the Week for 13th Time
nbcbayarea.com,Fire at South San Francisco House Displaces 8 People
nbcbayarea.com,"Kings Vs. Heat Watch Guide: Lineups, Injury Report, Player Usage"
nbcbayarea.com,Niners' Offense Couldn't Secure a Victory
nbcbayarea.com,Suspect Crashes on Westbound Interstate 580 After Brief Chase
nbcbayarea.com,I-Team: Broadway Ticket 'Short Sellers' Peddle Seats They Don't Own -- for Often Exorbitant Price Jumps
nbcbayarea.com,"Kings Notes: Buddy Hield Gets Hot Vs. Heat, De'Aaron Fox Plays Through Pain"
nbcbayarea.com,Billy Beane: Starting Pitching Is A's Top Priority in MLB Free Agency
nbcbayarea.com,Woman Sought in Deadly Sunnyvale Hit-and-Run
nbcbayarea.com,Shaun White Issues Apology Over 'Tropic Thunder' Halloween Costume
nbcbayarea.com,"Offensive Line Improvement Helps Derek Carr, Jon Gruden Run Raiders Attack"
nbcbayarea.com,Worker Dies After Falling Into Grape-Picking Machinery in Napa: Cal/OSHA
nbcbayarea.com,Warriors' Secret Sauce Comes Pouring Out on Klay Thompson's Record Night
nbcbayarea.com,"Former Genentech Scientist, 3 Others Charged With Stealing Trade Secrets"
nbcbayarea.com,Porn at Work: Dozens of California Government Employees Caught Viewing Porn on Taxpayer's Dime
nbcbayarea.com,"Kings Vs. Heat Projected Lineups, Injury Report, Player Usage"
nbcbayarea.com,3 Children Killed in Crash at School Bus Stop in Indiana
nbcbayarea.com,Klay Thompson Breaks Steph Curry's NBA Record With 14 3-Pointers vs. Bulls
nbcbayarea.com,Why Klay Thompson's Record-setting Night Is Bad News for Rest of NBA
nbcbayarea.com,Suspect in Navy Sailor's Murder Involved in Another Shooting Minutes Before
nbcbayarea.com,"Buddy Hield, Kings Expect to Win in Surprising Start to NBA Season"
nbcbayarea.com,Couple From India Died in Yosemite While Taking Selfie: Brother
nbcbayarea.com,"3-Year-Old Boy Shot, Transported to Hospital: Oakland Police"
nbcbayarea.com,MLB Free Agency: Who the Giants Might Target as Hot Stove Heats Up
nbcbayarea.com,Warriors Takeaways: What We Learned on Klay Thompson's Big Night Vs. the Bulls
nbcbayarea.com,"A's Extend Contracts, Anticipate Payroll Increase in Dawning of New Age"
nbcbayarea.com,Why Raiders' Jon Gruden Thinks NFL Trade Deadline 'can't Get Here Soon Enough'
nbcbayarea.com,"Pentagon Sending 5,200 Troops to Border Week Before Midterms"
nbcbayarea.com,Lion Air Crash Renews Concerns About Indonesia Airlines
nbcbayarea.com,Warriors' Klay Thompson Explodes for NBA-record 10 3-pointers in First Half
nbcbayarea.com,Kings Takeaways: Three Things We Learned in 123-113 Win Over Heat
nbcbayarea.com,"Warriors Vs. Bulls Watch Guide: Lineups, Injury Report, Player Usage"
nbcbayarea.com,Giants Exercise 2019 Options on Madison Bumgarner and Pablo Sandoval
nbcbayarea.com,Klay Thompson's NBA-record Shooting Thrills Former Warriors Teammates
nbcbayarea.com,Migrant Caravan Rests Before Continuing Journey to US-Mexico Border
nbcbayarea.com,Klay Thompson Had 'best Feeling' as Steph Curry Cheered Him on Vs. Bulls
nbcbayarea.com,Migrant Caravan Demands Transport as 2nd Group Enters Mexico
nbcbayarea.com,Top Five Free Agents A's Should Target During MLB Hot Stove
nbcbayarea.com,"Jackie Burns, Longest-Running Elphaba in Wicked on Broadway, Returns to the Iconic Role"
nbcbayarea.com,Raiders Injury Notes: Marshawn Lynch Returning Off IR Would Be 'very Difficult'
nbcbayarea.com,Giants Review: Alen Hanson Establishes Himself as Reliable Bench Player
nbcbayarea.com,"Warriors Vs. Bulls Projected Lineups, Injury Report, Player Usage"
nbcbayarea.com,"Indonesia Plane Crash Search Finds Remains, Debris at Sea"
nbcbayarea.com,Feast Well at Feast Mendocino!
nbcbayarea.com,Raiders-49ers Injury Report: Marshawn Lynch Coming IR Will Be 'very Difficult'
nbcbayarea.com,Warriors Ordered to Pay Off Remaining $40 Million Oracle Arena Debt
nbcbayarea.com,Klay Thompson Channels Jackie Moon En Route to NBA's 3-point Record
nbcbayarea.com,Raiders' Derek Carr Listed on Craigslist Posting Ahead of NFL Trade Deadline
nbcbayarea.com,Raiders Snap Count: Bruce Irvin's Workload Reaches New Low Vs. Colts
nbcbayarea.com,"NFL Trade Deadline 'can't Get Here Soon Enough' for Jon Gruden, Raiders"
nbcbayarea.com,MLB Free Agency: Bryce Harper to Giants? They Have Fourth-best Odds
nbcbayarea.com,Raiders-49ers Injury Report: 'Very Difficult' for Marshawn Lynch to Return
nbcbayarea.com,Raiders Snap Count: Irvin's Workload Reaches New Low Vs Colts
nbcbayarea.com,Oddsmaker Puts Giants in Top Five for Bryce Harper
nbcbayarea.com,US Limits Tech Exports to Chinese Firm on Security Grounds
nbcbayarea.com,Doctors: Get a Second Opinion Before Trusting Online Medical Reviews
nbcbayarea.com,Klay Thompson Learned a Lot About One Thing by Watching Steph Curry
nbcbayarea.com,Why Gruden Believes NFL Trade Deadline 'can't Get Here Soon Enough'
nbcbayarea.com,"Apple Expected to Unveil New iPads, Mac in New York"
nbcbayarea.com,Warehouse Fire Defendants to Face Trial in Oakland
nbcbayarea.com,Crews Respond to Mountain Lion 'Hunkered Down' in Pleasanton
nbcbayarea.com,Families 'in Shock' as Pittsburgh Synagogue Victims Identified; Shooting Suspect Charged With Hate Crimes
nbcbayarea.com,Teen in Kayak Seriously Injured by Suspected Drunken Boat Driver in San Mateo
nbcbayarea.com,Steph Curry: Alfonzo McKinnie 'not Even Close to Scratching the Surface'
nbcbayarea.com,US Service Member Beaten With Baseball Bat in Barrio Logan After Fight: Police
nbcbayarea.com,Woman Arrested in San Francisco Beating Death Over Pizza Slice
nbcbayarea.com,Anger Toward Media Spreads Into Local Communities
nbcbayarea.com,Mystery Deepens Around Dead Sisters Taped Together
nbcbayarea.com,"Amber Alert Called off for 4-Year-Old Taken by Mother, Believed to Be in Mexico: CHP"
nbcbayarea.com,Tesla's Musk Buys About $10M in Company Stock
nbcbayarea.com,Khashoggi's Fiancee Calls on Trump to Prevent 'Cover Up'
nbcbayarea.com,NFL QB Power Rankings Week 7: Rodgers' Heroics Over 49ers Puts Him No. 1
nbcbayarea.com,"Bye Offers Gruden, Raiders Time to Self-scout; 'We're Diagnosing Everything'"
nbcbayarea.com,Lucky Person in Morgan Hill Has 5 of 6 Winning Numbers: CA Lottery
nbcbayarea.com,Person Struck at Redwood City Caltrain Station
nbcbayarea.com,Oakland's Bulky Block Parties Curb Illegal Dumping
nbcbayarea.com,Don't Call Police: YouTube Outage Sparks Flurry of Comments on Social Media
nbcbayarea.com,'Education Isn't Always Prioritized in Our Country': Oakland Teacher Spends Almost $1K Out-of-Pocket on Students
nbcbayarea.com,Carlos and Smith Reflect on 1968 Olympics Protest 50 Years Later at San Jose State
nbcbayarea.com,KFC Restaurant a Total Loss After 2-Alarm Blaze in Antioch
nbcbayarea.com,Small WWII-Era Plane Runs Off Runway at Livermore Airport: FAA
nbcbayarea.com,Mega Millions Jackpot Soars to $900 Million After No Winner in Tuesday's Drawing
nbcbayarea.com,Report: Ride-Shares Increase San Francisco Congestion by 50 Percent
nbcbayarea.com,"Hotel Workers Strike Outside Marriotts in San Jose, San Francisco, Oakland"
nbcbayarea.com,"Brush Fire in Solano County Spreads to 4,500 Acres"
nbcbayarea.com,"Brush Fire Sparks Near Golf Course, Highway 101 South of San Jose"
nbcbayarea.com,Body Found at Chabot Park in San Leandro Belongs to Missing Woman: Family
nbcbayarea.com,17 Charged in $1 Million Apple Store Robbery Ring: California Attorney General
nbcbayarea.com,Thieves Steal Multiple Devices From Santa Rosa Apple Store During Broad Daylight
nbcbayarea.com,Workers Allege Hunters Point Dirt Needs to be Screened for Radiation
nbcbayarea.com,Another Royal Wedding for Britain as Princess Eugenie Weds Her Beau at Windsor Castle
nbcbayarea.com,San Francisco Prepares for Blue Angels as Fleet Week Gets Underway
