source,title
netloid.com,Hetthielly Beck Does A Beach Photo Shoot
netloid.com,Kayla Swift Does A 138 Water Photo Shoot
netloid.com,Kat Torres Models Swimwear In Malibu
netloid.com,Kayla Swift Does A 138 Water Photo Shoot
netloid.com,Kayla Swift Does A 138 Water Photo Shoot
netloid.com,Kayla Swift Does A 138 Water Photo Shoot
netloid.com,Kayla Swift Does A 138 Water Photo Shoot
netloid.com,WeWork Raises $500 Million For China Expansion
netloid.com,"San Francisco Based Model Cassandra Bankson Discovers She Has 2 Vaginas, 2 Wombs and 2 Cervixes"
netloid.com,"2015 Grammy Award Nominees Revealed: Beyoncé, Pharrell Williams Lead Noms"
netloid.com,"Angelina Jolie’s War Drama “Unbroken” Launches With $850,000"
netloid.com,12 Top Celebrities Who Divorced in 2014
netloid.com,Playboy Model Stefanie Knight Photoshoot For 138 Water in Malibu
netloid.com,Figure Appears In Image of 9/11 Tribute In Light
netloid.com,Election 2016: Final Presidential Debate Winner Is Hillary Clinton
netloid.com,Kayla Swift Does A 138 Water Photo Shoot
netloid.com,Kerrie McMahon Doing A 138 Water Photo Shoot
netloid.com,Top 4 Most Popular Slot Games in the World Right Now
netloid.com,Being a Fashionista Not a Dream Anymore With INDIA’S Best Fashion Colleges
netloid.com,How to cut down customer service expenses with a free help desk software
netloid.com,Snap Chat Adds Chat To It’s Video Service By Acquiring AddLive Secretly
netloid.com,Recover Lost Data With EaseUS Data Recovery Wizard Free
netloid.com,Kayla Swift Does A 138 Water Photo Shoot
netloid.com,Kayla Swift Does A 138 Water Photo Shoot
netloid.com,Kerrie McMahon Doing A 138 Water Photo Shoot
netloid.com,10 Artistic Photos Of “Purity Balls” Of Fathers And Daughters
netloid.com,Developers Teaching AI To Drive Using Mobile Phones
netloid.com,"V. Stiviano Says Donald Sterling Is Not A Racist, Defends His Comments"
netloid.com,"Isabelle Amarachi Asomugha, Kerry Washington’s Secret Baby Girl"
netloid.com,School Principal Fired for Having Sex with NYPD school-safety agent and Parent during School Hours and Leaving Dirty Photos on School’s Computers
netloid.com,Banks To Use AI To Sever Terrorists’ Funding
netloid.com,Virgin Media Fibre Break Causes City-Wide Outages
netloid.com,Apple Building $925M Data Centre In Denmark
netloid.com,Siemens Hub To Boost Singapore Smart Nation Initiative
netloid.com,15 Of The Most Unbelievably Beautiful Steps In The World.
netloid.com,Viking Introduces 50TB SSD For the Data Centre
netloid.com,Hilarious Saturday Night Live on How Beyonce Runs The World – Watch The Beygency
netloid.com,Nashville : Two Sides to Every Story – Season 3 Episode 9 Full Episode Recap
netloid.com,Kayla Swift Does A 138 Water Photo Shoot
netloid.com,It’s Officially! Kanye West marries Kim After Obtaining License in California
netloid.com,Digital Games Become India’s Revenue Trendsetters
netloid.com,Kaylee J Lavigne & Saab Marty Do A 138 Water Photo Shoot
netloid.com,Samsung ARTIK Gains SAP Leonardo IoT Certification
netloid.com,‘Anika’ vs ‘Lucious’ on ‘Empire’ – ‘Empire’ is Nearing Its End. – Season Finale
netloid.com,Samsung ARTIK Gains SAP Leonardo IoT Certification
netloid.com,Samsung ARTIK Gains SAP Leonardo IoT Certification
netloid.com,Grimm Season 4 Episode 7 Recap: The Grimm Who Stole Christmas
netloid.com,Netflix May Increase its Subscriptions
netloid.com,McKenna Berkley Dazzles in New Photoshoot.
netloid.com,Google Buys London Based Data Science Start-up Rangespan.
netloid.com,Apple Beats Wall Street In Shadow of IPhone 8
netloid.com,U.S. Army Opens Cyber Research Centre
netloid.com,U.S. Army Opens Cyber Research Centre
netloid.com,U.S. Army Opens Cyber Research Centre
netloid.com,Apple Reportedly Testing 3D Facial Recognition For IPhone 8
netloid.com,Apple Reportedly Testing 3D Facial Recognition For IPhone 8
netloid.com,Samsung Launches IoT Data Monetisation In ARTIK Cloud
netloid.com,New York City MTA F-Train Derails In Queens.
netloid.com,"George Clooney’s fiancée Amal Alamuddin is Representing Abdullah al-Senussi, Gaddafi’s Intelligence Chief"
netloid.com,Rumors Apple IPhone 8 Is Curved OLED Display Size Explained
netloid.com,Kerrie McMahon Doing A 138 Water Photo Shoot
netloid.com,Florida Approve Medical Marijuana
netloid.com,Data Centre Success Raises Nvidia Stock Target Price To $180
netloid.com,Kylie Jenner: Thanksgiving 2016 Family Picture
netloid.com,Data Centre Success Raises Nvidia Stock Target Price To $180
