source,title
networkworld.com,The recent right-to-repair smartphone ruling will also affect farm and industrial equipment
networkworld.com,The IBM-Red Hat deal: What it means for enterprises
networkworld.com,IBM says buying Red Hat makes it the biggest in hybrid cloud
networkworld.com,IBM-Red Hat deal: What the companies say
networkworld.com,Extending Network Capacity in Enterprise WLANs with 802.11ax
networkworld.com,Understanding mass data fragmentation
networkworld.com,OpenStack Foundation releases software platform for edge computing
networkworld.com,Top Ten Reasons to Think Outside the Router – No. 10: It’s Getting Cloudy
networkworld.com,Rackspace launches disaster recovery as a service program
networkworld.com,What’s the IoT doing to your data center?
networkworld.com,Windows 10 glitch delays Windows Server 2019
networkworld.com,Support a Work Environment That Accelerates Transformation
networkworld.com,5G and 6G wireless technologies have security issues
networkworld.com,Virtual application delivery controller: Where it fits into the software-defined data-center network
networkworld.com,Ubuntu's Cosmic Cuttlefish brings performance improvements and more
networkworld.com,451: Seeking Digital Transformation? Eight Essentials for Hybrid IT
networkworld.com,Managed Security Services
networkworld.com,"Arista joins Juniper, Cisco in 400G Ethernet race"
networkworld.com,Driving Enterprise Value through Smart Connected Devices
networkworld.com,Self-healing SD-WAN removes the drama of high-availability planning
networkworld.com,Xilinx lines up three major Chinese hardware vendors as OEM partners
networkworld.com,Is the IoT in space about to take off?
networkworld.com,Using nmap on your home network
networkworld.com,Bot Management: An Overlooked Layer in Account Takeover Defense
networkworld.com,Drone defense -- powered by IoT -- is now a thing
networkworld.com,The Cost of Credential Stuffing: A Poneman Institute Research Report
networkworld.com,Extend Your Data Center To The Cloud With VMware Cloud On AWS
networkworld.com,2018 State of the Internet / Security – Credential Stuffing Attacks Report
networkworld.com,Introduction to VMware Cloud on AWS
networkworld.com,IBM wants to manage your cloud services no matter which ones you run
networkworld.com,IDC MarketScape: Asia/Pacific Managed Sercurity Services 2018 Vendor Assessment
networkworld.com,IDC's Quantifying data center inefficiency: Making the case for composable infrastructure
networkworld.com,Cloud Transformation Guide: 10 Things to Consider Before Your Azure Migration
networkworld.com,Six Keys to Maximizing Big Data Benefits and Project Success
networkworld.com,Gartner: Top 10 2019 tech trends you should know
networkworld.com,"70 Petabytes, One Cloud Backup Solution: The Oath Story"
networkworld.com,Forrester: Hybrid IT Strategy Insights: How Composable Infrastructure can fuel breakthrough business innovation and performance
networkworld.com,Dimension Data and Palo Alto Networks
networkworld.com,When Will We Be Able to Purchase 802.11ax Access Points and Client Devices?
networkworld.com,New Signature Microsoft 365 Guide
networkworld.com,Taming Information Sprawl with A Radically New Approach to ECM
networkworld.com,IDC TECHNOLOGY SPOTLIGHT: Primary Flash Market Evolving to Next Generation Architectures
networkworld.com,60 Minutes torpedoes Huawei in less than 15 minutes
networkworld.com,A new ARM-based server processor challenges for the data center
networkworld.com,US Navy’s high-resolution radar can see individual raindrops in a storm
networkworld.com,Infrastructure life cycle costs: How ITAD and TPM can save you money
networkworld.com,Intelligent Data Governance for Dummies
networkworld.com,Is Your Data Center Holding You Back? Why Putting Off Modernization Hinders Success
networkworld.com,Hyperconverged Infrastructure for Dummies - SimpliVity Edition
networkworld.com,"Cisco sets $2.3B deal for unified access, multi-factor authentication security firm Duo"
networkworld.com,Cisco unearths 13 'High Impact' IOS vulnerabilities you need to patch now
networkworld.com,"How to boost Wi-Fi performance: Experts talk planning, troubleshooting"
networkworld.com,"Lenovo, NetApp team up vs. Dell EMC, HPE on storage"
networkworld.com,What's wrong with Cisco running SD-WAN on your routers?
networkworld.com,"On the road to your IoT adventure: planning, deployment and measurement (Part 2)"
networkworld.com,How millimeter-wave wireless could help support 5G and IoT
networkworld.com,Is there a white-box server in your data center’s future?
networkworld.com,Zero Trust Networking (ZTN): don’t trust anything
networkworld.com,Why banks didn’t ‘rip and replace’ their mainframes
networkworld.com,ICANN sets plan to reinforce internet DNS security
networkworld.com,Retail IoT: Walmart's IoT patent filing might be the creepiest ever
networkworld.com,This Platform Is Making Management of Apple Devices Easy
networkworld.com,"Data center power efficiency increases, but so do power outages"
networkworld.com,Data center staff are aging faster than the equipment
networkworld.com,"Network World: Edge, Intent-based networking are all the rage; IT networking budgets rise"
networkworld.com,Apple Watch 4 represents an epic fail for smartwatches in business
networkworld.com,10 hot hybrid-cloud startups to watch
networkworld.com,How enterprises can prep for 5G
networkworld.com,Cisco opens DNA Center network control and management software to the DevOps masses
networkworld.com,Gartner Magic Quadrant for Security Information & Event Management (SIEM) 2017
networkworld.com,Two studies show the data center is thriving instead of dying
networkworld.com,"D3 Security: One Platform to improve Security Operations Efficiency, Quality, and Efficacy with SOAR Tools."
networkworld.com,"Review: Icinga enterprise-grade, open-source network monitoring that scales"
networkworld.com,Google’s tiny chip represents a big bet on IoT
networkworld.com,What to expect when the internet gets a big security upgrade
networkworld.com,How the L1 Terminal Fault vulnerability affects Linux systems
networkworld.com,How Faster Insight Into Your Operating Data Drives Business Success
networkworld.com,The Application Networking Survey 2018: What is Failing IT Today and Why the Future of Cloud Computing is Bright
networkworld.com,AI can be a game changer for WI-Fi management
networkworld.com,Why NVMe? Users weigh benefits of NVMe-accelerated flash storage
networkworld.com,Wi-Fi analytics get real
networkworld.com,How updating an outdated industrial control system can work with fog computing
networkworld.com,"Intel, AMD both claim server speed records"
networkworld.com,Top network monitoring software and visibility tools
networkworld.com,Cloud Management for Azure with New Signature
networkworld.com,Do network pros need to up their DevOps chops?
networkworld.com,"Google, Cisco amp-up enterprise cloud integration"
networkworld.com,"Scale Computing, APC partner to offer micro data center in a box"
networkworld.com,"Cisco, Arista settle lawsuit, refocus battle on network, data center, switching arenas"
networkworld.com,"Fiber transmission range leaps to 2,500 miles, and capacity increases"
networkworld.com,Cisco CEO: Webex service outage 'unacceptable'
networkworld.com,Spray-on antennas will revolutionize the Internet of Things
networkworld.com,4 ways next generation NPMD solutions reduce risk in network transitions
networkworld.com,IDC: Business Case for All-Flash Arrays When Integrating Flash into the Cloud
networkworld.com,Centralize Access Management for Network Devices
networkworld.com,Shredding files on Linux
networkworld.com,What is Nmap? Why you need this network mapper
networkworld.com,How to negotiate a Cisco Enterprise Agreement that works for you
networkworld.com,Qualcomm/Facebook gigabit Wi-Fi field trials to start in 2019
networkworld.com,Pure Storage CEO on all-flash data centers and the cloud
