source,title
newnownext.com,Protest Against Intersex Surgery Draws Hundreds in NYC
newnownext.com,“Queer Eye” Season 3 Will Feature the Show’s First Lesbian Makeover
newnownext.com,"Brazil Elects Ultra-Conservative, Anti-Gay Politician as President"
newnownext.com,Watch: “Queer Eye” Star Tan France Talks Hasan Minhaj Into a Crop Top
newnownext.com,Alleged #MAGABomber Told Lesbian Boss She “Should Burn in Hell”
newnownext.com,Gus Kenworthy Dressed up as Adam “Ripoff” Rippon for Halloween
newnownext.com,Exclusive: “Heathers” Star Melanie Fields Absolutely Slays Whitney’s “I Have Nothing” for “Lip Sync Battle”
newnownext.com,“Queer Eye” Star Antoni Porowski Rebounds After Split From Boyfriend
newnownext.com,The Trevor Project Will Honor Ryan Murphy and His “Pose” Cast
newnownext.com,"Garrett Clayton Was Pressured to Stay Closeted, Told to “Butch It Up”"
newnownext.com,"Alyssa Edwards Talks “Dancing Queen,” “Drag Race,” and Helping You Spill Your Tea at Camp Tazo Next Year"
newnownext.com,"WATCH LIST: Outstanding Features From Gay Asian-American Directors, “1985,” and “The Chilling Adventures of Sabrina”"
newnownext.com,Robyn’s New Album “Honey” Is Out
newnownext.com,Cher’s “Believe” Album Getting First Vinyl Release for 20th Anniversary
newnownext.com,Trump Administration Aims to Erase All Rights for Transgender People
newnownext.com,"Lauren Jauregui’s First Solo Single Is the Dark, Sultry Jam of Our Dreams"
newnownext.com,Watch Dolly Parton and Linda Perry Perform a New Song From “Dumplin’”
newnownext.com,Watch: Transgender Advocates Rally at the White House Over Erasure Memo
newnownext.com,Gay Student Sues Homophobic Israeli Pizzeria That Wouldn’t Serve Him
newnownext.com,"These Inspiring Identical Twins Came Out as Trans, Transitioned Together"
newnownext.com,Here’s Your First Look at RuPaul and Raja on “The Simpsons”
newnownext.com,"Darren Criss, Nick Jonas, Dan Reynolds Help Raise $400,000 at Justin Tranter’s GLAAD Fundraiser"
newnownext.com,Trump Selects a Second Gay Conservative Judicial Nominee
newnownext.com,Cate Blanchett Will “Fight to the Death” for Straight Actors to Play Gay
newnownext.com,RuPaul Wants You to Vote
newnownext.com,Watch Four “RuPaul’s Drag Race” Faves Recreate “Lady Marmalade”
newnownext.com,"Cyndi Lauper Enlists Bebe Rexha, Shea Diamond, Natalie Merchant For Annual LGBTQ Holiday Benefit Concert"
newnownext.com,Janet Jackson to Receive the 2018 MTV Ema Global Icon Award
newnownext.com,"Laverne Cox Reflects on Dating, Self Love, and Survivor’s Guilt"
newnownext.com,"Listen: Mariah Carey Drops Another New Track, “Go The Distance”"
newnownext.com,The Next Season of “Orange Is the New Black” Will Be Its Last
newnownext.com,"Mariah Carey, Peppermint, Trace Lysette, and More Sport Purple for #SpiritDay 2018"
newnownext.com,Carmen Maria Machado’s Bestseller “Her Body And Other Parties” Is Getting a TV Show
newnownext.com,"Troye Sivan Teases Something Special, Then Takes It Back"
newnownext.com,Britney Spears Returning to Las Vegas for “Domination” Residency in 2019
newnownext.com,A Coven of Witches Is Planning to Publicly Hex Brett Kavanaugh
newnownext.com,"“Looking” Star Murray Bartlett, Bob the Drag Queen, and More Join Netflix’s “Tales of the City”"
newnownext.com,Meet the Gay Couple Shaking Up the Fine Art Market
newnownext.com,"Laverne Cox, Carmen Carrera, Janet Mock Among 14 Trans Superstars On Cover Of “Candy” Magazine"
newnownext.com,Josh Segarra Cast as RuPaul’s Boyfriend in Netflix Comedy Series
newnownext.com,Pro-Trump Proud Boys Member Arrested for Homophobic NYC Assault
newnownext.com,Sara Ramirez Open to Making a “Grey’s Anatomy” Return
newnownext.com,"Hey, Ghoul, Hey! 7 Places to Scare Up Some Fun This Halloween"
newnownext.com,NFL’s Chad Johnson Wants Guys To Stop Sending Him Naked Pictures. For Real
newnownext.com,"For the First Time in Years, Progress Toward LGBTQ Inclusion in Schools Has Actually Slowed Down"
newnownext.com,8 Celebrity Couples Who Said They Wouldn’t Get Married Until Gay People Could
newnownext.com,The Queer History (and Present) of NYC’s Village Halloween Parade
newnownext.com,"“Good Luck Charlie” Brings First Gay Characters To Disney Channel. Miley Cyrus Praises, OMM Condemns"
newnownext.com,"Happy Birthday, RuPaul: A Gif Wall For The Supermodel Of The World"
newnownext.com,"The Fountainheads: Lucy Hicks Anderson, Mother of Marriage Equality and Transgender Rights"
newnownext.com,"Pro-Trump Mob Assaults Protesters in NYC: “Are You Brave Now, F*ggot?!”"
newnownext.com,Exclusive: Ex-“American Idol” Star David Hernandez: I Was Arrested on Booze and Xanax
newnownext.com,Fall Preview 2018: 9 Queer-Inclusive Books You Won’t Want to Miss
newnownext.com,“Golden Girls” Action Figures Were Just Unveiled at San Diego Comic Con
newnownext.com,"That Time Troye Sivan Peed at a Urinal Next to Zac Efron, His First Crush"
newnownext.com,"Looking Back at the Notorious Disco Studio 54: Sex, Drugs, and Thump Thump"
newnownext.com,"These Queer Artists Were Censored on Social Media. Now, They’re Fighting Back"
newnownext.com,NSFW: Batman Goes Full Frontal in DC’s New Comic for Mature Readers
newnownext.com,Tokyo Passes Law Banning LGBTQ Discrimination
newnownext.com,76 Thoughts I Had While Watching Aretha Franklin’s Funeral
newnownext.com,10 Things You Absolutely Must Do at DragCon NYC 2018
newnownext.com,LGBT Athletes Tackle Discrimination In New “Alone In The Game” Trailer
newnownext.com,“13 Reasons Why” Actor Brandon Flynn Comes Out: “Equality Takes Courage”
newnownext.com,Your 2018 U.S. Pride Guide Is Here!
newnownext.com,Watch: Gay Singer Freddie Atlas Explores Finding Beauty in Uninspiring Places in “Something About You” Video
newnownext.com,“Billy on the Street” Wants to Know Why Emma Stone Isn’t on Instagram
newnownext.com,16 Celebrities Who Came Out This Year
newnownext.com,Mena Suvari on Her Unconsciously Queer Career and Dating a Gay Man in “American Woman”
newnownext.com,"WATCH LIST: Gay Exposé “Scotty and the Secret History of Hollywood” in Theaters, and “Orange Is the New Black” Returns"
newnownext.com,What’s Next: 7 Issues Facing The LGBT Community After Marriage Equality
newnownext.com,These Female Drag Queens Don’t Give A Tuck If You Think They’re Appropriating Gay Culture
newnownext.com,"While You Were Losing Your Mind Over Beyoncé’s Performance, Coachella’s Anti-LGBT Owner Made Millions"
newnownext.com,The “Mamma Mia 2” Trailer Is Here And Fans Are Outraged Over The Plot
newnownext.com,Has the Pope and the Catholic Church’s Stance on LGBTQ People Evolved?
newnownext.com,Dean Cain Struggles to Answer Why He’s Speaking at Anti-LGBTQ Event
newnownext.com,"Michael Musto: An Open Letter To Ellen DeGeneres’ Ex, Anne Heche"
newnownext.com,Original “Boys in the Band” Star Laurence Luckinbill: “The New Show Has Something We Didn’t Have”
newnownext.com,There’s a “Dream Daddy” Comic Book and You Can Read the First Issue Right Now
newnownext.com,The 2018 Emmys: The “How in the Hell You Gonna Award Somebody Else?” Recap
newnownext.com,"Traci Lords on “Swedish Dicks,” Keanu Reeves, and Gays"
newnownext.com,Trailer for New Film “1985” Renders the AIDS Crisis in Black and White
newnownext.com,West Hollywood to Hold Nation’s First Bi Pride
newnownext.com,TNT’s “Claws” Season Two Is Even Gayer With Twink-Mobster Romance and Quiet Ann Gets Loud
newnownext.com,Jack Whitehall to Play Disney’s First Openly Gay Character
newnownext.com,8 Queer Comedians to Watch Who Aren’t Problematic
newnownext.com,Channing Tatum and BFF Nick Zano Have a Bromantic “Cock-Talk” In A Warplane Over Afghanistan
newnownext.com,"Meet Danielle Skidmore, a Transgender Activist on the Cusp of Making Political History in Texas"
newnownext.com,"Brad Pitt Reportedly Bisexual, Has “Picky Tastes”"
newnownext.com,LGBT Soccer Fans Warned They’ll Be Hunted Down and Stabbed at the World Cup in Russia
newnownext.com,Kate McKinnon Spoofs Sen. Lindsey Graham in “SNL” Kavanaugh Sketch
newnownext.com,Fall Preview 2018: 5 Queer Broadway Shows to Believe In
newnownext.com,Trinidad Decriminalizes Homosexuality In Landmark Court Case
newnownext.com,"Justin Bieber Hugs, Invites Gay Fan to His Church"
newnownext.com,"Dana Delany: “If I Were a Lesbian, You’d Know It”"
newnownext.com,"Key West’s Annual Gay Festival, Tropical Heat, Is Proof the Island’s Back in Business Post-Hurricane"
newnownext.com,“Claws” Star Judy Reyes Discusses Very Gay Revelations on This Week’s Outrageous Episode
newnownext.com,Math Teacher Accused Of Having Sex With His Male Student In School Bathroom
newnownext.com,Hayley Kiyoko Is Your “Lesbian Jesus” And She’s Here To Save Pop Music
newnownext.com,Wentworth Miller And Russell Tovey Share Superhero Kiss On “The Flash”
newnownext.com,"Drag Queens, Male Strippers, and Gay Cowboys Rock Provincetown—and Wigstock Returns to New York"
