source,title
oaoa.com,Progress? Gridlock? How midterm vote could affect US economy
oaoa.com,"West's old mines hold danger for some, adventure for others"
oaoa.com,The Latest: Couple says fatal fall victim captured in selfie
oaoa.com,Rite Aid Announces Preliminary Results of Voting at 2018 Annual Meeting of Stockholders
oaoa.com,IBM Board Approves Quarterly Cash Dividend; Authorizes $4 Billion for Stock Repurchase
oaoa.com,"Devils, 76ers owner going all in on sports betting promotion"
oaoa.com,"Five things you need to know today, Oct. 30"
oaoa.com,Saudi ties to US colleges come under mounting scrutiny
oaoa.com,PrimeLending Named Best Workplace for Women by Great Place to Work® and Fortune for Fourth Straight Year
oaoa.com,DPS identifies woman in fatal Ector County wreck
oaoa.com,Campbell Issues Statement on Third Point Presentation
oaoa.com,Civic Brings Innovative Identity Verification Solutions to the ElevenPaths and Rivetz Cybersecurity Partnership
oaoa.com,Cavs' star Love could miss significant time with foot injury
oaoa.com,Cloud Storage Market for Manufacturing Industry to 2023: Expanding at a CAGR of 32.58% - ResearchAndMarkets.com
oaoa.com,INSIDE THE OA ARCHIVES: 2004: Osama bin Laden admits to 9/11 attacks
oaoa.com,Global Home Audio Equipment Market 2018-2022 | Growing Demand for Customized Home Theatre Systems to Boost Growth | Technavio
oaoa.com,American Water Declares Quarterly Dividend
oaoa.com,"New iPad Pro with All-Screen Design is Most Advanced, Powerful iPad Ever"
oaoa.com,"Cint Appoints Karine Parsy as Executive Vice President, APAC"
oaoa.com,"Introducing Element-D, the Latest Addition to the Elemental Machines Platform"
oaoa.com,Rheonix Announces Launch of NGS OnePrep™ Automated DNA Extraction and Library Preparation Solution
oaoa.com,Profitable argument: Delticom B2B shops introduce a lifetime warranty for house brands
oaoa.com,Project Management Institute Announces Finalists of the 2018 PMO of the Year Award
oaoa.com,LogicMonitor Launches Google Cloud Platform Capabilities for Expanded Multi-Cloud Performance Monitoring
oaoa.com,nVent Prepares for Industry 4.0 with Launch of nVent RAYCHEM Elexant Connected Solutions
oaoa.com,Siemens Government Technologies to Extend Energy Efficiency and Readiness Efforts for Army Depots
oaoa.com,"It’s a Bird…It’s a Plane…No, It’s a Life-Sized, Fire-Breathing, Talking Spyro Drone Celebrating the Launch of Spyro Reignited Trilogy"
oaoa.com,All-New MacBook Air Takes Flight
oaoa.com,Rosai and Ackerman's Surgical Pathology - 2 Volume Set. Edition No. 11 - ResearchAndMarkets.com
oaoa.com,Ncardia Launches Custom CRISPR Gene Editing in hiPSC-Derived Cell Lines with Horizon Discovery as Strategic Partner
oaoa.com,Oomnitza Ushers in Next Generation of IT Asset Management with Oomnitza Bot
oaoa.com,Thomas Bunn Joins BCW to Lead U.S. Consumer Marketing Practice
oaoa.com,Philadelphia's decadent 'Wing Bowl' no more after 26 years
oaoa.com,American Water Resources and the Philadelphia Energy Authority Launch Service Line Protection Partnership for City Homeowners
oaoa.com,Atlantix Partners Announces New Partner – Walter Mores and New Managing Director – Alex Davis
oaoa.com,"Kim Perell’s First Book, The Execution Factor: The One Skill That Drives Success, Becomes a National Bestseller"
oaoa.com,AXA XL Launches Cyber Insurance for Small & Mid-Size Businesses on Slice ICS
oaoa.com,Sentient Jet Continues as Official Private Jet Partner of the 2018 Breeders’ Cup World Championships
oaoa.com,Fedora 29 Now Generally Available
oaoa.com,Global Adult Diapers Market 2018-2022 | Growth in Online Retail for Personal Hygiene Products to Boost Demand | Technavio
oaoa.com,Eastman Chemical Company Announces Cash Tender Offer for Any and All 5.500% Notes due 2019
oaoa.com,G3 Pharmaceuticals Signs Exclusive License and Option Agreement for Treating Diastolic Heart Failure (HFpEF) by Inhibiting Galectin-3.
oaoa.com,Fenox Venture Capital Partners with Sega Sammy Holdings in $20 Million Venture Fund
oaoa.com,Global Hyperscale Data Center Market 2017-2021| Construction of Green Data Centers to Boost Growth| Technavio
oaoa.com,"GameStop and Right Media Solutions Bring New Digital Video Network Media Players to More than 3,800 GameStop Locations"
oaoa.com,ExaGrid Provides Quick Recovery of 100% of Data After Virus Hits Servers at Medical Center
oaoa.com,VoiceBase Extends Deep Learning Neural Network Compute to Verne Global
oaoa.com,Chalva Tchkotoua Joins Protegrity as Chief Marketing Officer and Head of Global Alliances
oaoa.com,Global Generic E-learning Courses Market 2018-2022 | Cost Advantage of Generic Courses to Boost Demand | Technavio
oaoa.com,"Global Respiratory Protective Equipment Market - Technologies, Market Share and Industry Forecast to 2024 - ResearchAndMarkets.com"
oaoa.com,Cintas Corporation Announces Annual Dividend Increased for the 35th Consecutive Year
oaoa.com,Global Study by Euromonitor International Shows 25.8 Percent of Alcohol Consumed is Illicit
oaoa.com,IKARUS Security Software Partners with PolySwarm to Advance Early Malware Detection
oaoa.com,VCs Bet on New York Startup Helping to Modernize the $80 Billion Lottery Industry
oaoa.com,SourceDay Selected as a 2018 Red Herring Top 100 Global
oaoa.com,Global Telecom IoT Market Analysis & Projections 2018-2025 - ResearchAndMarkets.com
oaoa.com,Global Consumer Camera Drones Market 2018-2022| Adoption of Delivery Drones to Boost Growth| Technavio
oaoa.com,Code42 SVP of Marketing Ann Fellman Named a Top Women Leader in SaaS
oaoa.com,New Xerox ConnectKey Printers Uplevel Productivity and Creativity in the Workplace
oaoa.com,New Mac mini Packs a Huge Punch
oaoa.com,BG Staffing: 3Q Earnings Snapshot
oaoa.com,Global Healthcare Cloud Computing Market 2018-2022 - Introduction of Edge Computing to Boost Growth - Technavio
oaoa.com,Dr. Kylie Mitchell to Present “The Science Behind Chelated Minerals for Supplementation” at SupplySide West 2018
oaoa.com,Schwab Advisor Services Announces Recipients of the 2018 IMPACT Awards®
oaoa.com,"Global Obstructive Sleep Apnea (OSA) Market Insights, Epidemiology and Market Forecast to 2027 - ResearchAndMarkets.com"
oaoa.com,FireLight® Embedded by Insurance Technologies Delivers Innovative Sales Enablement in Third-Party Sales Platforms and Solutions
oaoa.com,Tierra Nueva Launches Dunkin’ Branded Coffee Thins™ at Retailers Nationwide
oaoa.com,"Repair Pricer Integrates With HomeBinder to Provide Homeowners with Accurate, Unbiased Pricing Data During and After Home Purchasing Process"
oaoa.com,Diligent Expands Initiative with LEED Certified SWPPP Compliant Concrete Washout Solutions
oaoa.com,Principality of Monaco: Mark Mawson awarded with FUTURUM PRIZE by Prince Albert II of Monaco
oaoa.com,puppyrobot Launch Turns Any Surface into Interactive HD Touchscreen
oaoa.com,Physicians' Education Resource® Will Host the 13th Annual New York Lung Cancer Symposium®
oaoa.com,Willie Nelson to Be Honored at Recording Academy™ Producers & Engineers Wing® 12th Annual GRAMMY® Week Celebration
oaoa.com,Inseego Delivers Industry’s First Gigabit Mobile Hotspot
oaoa.com,BehavioSec to Speak at FS-ISAC Fall Summit on Behavioral Biometrics
oaoa.com,"Global Cloud-based Smart Robotics (Cloud Robotics) Market 2018-2023: Focus on Business Model, Deployment Model & End-Users - ResearchAndMarkets.com"
oaoa.com,iboss Strengthens Leadership Team with Senior Executive Hires
oaoa.com,Pivot3 Experiences More than 50-Percent Growth in 2018
oaoa.com,"Insperity Ranks No. 1 on Houston Business Journal’s List of Best Places to Work, Marking 4th Consecutive Year"
oaoa.com,Travelers Partners With Gilbane and Triax Technologies to Test Benefits of Wearables for Construction Industry
oaoa.com,Exabeam Appoints Chief Financial Officer and Executive Vice President of Engineering to Growing Leadership Team
oaoa.com,CyberLink Honors Winners of the “AI Meets Beauty” Image Recognition Challenge
oaoa.com,Infiniti Research Reveals the Crucial Steps to Develop a Perfect Brand Strategy for the Long-Term Success of Businesses
oaoa.com,New Cooper® SEVERE Series™ MSD Truck and Bus Radial Tire is Designed for Mixed Service Use
oaoa.com,Michaels Names Newell Brands 2018 Partner of the Year
oaoa.com,Opus 2 Delivers Virtual Courtrooms with RingCentral
oaoa.com,Trump must hold firm and send the caravan back
oaoa.com,"COLLEGE BASKETBALL: Odessa College men's, women's teams picked second in WJCAC poll"
oaoa.com,MEN'S COLLEGE BASKETBALL: UTPB picked fifth in preseason poll
oaoa.com,WOMEN'S COLLEGE BASKETBALL: UTPB picked ninth in preseason poll
oaoa.com,City approves water plant upgrade designs
oaoa.com,"Sweta Vaidya, FSA, CFA, EA, Joins Callan’s Capital Markets Research Group"
oaoa.com,HIGH SCHOOL FOOTBALL: Permian's Powell commits to Longhorns
oaoa.com,"Early voting in Texas begins with lines, strong turnout"
oaoa.com,"Five things you need to know today, Oct. 23"
oaoa.com,"Permian Basin Drilling Report: Oct,11 through Oct. 17"
oaoa.com,"Five things you need to know today, Oct. 22"
oaoa.com,NORTH AMERICAN HOCKEY LEAGUE: Jackalopes drop high-scoring game to Brahmas
oaoa.com,LETTER TO THE EDITOR: U.S. quickly going to crisis mode
oaoa.com,"HIGH SCHOOL CROSS COUNTRY: Odessa High, Permian runners head to I-6A Meet"
