source,title
opposingviews.com,Dad Learns His Fate After Beating His Daughter's Rapist To Death
opposingviews.com,Unfortunate Updates 2 Years After Woman Was Burned By Ex (Photos)
opposingviews.com,"Woman Falsely Accuses National Guard Member Of Being A Rapist, Here's What A Judge Just Decided"
opposingviews.com,"Creep Flashes His Genitals At Playground, Disgusted Dad Gives Him Instant Karma"
opposingviews.com,Here's Why You Should Stop Eating Baby Carrots ASAP
opposingviews.com,"This Actor Famously Served In The Military, But Now He's Unrecognizable. Can You Guess Who It Is?"
opposingviews.com,Man Hears A Voice Start To Whisper After His Wife Left Her Phone On
opposingviews.com,Through the Decades: How Media Influenced 'Ideal Body Type' for Women
opposingviews.com,Cops In Tears After Discovering 3 Women's Use For Bedsheets
opposingviews.com,This Is What The Boy Who Played 'Young Forrest Gump' Looks Like Now (Photos)
opposingviews.com,"Mom Brags About 'Incest', Backfires When People Hear What She Does To Kids During Sex"
opposingviews.com,16-Year-Old Boy Raped And Murdered By Friends
opposingviews.com,'Best Sex Ever': Dad Who Raped His Daughter For 2 Decades Learns The Consequences (Photos)
opposingviews.com,"Entitled Football Brats Kneel For Anthem, Fed-Up Referees Teach Them Lesson In Respect"
opposingviews.com,"Couple Finds $24,000 While Renovating Home"
opposingviews.com,Dog-Meat Eating in China: Popular and Horrific
opposingviews.com,Lady Storms Out Of Diner After Manager's Brutally Honest Piece Of Advice
opposingviews.com,"If You See A Child With A Tiny Heart Drawn On Their Wrist, This Is What It Means"
opposingviews.com,Woman Gives Birth In Hospital Hallway (Photos)
opposingviews.com,Teen Solves His Own 13-Year Abduction Case (Photos)
opposingviews.com,Teacher's Viral Message To Students Sparks Controversy (Photos)
opposingviews.com,"Mom Feels Something Slimy Between Legs While Driving, Shocked By What 'Slid Out'"
opposingviews.com,Best Friends of Utah: The Process Church of the Final Judgment to Animal Society
opposingviews.com,Tom Cruise Reportedly Won't Visit Daughter Suri For One Simple Reason
opposingviews.com,Here Are The Pants That Got This Teen Girl Sent Home From School (Photo)
opposingviews.com,Raped Child's Autopsy Results Leaves Court In Tears
opposingviews.com,"Mom Found In Bed With Son, Cops Horrified When They See What's Next To Them After"
opposingviews.com,Popular High School Student Sadly Commits Suicide One Day After Getting in Trouble for Throwing a Party
opposingviews.com,'Fargo' Actor Steve Reevis Dies At 55
opposingviews.com,Fans Notice Something Different About Taylor Swift; Did She Get Massive Breast Implants? (Photos)
opposingviews.com,"3 Dangerous Fad Diets: HcG, Baby Food, Apple Cider Vinegar"
opposingviews.com,"Southern Girls Cat Fight In Walmart Parking Lot, Bully Suffers Shocking Wardrobe Malfunction"
opposingviews.com,Gambian Veterinary Clinic Helps Remove Parasitic Mangoworms From Little Puppy (Video)
opposingviews.com,"Female Prisoner Sues State, Wins $267,500 After What Officials Wouldn't Do Between Her Legs"
opposingviews.com,Missing Girl's Dad Says He Knows Who Took Her (Photos)
opposingviews.com,Tragic Obituary For Young Man Goes Viral
opposingviews.com,Dad Who Raped His Daughter And Fled To Germany For 10 Years Learns His Fate
opposingviews.com,McDonald's Boss Replies After Burger-Flipper Says He 'Won't Serve No Cop'
opposingviews.com,San Jose City Council Considers New Proposal Allowing Police to Tap into Private Surveillance Cameras
opposingviews.com,12-Year-Old Punished At School For Hair Deemed 'Too Short'
opposingviews.com,Trump-Hating Maxine Waters Gets Brutal Karma In Front Of Her LA Mansion
opposingviews.com,"Woman Swaps Bar Codes At Walmart, Pays $3 For Computer"
opposingviews.com,How Much Did the NRA Pay Senators Who Killed Gun Background Checks?
opposingviews.com,New Ordinance In New Jersey Requires Panhandlers To Apply For Permit To Solicit Money
opposingviews.com,How to Keep Your Job When You Have PTSD
opposingviews.com,Brother Admitted To Killing Sister For Strange Reason
opposingviews.com,Spanking Adult Women For Punishment? It Was Cool In The 50's
opposingviews.com,This Selfie Just Landed A Mom In Hot Water (Photo)
opposingviews.com,Bookmakers: Trump Impeachment Odds Go Up In 2018
opposingviews.com,Baby's Wild Hair Caused By Genetic Disorder (Photos)
opposingviews.com,News Station Forces Meteorologist To Cover Up During Live Broadcast (Video)
opposingviews.com,White Model With Europe's Biggest Breasts Turns Black (Photos)
opposingviews.com,Kentucky Hospital Can't Afford To Care For 768-Pound Man (Video)
opposingviews.com,Robert Couturier’s Invention ‘The Boot’ Helps Protect School Classrooms
opposingviews.com,"Men Rush To Beat Up Woman Because She's Wearing A Short Skirt, Quickly Find Out Why That's A Bad Idea (Video)"
opposingviews.com,Moms Arrested After Kids Found In Home Full Of Feces
opposingviews.com,Dad Does Something Shocking 1 Year After Begging His Pregnant Girlfriend To Get An Abortion
opposingviews.com,Nursing Home Resident Accused Of Raping 95-Year-Old
opposingviews.com,NAACP Chapter Wants 'The Star-Spangled Banner' Replaced
opposingviews.com,Mother Finally Discovers What Has Been 'Melting' Her Child's Skin (Photos)
opposingviews.com,'I've Seen It All': Woman Explains What It's Like To Make $7/Minute Hanging Out Online With Men
opposingviews.com,"Toddler Madison Dolford Shot To Death, Mother April Dixon And Possible Father Timothy Sanders Charged"
opposingviews.com,"Community Offers $20,000 Reward For Information About Killer Of 9-Year-Old Boy In Chicago"
opposingviews.com,Clinton Cautions Over Impact Of Artificial Intelligence
opposingviews.com,Woman Suspected Of Stealing From Ulta Beauty Store Wears 'Won't Be Caught' T-Shirt
opposingviews.com,"Arizona Man Finds Fallout Shelter Under His House, Posts It To Reddit (Photos)"
opposingviews.com,"Doctors Perform C-Section After Mom's Two-Day Labor, Can't Believe What They Find Inside Her"
opposingviews.com,"Man Runs Out On Blind Date, Leaves Woman With $50 Tab (Photos)"
opposingviews.com,Ivanka Trump Slammed For 'Creepy' Picture With Kids (Photos)
opposingviews.com,Man Who Tried To Collect Girlfriend's $1 Million Life Insurance Pleads Not Guilty To Murdering Her
opposingviews.com,"Westboro Baptist Church Member Libby Alvarez Escapes, Lives Life of Freedom"
opposingviews.com,Tampa Bay Rays Manager Joe Maddon is the Worst Person Ever
opposingviews.com,A 12-Year-Old Bride in Norway Named 'Thea' Blogs About Her Upcoming Marriage
opposingviews.com,"Colorado Teacher Carly McKinney Tweets Nude Photos and Drug References, Calls Students ‘Jailbait’"
opposingviews.com,Venezuela's Crisis Not Caused By Socialism
opposingviews.com,Married Mom Admits To Sex With Underage Boys (Photos)
opposingviews.com,"Jolly Tumuhirwe, Nanny Who Beat 18-Month-Old, Pleads Guilty to Torture Charges (Video)"
opposingviews.com,"Man Who Raped 11-Year-Old, Impregnated Her, Sentenced To 35 Years In Prison"
opposingviews.com,Man Kills Himself While Taking Picture With Grenade (Photos)
opposingviews.com,Killer Who Ate Human Flesh Learns That Karma Comes Quick (Photos)
opposingviews.com,The World's Happiest Countries Take The Most Antidepressants
opposingviews.com,Mother Walks In On Four-Year-Old Performing Oral Sex On Her Toddler
opposingviews.com,How to Fix Your Cholesterol Without Medication
opposingviews.com,"How ISIS and an Islamic State Will Impact Muslims, The U.S., and the World"
opposingviews.com,"HD TV Antennas Get Up to 40 TV Channels, Without Cable or Dish Satellite"
opposingviews.com,Anti-Vaccine Website Upset That Muslims Don't Vaccinate
opposingviews.com,Controlling Your Blood Sugar in Hot Weather
opposingviews.com,Autopsy Results Outline Disturbing Details In 9-Year-Old Omaree Varela's Death (Video)
opposingviews.com,Scientist on Deathbed Claims There Are Two Groups of Aliens in Area 51
opposingviews.com,"Woman Uses Men's Bathroom At Garth Brooks Show, Suffers The Consequences"
opposingviews.com,"Single Mom Rents Hotel Room With Homeless Man, He Gets More Than He Expected"
opposingviews.com,Melania Trump's Puerto Rico Outfit Sparks Controversy (Photos)
opposingviews.com,Here's What Happens If You Soak Your Feet In Listerine
opposingviews.com,Trump Makes MLK Historic Site Historic National Park (Photos)
opposingviews.com,Teen Dies After Students Bully Him In Front Of Teacher (Video)
opposingviews.com,"Dawn Weiser, 44, Pleads Not Guilty to Trying to Kill Snoring Husband Doug After She Couldn’t Sleep"
opposingviews.com,"Indiana Cops Pull Guns On Pregnant Woman, Husband For Speeding To Hospital (Video)"
opposingviews.com,"Grandpa Who Raped, Impregnated His Own 11-Year-Old Granddaughter Learns His Fate"
opposingviews.com,Why Are the Los Angeles Dodgers so Bad?
