source,title
reuters.com,Wall Street moves higher as chip stocks rebound
reuters.com,U.S. consumer confidence at 18-year high; house price gains slow
reuters.com,Trump targets U.S. birthright citizenship ahead of elections
reuters.com,Pittsburgh mourns synagogue shooting victims as protesters await Trump
reuters.com,Chesapeake Energy shares tumble on $4-billion WildHorse deal
reuters.com,Breakingviews - Exclusive: FedEx drops NRA deal by snail-mail
reuters.com,"Bunge finalizing agreements with investors, to consider sale: sources"
reuters.com,Former Leicester bosses pay tribute to chairman
reuters.com,"Apple spruces up Macs, iPad Pros and raises prices"
reuters.com,"Oil prices down more than $1 on rising supply, trade war"
reuters.com,Rising U.S. crude output sparks race to build export terminals
reuters.com,'Who's in charge?' Next Mexico leader clashes with business over airport
reuters.com,Continental Resources eyes widening fourth-quarter oil differential
reuters.com,Raiders CB Rodgers-Cromartie retires immediately
reuters.com,Pittsburgh mourns synagogue massacre victims as protesters await Trump
reuters.com,"Ex-Valeant, Philidor executives get prison for fraud"
reuters.com,Pimco chief Dan Ivascyn says Fed will hike despite Trump criticism
reuters.com,Trump citizenship plan may not conflict with constitution -Pence
reuters.com,Wall Street gains as chip stocks lead bounce back
reuters.com,Bavarian parties nearing conservative-centrist coalition: sources
reuters.com,Golf: World Golf Foundation defends Hall of Fame's selection policy
reuters.com,Coke profits get health kick in third quarter
reuters.com,Kerry Washington returns to Broadway
reuters.com,Iran: U.S. curbs to have 'severe consequences' for global order
reuters.com,Rohingya returns to Myanmar must not be rushed or premature: UNHCR
reuters.com,Under Armour shares surge as turnaround efforts take hold
reuters.com,Greece's Gastrade launches market test for Alexandroupolis LNG terminal
reuters.com,Halloween parades around the world
reuters.com,Mexican economy recovers in third quarter as trade worries fade
reuters.com,"Nigeria police fire on Shi'ite march, kill protester-group"
reuters.com,UPDATE 1-Investors receiving payment on PDVSA 2020 bond -sources
reuters.com,Swedish caretaker PM says speaker's talks made progress in breaking deadlock
reuters.com,Seahawks LB Kendricks gets eight-game suspension
reuters.com,UPDATE 1-Brazil's Eletrobras to assume more debt to privatize distributor -source
reuters.com,Boston gangster James 'Whitey' Bulger found dead in prison: NBC News
reuters.com,Cargill's Dines named new CFO; Smits takes new role in Asia
reuters.com,"EU probes Tata Steel, ThyssenKrupp planned joint venture"
reuters.com,"Amid controversy, Turkey opens 'world's largest airport'"
reuters.com,Trump weighing birthright citizenship plan: Pence
reuters.com,Randgold Resources' Mali gold mining complex ramps up production
reuters.com,UPDATE 1-Brazil's Itaú Unibanco may pursue riskier loans -CEO
reuters.com,UPDATE 1-BP 'blowout' results keep FTSE afloat as Reckitt tumbles
reuters.com,"Europe shares dip, earnings disappointment weighs"
reuters.com,Breakingviews TV: OMGE
reuters.com,Kids' apps may have a lot more ads than you think
reuters.com,"South Africa's rand tracks emerging markets rally, stocks fall"
reuters.com,Solari says Real stars in pain and determined to fight back
reuters.com,Engie gets green light for grounded offshore wind projects in France
reuters.com,Turkish military says kills seven Kurdish militants in northern Iraq
reuters.com,Lebanese government talks hit snag over Sunni representation
reuters.com,RPT-Ex-BlackRock credit chief eyes 2019 hedge fund launch -sources
reuters.com,Long-lasting HIV injection is a step closer after second GSK study
reuters.com,Brazil's Eletrobras to assume additional $800 mln in debt to privatize distributor- source
reuters.com,Libyan state oil firm demands pay increases for oil workers
reuters.com,"UPDATE 2-Lebanon's risk profile ""rising sharply"" -World Bank"
reuters.com,India's Bank of Baroda Q2 profit jumps a fifth on lower bad loans
reuters.com,Strong truck demand drives Cummins third-quarter profit beat
reuters.com,Sports Direct to close stores in Evans Cycles rescue
reuters.com,U.S. senator says will offer bill to back Trump birthright citizenship plan
reuters.com,"Israel, Boeing sign reciprocal spending deal: ministry"
reuters.com,Merkel - Stepping down as CDU leader won't weaken me on world stage
reuters.com,Yemeni teacher turns his home into school for 700 students
reuters.com,Swedish police say arrested man wanted in Denmark for murder attempt
reuters.com,Mourning after Pittsburgh synagogue shooting
reuters.com,White House's Kudlow says Trump not demanding Fed policy change
reuters.com,U.S. CDC confirms 62 cases of rare polio-like neurological condition
reuters.com,Republican has narrow lead in Tennessee U.S. Senate race: poll
reuters.com,Putin says Trump listens to him and wants to repair U.S.-Russia ties
reuters.com,UK PM May says concerned by report into bullying in parliament
reuters.com,"U.S. Senate bill could give Tesla, GM electric car tax credit boost"
reuters.com,Soccer: Late goal gives Peru 1-1 draw with U.S.
reuters.com,"At U.N., Cuban diplomats shout down U.S. event on political prisoners"
reuters.com,Appeals court to hear U.S. Justice Department objection to AT&T deal on Dec. 6
reuters.com,UK won't lower food standards to win post-Brexit trade deals - minister
reuters.com,WADA to audit Russian anti-doping agency in December
reuters.com,Brazil's federal police asks top court to indict President Temer on graft charges
reuters.com,"Luxembourg's Bettel says on March 29, it's 'game over' on Brexit"
reuters.com,EU regulators ask Sony's rivals and users how it might use power after EMI deal
reuters.com,"No decision on Turkey sanctions yet, top U.S. diplomat says"
reuters.com,"U.S. issues new Iran sanctions targeting Bank Mellat, other companies"
reuters.com,At least seven killed in train derailment in Morocco
reuters.com,Dutch minister unlikely to attend Saudi conference after journalist's disappearance
reuters.com,U.S. security adviser Bolton to meet Lavrov next week: Kremlin
reuters.com,BNP Paribas's chairman cancels attendance at Saudi Arabia's investment conference
reuters.com,EU's Barnier says will work 'seriously' in coming weeks for Brexit deal
reuters.com,Russian delegation met with Saudi Arabia Crown Prince to discuss Syrian crisis: Foreign Ministry
reuters.com,Bodies of South Korean climbers killed in Himalayas are returned home
reuters.com,Brexit deal made harder by May comments: EU official
reuters.com,Liam Fox says UK needs longer transition period to make free-trade deal with EU - the Times
reuters.com,U.S. Secretary of State met with families of detained Turkish U.S. Mission employees - pool report
reuters.com,Trump says former lawyer Cohen's testimony was 'totally false': AP
reuters.com,"UK's May had nothing new on Brexit for summit, but tone calm: Tajani"
reuters.com,China slashes banks' reserve requirements as trade war imperils growth
reuters.com,"On Brexit, Britain's May urges EU to do 'difficult deal' once again"
reuters.com,"Energy drives up euro zone inflation in Sept, core edges lower"
reuters.com,Honda to invest $2.75 billion in GM's self-driving car unit
reuters.com,Limo in deadly New York crash failed inspection: Governor
reuters.com,Pompeo tells Turkey's Erdogan U.S. willing to aid Khashoggi probe: State Department
reuters.com,Banks back Democrats in bid to rebuild bipartisan support
reuters.com,Schroders Plc and Lloyds Banking Group in talks over wealth management alliance
