source,title
rt.com,What ordinary Americans really think of Russia
rt.com,Australian govt lambasted after supporting ‘It’s OK to be white’ meme as policy
rt.com,"Kinky, panty-selling, yoga teacher will still run for office in US despite revelations"
rt.com,Appalling truth of Leningrad siege: 95yo Russian writer gives powerful speech at Bundestag
rt.com,McDonald's to employees: Avoid burgers and fries - it's risky for your health
rt.com,‘World knows who truly violates sovereignties’: Beijing blasts Pence speech on ‘Chinese meddling’
rt.com,"8yo girl pulls 1,500yo sword from Swedish lake in King Arthur-like discovery (PHOTOS)"
rt.com,Namibia follows South Africa with pledge to expropriate white-owned land
rt.com,‘Groundhog day’ - Corbyn slams May as she updates parliament on Brexit
rt.com,"Senators Flake, Manchin, Collins have their offices surrounded by protesters after Kavanaugh vote"
rt.com,Russian pension reform bill signed into law by Putin
rt.com,"12yo ‘cannibal’ & her lover kill, dismember landlord out of ‘hunger and curiosity’ – reports"
rt.com,'My face when they say they didn't like my jump' - Khabib posts 'apology' for UFC fracas
rt.com,"Tired of the political divide in America? Don’t worry, it’s going to get much worse"
rt.com,"Palin, Rice mull challenging Alaska & Maine senators whose Kavanaugh votes sparked outrage"
rt.com,'F*ck Kavanaugh' lipstick and 4 other below-the-belt attacks on embattled Supreme Court nominee
rt.com,Ex-boyfriend casts doubt on Ford’s testimony about Kavanaugh-created 'trauma’
rt.com,"Watch S-300 launchers, interceptors & radars unloaded in Syria after Il-20 downing (VIDEO)"
rt.com,"‘Now, it’s the Netherlands’ turn’: Moscow slams ‘anti-Russia campaign’ after OPCW hacking claims"
rt.com,UK gearing up for cyber-war against Russia? Moscow asks London to clarify media report
rt.com,‘Unwavering support’ against ‘Iranian aggression’? Israel welcomes record $38bn US military aid
rt.com,Cutting out the US dollar: Russia & UK may switch to settlements in national currencies
rt.com,‘Peace with Iran!’ Anti-war activist dragged from Trump official’s anti-Tehran speech (VIDEO)
rt.com,"‘We’d take out Russia’s nukes,’ US NATO envoy says, claiming ‘banned’ missiles are being developed"
rt.com,"Saudi Arabia can survive ‘2,000 years’ without US help & not face civil war like America – MBS"
rt.com,Kavanaugh nomination goes to final vote in Senate
rt.com,CSKA Moscow 1-0 Real Madrid: Superb CSKA humble holders in Moscow (PHOTOS)
rt.com,"‘Aliens are real’: SpaceX West Coast launch freaks Californians out (PHOTOS, VIDEOS)"
rt.com,‘I don’t have an attorney-general’: Trump slams Sessions in Oval Office interview
rt.com,"US man who sent ‘ricin letters’ to Trump & Pentagon also mailed toxins to Putin, Queen Elizabeth II"
rt.com,Murder at consulate? Turks say dissident journalist killed at Saudi diplo building
rt.com,"Foreign mediators? Catalonia urges Madrid to talk independence, forwards letter to Trump, Putin & Xi"
rt.com,Trump accused of anti-Semitism over claim Soros funds ‘elevator screamers’
rt.com,"Emergency escape at 6000 km/h: How near miss Soyuz rocket accident unfolded (PHOTOS, VIDEO)"
rt.com,Rosenstein hasn’t been fired – yet. Here’s a look at some of his most controversial moments
rt.com,Elon Musk likes anime and says it's time to build a giant robot
rt.com,Russia ‘reserves right to respond’ after saying Israel’s actions led to downing of Il-20 by Syria
rt.com,Back in the USSR: Prim Soviets had show exactly like new swimsuit-free Miss America (PHOTOS)
rt.com,‘Can we film the Ecuadorian embassy from your house?’ BBC asks residents to install Assange cam
rt.com,War in Syria won’t end while the US remains there – Lavrov to French media
rt.com,Hunt for ‘Googly Eye Bandit’ is on in Georgia after war hero’s statue gets funny eyes
rt.com,Golf fan ‘blind in one eye’ after being hit by stray shot at Ryder Cup
rt.com,"US-China trade war could last 20 years, warns Jack Ma"
rt.com,A look back at Theresa May’s awkward dancing career that’s bringing the ‘robot’ back (VIDEOS)
rt.com,British citizens would be in danger’: Pro-Israel groups attack Labour’s plan to freeze arms sales
rt.com,MAGA hat wearing Kanye West booed by SNL audience after pro-Trump speech off-air
rt.com,Russia to supply S-300 to Syria within 2 weeks after Il-20 downing during Israeli raid – MoD
rt.com,‘We won’t pay for thin air’: Moscow responds to Council of Europe expulsion threats
rt.com,‘US didn’t expect Russia to grow so strong in Arctic’: Why Pentagon is rebuilding Cold War-era fleet
rt.com,‘Millions of water bottles’ left on Puerto Rico runway a year after Hurricane Maria (PHOTOS)
rt.com,China’s ‘Peace Ark’ ship makes maiden visit to Venezuela (VIDEO)
rt.com,"US plan to prevent fall of last terrorist nest in Syria, no concern for civilians – Russian UN envoy"
rt.com,One step from bloodshed: Moscow slams Kosovo invasion of Serb-majority area
rt.com,Instagram co-founders resign after alleged row with Zuckerberg in latest blow to Facebook
rt.com,"Erdogan calls for Security Council reform, hails Turkey's work in Syria during UNGA speech"
rt.com,Iran considers SWIFT payment system alternative to bypass US sanctions
rt.com,Trump trade wars: Ford reports $1bn in lost profits as US companies feel the heat
rt.com,Tesla shares soar after Musk gets ousted as chairman
rt.com,Man accused of raping deaf woman who gave him shelter during Hurricane Florence
rt.com,Size matters: ‘Freak show’ dwarf wrestling event axed due to fears over ‘inclusivity’ (PHOTOS)
rt.com,North Korea may have up to 60 nukes in its arsenal – Seoul
rt.com,Peace overture? No ballistic missiles seen in North Korea’s 70th anniversary parade (PHOTOS)
rt.com,Christmas miracle: 'How easily we are bought by Jeff Bezos' $15 publicity stunt' - Lee Camp
rt.com,White supremacist conspiracy theory erupts over hand signal at Kavanaugh hearing
rt.com,‘Whiter than white’: Senior cop who used age old phrase could be fired for alleged ‘racism’
rt.com,"Nevada woman dies in jail after being denied medical help, DA finds no wrongdoing"
rt.com,Satellite pics show Syria strike as Israeli Air Force chief goes to Moscow to explain Il-20 incident
rt.com,‘I don’t care if I incite fear of Muslims’ – Tommy Robinson in heated interview
rt.com,Decade after financial crisis JPMorgan predicts next one’s coming soon
rt.com,Unseen in 35 years: Veteran weather reporter on oceans ‘exploding’ with tropical storms
rt.com,Got your popcorn? Trump's Security Council performance could be more than just Iran bashing
rt.com,"To protect arms sales, Pompeo favors sole voice backing renewed support of Saudis in Yemen – report"
rt.com,‘Orwellian’ move: Facebook teams up with US government to police ‘fake news’ in foreign elections
rt.com,Modric beats Ronaldo & Salah to claim FIFA men’s player of the year award
rt.com,Putin: Trade between Russia & India will reach $30bn by 2025
rt.com,Kavanaugh confirmed & sworn in as US Supreme Court justice amid protests
rt.com,‘Totally political’: Trump defends Kavanaugh amid sexual assault allegations
rt.com,"Brexiteer politicians are ‘liars,’ who left campaign ‘next day’ after UK referendum – Macron"
rt.com,Iran’s elite guards vow ‘deadly’ revenge as Tehran blames US & allies for parade attack
rt.com,India to present Russia with vintage MiG-21s as gesture of appreciation – report
rt.com,"17 years after 9/11, Al-Qaeda rebranded by US government & media as besieged rebels"
rt.com,"USA Today adds ‘pedophilia’ angle to Kavanaugh saga, sparks outrage"
rt.com,"25,000 Brits could be infected with contaminated blood from US prisoners and addicts, inquiry hears"
rt.com,"Soaring by $38,000 per second: US national debt now exceeds $21.5 trillion"
rt.com,Russia to sell off more US Treasuries in retaliation against sanctions
rt.com,Russia could gain from trade wars by cornering new markets – economy minister
rt.com,‘Extremely sad and serious’: Police find man ‘kept as slave’ in shed for 40yrs
rt.com,India’s crude-oil demand to reach 500 million tons in 2040 - biggest refiner
rt.com,Moscow slams Bellingcat for ‘leaking misinformation’ on Salisbury suspects from special services
rt.com,'Another black person?!' NY nanny sues couple over firing after ‘racist’ text
rt.com,Kavanaugh conundrum: Two men claim to be real culprits behind assault on Ford
rt.com,"Tear gas as protesters clash with police in Thessaloniki, chanting ‘Macedonia is Greece’ (PHOTOS)"
rt.com,"‘I hope they didn’t do it’: State Dept in doubt over S-300 delivery, warns of ‘serious escalation’"
rt.com,FBI and Blackhawk choppers: National Solar Observatory shuts over mysterious ‘security issue’
rt.com,NATO tripled military presence on Russia's borders in just 5 years – Moscow
rt.com,"‘Tipping point passed’: Swedes waking up to reject liberal globalists, says political analyst"
rt.com,Aliens or solar flare? Questions remain as Sunspot Observatory partially reopens after FBI closure
rt.com,Theresa May knew Brexit ‘Leave’ campaign had broken law before triggering Article 50
rt.com,Syria spat over? US starts training Turkish troops for joint patrols in Manbij
rt.com,Trump’s praise for India criticized on Twitter amid hike in oil prices and poverty
