source,title
screenrant.com,Ryan Hansen Returning For Veronica Mars Revival
screenrant.com,Cate Blanchett To Star In Mrs. America Limited Series At FX
screenrant.com,Original Suicide Squad Members That Need to Return For James Gunn's Sequel
screenrant.com,Halloween: 20 Strange Things About Michael’s Anatomy
screenrant.com,Legend of Zelda TV Show in Development With Adi Shankar in Talks to Produce
screenrant.com,Which Guardians of the Galaxy Cast Members Will Follow James Gunn To DC?
screenrant.com,Why Star Wars 9 Needs To Include ANOTHER Death Star
screenrant.com,Supernatural: 25 Things Only True Fans Know About The Apocalypse World
screenrant.com,Aquaman Extended TV Spot Reveals (Brief) New Footage Of Black Manta & More
screenrant.com,20 Crazy Details Behind The Making Of The MCU's Phase One
screenrant.com,Avengers 4: Thor Movies Connect Quantum Realm To The Soul Stone
screenrant.com,Exclusive: Karissa Lee Staples & Tyler Johnson to Star in Indie Thriller Stripped
screenrant.com,The Big Bang Theory Should End With Raj & Anu's Wedding
screenrant.com,David Dastmalchian Interview: Ant-Man and the Wasp Blu-ray
screenrant.com,Avatar Sequels Get A New Logo (Without Papyrus Font)
screenrant.com,Lorena Villarreal & Melina Matthews Interview: Silencio
screenrant.com,Aquaman: Young Arthur Curry Flashback Scene Details Revealed
screenrant.com,Boy Erased Trailer #2 Highlights Real-World Gay Conversion Therapy
screenrant.com,Sigourney Weaver Is Already Working On Avatar 4 & 5
screenrant.com,The Eternals Could Be A Prequel To The Entire MCU
screenrant.com,Titans Actor Prefers the DC Series to Avengers: Infinity War
screenrant.com,DC's Live-Action Doom Patrol Revealed in New Photos
screenrant.com,20 Things Everyone Gets Wrong About Harley Quinn
screenrant.com,20 Mistakes Fans Completely Missed In Iron Man Movies
screenrant.com,Why The Walking Dead Is Losing Viewers (Despite Season 9 Being Better)
screenrant.com,"Harry Potter: 13 Strongest Death Eaters (And 7 So Weak They're Useless), Ranked"
screenrant.com,What Star-Lord Almost Looked Like In Guardians of the Galaxy
screenrant.com,20 Things About Daredevil That Make No Sense
screenrant.com,Daredevil: 20 Weirdest Details About Bullseye’s Anatomy
screenrant.com,How A Pirates of the Caribbean Reboot Can Fix The Franchise
screenrant.com,Freddy Krueger Actor Worked On Original Halloween Movie Just One Day
screenrant.com,Can You Ever Forgive Me? Review: McCarthy's Great Memoir is Not a Fake
screenrant.com,A Heathers Reboot In 2018 Was Always A Terrible Idea
screenrant.com,John Noble Interview: Silencio
screenrant.com,Fallout 76 Live-Action Trailer Is Weirdly Cheerful
screenrant.com,Star Wars: 25 Things That Make No Sense About Stormtroopers
screenrant.com,Ralph Breaks the Internet Celebrates #InternetDay With KnowsMore Clip
screenrant.com,The Haunting of Hill House: Every Episode Ranked
screenrant.com,"Michael Rooker Calls James Gunn Firing 'Terrible', Hypes Suicide Squad 2"
screenrant.com,LEGO Harry Potter Collection Review: A Fun If Unambitious Remaster
screenrant.com,Call of Duty Movie May Start Filming Next Year
screenrant.com,DC Fans Recreate Distracted Boyfriend Meme With New & Old Aquaman Costumes
screenrant.com,Stallone Almost Retired Rambo After Original Fifth Movie Was Rejected
screenrant.com,What To Expect From Castlevania Season 3
screenrant.com,"Arrow Season 7: 8 Big Questions From Episode 3, ""Crossing Lines"""
screenrant.com,Marvel's Runaways Actor Kip Pardue Accused Of Sexual Assault
screenrant.com,Superman Gives Batman All His Kryptonian Superpowers?
screenrant.com,The Quake Trailer: The Wave Gets An Earthquake Disaster Sequel
screenrant.com,The Flash 100th Episode Brings Back Barry Allen's Past Villains
screenrant.com,10 Pokémon Way Weaker Than Fans Thought (And 10 Even Stronger)
screenrant.com,Edge Of Seventeen TV Show In Development At YouTube
screenrant.com,20 Movies Hurt By Crazy CGI Actor Stand-Ins
screenrant.com,The Grinch Movie's Billboards Have Incredibly Mean Messages
screenrant.com,No Man's Sky Receives Big Underwater Abyss Update
screenrant.com,Avengers 4 Fan Art Imagines Katherine Langford As Kate Bishop's Hawkeye
screenrant.com,Iron Man & Pepper Potts' Rescue Team Up In Avengers 4 Fan Art
screenrant.com,"Creed 2: Ivan Drago is 'Pretty Damaged', Says Dolph Lundgren"
screenrant.com,Iron Man's Newest Armor is His Most Ridiculous Yet
screenrant.com,Heathers TV Show Cuts Two Episodes In Wake Of Pittsburgh Shooting
screenrant.com,Gotham Season 5 Gets January 2019 Premiere Date & Expanded Episode Count
screenrant.com,Attack On Titan Movie In Development; IT's Andy Muschietti To Direct
screenrant.com,The Walking Dead: Rick's Last Episode Trailer Teases Shane's Return
screenrant.com,The Last Kingdom Season 3 Full Trailer Teases The Death Of A King
screenrant.com,The Chilling Adventures of Sabrina Confirms Riverdale Shared Universe
screenrant.com,20 Crazy Theories About Naruto And His Family (That Make Too Much Sense)
screenrant.com,"Star Wars 9 Theory: VADER Corrupted Kylo Ren, Not Snoke"
screenrant.com,Red Dead Redemption 2: [SPOILER] Easter Egg Location Guide
screenrant.com,Hobbs & Shaw: The Rock Introduces Vanessa Kirby's Fast & Furious Character
screenrant.com,"Why Deadpool 2 PG-13 Cut Is Happening, According To The Writers"
screenrant.com,Russian Supergirl Has A Kryptonite Problem After The Latest Episode
screenrant.com,Disney Play Should Bring Back Marvel One-Shots
screenrant.com,Boba Fett Movie Would've Had Other Empire Strikes Back Bounty Hunters Return
screenrant.com,MCU Characters Least Likely to Appear Again After Avengers 4
screenrant.com,Predicting the Arrowverse Elseworlds Crossover Villain
screenrant.com,The Simpsons' Apu Controversy Timeline: What Really Happened & What's Next
screenrant.com,DC's Titans Still Doesn't Have A Real Villain - Who Is It?
screenrant.com,"More Than Half Of Movies Since 1968 Have Been Rated R, MPAA Study Finds"
screenrant.com,"Avengers: Infinity War Gets Simple, But Cool Empire Magazine Cover"
screenrant.com,Red Dead Redemption 2 PC Version Hinted At By Companion App
screenrant.com,What We Know About Red Dead Redemption 2 Online From Leaks
screenrant.com,Boundless Review: Aimlessly Entertining
screenrant.com,Doctor Who Hints The Doctor Was Female Before (Which May Create A Plot Hole)
screenrant.com,Fantastic Four Vanished Because Marvel is a Hot Mess
screenrant.com,Here's Every Object Bullseye Throws In Daredevil Season 3
screenrant.com,Avengers: Infinity War Halloween Display Recreates Heart-Breaking Death
screenrant.com,The Walking Dead May Have Just Shown How Rick Dies
screenrant.com,Deadpool 2 PG-13 Cut Contains New Scenes Filmed 2 Months Ago
screenrant.com,Full PlayStation Classic Game List Officially Revealed
screenrant.com,To All the Boys I’ve Loved Before Becomes A Mega Hit For Netflix
screenrant.com,Netflix is Considering Ending Fuller House After Season 4
screenrant.com,Batmobile Spotted on Joaquin Phoenix’s Joker Movie Set
screenrant.com,Mark Strong Really Wants You To Play Battlefield V The Right Way
screenrant.com,First Look at Gotham’s Bane Costume (Possibly) Revealed in Cast Photo
screenrant.com,Toys ‘R' Us May Reopen As Lenders Reverse Bankruptcy Plan
screenrant.com,Marvel Killing Off a Guardians of the Galaxy Hero
screenrant.com,Aquaman Five-Minute Trailer Reveals First Look At Comic Costume
screenrant.com,Rumor: Ben Affleck Training To Star In The Batman
screenrant.com,Is Venom In The MCU? Marvel/Spider-Man Movie Rights & Shared Universes Explained
screenrant.com,9 Casting Decisions That Hurt Gilmore Girls (And 11 That Saved It)
screenrant.com,Avengers 4 Leak Reveals Best Look At Thanos' Sword Design
