source,title
sploid.gizmodo.com,Nobody knew how the clitoris really worked until four years ago
sploid.gizmodo.com,Watch Jar-Jar getting killed in this deleted Star Wars scene
sploid.gizmodo.com,Michael Jordan's son just tweeted a photo of his penis
sploid.gizmodo.com,Would you put these terrifying sex toys inside your body?
sploid.gizmodo.com,Cool photos of the F-22 refueling at night on its way to Syria
sploid.gizmodo.com,How to be more productive according to the brilliant Alan Turing
sploid.gizmodo.com,How to do cool things in YouTube using your browser's address bar
sploid.gizmodo.com,Scientists film how the brain makes memories for the first time ever
sploid.gizmodo.com,"The new Madden game sucks, don't get it"
sploid.gizmodo.com,What is this secret code hidden in so many films and TV shows?
sploid.gizmodo.com,"If you put all humans on a pile, they would take a really small space"
sploid.gizmodo.com,The best dessert ever is a shot of milk inside a glass made of cookie
sploid.gizmodo.com,"Over 81,000 Falling Dominoes Recreate the Greatest Super Mario Game of All Time"
sploid.gizmodo.com,Watch This Artist Reveal His Invisible Calligraphy Using a Few Drops of Ink
sploid.gizmodo.com,Don't watch this if you don't want to freak out about your life choices
sploid.gizmodo.com,The exact moment in which a Soyuz space capsule hits the ground
sploid.gizmodo.com,How to Make a DIY Dyson Bladeless Fan with a Water Jug and a Plant Vase
sploid.gizmodo.com,This crazy pizza fried chicken has permanently warped my concept of food
sploid.gizmodo.com,Parents who buy Grand Theft Auto V for their kids suck
sploid.gizmodo.com,Women can't re-enter their home countries after Korean plastic surgery
sploid.gizmodo.com,This Artist Turns Spilled Paint Into Gorgeous Avalanches of Color
sploid.gizmodo.com,A spaghetti bun and meatball sandwich is evolution at its finest
sploid.gizmodo.com,These idiots celebrated 9/11 with a Muslims vs Americans costume party
sploid.gizmodo.com,How this guy lost 100 pounds in 11 months without suffering
sploid.gizmodo.com,This Guy Hacked Together a Glove That Makes Time Appear to Slow Down
sploid.gizmodo.com,North Korea Army's camouflage must be a prank on them or us
sploid.gizmodo.com,Pool-Jumping Daredevil Needs New Feet After Gruesome Accident
sploid.gizmodo.com,How to run like a champ without hurting yourself
sploid.gizmodo.com,"The First Person View of Climbing a Snowy 22,000-Foot Tall Mountain Is a Little Bit Terrifying"
sploid.gizmodo.com,This image isn't a 3D game but America's newest stealth machine
sploid.gizmodo.com,Rock mysteriously appears in front of the Mars Opportunity rover
sploid.gizmodo.com,Watching the Movement of Colorful Coral Is Really Something Special
sploid.gizmodo.com,China must be the weirdest and most extravagant country in the planet
sploid.gizmodo.com,Did you know that the smelloscope from Futurama actually exists?
sploid.gizmodo.com,Badass T-rex on a Jetski Is Exactly Why We'll Miss the Summer
sploid.gizmodo.com,The crappy photos of NASA's golden era you never get to see
sploid.gizmodo.com,The Rocky Mountains Painted With the Colors of Fall Are a Treat For Your Eyes
sploid.gizmodo.com,Here Are Some of the Most Beautiful Shots in Film History
sploid.gizmodo.com,This incredible intergalactic game is a sci-fi fan dream
sploid.gizmodo.com,How Would a Real Space Elevator Work and Is It Even Possible to Build?
sploid.gizmodo.com,Biking Through Portals Like This Would Be So Freaking Sick
sploid.gizmodo.com,This video shows how Japan is a mystical world set in modern times
sploid.gizmodo.com,I'm Completely Hypnotized by These Strutting Randomly-Generated Monsters
sploid.gizmodo.com,"Japan keeps ignoring World War II surrender terms, builds carrier"
sploid.gizmodo.com,Comic book God Stan Lee explains his beef with Superman
sploid.gizmodo.com,10 delicious ways countries around the world cook their steaks
sploid.gizmodo.com,Watch a super genius honey badger break out of all kinds of cages
sploid.gizmodo.com,There’s Something Super Eerie About Watching Thunderstorms Unfold in Black and White
sploid.gizmodo.com,The Pilot of This Camera Drone Has Mad Skills
sploid.gizmodo.com,I Feel Like I'm a Part of This Jazz Band Captured With a Depth-Sensing Microsoft Kinect Camera
sploid.gizmodo.com,It's impossible to tell the difference between real life and video games
sploid.gizmodo.com,There'll Be Something in Your Eye as You Watch These Kids Experience Zero-Gravity
sploid.gizmodo.com,Our universe may be the byproduct of a dead star in another universe
sploid.gizmodo.com,Artificial Intelligence Directed a Music Video and the Results Will Melt Your Eyes
sploid.gizmodo.com,Can you use your nipples to unlock your iPhone 5S? Look at this guy
sploid.gizmodo.com,Awesome time-lapse shows the complete disassembly of a U-2 Dragon Lady spy plane
sploid.gizmodo.com,A secret room behind a bookshelf is cool until a stranger lives inside
sploid.gizmodo.com,"The movies of Quentin Tarantino and the films he's influenced by, side-by-side"
sploid.gizmodo.com,I'm Not Sure Who Won This Octopus vs Eel vs Human Fight
sploid.gizmodo.com,How the 1940s Superman Cartoon Changed Eveything
sploid.gizmodo.com,New game lets people watch Ellen Page naked from every angle
sploid.gizmodo.com,Beyond Gorgeous Video Shows the Making of a Damascus Steel Sword
sploid.gizmodo.com,Watch the Grand Canyon Fill With Clouds in This Timelapse of a Rare Weather Phenomenon
sploid.gizmodo.com,Watch a Pack of Adorable Arctic Fox Pups Destroy a Documentary Filmmaker's Camera
sploid.gizmodo.com,Watch a Furby Cry Tears of Smoke While It Burns to Hell From the Inside
sploid.gizmodo.com,Next season Sunday football Matrix-style replays will look awesome
sploid.gizmodo.com,"YouTube Forgot to Send This Guy His Award, So He Made His Own"
sploid.gizmodo.com,Scientists discover flies can think ergo they're assholes on purpose
sploid.gizmodo.com,Watching a ship launch to sea for the first time is so satisfying
sploid.gizmodo.com,"Holy crap, I can't believe this wasn't made with a computer"
sploid.gizmodo.com,You don't need to spend a fortune to have a wonderful wedding!
sploid.gizmodo.com,Why have salad or soup with croutons when you can use pizza croutons
sploid.gizmodo.com,"The View While Swinging 6,000 Feet In the Air From Hot Air Balloons Is Stunning"
sploid.gizmodo.com,"How Many Iconic Movies Can Your Brain Spot as 1,000,000 Frames Flash by in Five Minutes?"
sploid.gizmodo.com,Walking on a Lego-Covered Treadmill Might Be the Most Painful Thing Ever
sploid.gizmodo.com,The best GIFs of 2015 according to the Internet
sploid.gizmodo.com,Cowboy in a T-Rex Costume Is the Best Thing About This Rodeo
sploid.gizmodo.com,I Wish I Could Wake Up to Robots Getting Me Ready in the Morning Like This
sploid.gizmodo.com,Seeing people's faces get blown by air in slow motion is hilariously absurd
sploid.gizmodo.com,This Short Film Made By Pixar Animators in Their Spare Time Is Damn Good
sploid.gizmodo.com,This is how steel looks after being shot by a railgun
sploid.gizmodo.com,Check Out 20 Popular Movies Before and After Visual Effects Were Added
sploid.gizmodo.com,Drone Footage Shows a Pod of Dolphins Hunting a Shark
sploid.gizmodo.com,A boy letting go of his kite is a metaphor for life
sploid.gizmodo.com,Realistic game gets you right inside Gitmo to torture prisoners
sploid.gizmodo.com,This restaurant might have the best bread and butter in the world
sploid.gizmodo.com,Scientists discover a way to make real life lightsabers
sploid.gizmodo.com,This painting of an egg looks like it actually cracks when an artist draws over it
sploid.gizmodo.com,Japan's kinky sex hotels revealed!
sploid.gizmodo.com,Watch This Stump Grinder Basically Vaporize a Tree Stump
sploid.gizmodo.com,Which Hollywood superstar humiliated her sister for being fat?
sploid.gizmodo.com,"Climbing a 1,500-Foot Radio Tower Without Safety Gear Is Stupid for So Many Reasons"
sploid.gizmodo.com,This is how ESPN makes up stories: a step-by-step video analysis
sploid.gizmodo.com,Watch a guy get strapped on top of a flying airplane
sploid.gizmodo.com,You can upgrade your iPhone and iPad with the all-new iOS 7 right now
sploid.gizmodo.com,Why did David Bowie kidnap a baby in the movie Labyrinth?
sploid.gizmodo.com,The dramatic evolution and 9 obscure facts about The Simpsons
sploid.gizmodo.com,Watching a Master Woodworker Turn a Log Into a Bowl Is the Perfect Way to Relax
sploid.gizmodo.com,This Stabilized Footage of a Mountain Bike Ride Is So Dang Buttery Smooth
sploid.gizmodo.com,"Luke was going to become Vader, destroy the Rebels and become Emperor"
