source,title
sports.yahoo.com,Reports: Broncos trade Demaryius Thomas to Texans
sports.yahoo.com,Giants' backup QB Kyle Lauletta arrested after traffic incident in New Jersey
sports.yahoo.com,Jayhawks QB Bender has breakthrough moment in upset win
sports.yahoo.com,"Like him or not, Jordan Matthews came up huge in London"
sports.yahoo.com,Eagles acquire WR Golden Tate from Lions
sports.yahoo.com,College Basketball’s Top Frontcourts
sports.yahoo.com,Henri Jokiharju is everything the Blackhawks had hoped he'd be
sports.yahoo.com,"NFL to stage four 2019 London games, Jaguars among clubs"
sports.yahoo.com,"De'Aaron Fox questionable, Iman Shumpert out for Kings vs. Magic"
sports.yahoo.com,Lions trade Golden Tate to Eagles
sports.yahoo.com,John Elway on Demaryius Thomas trade: We want to play young WRs
sports.yahoo.com,Dana White says Mayweather-Khabib fight will only happen in UFC
sports.yahoo.com,Give and Go: Is Jimmy Butler Sixers' last chance at a star?
sports.yahoo.com,What Monday's pitching decisions mean for the White Sox in 2019
sports.yahoo.com,"Derek Carr, Jon Gruden able to run Raiders' attack with improved O-line play"
sports.yahoo.com,Things go from bad to worse for laughably bad New York Giants
sports.yahoo.com,Ian Rapoport: Houston Texans closing in on trade for Denver Broncos wide receiver Demaryius Thomas
sports.yahoo.com,Ian Rapoport: Ty Montgomery could be available for trade
sports.yahoo.com,San Antonio Spurs to retire Ginobili's jersey in March ceremony
sports.yahoo.com,"WATCH: With a new haircut, Kyrie Irving can't miss"
sports.yahoo.com,Morgan planning all-new 1960s-inspired sports car
sports.yahoo.com,Billy Beane: Starting pitching is A's top priority in MLB free agency
sports.yahoo.com,Report: Texans closing in on Demaryius Thomas trade
sports.yahoo.com,Ian Rapoport: The rise of Denver Broncos wide receiver Courtland Sutton hastened Demaryius Thomas trade
sports.yahoo.com,The Dodgers' Long History of Spotty Tactics Involving Cuban Prospects Is Under Federal Scrutiny
sports.yahoo.com,Bruins going with Halak again is a sign of the times
sports.yahoo.com,Return of Jamie Collins to Patriots may not be as wacky as it sounds
sports.yahoo.com,7 Things That Made Week 8 Awesome
sports.yahoo.com,Bears film breakdown: How a perfectly called and executed screen led to a 70-yard touchdown for Tarik Cohen
sports.yahoo.com,"Look out, Spurs! NFL to play a fourth London game in 2019"
sports.yahoo.com,Tennis: Kasatkina hangs on in Zhuhai despite Wang fightback
sports.yahoo.com,"Football Manager 2019 review: Bigger than ever, but better?"
sports.yahoo.com,Paul Maurice wasn't ready for the Finnish media
sports.yahoo.com,"Kings notes: Buddy Hield gets hot vs. Heat, De'Aaron Fox plays through pain"
sports.yahoo.com,Seahawks LB Kendricks gets eight-game suspension
sports.yahoo.com,NFL trade rumors: Texans finalizing deal for Broncos WR Demaryius Thomas
sports.yahoo.com,Citroen could revive third car for Loeb/Breen
sports.yahoo.com,Raiders CB Rodgers-Cromartie retires immediately
sports.yahoo.com,New York Giants quarterback Kyle Lauletta was arrested on his way to practice
sports.yahoo.com,Panthers add a practice squad quarterback
sports.yahoo.com,NFL decides Mychal Kendricks' 'indefinite' suspension will be eight games
sports.yahoo.com,Angels hire the Astros’ Doug White to be their pitching coach
sports.yahoo.com,Tom Brady: Aaron Rodgers inspires me
sports.yahoo.com,Big 12 adopts verification of Baylor Title IX reforms
sports.yahoo.com,Paul Pogba trolls himself in hilarious penalty spoof video
sports.yahoo.com,Trial begins for sports radio voice Craig Carton
sports.yahoo.com,"V&E, Skadden, Gibson Dunn Advise on $1.7B Eagle Ford Shale Acquisition"
sports.yahoo.com,Edmund's season over as Brit pulls out of Paris Masters
sports.yahoo.com,Lewis Hamilton has 'no idea' why Mercedes F1 team is now struggling
sports.yahoo.com,"Eden Hazard, Kylian Mbappe, Paul Pogba and the huge transfer deals that could happen in January"
sports.yahoo.com,"USWNT, Orlando striker could switch allegiance to England"
sports.yahoo.com,"Would Browns, Baker Mayfield entice Josh McDaniels?"
sports.yahoo.com,Celtics rookie Robert Williams ready if role increases
sports.yahoo.com,Ben Roethlisberger has a broken finger on left hand
sports.yahoo.com,Pelissero: 'Doesn't sound like' New Orleans Saints want to trade quarterback Teddy Bridgewater
sports.yahoo.com,Nagelsmann out to break Cup curse at future club Leipzig
sports.yahoo.com,Time for Penny Hardaway to transfer hoopla into hoop wins
sports.yahoo.com,ESPN makes revisions to Booger mobile
sports.yahoo.com,"Kevin Durant loves basketball more than ever, 'it's making my life better'"
sports.yahoo.com,The 2 Robbies: Reflecting on tragedy
sports.yahoo.com,‘I’m no Superman’ – Valverde insists Clasico win changes nothing
sports.yahoo.com,Former Leicester bosses pay tribute to chairman
sports.yahoo.com,CFTC Commissioner Urges Regulators to Approach Fintech With an 'Open Mind'
sports.yahoo.com,"Hamilton will dominate F1 for next five years, says ex-carting coach"
sports.yahoo.com,Jones forced to face unexpected England rebuilding job
sports.yahoo.com,Rodgers inspires me - Brady
sports.yahoo.com,Dolphins sign defensive tackle Ziggy Hood
sports.yahoo.com,Why Real Madrid have just two weeks to replace Julen Lopetegui
sports.yahoo.com,VIDEO: Player booked for proposing to girlfriend after scoring
sports.yahoo.com,"Mistakes, punches, quitting: A difficult year for Seminoles"
sports.yahoo.com,DeAngelo Hall: Washington Redskins are making me wish I hadn't retired
sports.yahoo.com,"Gasly: Rules over F1 racing a ""weird grey area"""
sports.yahoo.com,ICYMI: Warriors respond to Josh Duhamel’s criticism by grooving to remix of Fergie’s All-Star national anthem
sports.yahoo.com,"Centered by Fatherhood, Will Grier Is Enjoying the Final Year of His Winding College Career"
sports.yahoo.com,Real head to Africa to start Copa del Rey campaign
sports.yahoo.com,Doc Rivers Q&A: The Clippers Coach Speaks on Sacrifice and the Value of Giving Back
sports.yahoo.com,The Bills ran a play from 'Tecmo Super Bowl' that didn't work
sports.yahoo.com,Ganassi: Rosenqvist impressively close to Dixon in IndyCar test
sports.yahoo.com,Ahmed aiming to cement Twenty20 dominance against New Zealand
sports.yahoo.com,Tuesday’s Hot Clicks: Bills Fans Set New Record for Sex Toys on the Field
sports.yahoo.com,Nigeria's Obi Mikel has not quit international football
sports.yahoo.com,Giants backup quarterback Kyle Lauletta arrested for traffic offense
sports.yahoo.com,Debate: Can Lewis Hamilton break Michael Schumacher’s F1 records?
sports.yahoo.com,Five unorthodox sporting venues
sports.yahoo.com,Golden State Warriors' quest for three-peat starts tonight at Oracle Arena against the Oklahoma City Thunder
sports.yahoo.com,'A Dirty Play by a Dirty Player': The Brewers Have Had It With Dodgers Star Manny Machado
sports.yahoo.com,"Jackie Bradley, Jr.’s grand slam keys 8-2 Red Sox win over Astros in ALCS Game 3"
sports.yahoo.com,Manny Machado Called 'Dirty' by Brewers After Collision With Jesus Aguilar
sports.yahoo.com,New England Patriots head coach Bill Belichick on Chicago Bears linebacker Khalil Mack: I'm not putting him in Lawrence Taylor's 'class'
sports.yahoo.com,Chili Davis after being ousted by Cubs: 'There were multiple players in there I didn't connect with'
sports.yahoo.com,Should you be worried about Royce Freeman and Phillip Lindsay in Week 7?
sports.yahoo.com,Libya 2 Nigeria 3: In-form Ighalo fires Super Eagles to Group E summit in Sfax classic
sports.yahoo.com,What must Dallas Cowboys do to overtake Washington Redskins and Philadelphia Eagles in NFC East?
sports.yahoo.com,Report: Sixers turned away Suns' trade offer for T.J. McConnell
sports.yahoo.com,"New York Giants owner John Mara: Wide receiver Odell Beckham Jr. needs to do more playing, less talking"
sports.yahoo.com,Red Sox' 8-6 win over Astros in Game 4 of ALCS marred by interference call
sports.yahoo.com,What's the future of the Seattle Seahawks after owner Paul Allen's passing?
sports.yahoo.com,A fan snuck into the Octagon during the UFC 229 brawl to check on Conor McGregor
sports.yahoo.com,Will high risk lead to high reward? How Danny Ainge's bold moves made Boston a title contender
sports.yahoo.com,"Live stream: Here's where to watch Boston Red Sox vs. Houston Astros, Game 3 of ALCS"
