source,title
tampa.cbslocal.com,Malcolm Jenkins: ‘Darnold Checks All The Boxes You Want From A Rookie’
tampa.cbslocal.com,2018 Kids Rock Science STEM Event
tampa.cbslocal.com,Here’s How To Stop Facebook From Sharing Your Data
tampa.cbslocal.com,(AUDIO) Comedian/Author Steve Melia Shares What It's Like To See All 162 Of His Favorite Baseball Team's Games In One Season
tampa.cbslocal.com,Cat Lost During Hurricane Reunited With Owner 14 Years Later
tampa.cbslocal.com,"Bitcoin Blockchain Contains Child Porn And Using It Could Be Illegal, Study Says"
tampa.cbslocal.com,The Latest: Feds Send 20 More ATF Agents to Chicago
tampa.cbslocal.com,NHL Cancels Games Through Dec. 14th; All Star-Weekend Cancelled As Well
tampa.cbslocal.com,"Impaired Driver Mistakes Jail Booth For Drive-Thru, Orders Breakfast"
tampa.cbslocal.com,Male Birth Control Pill Found To Be Safe And Effective By Study
tampa.cbslocal.com,"Katey Sagal Talks Superior Donuts, Married With Children & Music"
tampa.cbslocal.com,Is Secondhand Marijuana Smoke Dangerous? Biologist Says Yes
tampa.cbslocal.com,(AUDIO) University Of Tampa Baseball Coach Joe Urso Talks To The Babe About UT’s Latest National Title
tampa.cbslocal.com,"Vegans Protest Restaurant, So Chef Carves Deer In Front Of Them"
tampa.cbslocal.com,Parents Turn In Son To Stop School Shooting Plot In Michigan
tampa.cbslocal.com,Lockheed Martin Receives Patent For ‘World Changing’ Fusion Reactor
tampa.cbslocal.com,Social Media Rushes to Define Trump’s ‘Covfefe’ Tweet
tampa.cbslocal.com,New Stem Cell Treatment Gives Blind Patients Ability To Read
tampa.cbslocal.com,UNICEF Says 17 Million Babies At Risk From Toxic Air
tampa.cbslocal.com,Mark Cook Of Pewter Report: Clayborn’s Injury Is And Isn’t A Big Deal
tampa.cbslocal.com,$75 Speeding Ticket Goes All The Way To State Supreme Court
tampa.cbslocal.com,Madonna’s Emotional Speech on Feminism Earns Props from Gaga
tampa.cbslocal.com,Ex-Sandusky Attorney Facing Sentence in $767K Client Theft
tampa.cbslocal.com,(PODCAST) On the Rox: 5 NFL Teams that May Flounder & 5 New Tinder-Like Apps
tampa.cbslocal.com,The Latest at CES: Skip the Dressing Room to Try Gap Clothes
tampa.cbslocal.com,The Latest: Florida Democrats Call for Emergency Gun Bill
tampa.cbslocal.com,Mr. Know-It-All Marlins Fire Sale Extra Extra … The Rays got hosed
tampa.cbslocal.com,Lightning Say Stamkos Won’t Be Traded Before NHL Deadline
tampa.cbslocal.com,Rays Report: The Rays Walk Off in 12 with the Wild Card Lead
tampa.cbslocal.com,"34 Percent Of LinkedIn Profiles Lie A Little, 10 Percent Lie Completely, Study Finds"
tampa.cbslocal.com,Viewer’s Guide: GOP Debate About Trump vs. Everyone Else
tampa.cbslocal.com,The Latest: Warriors Beat Cavs 129-120 to Win NBA Title
tampa.cbslocal.com,The Latest: Co-Owner of Chicago Cubs to Meet with Trump
tampa.cbslocal.com,Police: Man Tries To Bring Nearly 30 Snakes On Plane
tampa.cbslocal.com,The Latest: Clinton Says US Faces Challenges in Terror Fight
tampa.cbslocal.com,Giant Blowout: NL Routs AL 8-0 In All-Star Game
tampa.cbslocal.com,"LOCASH Talks Keith Urban Phone Call, Almost Quitting And ACM Awards Nominations"
tampa.cbslocal.com,"The Latest: Harvey’s Effects May Reach Alabama, Florida"
tampa.cbslocal.com,WATCH: Patrick Mahomes Leads Fans In Singing ‘Sweet Caroline’ During Rout Of Bengals
tampa.cbslocal.com,Ashlie Atkinson Talks ‘One Dollar’ On CBS All-Access
tampa.cbslocal.com,Florida Man Returns Home To Find Neighbor Claimed Half His Driveway With Cinder Block Wall
tampa.cbslocal.com,73rd Tony Awards To Be Broadcast Live From Radio City Music Hall
tampa.cbslocal.com,Bob Newhart Returns On A New Episode Of ‘The Big Bang Theory’
tampa.cbslocal.com,Naked Man Swims Among Sharks At Toronto Aquarium
tampa.cbslocal.com,35 States Ask FCC To Allow New Technology To Block Spoofed Robocalls
tampa.cbslocal.com,Cancer Survivor Says Store Manager Asked Him To Cover Disfigured Face
tampa.cbslocal.com,Man Stabbed At Haunted House After Friend Mistakes Knife For Prop
tampa.cbslocal.com,Doctors Warn Of C-Section ‘Epidemic’ As Global Rates Double
tampa.cbslocal.com,Sheriff’s Deputy Says He Was Served Bleached Burritos At Taco Bell
tampa.cbslocal.com,"Key Ingredient For Life On Earth Came From Outer Space, Study Reveals"
tampa.cbslocal.com,Passengers Safe After Allegiant Air Flight Makes Emergency Landing
tampa.cbslocal.com,Ian Eagle: ‘Steelers Right Back In AFC North Race If They Win’
tampa.cbslocal.com,Nora Krug Confronts Her German Roots In ‘Belonging’
tampa.cbslocal.com,"WSJT Smooth Jazz, 94.1-HD2"
tampa.cbslocal.com,Can The Golden State Warriors Three-Peat?
tampa.cbslocal.com,‘Creepy Skull’ Spotted In Hurricane Michael Satellite Imagery
tampa.cbslocal.com,SHOWTIME To Premiere ‘The Family Business: Trump And Taxes’ On Sunday
tampa.cbslocal.com,Cow Goes Viral As Backseat Passenger
tampa.cbslocal.com,"Fantasy Football: Start Andy Dalton, Jamaal Williams And Kenny Stills In Week 1"
tampa.cbslocal.com,Corey Chavous: ‘Key For Penn State Is Getting Haskins Off Of His Spot’
tampa.cbslocal.com,Police Bust Weekly Mahjong
tampa.cbslocal.com,Louisiana Mayor Reverses Controversial Nike Ban
tampa.cbslocal.com,Best Botanical Gardens In Tampa Bay
tampa.cbslocal.com,Former WWE Wrestler Torrie Wilson Goes On Twitter Rant About TSA Pat Down
tampa.cbslocal.com,"Powassan Virus: New, Deadly Tick Spread Disease Scaring Doctors"
tampa.cbslocal.com,Former Boxer Oscar De La Hoya Says He’ll Run For President In 2020
tampa.cbslocal.com,Man Dies After Accidentally Impaling Himself With Lance At Medieval Festival
tampa.cbslocal.com,Best Bars For Singles In Tampa Bay
tampa.cbslocal.com,Texas Mayor Shoots & Kills Mini-Horse Killing Alligator
tampa.cbslocal.com,DFS Week 5: Aaron Rodgers Primed For Big Day Against Struggling Lions
tampa.cbslocal.com,NASA’s Planet-Hunting Telescope Discovers Two Distant Planets
tampa.cbslocal.com,2017 Inspired DIY Halloween Costumes
tampa.cbslocal.com,Hillary Clinton Makes Surprise Appearance On ‘Murphy Brown’ Premiere
tampa.cbslocal.com,More Stars Announced For ‘Stand Up To Cancer’ Telecast
tampa.cbslocal.com,VIDEO: Northern Lights Dazzle Skies Over Arctic Circle
tampa.cbslocal.com,Florida Grandma Pops Out Dentures To Scare Off Naked Trespasser
tampa.cbslocal.com,Best Volunteer Opportunities For Animal Lovers In Tampa Bay
tampa.cbslocal.com,"Man Loses $1,300 In Supermarket, Good Samaritan Returns It"
tampa.cbslocal.com,Lions Eat Group Of Suspected Rhino Poachers In South Africa
tampa.cbslocal.com,Applebee’s Waitress Told ‘We Don’t Tip Black People’
tampa.cbslocal.com,Best Places In Tampa Bay To Watch The Sunset
tampa.cbslocal.com,Best Places For A Fall Marriage Proposal In Tampa Bay
tampa.cbslocal.com,Cedric The Entertainer On “The Neighborhood” & Career
tampa.cbslocal.com,Louisiana Water System Tests Positive For Brain-Eating Amoeba
tampa.cbslocal.com,Packers Fan Creates GoFundMe Campaign To Pay Clay Matthews’ Fines
tampa.cbslocal.com,Baby Shark Found In A Beach Garbage Can
tampa.cbslocal.com,Best Places For Picking Fresh Fruit In Tampa Bay
tampa.cbslocal.com,Tampa Bay Rays Unveil Plans For New Stadium
tampa.cbslocal.com,Flight Delayed After Woman Brings Emotional Support Squirrel On Plane
tampa.cbslocal.com,Best Language Classes In Tampa Bay
tampa.cbslocal.com,Best Fall Sports Leagues For Kids In Tampa Bay
tampa.cbslocal.com,Best Things To Do Labor Day Weekend In Tampa Bay
tampa.cbslocal.com,Best Sporting Goods Stores In Tampa Bay
tampa.cbslocal.com,Study: Millennials Are Causing U.S. Divorce Rates To Plummet
tampa.cbslocal.com,Best Improv Comedy In Tampa Bay
tampa.cbslocal.com,Police: Man Tries To Drown Wife In Dog Bowl After Fight Over Frozen Pizza
tampa.cbslocal.com,Bartolo Colon Passes A Milestone In Midst Of A Tough 2018 Season
tampa.cbslocal.com,Goldman Sachs Asks ‘Is Curing Patients A Sustainable Business Model?’
tampa.cbslocal.com,Google+ To Shut Down Amid Security Bug
tampa.cbslocal.com,Best Bars With Ladies’ Nights In Tampa Bay
