source,title
techvibes.com,General Fusion Secures $49.3 Million to Transform Clean Energy
techvibes.com,AI for Earth: Microsoft’s Most Compelling Environmental Projects
techvibes.com,Assent Compliance Announces $130 Million Growth Equity Investment
techvibes.com,Nintendo and Actua Partner to Bring Educational Gaming Programs Across Canada
techvibes.com,The Time is Right: FemaleForce Brings Together Canada’s Leading Entrepreneurial Spirits
techvibes.com,Government of Canada Launches Digital Academies
techvibes.com,From Engineering to a Consumer Brand: Thalmic Labs is now North
techvibes.com,Drake Joins Esports Organization 100 Thieves as Co-owner After Series A
techvibes.com,"TD Announces Investments in Creative Destruction Lab, Cleantech, AI, Fintech and More"
techvibes.com,Canada Invests $25 Million into the Creative Destruction Lab
techvibes.com,"Funding Roundup: Finn AI, Foxquilt, Alliance Magnesium, exactEarth"
techvibes.com,Dun & Bradstreet Cloud Innovation Center an Anchor of Vancouver’s Downtown Tech Community
techvibes.com,Five Reasons to Hire Summer Interns – and Why You Need to Make Your Mind up by January
techvibes.com,"Shaw, Telus, Novus: The Complete Guide to Selecting Your Internet Provider in Vancouver"
techvibes.com,Six Technology Trends That Will Have the Greatest Impact on Canada in 2015
techvibes.com,Israeli Crowdfunding Giant to Open Office in Canada
techvibes.com,"Seven Tips from Bruce Croxon on How to Survive Ups, Downs of Entrepreneurship"
techvibes.com,"Maker of ‘Smart Clothing,’ OMsignal a Finalist for Startup of the Year"
techvibes.com,Seven Interesting Facts You Probably Didn’t Know About Canadian Entrepreneur Stewart Butterfield
techvibes.com,Car2Go Reaches 1 Million Members with Vancouver Leading Canadian Markets
techvibes.com,Hubdoc Looks to Take Accounting Automation to the Next Level
techvibes.com,Koho Set to Disrupt Canada’s Big Five Banks
techvibes.com,Offshore Development for Startups: The Five Pillars of Success
techvibes.com,Equity Crowdfunding Dominates Discussion at Canadian Crowdfunding Summit
techvibes.com,Everyone Already Knew Tim Cook Was Gay. That Doesn’t Make His Coming Out Any Less Significant
techvibes.com,"Netflix Canada Has Less Content Than in US, Yes – But It’s Better Quality"
techvibes.com,Documenting SR&ED in an Agile World
techvibes.com,BlackBerry: Here’s What Went Wrong with BBM for Android and This is How We’re Fixing It
techvibes.com,"CRTC Fines Telelisting $260,000 for Breaking Unsolicited Telecommunications Rules"
techvibes.com,50 of Today’s Most Innovative and Fastest-Growing Technology Companies in Canada
techvibes.com,Canada Has a Disease Called Risk-Aversion and It’s Going to Take a Cultural Shift to Propel Us Forward
techvibes.com,Not So Viable After All: North America’s First Vertical Urban Farm Files for Bankruptcy
techvibes.com,"Revvly Cofounder Saadia Muzaffar on Scaling, Validation, and the Lonely World of Startups"
techvibes.com,Player-to-Fan Platform Shnarped to Help Santa Reward Fans This Year
techvibes.com,"BlackBerry’s QNX Still Dominates Car Market, but For How Much Longer?"
techvibes.com,"How Canada’s Privacy Laws Differ from Those in US, Europe"
techvibes.com,Customers ‘Shocked’ by Shaw Hiking Internet Prices
techvibes.com,Online Retailer Everlane to Expand into Canada
techvibes.com,Wagepoint Raises $2 Million Seed Round to Expand US Presence and Product Lines
techvibes.com,Easy Buzzer Launches New Front Door Intercom Service for Condo Residents
techvibes.com,"PwC Names Canada’s Innovator of Year, Highlights 10 Up-and-Coming Tech Companies"
techvibes.com,Tangerine Becomes First Canadian Bank to Offer Clients E-Signing on Mobile Devices
techvibes.com,Tea-Dispensing Robot Wants to Give Consumers a JOLT at Touch of a Button
techvibes.com,MaRS Announces Women in Cleantech Challenge Finalists
techvibes.com,Strongbody Apparel Uses Nanotechnology from Ocean to Make Next Generation of Activewear
techvibes.com,Flatbook Aims for Consistency as Growing Hospitality Brand in Emerging Sharing Economy
techvibes.com,Ladies Learning Code Wants Your Help to Bridge the Digital Divide for Youth
techvibes.com,Rogers Opens Calgary’s First Tier III Certified Data Centre
techvibes.com,"Chef’s Plate Raises Seed Round, Aims to Put Canadians Back in Their Kitchens"
techvibes.com,Mosaic Manufacturing Innovates 3D Printing by Combining Multiple Materials
techvibes.com,"BC Has Canada’s Highest Percentage of Households with Internet Access, StatsCan Says"
techvibes.com,Beyond the Rack’s Yona Shtern Shares Advice for Entrepreneurs at Accelerate MTL 2012
techvibes.com,"Vancouver to Open Technology and Social Innovation Centre to Support Entrepreneurs, Startups"
techvibes.com,A Simple Guide for Canadians to Legally Enjoy Content from US Netflix: 2014 Edition
techvibes.com,Government of Canada Releases New Digital Standards
techvibes.com,The Best Cloud Accounting Options for Your Startup
techvibes.com,"Risk, Mentorship, and Balance: The Three Pillars of Entrepreneurial Success"
techvibes.com,"Square Announces Permanent Office in Waterloo, Hiring Team of 30 Engineers"
techvibes.com,Kepler Raises $16 Million to Launch Nanosatellites into Orbit
techvibes.com,54-Hour Hackathon Gives Participants Crash Course in Hardware Startups
techvibes.com,Enflick’s TextNow Expands Mobile Voice and Data Services with New LTE Phone
techvibes.com,Google And Actua Dedicate $1.5 Million to Engage Canada’s Youth in Computer Science
techvibes.com,Shafin Diamond Tejani Named BC Angel Investor of Year
techvibes.com,Biglaw Needs to Trim Some Fat and Legaltech is the Profession’s New Personal Trainer
techvibes.com,Air Canada to Charge $5 an Hour for In-Flight Wifi
techvibes.com,ING Direct the First Bank to Launch Remote Cheque Deposit for All Customers
techvibes.com,Canadian City Named One of World’s Most Intelligent Communities in 2015
techvibes.com,"Nexalogy Looks to Harness Big Data, Filter It into Actually Useful Insight"
techvibes.com,LNG Studios Says This 3D Scanning Technology Could Change Real Estate Game in Canada
techvibes.com,How Far 3D Printing Came in 2014 – And Where It’s Headed This Year
techvibes.com,Toronto Startup Field ID Acquired by Master Lock Canada
techvibes.com,Triggerfox Offers New Way for Professionals to Build and Manage Network of Contacts
techvibes.com,A Founder’s Open Thank You Letter to Early Adopters and Life Givers
techvibes.com,The Ins and Outs of Granting Equity to Your Tech Startup All Star Team
techvibes.com,"Consumers Order Boxes of Poop Online, Shocked to Receive Boxes of Poop in Mail"
techvibes.com,Simply Laundry Enables Customers to Drop Dry Cleaning Off in Their Own Building
techvibes.com,"For Employer of Year Finalist Shopify, Being a Great Place to Work is About More Than Just Perks"
techvibes.com,Syntronic Opens First North American R&D Centre in Ottawa
techvibes.com,Becoming an Innovator: How to Bring New and Original Ideas into This World
techvibes.com,"Frank & Oak Named Among World’s Most Innovative Retail Companies Alongside Alibaba, Pinterest"
techvibes.com,The Four Biggest Stumbling Points in Running a Crowdfunding Campaign
techvibes.com,"Stephen Lake, Who Started 2013’s Startup of the Year, Up for Entrepreneur of the Year in 2014"
techvibes.com,Microsoft Announces New Toronto Headquarters and $570 Million in Investments
techvibes.com,Another Dragons’ Den Deal Dies in Due Diligence
techvibes.com,The Four Biggest Problems I Have with This Kind of Startup Pitch Competition
techvibes.com,Mojio Launches Open-Platform Cellular Device That Connects Your Car to the Internet of Things
techvibes.com,"SweetIQ Helps Retailers Turn Online Searches into Offline Sales, Including Some Big Brands"
techvibes.com,Canadian Government Announces Which Startup Accelerators Will Get Funding Under CAIP
techvibes.com,Canadians Break Record for Most Selfies Taken in One Hour
techvibes.com,Canadian Entrepreneur Named ‘Billionaire-to-Be’ with Net Worth of $650 Million and Growing
techvibes.com,Netflix Explains Why Its Canadian Content Library is So Different from the US
techvibes.com,Four Canadian Companies Join ZDG’s International Incubation Centre in Ottawa
techvibes.com,"Telus Rebrands Public Mobile, Changes All Plans, Only Rips Customers off a Little"
techvibes.com,Coinsquare’s Groundbreaking New Relationship with BMO
techvibes.com,Five Startups in Canada Trying to Disrupt the Hockey Industry
techvibes.com,"Edinburgh Street Fight Caught on Google Maps, Promptly Taken Down"
techvibes.com,Three Canadian Cities Make List of Top 10 Smartest North American Cities
techvibes.com,"Canadian Startup Nextwave Lands $500,000 to Bring for Smart Messaging Platform to Market"
techvibes.com,"Rogers Exec Said He Wishes He Could Block Streaming Services Like Netflix, Company Denies It"
techvibes.com,On the Relentless Permeation of Technology and the Lines It Continues to Blur
