source,title
theage.com.au,"Justice delayed, justice denied as OPP loses control of rape cases"
theage.com.au,Who should you vote for in the Victorian election based on what matters to you most
theage.com.au,Catholic Church set to be sued by dozens of victims of clerical abuse
theage.com.au,Two dead after suspected family shooting near Mildura
theage.com.au,"I'm all for religious education, just not Matthew Guy's version"
theage.com.au,"'Grotesque attack': Cyclist sideswiped, thrown from bike in road rage incident"
theage.com.au,Massive fee hike for trucks at Port of Melbourne prompts consumer warning
theage.com.au,Choosing Bombers was a close call: Shiel
theage.com.au,New factory to make Morwell 'electric car capital' as Labor eyes marginal seat
theage.com.au,Banned Murray given rookie spot as Pies cut five
theage.com.au,Where are our mates? Online series takes aim at undercover ticket inspectors
theage.com.au,"Fifteen minutes of fame for locals Yucatan, Sound Check"
theage.com.au,Why Matthew Guy wanted to keep his religion in state schools plan quiet
theage.com.au,Langford leaves Hawks and AFL with year to go on contract
theage.com.au,Panama-based company ordered to pay $4.5m for Stawell tyre clean-up
theage.com.au,Essendon vow to reduce reliance on pokies
theage.com.au,Greens float plan to make the Yarra River swimmable again
theage.com.au,Coroner calls for gas bottle safety valves after fatal truck blast
theage.com.au,"Thinkin' Big fares well in barrier draw for Derby, Weir is out of luck"
theage.com.au,"Col Sylvia, a larrikin life cut short"
theage.com.au,"Man who held up couples at secluded spot in 1980s admits murder, rape"
theage.com.au,North to play Essendon or Richmond on Good Friday
theage.com.au,Police dragged feet as rapist allegedly plotted to kill teen victim
theage.com.au,Victorian minister Martin Foley in scuffle with angry protester
theage.com.au,"'I need him involved': Guy, Morrison yet to connect on campaign trail"
theage.com.au,Waller out to divide and conquer Cup field with borderline pair
theage.com.au,Yucatan rides again: Cup favourite to race under original name
theage.com.au,"The gospel, according to Matthew, is what kids and true believers need"
theage.com.au,Large marijuana crop discovered metres from Kew primary school
theage.com.au,Magic Circle 'not a V8 but a powerful diesel' suited to Flemington
theage.com.au,Gai's hopes for Runaway rise as several Cup hopes fall by wayside
theage.com.au,"Whitecross, Lovell delisted by Hawks"
theage.com.au,RV surplus up and wagering revenues lift as drive for gains continues
theage.com.au,Richmond to face Collingwood in second-round blockbuster
theage.com.au,Run a series at Flemington to qualify for the Melbourne Cup: Williams
theage.com.au,Coalition vows to reinstate religious instruction in state schools
theage.com.au,Heavy delays on West Gate Freeway after multi-car crash
theage.com.au,Gai has rider on stand-by in case of Derby Dee-light
theage.com.au,'I love this place': Andrews boards big red bus for trip to his roots
theage.com.au,Bourke Street accused James Gargasoulas fit to stand trial for murder
theage.com.au,"Bart's book: Cummings clocks 10,000 metres in search of Cup win"
theage.com.au,Teen threatened in one of two armed robberies in Ballarat
theage.com.au,Why your long service leave will change this week
theage.com.au,Diplomatico ready for 'awfully big jump' in class in the Coolmore
theage.com.au,Driver flees after horrifying hit on man in a wheelchair
theage.com.au,Yucatan trainer offers Cup favourite a chance to take name back
theage.com.au,"Heatwave set to sweep across Victoria, mercury to hit 40 degrees in the north"
theage.com.au,Woman shot and killed near Mildura
theage.com.au,Former AFL player Colin Sylvia dies in Mildura car crash
theage.com.au,Yucatan Ire confirms Melbourne Cup favouritism at Werribee
theage.com.au,Five AFL clubs awarded new 20-year licenses to operate pokies
theage.com.au,Off and racing: new-look Flemington open for business
theage.com.au,Forecast glitch left balloon crash pilot unaware of wind change: report
theage.com.au,"Lygon Street is changing, but it's not dying"
theage.com.au,"Gai lights up Flemington dark, and will shine brightly on Saturday too"
theage.com.au,Five in hospital after car and minibus collide in Werribee South
theage.com.au,Stay away: Guy fears infection from toxic feds
theage.com.au,Victorian state election 2018: Today's campaign at a glance
theage.com.au,"North East Link backed, but holes in economic case revealed"
theage.com.au,Coalition pledges $1 billion over 10 years for Victoria's country roads
theage.com.au,Know somewhere that's not gender equitable? Crowd mapping aims to help
theage.com.au,"Stacks of cash: Morrison splashes $154m on Great Ocean Road, Geelong"
theage.com.au,"Current crop very different, what chance some old Melbourne Cup magic?"
theage.com.au,"Worst day of career, says Weir after Humidor, Kings Will Dream injuries"
theage.com.au,Mental health royal commission must include drug and alcohol services
theage.com.au,Woman suffers critical burns in kitchen explosion
theage.com.au,Key Kangaroo Brown hobbled by hip surgery
theage.com.au,Humidor unlikely to run in Seppelt Wine Stakes: Weir
theage.com.au,Who should you vote for in the Victorian state election based on what matters to you most
theage.com.au,"Christopher Skase's widow auctions $100,000 of high life mementoes"
theage.com.au,Long way to go say Liberals after polling points to a clear defeat
theage.com.au,"Melbourne Cup favourite name change 'unacceptable', says O'Farrell"
theage.com.au,City fringe land to remain green as minister rejects $15m market plan
theage.com.au,Hayes hopes to avoid Cup penalty with Ventura Storm
theage.com.au,No thrills or spills from either party but that's not such a bad thing
theage.com.au,GWS Giants to face Adelaide Crows in Canberra
theage.com.au,Competing solar and fast rail schemes economically wasteful: report
theage.com.au,Bulldogs and Tom Liberatore see fit to commit
theage.com.au,How parents can help their children through VCE exams
theage.com.au,"No thrills and spills from either party, but that's not such a bad thing"
theage.com.au,Our cricketers can rise from the ashes
theage.com.au,Woman grabbed and dragged into laneway in terrifying CBD attack
theage.com.au,Trainer says Written By should be even shorter price favourite for Coolmore Stud Stakes
theage.com.au,"Killer who bashed woman with brick, golf club says he's 'deeply sorry'"
theage.com.au,Our super problem of living longer
theage.com.au,"Let sleeping Norms lie, says irate widow of Life. Be In It artist"
theage.com.au,"Cliffs could be better than Johannes, says Coolmore's Werribee boss"
theage.com.au,Shiel's relief as late deal seals him as a Bomber
theage.com.au,'I can't thank both clubs enough': Beams' joy for Magpie return
theage.com.au,Trade wrap: Who is in and who is out at every AFL club
theage.com.au,Scores of Rebel bikies descend on Melbourne only to be met by police lying in wait
theage.com.au,Two sisters went to visit their brother's grave and discovered he was gone
theage.com.au,"Bomber Thompson has breached bail, DNA found on seized ice, court told"
theage.com.au,'Move on': Student's court bid to reverse fail grade for dog project dismissed
theage.com.au,Gaff to stay at West Coast after turning down North offer
theage.com.au,Bus strike at state's largest bus company scheduled for Friday
theage.com.au,Yeo flies high to grab second West Coast best and fairest
theage.com.au,"GWS duo nominate new clubs, Dees shape as realistic destination for May"
theage.com.au,'Forced to walk the gauntlet': High Court threat to safe access zones
theage.com.au,Victims lose $50K in bitcoin scam in Melbourne's west
