source,title
theepochtimes.com,Death Row Inmate Rodney Berget Cracks Joke Just Minutes Before His Execution
theepochtimes.com,More Convictions in Rotherham As Asian Grooming Gangs Investigation Grows in England
theepochtimes.com,"Apple Gives Aging Macs, iPad Pros an Update in New York"
theepochtimes.com,Third Migrant Caravan Heads Toward Mexico as Second Caravan Gets Violent at Border
theepochtimes.com,Trump to Sign Executive Order Terminating Birthright Citizenship for Non-US Citizens
theepochtimes.com,Virginia Child Killed Chasing Her Dog Will Be Buried Together With Pet
theepochtimes.com,How a Young Monk Became Enlightened
theepochtimes.com,Rabbi of Tree of Life Synagogue Says Trump Is Welcome to Visit Shooting Site
theepochtimes.com,Air Quality Standards: An Ever-Changing Target
theepochtimes.com,Megyn Kelly Probably Won’t Get Full Payout for Leaving NBC: Report
theepochtimes.com,President Trump and First Lady to Visit Pittsburgh Synagogue
theepochtimes.com,Senate Legislation Planned to Alter Birthright Citizenship Following Trump Announcement
theepochtimes.com,"After Rejecting Offer, Migrant Caravan Demands Transport From Mexican Authorities"
theepochtimes.com,"German Leader Merkel to Exit as CDU Party Chief, Won’t Run in 2021 for Chancellor"
theepochtimes.com,"Bars Around the World Go Green, Drawing in Eco-Conscious Consumers"
theepochtimes.com,Man Charged With Burglarizing Jayme Closs’s Home Weeks After Her Disappearance
theepochtimes.com,"Videos of the Day: 5,200 Troops to Deploy to US-Mexico Border to Stop Migrant Caravan"
theepochtimes.com,"Camel Attacks Man at South Carolina Fair, Riders Terrified"
theepochtimes.com,Officials: Shots Fired Into Florida Republican Office by ‘Some Sick Person’
theepochtimes.com,Upsurge of Mysterious Polio-Like Cases in Some US States: CDC
theepochtimes.com,WikiLeaks’ Assange Says Ecuador Seeking to End His Asylum
theepochtimes.com,Indonesian Plane Hit Ocean at Hundreds of Miles per Hour
theepochtimes.com,‘Haunted:’ Halloween Short Film Shines Light on Real Monsters
theepochtimes.com,"Jewish Doctor, Nurses Tended to Pittsburgh Synagogue Shooter’s Injuries: Report"
theepochtimes.com,"New York Times Paints Trump as Peddler of Anti-Semitic Conspiracies, Cites No Evidence"
theepochtimes.com,NASA’s Supersonic Parachute Ready for 2020 Mars Mission
theepochtimes.com,North Carolina Toddler Mauled by Family Dog Later Dies in Hospital: Reports
theepochtimes.com,"Woman, 21, Publicly Caned for ‘Close Proximity’ to Boyfriend in Indonesia"
theepochtimes.com,Passenger Killed in Lion Air Disaster Sent Selfie to New Wife Minutes Before Crash: Reports
theepochtimes.com,"An Estimated 2,000 Children Traveling With Migrant Caravan Are in Desperate Need of Care"
theepochtimes.com,"Hurricane Oscar Strengthens, Expected to Track on Path to NE Atlantic"
theepochtimes.com,Overcoming Grief With Grace: How Forward Planning Can Make All the Difference
theepochtimes.com,A Taste of the Joseon Dynasty
theepochtimes.com,"Stony-Faced, Silent Synagogue Shooting Suspect Held Without Bond"
theepochtimes.com,Rabbi Vows Pittsburgh Synagogue Massacre ‘Will Not Break Us’
theepochtimes.com,"Military Deploys 5,200 Troops to Fortify Border"
theepochtimes.com,California Woman Dies After Undergoing Emergency C-Section to Save Daughter
theepochtimes.com,Lion Air Plane Crash: More Remains of Passengers Recovered
theepochtimes.com,Bring Out Your Inner Rock Star With These Boots
theepochtimes.com,"Woman Blows Herself up in Tunis, Wounding 15 People Including 10 Police Officers"
theepochtimes.com,‘Appalling:’ Protesters Interrupt Moment of Silence for Pittsburgh Synagogue Victims
theepochtimes.com,9th Child Dead From Flu-Like Adenovirus Outbreak at New Jersey Center
theepochtimes.com,Gab.com Goes Offline After Pittsburgh Synagogue Shooting
theepochtimes.com,‘Lake Honghu’ Revolutionary Opera Far From the Truth
theepochtimes.com,Princess Ayako of Japan Marries Commoner in Tokyo Ceremony
theepochtimes.com,"Reports: 5,000 Troops to Deploy to US-Mexico Border to Stop Migrant Caravan"
theepochtimes.com,Cornell Drops Exchanges With Chinese School Over Academic Freedom Issues
theepochtimes.com,WWF Demands Action as Wildlife Populations Fall 60%
theepochtimes.com,El Chapo Loses Last Minute Bid to Postpone Trial
theepochtimes.com,Why Kids (and Everyone) Need Magnesium
theepochtimes.com,Student Shot at Butler High School in North Carolina Dies
theepochtimes.com,"Migrant in Caravan Says He Was Convicted of Attempted Murder, Deported From US"
theepochtimes.com,Another Suspicious Package Addressed to CNN Intercepted in Atlanta: Reports
theepochtimes.com,Beat Autumn Anxiety With This 7-step Checklist
theepochtimes.com,Two Women Found Duct-Taped Together in NYC Identified as Saudi Sisters
theepochtimes.com,1 Migrant Dies as 2nd Group Tries to Force Entry Into Mexico
theepochtimes.com,Witnesses Fear Chinese Regime Murdering Uyghurs for Their Organs
theepochtimes.com,Six Killed as Venice Hit by Unusually High Tide
theepochtimes.com,Bolsonaro Pledges to ‘Change the Destiny of Brazil’ After Winning Presidency
theepochtimes.com,New York Times Slammed for Fictional Trump Assassination Story
theepochtimes.com,Hurricane Oscar Forms in Atlantic Ocean as Track Forecast Updated
theepochtimes.com,New Brazilian President Says He’ll Move Embassy in Israel to Jerusalem
theepochtimes.com,"Lion Air Crash: No Survivors Expected, Say Indonesia Officials"
theepochtimes.com,McConaughey Gives Back to First Responders in Texas Visit
theepochtimes.com,Trump Connects With Young Black Conservatives at White House Summit
theepochtimes.com,European Human-Rights Court Rejects Claim in Muhammad Insult Case
theepochtimes.com,Woman Holds Pet Slumber Parties at Animal Shelter
theepochtimes.com,Gunshots at ‘The Purge’ Halloween Party in California Nightclub Leave Seven Wounded
theepochtimes.com,Black Approval of Trump at Record 40 Percent in Rasmussen Poll
theepochtimes.com,Pilot Arrested for Trying to Bring Loaded Gun Onto Airplane
theepochtimes.com,"Government Agenda, Subsidies Drive Exponential Increase in Chinese Patent Filings"
theepochtimes.com,German SPD Leader Gives Merkel an Ultimatum After State Vote Losses
theepochtimes.com,Red Sox Beat Dodgers in Game Five to Win World Series
theepochtimes.com,Sir Charles Villiers Stanford’s ‘Mass Via Victrix (1914–1918)’ Premieres After 99 Years
theepochtimes.com,Soprano Sondra Radvanovsky Brings Down the House as Tosca
theepochtimes.com,Why We’re Unlikely to See an October Surprise
theepochtimes.com,6.1 Magnitude Earthquake Hits Off Coast of El Salvador
theepochtimes.com,Myths: Mapping Our Way Home
theepochtimes.com,Canadians Hold Vigil in Solidarity With Pittsburgh Synagogue Shooting Victims
theepochtimes.com,Alan Cheung
theepochtimes.com,Autos and Banks Help European Shares Rebound After Sell-Off
theepochtimes.com,Math Scores of High School Grads Hit 20-Year Low
theepochtimes.com,The Feeling That You’re Always Behind on Work
theepochtimes.com,Reports: Germany’s Merkel Prepares to Give up Party Job
theepochtimes.com,Police Identify Student Killed in Shooting at Butler High School
theepochtimes.com,Shipping Data Reflects Slowing Chinese Economic Growth
theepochtimes.com,NTD Inspired
theepochtimes.com,Suspect in Utah University Murder Was Sex Offender
theepochtimes.com,Jayme Closs Disappearance: Wisconsin Sheriff Seeks 100 Volunteers for Search Party
theepochtimes.com,"Tents Erected at Florida’s Tyndall Air Force Base, Struck by Hurricane Michael"
theepochtimes.com,"Warning From Down Under: Influence From China, Not Russia, Is Most Dangerous"
theepochtimes.com,EU Leaders Prepare Hardball Brexit Summit for UK Prime Minister Theresa May
theepochtimes.com,Roseanne Barr-Less Show ‘The Conners’ Has Much Lower Ratings in Premiere: Reports
theepochtimes.com,"Send US Military to Seal Up Border, Angel Mom Says"
theepochtimes.com,Melania Trump’s Plane Makes Emergency Landing; She Eventually Makes It to Event
theepochtimes.com,At Least 25 Earthquakes Strike Alaska in 24 Hours: USGS
theepochtimes.com,"Mass Shooting at College in Crimea Leaves 18 Dead, Over 40 Wounded"
theepochtimes.com,"In Photos: Trump Rally in Mesa, Arizona"
theepochtimes.com,Pompeo to Trump: Saudis Need ‘A Few More Days’ for Khashoggi Investigation
theepochtimes.com,The Media and Politicians Are Wrong on Both the INF Treaty and Saudi Arabia
