source,title
theprovince.com,Aidan's Cup gives sick kids the chance to ride super cars around Pitt Meadows track
theprovince.com,"Letters, Oct. 30: Surrey voters have been clear – they ..."
theprovince.com,"Canucks 5 Wild 2: Prized rookie Pettersson shoots, scores, even blocks shots"
theprovince.com,Kenneth Green: Trudeau government carbon-tax plan is rife with problems
theprovince.com,"Devils, 76ers owner going all in on sports betting promotion"
theprovince.com,Molokai: a break from the mainstream
theprovince.com,Calgary Stampeders need a victory in B.C. to finish first in West Division
theprovince.com,"Canucks Post Game: Pettersson's passion plays, Granlund's gritty game, Sutter's severe injury"
theprovince.com,"US West's abandoned mines hold danger and, for some, thrills"
theprovince.com,"Halloween can be deadly for pedestrians, traffic study says"
theprovince.com,"Still golden: Biles, Americans roll at world championships"
theprovince.com,More work needed to curb B.C.'s housing affordability crisis says CHBA BC
theprovince.com,"UPDATED: Canucks Game Day: Pettersson's potential, Nilsson's injury, another Granlund"
theprovince.com,AP FACT CHECK: Trump off track on birthright citizenship
theprovince.com,Chelsea coach fined for taunting Mourinho
theprovince.com,Settlement reached in Ohio case of stun-gunned black girl
theprovince.com,"Ben Kuzma: Recalled Bachman hasn't lost relentless drive, upbeat demeanour"
theprovince.com,Project 529 helps position Vancouver as world leader in fighting bike theft
theprovince.com,"'Not a Cold War situation': As West and Russia both hold military drills off Norway, NATO chief expects 'respectable' behaviour"
theprovince.com,"Gum, bottled water, pizza bagels want to be called 'healthy'"
theprovince.com,4 years of CFP rankings show importance of a good start
theprovince.com,"Mistakes, punches, quitting: A difficult year for Seminoles"
theprovince.com,Jayhawks QB Bender has breakthrough moment in upset win
theprovince.com,'It has to end': Trump says he will use executive order to end citizenship for children of non-citizens born on U.S. soil
theprovince.com,UGA's 'Hot Rod' Blankenship returns to where legend was born
theprovince.com,"Vancouver Weather: Mainly cloudy, with a slight chance of rain"
theprovince.com,Volkswagen profit rises despite emissions certification woes
theprovince.com,Recording Academy to honour Willie Nelson
theprovince.com,"Namaste plans to launch recreational dispensaries through Cannmart, Infinite Labz"
theprovince.com,Fourteen Vancouver Sun/The Province journalists win big at the Jack Webster Awards
theprovince.com,"Hilary Weston Writer's Trust non-fiction prize excerpt: 'If I made MVP, would my mother come back?'"
theprovince.com,St. John's to host Canada's final two qualifying games for basketball World Cup
theprovince.com,Rising from the ashes: Langley couple replaces classic car collection lost to fire last year
theprovince.com,B.C. securities regulator seeks another $7.2 million in assets in fraudster case
theprovince.com,Vancouver's Ignite Pizzeria chef named best traditional pie maker in Canada
theprovince.com,Canadian conceptual art pioneer remembers all the names he has known
theprovince.com,Progress? Gridlock? How midterm vote could affect US economy
theprovince.com,What the heck is Blockchain?
theprovince.com,"Mets throw a changeup, hire agent Brodie Van Wagenen as GM"
theprovince.com,New bus operators step in to replace 83% of Greyhound's lost routes
theprovince.com,Loto-Québec won't renew rent on Bell Centre loge
theprovince.com,Illinois defensive co-ordinator Hardy Nickerson resigns
theprovince.com,Theatre review: Sex with Strangers focuses on how online world meets real life
theprovince.com,Christie Blatchford: Fired UBC professor Steven Galloway suing woman who accused him of sexual assault
theprovince.com,Playoff turnover: 6 of 13 on CFP selection committee new
theprovince.com,US election integrity depends on security-challenged firms
theprovince.com,Gabriella's Kitchen enters into agreement to acquire Sonoma Pacific Distribution
theprovince.com,Pedestrian dies after being struck by bus in Delta
theprovince.com,Vancouver Giants come from behind win shows team's character
theprovince.com,"While Remembrance Day is about honour, it can trigger tough emotions for some veterans"
theprovince.com,World bronze medallist Gabrielle Daleman withdraws from second Grand Prix
theprovince.com,CAS clears candidate for controversial boxing body election
theprovince.com,How old is cacao? New research pushes back date
theprovince.com,"Former Audi CEO to be released, over 4 months after arrest"
theprovince.com,"If it's October, it must be Australia for Savannah McCaskill"
theprovince.com,Joey Bosa: Brother made right decision not to return to OSU
theprovince.com,Nebraska 'D' knows it must plug leaks to play with Buckeyes
theprovince.com,"Georgia back on track, ready for SEC East showdown vs Cats"
theprovince.com,"Column: Logano put it all on the line, as he should have"
theprovince.com,Syracuse looking up after getting ranked No. 22
theprovince.com,"Poor return: Packers, Montgomery look to get past fumble"
theprovince.com,"Back in Top 25, Virginia remains focused on winning division"
theprovince.com,Michigan's Chase Winovich calls Conor McGregor big brother
theprovince.com,"Don't look now, but it's another top-5 Alabama-LSU matchup"
theprovince.com,Wolfpack defence struggling after matchups with top offences
theprovince.com,Petersen backs Browning as Huskies seek offensive answers
theprovince.com,Purdue returns to cleanup mode after winning streak ends
theprovince.com,No. 2 Clemson 'a lot better' heading down the stretch
theprovince.com,Oklahoma coach Riley not interested in the NFL right now
theprovince.com,"Seahawks back from bye with Wright, Dickson practicing"
theprovince.com,Baylor QB Brewer in concussion protocol before Oklahoma St
theprovince.com,Duke women's PG Lambert to miss season after reinjuring knee
theprovince.com,Jackson State fires Hughes after less than 3 seasons
theprovince.com,Canadian ski cross racer Duncan retires months after Pyeongchang controversy
theprovince.com,Doeren: NC State WR Louis having season-ending ankle surgery
theprovince.com,"Rowling, Tolkien, Austen novels vie for bragging rights"
theprovince.com,Coach Urban Meyer says he'll be back at Ohio State next year
theprovince.com,Three 'pretty big' earthquakes reported in Pacific Ocean off Vancouver Island
theprovince.com,Actress Selma Blair say she has been diagnosed with MS
theprovince.com,"Browns' Jackson not pointing fingers, will 'help' offence"
theprovince.com,Svitolina and Pliskova win opening matches at WTA Finals
theprovince.com,J.J. Adams: Davies the star of Whitecaps' academy system pushing to enter new era
theprovince.com,"As Canadian oil discount reaches record highs, national energy regulator sets out plan for Trans Mountain"
theprovince.com,"Canucks Game Day: No Pettersson payday, lots of Boeser groin intrigue"
theprovince.com,"Ben Kuzma: Canucks goalies pulling out all stops to remain supportive, competitive"
theprovince.com,"Anne McMullin: Municipalities need to lower costs, speed up approvals, to tackle housing affordability"
theprovince.com,Run 'n' gun Thunderbirds open USports basketball campaign with Courtside festival Friday
theprovince.com,"Brock Boeser dealing with groin injury, Canucks recall Darren Archibald"
theprovince.com,"Ed Willes: QB 'brothers' armed for showdown with plenty on line for Lions, Eskies"
theprovince.com,Reality bites: Real Salt Lake sinks Whitecaps' season
theprovince.com,Canucks at Night: Good teams like the Jets teach lessons
theprovince.com,Ben Kuzma: Don't expect Marchand to pump Canucks' tires even with changing casts
theprovince.com,Patrick Johnston: Horvat gets a handle on face-offs by combining strength with Malhotra
theprovince.com,Fresh-faced T-Birds aim to bump off old foe to start volleyball season
theprovince.com,Lions look to clinch playoff spot in battle against Eskimos
theprovince.com,"B.C. teen gives away tickets to Ellen Degeneres show, plans O Canada welcome"
theprovince.com,IHIT seeks help in solving homicide of Sumeet Randhawa in Surrey
theprovince.com,"Giants drop second straight to Portland, but coach Dyck says he's pleased with progress"
theprovince.com,"Hard-nosed rusher Sutton is Buono's 'kind of guy,' should be key to Lions' playoff push"
theprovince.com,"Vandals cut down poles with chainsaw, cut power in PoCo"
