source,title
theverge.com,Apple iPad Pro and MacBook event live blog
theverge.com,"Apple’s new iPad Pro has Face ID, USB-C, and slimmer bezels than ever before"
theverge.com,The 5 biggest announcements from the Apple iPad and MacBook event
theverge.com,Apple’s new Mac mini includes six-core processors and a space gray finish
theverge.com,"Apple announces new MacBook Air with Retina display starting at $1,199"
theverge.com,Apple announces AMD Vega graphics options for MacBook Pro
theverge.com,The stakes for the new MacBook are much higher than for the iPad
theverge.com,Twitch doesn’t need to be YouTube
theverge.com,The new iPad Pro doesn’t have a headphone jack
theverge.com,James Patterson’s next novel will be released on Facebook Messenger
theverge.com,MacBook Air 2018: hands-on with Apple’s new ultra-thin laptop
theverge.com,iPad Pro: hands-on with Apple’s new all-screen tablet
theverge.com,Google wants to make its products more human
theverge.com,"iOS 12.1 coming October 30th with group FaceTime, dual-SIM support, and ‘beautygate’ fix"
theverge.com,Apple released the Apple Watch Series 4’s EKG feature today
theverge.com,The OnePlus 6T might be the company’s big break in America
theverge.com,Faraday Future loses EV pioneer amid layoffs
theverge.com,The new Apple Pencil 2 has gesture controls and charges wirelessly from the iPad Pro
theverge.com,Lenovo is now licensing Sony’s patents for its PlayStation VR copycat headset
theverge.com,Will Google’s homepage news feed repeat Facebook’s mistakes?
theverge.com,"Volkswagen, Intel, and Mobileye will launch a self-driving taxi service in Israel in 2019"
theverge.com,Ava DuVernay partners with Netflix for Prince documentary
theverge.com,Nintendo needs a heck of a holiday season to meet Switch sales goal
theverge.com,Your old Apple Pencil isn’t compatible with the new iPad Pro
theverge.com,Wisconsin’s $4.1 billion Foxconn boondoggle
theverge.com,"Pixel 3 XL glitch is causing a second notch to appear, but a fix is coming"
theverge.com,PS4 and Xbox One users can now stream college football through ESPN+
theverge.com,The new MacBook Air and Mac mini are made of 100 percent recycled aluminum
theverge.com,The Tundra PIE Pro is a pickup truck that makes Pizza Hut on the go
theverge.com,Why social media is friend to far-right politicians around the world
theverge.com,Twitter is thinking about killing the Like button — but don’t hold your breath
theverge.com,Red Dead Redemption 2 horse riding fails are tragically funny
theverge.com,"US tariffs could hit remaining Chinese goods, including tech products"
theverge.com,"Waze adds Pandora, TuneIn, and five other streaming services into app"
theverge.com,"iOS 12.1 is now available with group FaceTime, new emoji, and ‘beautygate’ fix"
theverge.com,The bizarre Justin Bieber burrito incident reminds us not to believe everything online
theverge.com,The Asus ZenFone 6 leaks with the most unsightly notch of all
theverge.com,Google is hosting a global contest to develop AI that’s beneficial for humanity
theverge.com,Amazon’s budget-friendly Fire tablet lineup is even cheaper this week
theverge.com,Apple’s new iPad Pros can charge an iPhone over USB-C
theverge.com,These headphones bring FM radio to your iPhone
theverge.com,Verizon service won’t work well with Apple’s dual-SIM setup for now
theverge.com,Microsoft Office is getting a dark mode for macOS Mojave
theverge.com,Uber introduces an Amazon Prime-style monthly subscription service
theverge.com,SoundCloud pulls controversial contract terms after Verge report
theverge.com,Apple’s redesigned MacBook Air is now available for preorder
theverge.com,RED Hydrogen One review: all hype
theverge.com,October Apple event 2018: the latest announcements from the keynote
theverge.com,OnePlus plans to have the first 5G phone in Europe
theverge.com,TanaCon organizer Good Times Entertainment files for bankruptcy
theverge.com,Gab.com goes down after GoDaddy threatens to pull domain
theverge.com,Early WiiMote prototype emerges with wires that let it plug into a GameCube
theverge.com,Audio-Technica makes its best-selling M50x headphones wireless
theverge.com,"Sony details all 20 PlayStation Classic games, including GTA, Resident Evil, and Metal Gear Solid"
theverge.com,Alexa skills come to the Nvidia Shield TV
theverge.com,Apple’s new iPad Pro is now up for preorder
theverge.com,OnePlus 6T announced with premium specs and in-display fingerprint reader
theverge.com,James Cameron’s Avatar sequels have finally moved on from Papyrus
theverge.com,"OnePlus 6T review: revised formula, same results"
theverge.com,Halloween is a scary night to be a pedestrian
theverge.com,Google begins rollout of Discover feed on US homepage
theverge.com,The Walking Dead just pulled its best switcheroo in years
theverge.com,"Texas voting machines are switching votes — but it’s bad design, not hacking"
theverge.com,Google Home will play music and sound effects when you read Disney storybooks
theverge.com,Sonos One coming in five limited edition colors for $229 on November 5th
theverge.com,Decoding images from the Golden Record
theverge.com,DJI’s new drone features swappable search and rescue accessories
theverge.com,Two more platforms have suspended Gab in the wake of Pittsburgh shooting
theverge.com,Why a government agency is spreading memes about dogs riding pigeons
theverge.com,Apple is investigating a report that illegal student labor was used to build Apple Watches
theverge.com,IBM will acquire open-source cloud software company Red Hat
theverge.com,China’s first attempt to reach orbit with a private space company failed
theverge.com,Blue Apron now sells its meal kits on Jet.com as competition grows
theverge.com,A new icon seemingly confirms that the next iPad Pro won’t have a home button
theverge.com,Walmart-owned Sam’s Club is opening a cashier-less store in Texas
theverge.com,What to expect at Apple’s October hardware event
theverge.com,Hive’s new Home View Outdoor security camera was designed by Yves Béhar
theverge.com,No Man’s Sky underwater update adds sea monsters and submarines
theverge.com,The true madness of a viral wing pricing scheme
theverge.com,Apple’s new iPad Pro keyboard magnetically attaches and includes two angles
theverge.com,Check out some of the best data visualizations from the Information is Beautiful awards
theverge.com,"Fallout 76 on the Nintendo Switch isn’t ‘doable’, says Bethesda"
theverge.com,Paypal bans Gab following Pittsburgh shooting
theverge.com,"RED’s Hydrogen One ‘holographic’ smartphone launches on November 2nd for $1,295"
theverge.com,This sensor will alert your Airbnb host if it thinks you’re having a party
theverge.com,Midnight Scenes are the perfect Halloween weekend bite-sized games
theverge.com,Smart Home Reviews
theverge.com,Google mandates two years of security updates for popular phones in new Android contract
theverge.com,"Tesla adds $1,000 to price tag of midrange Model 3 that was announced last week"
theverge.com,"Helm is a personal, private email server that won’t share your data"
theverge.com,Anonymous Microsoft and Amazon employees speak out on Medium
theverge.com,Netflix criticizes EU over ‘content quota’
theverge.com,How to view your notification history on Android
theverge.com,OnePlus is launching a new backpack alongside the OnePlus 6T
theverge.com,Peter Thiel associate named as ambassador to Sweden
theverge.com,Facebook may have knowingly inflated its video metrics for over a year
theverge.com,YouTube was down but now it’s back
theverge.com,"Sure, spinning bricks can work as a display"
theverge.com,Google Chromecast (2018) review
theverge.com,Apple ‘deeply apologetic’ for payment app phishing hacks in China
