source,title
theweathernetwork.com,'Classic' fall storm may dump snow in Alberta by week's end
theweathernetwork.com,Hungry squirrels go nuts over man's eco-friendly car
theweathernetwork.com,Freezing rain threatens Wednesday commute in southern Quebec
theweathernetwork.com,Why there may be thousands of stink bugs under your sofa
theweathernetwork.com,"The weather with a twist, tracking B.C.'s tropical punch"
theweathernetwork.com,"Heavy rainfalls, snow on the way for British Columbia"
theweathernetwork.com,"Heavy rain, foot-deep waters flood metro Vancouver roads"
theweathernetwork.com,"Multiple deaths reported as storms, high winds batter Italy"
theweathernetwork.com,"Quake hits near Tofino, B.C., active 2 months for tremors"
theweathernetwork.com,"In honour of national cat day, here are Canada's wildest"
theweathernetwork.com,Crafty critters carving up jack-o'-lanterns across Canada
theweathernetwork.com,Don't cringe: Every day is Halloween for these eerie insects
theweathernetwork.com,October rains frustrating potato harvest
theweathernetwork.com,Philippines evacuates coastal areas ahead of Typhoon Yutu
theweathernetwork.com,Big snow forces 3 hour closure of B.C.'s Coquihalla Highway
theweathernetwork.com,Canada's dry lakes and dust storms 'warning for planet'
theweathernetwork.com,How a near-perfect rectangle iceberg formed
theweathernetwork.com,World's best travel destinations include Manitoba
theweathernetwork.com,Discover hidden gems in Europe this winter
theweathernetwork.com,Mars InSight is a month out from its Seven Minutes of Terror
theweathernetwork.com,Fall hangs on in Ontario; milder but unsettled weather
theweathernetwork.com,Some apples now have trademark management companies
theweathernetwork.com,Self-driving cars may cause more pollution
theweathernetwork.com,IN PHOTOS: First real snowfall for many Ontarians
theweathernetwork.com,What's the dirtiest surface on a plane? You'd be surprised
theweathernetwork.com,The history of Halloween has harvest festival origins
theweathernetwork.com,"HALLOWEEN: Tricky threats for some, one widespread treat"
theweathernetwork.com,Long recovery for Pacific islands after deadly Typhoon Yutu
theweathernetwork.com,"Ontario faces salt shortage as winter nears, here's why"
theweathernetwork.com,Messy winter weather inbound to Quebec
theweathernetwork.com,Plastic art at Ripley's aquarium shines a light on pollution
theweathernetwork.com,Caterpillar orange stripe says a lot about upcoming winter
theweathernetwork.com,Mexicans recover after Willa's 'end of world' onslaught
theweathernetwork.com,How globalisation spreads infectious diseases
theweathernetwork.com,Trudeau gambles Canadians will take the long view on climate
theweathernetwork.com,Foundations are making climate change a bigger priority
theweathernetwork.com,Canadian lab may solve mystery of how life on Earth began
theweathernetwork.com,Don't blame cows on climate change
theweathernetwork.com,Renewable energy is Canada's giant employment opportunity
theweathernetwork.com,"'Scissors' make leaves fall from trees, here's how"
theweathernetwork.com,Trampolining fox greets mother and daughter
theweathernetwork.com,3-Day Severe Weather Outlook
theweathernetwork.com,Quick jump from summer to November in southern Ontario
theweathernetwork.com,For Science! Why are static shocks so bad during the winter?
theweathernetwork.com,"October has a stormy reputation to uphold, will it deliver?"
theweathernetwork.com,"Calgary digs out from 35+ cm storm, reinforcements called"
theweathernetwork.com,Deadly Yellowstone fire caused by vehicle: Report
theweathernetwork.com,"Snow is falling in Alberta, the biggest round is still ahead"
theweathernetwork.com,Indonesia in a race against time to save quake victims
theweathernetwork.com,"Strongest ridge in 60 years, what makes this so unusual?"
theweathernetwork.com,UPDATE: Officials increase Friday's tornado count to SIX
theweathernetwork.com,Protest erupts after B.C. refuses help in fire-stalked town
theweathernetwork.com,Tornado 101: What you need to know about staying safe
theweathernetwork.com,"Alberta: Long day on the roads, HUGE wallop of snow, 20+CM"
theweathernetwork.com,"Saskatchewan: 9 tornadoes in 2 days, close to YEARLY total"
theweathernetwork.com,"EF-2 tornado confirmed after FIERCE storms in Ont., Quebec"
theweathernetwork.com,It may be time to re-consider what's recyclable
theweathernetwork.com,"Florence leaves millions of poultry birds, 5,500 hogs dead"
theweathernetwork.com,Gordon the latest storm on a well-worn path to Canada
theweathernetwork.com,"Hong Kong, southern China clean up after deadly typhoon"
theweathernetwork.com,Major earthquake off Venezuela coast rocks capital
theweathernetwork.com,El Niño likely setting up for a winter comeback
theweathernetwork.com,"Powerful typhoon kills two, snarls transport in Japan"
theweathernetwork.com,A record no one wanted to break: St. John's snowy streak
theweathernetwork.com,Could a hurricane be the cause of Florida's red tide?
theweathernetwork.com,"Deadly, fast-spreading Cali wildfire nears Yosemite park"
theweathernetwork.com,"Nicknames mean a lot to Canadians, here's a list of the best"
theweathernetwork.com,"Death toll rises, grim image of post-Michael Florida emerges"
theweathernetwork.com,Europe battles one of most intense heat waves in history
theweathernetwork.com,Friday's eastern Ontario storm leaves one dead in Kingston
theweathernetwork.com,Trump pledges strong federal support to Florence-hit areas
theweathernetwork.com,How 2018 hurricane outlook compares to 2017's devastation
theweathernetwork.com,PHOTO: Giant Greenland iceberg can be seen from space
theweathernetwork.com,Ocala sinkhole situation worsens; numerous homes at risk
theweathernetwork.com,Whirlwind of lava spews from Hawaii's Kilauea volcano: WATCH
theweathernetwork.com,"Chris accelerates towards Newfoundland, risk of flash floods"
theweathernetwork.com,"After 51 hour heat streak, village sets new world record"
theweathernetwork.com,Southwest drought worsens as hot June weather arrives
theweathernetwork.com,"Fall 2018: Next 3 months of weather, plus winter sneak peek"
theweathernetwork.com,Coyote sightings leave Toronto residents shaken
theweathernetwork.com,Most powerful storm to hit Japan in 25 years leaves 11 dead
theweathernetwork.com,N.L. experiences 'one of the hardest' growing seasons ever
theweathernetwork.com,"Must see: How and why Toronto got so swamped, so fast"
theweathernetwork.com,'Bar code charts': See how hot Canadian cities are becoming
theweathernetwork.com,Catastrophic flooding hits Baltimore suburb: Surreal video
theweathernetwork.com,"Part of California is sinking, here’s where and why"
theweathernetwork.com,Scientists seek new ways to combat Florida's 'red tide'
theweathernetwork.com,Parts of B.C. receive yearly snowfall average in 72 hours
theweathernetwork.com,Landslide takes out a huge chunk of Route 30 in Pennsylvania
theweathernetwork.com,Manitoba's EF-4 strongest tornado this year in North America
theweathernetwork.com,Mystery deepens for glowing arcs in the sky known as 'STEVE'
theweathernetwork.com,Shocking Find: Central Africa is the lightning 'capital' of the world
theweathernetwork.com,Drought and extreme heat fuel wildfires in U.S. West
theweathernetwork.com,A world-renowned ski destination is losing its snow
theweathernetwork.com,Oklahoma issues new regional protocol to curb earthquakes
theweathernetwork.com,April snowiest month of Toronto's cold weather season
theweathernetwork.com,"Heavy rain, flooding possible this week along Texas coast"
theweathernetwork.com,"Japan struggles to restore water, flood death toll tops 200"
theweathernetwork.com,Lava bomb injures 23 tourists in Hawaii
theweathernetwork.com,"100-pound ice chunk clings to CN Tower, we do damage math"
