source,title
truthrevolt.org,Women’s March Leader Claims She’s Not Anti-Semitic by Tweeting Anti-Semite Rapper
truthrevolt.org,"Condi Rice Tells ‘The View’ She’s Pro-2A, Father Used Guns to Protect from KKK"
truthrevolt.org,Spontaneous ‘USA’ Chant During SOTU Speech Triggered Dems
truthrevolt.org,More Hollywood Hypocrisy: Heroic Feminist Natalie Portman Also Supporter of Child Sex Predator
truthrevolt.org,"Harvard, UC-Berkeley Among FIRE’s ’10 Worst Colleges for Free Speech 2018’"
truthrevolt.org,List of Companies No Longer Partnering with NRA Growing
truthrevolt.org,Tucker Carlson Reveals Stunning Stats on Immigrant Crime
truthrevolt.org,"Sen. Dick Durbin’s ‘Full Time’ Priority Isn’t US Citizens, It’s Illegal Aliens"
truthrevolt.org,Candace Owens: Black Panther - A Pro-Trump Movie
truthrevolt.org,Dick’s Sporting Goods Pulls ‘Assault-Style Rifles’ From All Stores
truthrevolt.org,Movie Critics Complain Eastwood Doesn't Show Sympathetic Terrorist
truthrevolt.org,GQ: Man Rescuing Bunny From Wildfire Reveals Whites' Hatred for Blacks
truthrevolt.org,Former Porn Star Reveals She Quit Over ISIS Threats
truthrevolt.org,CNN At It Again: Allows NRA To Be Vilified as Child Killers
truthrevolt.org,FLASHBACK: Bill Clinton on Illegal Immigration: 'We are a Nation of Laws'
truthrevolt.org,CBS News’ Deceptive Headline Pegs Grocery Store as Major Firearms Dealer
truthrevolt.org,Black Lives Matter Asks Whites to ‘Give Up Your Home to Black Family’
truthrevolt.org,"CA Dems Want to Fine Waiters $1,000 for Offering Plastic Straws"
truthrevolt.org,Leftists Insult Jeff Sessions' Asian Granddaughter: 'Return this Asian Baby to the Toys R Us'
truthrevolt.org,Brown University Student 'Collective' Objects to 'Fascist' Guy Benson's Free Speech
truthrevolt.org,"Jennifer Lawrence: Time to Take a Year Off and ""Fix Our Democracy"""
truthrevolt.org,Restaurant Asks White People to Pay More
truthrevolt.org,"WATCH: Dem Leadership Crumbling, Pelosi Can Hardly Speak"
truthrevolt.org,WaPo Dismisses 'Myth' of Left-Wing University Bias
truthrevolt.org,Colbert and San Juan Mayor Serve Up Some Fake News
truthrevolt.org,NBC News Got Through Entire Special Report on AR-15 Without Fear-Mongering
truthrevolt.org,MUST-WATCH: John Stossel Exposes ‘Southern Poverty Law Center Scam’
truthrevolt.org,San Diego State Hires New President Based Solely on Social Justice Background
truthrevolt.org,"Ivanka Posts Sweet Pics of Father/Son Fishing, Left Finds Reason to Hate"
truthrevolt.org,Media Matters’ ‘Volatile and Erratic’ Founder David Brock
truthrevolt.org,LGBT Activists Push for LGBTQQICAPF2K
truthrevolt.org,Rapper Cardi B: 'Hitler' Trump ‘Wishes Death’ on ‘Anybody Not White’
truthrevolt.org,"Viral Chart Claims to Fight Fake News, Promotes Biased Media"
truthrevolt.org,Prager U: Why Did the Democratic South Become Republican?
truthrevolt.org,Praise for the 7 Progressive 'Frozen' Moments
truthrevolt.org,Paul Joseph Watson: The Truth About 'Sh*thole Countries'
truthrevolt.org,What Was That About Media Bias? Research Shows Just 7% of Journalists Identify as Republicans
truthrevolt.org,FLASHBACK: Watch ‘The View’ Ladies Lose Their Minds When Norm MacDonald Called Bill Clinton a Murderer
truthrevolt.org,Condell: A Word to the Criminal Migrant
truthrevolt.org,Newsweek Cover Controversy: Orange Penis-Shaped Balloon Targets President
truthrevolt.org,Church of Sweden to Make God ‘Gender Neutral’
truthrevolt.org,DoJ Goes to Bat for YAF Against UC Berkeley Free Speech Violations
truthrevolt.org,Cop Shot In Ferguson As Obama Says 'Most Americans' Believe Nation Is Racist
truthrevolt.org,YAF Reports: College Courses Rife With Leftist Insanity
truthrevolt.org,Pat Condell: Europe Is Killing Itself
truthrevolt.org,S.E. Cupp Panel Scolds Journalists for Being Clueless About Guns
truthrevolt.org,Major Networks Dismiss Nunes Memo as Very Dangerous 'Nothing Burger'
truthrevolt.org,Fox News' Conor Powell Invents Middle East History
truthrevolt.org,"ABC News Ignores 30,000+ Complaints Over 'The View' Star Behar's 'Anti-Christian Bigotry'"
truthrevolt.org,"Paramount, Jay-Z Producing DocuSeries on Trayvon Martin"
truthrevolt.org,Former SJW Takes Heat from Left for Her Apostasy
truthrevolt.org,Nancy Pelosi Hopes “Bump Stock” Ban Will Be Slippery Slope
truthrevolt.org,"Actor Nick Searcy Subs For Rush, Explains Why Hollywood Doesn't Get Trump"
truthrevolt.org,MSNBC's Jennifer Rubin Calls Pro-Border Enforcement Guest 'Inhumane Beast'
truthrevolt.org,"Washington Post: As Senator, Clinton's 200,000 Jobs Promise Failed"
truthrevolt.org,Desperation: ABC Pushes Dolly Parton to Call Trump the Face of Modern Sexism
truthrevolt.org,Ted Cruz: Celebs Are Gun Control Hypocrites
truthrevolt.org,"Poland Catholics Pray Along the Border, Liberal Media Cries Islamophobia"
truthrevolt.org,Oberlin College Convicts Male Students of Sex Assault in Every Single Case
truthrevolt.org,Women’s March Plans ‘National School Walkout’ to Protest Guns
truthrevolt.org,Alabama State Rep Seeks Law to Arm Teachers
truthrevolt.org,Now at Vanderbilt: Conservative Professor Targeted by Offended Students
truthrevolt.org,"Forget Being Faster Than Speeding Bullet, CW’s ‘Supergirl’ is Anti-Gun"
truthrevolt.org,Morning Joe: Michael Brown Was A Thug
truthrevolt.org,USA Today Editors Dump on Trump: ‘Donald Trump is Uniquely Awful’
truthrevolt.org,Students Out of Control as St. Paul Schools Spend Millions on ‘White Privilege’ Training
truthrevolt.org,Vanderbilt 'Hate Crime' Is Just Blind Girl's Dog Poop
truthrevolt.org,MSNBC's Ari Melber: Object to the War on Christmas? Then You're Anti-Semitic
truthrevolt.org,"Hypocrisy Alert! Income Inequality Blowhard Robert Reich Paid $242,613 To Teach One Course"
truthrevolt.org,Atlantic Columnist: 'Being Against Gay Marriage Doesn't Make You a Homophobe'
truthrevolt.org,WaPo Admits 'Vast Majority' of Police Shootings Justified
truthrevolt.org,"Politico Article Compares Stephen Miller, a Jew, to Stalin, Killer of Jews"
truthrevolt.org,The Onion: Trump Voter Feels Betrayed by President After Reading 800 Pages of Queer Feminist Theory
truthrevolt.org,Brown University Allowing Students to Self-Identify as People of Color
truthrevolt.org,Friend Of Obama And Founder Of Largest Gay Rights Org Charged As Pedophile
truthrevolt.org,"Chicago's Guns, Bullets to be Melted and Made into Jewelry"
truthrevolt.org,Brian Williams Praises Analyst Who Calls Republicans KKK
truthrevolt.org,Tucker Carlson Fights Back Against Joy Reid's 'White Nationalist' Attack
truthrevolt.org,"Sharpton: If You Want Black Men to Take Care of Their Families, Give Them Training & Jobs"
truthrevolt.org,Joe Scarborough: ‘We Know What’s in the Memo' -- 'A Whole Lie'
truthrevolt.org,"School Dress Code Bans U.S. Flag, Then Administration Backpedals Hard"
truthrevolt.org,Liberal Media Bias Just a 'Conservative Fabrication'
truthrevolt.org,Study: Men Are Better Drivers Than Women Because of Sex
truthrevolt.org,CATO’s 50 States Ranked by Freedom
truthrevolt.org,NBC's 'Great News' Blames Trump for PC Tyranny
truthrevolt.org,GapKids Ad 'Racist' Because Black Girl is White Girl's 'Armrest'
truthrevolt.org,"Trump's VA Makes Dramatic Improvements, Media Yawns"
truthrevolt.org,Fake News CNN Drops Baffling Ad Claiming They’re All About ‘Facts First’
truthrevolt.org,CNN Analyst: Women Can’t Conceal Guns Because They Wear Dresses
truthrevolt.org,"Reporter Asks What Trump Is Doing To Combat Gun Violence, Sanders Turns the Tables"
truthrevolt.org,WATCH: 10 Minutes of Liberal ‘Tolerance’ Over Man Wearing #BuildTheWall Shirt
truthrevolt.org,Hillary Nutcracker Accompanied by Corkscrew Bill
truthrevolt.org,FLASHBACK: Milton Friedman Schools a Young David Brooks on Free College
truthrevolt.org,Navajo Nation Reservation In Az. Calls Its High School Football Team 'The Redskins'
truthrevolt.org,38-Year-Old Pedophile Claims He Likes Kids Because He’s ‘Trans-Age’
truthrevolt.org,Kaepernick to Get Award for ‘Making World a Better Place’
truthrevolt.org,Director Joss Whedon: ‘ICE is Trump’s SS’
truthrevolt.org,LA Street Artist Blasts Obama for 'Scandalous' Fundraiser
truthrevolt.org,The Atlantic: The Beard a Symbol of 'White Supremacy'
