source,title
uproxx.com,The ‘Chilling Adventures Of Sabrina’ Series Creator Has Clarified Why Salem That Cat Hasn’t Spoken (Yet)
uproxx.com,Ryan Reynolds Filmed New Scenes For The PG-13 ‘Deadpool 2’ Cut That May Also Please R-Rated Fans
uproxx.com,Two Popular ‘Stranger Things’ Characters Were Originally Going To Die In Season 1
uproxx.com,‘The Walking Dead’ Teases A Violent Death For Rick Grimes In His Final Episode Photos
uproxx.com,Ryan Reynolds Filmed Some New ‘Deadpool 2’ Scenes For A PG-13 Version
uproxx.com,‘Game Of Thrones’ Fans Think They May Have Figured Out The Prequel’s Setting
uproxx.com,‘Bodied’ Director Joseph Kahn Talks With Us About His Film’s Unapologetic Critique Of ‘Woke Culture’
uproxx.com,What Will Life Really Look Like On Mars?
uproxx.com,Padma Lakshmi Was Motivated By Louis C.K.’s Controversial Comeback To Put On A Comedy Show
uproxx.com,Lena Dunham Is Writing A Syrian Refugee Movie For Steven Spielberg And J.J. Abrams
uproxx.com,Cleveland Will Reportedly Be Getting An All-Star Game As Early As 2022
uproxx.com,Infamous Boston Mob Boss Whitey Bulger Has Reportedly Been Killed In Prison
uproxx.com,Meek Mill Evolves His Style With His Return On The Soulful ‘Dangerous’ With Jeremih And PNB Rock
uproxx.com,"NBA Dysfunction Rankings: A Fight At The Top Between The Cavs, Wizards, And Wolves"
uproxx.com,Troye Sivan Performs His Haunting New Song ‘Revelation’ On ‘Ellen’
uproxx.com,The ‘Is Candy Corn Gross’ Debate Is Raging On Twitter For ‘National Candy Corn Day’
uproxx.com,"Cass McCombs Announces A New Album ‘Tip Of The Sphere’ With The Hypnotic New Single, ‘Sleeping Volcanoes’"
uproxx.com,Two ‘Avatar’ Sequels Have Finished Shooting And Dropped The Papyrus Font Due To An ‘SNL’ Sketch
uproxx.com,Eminem’s Soundtrack For The Battle Rap Film ‘Bodied’ Is Reportedly Dropping This Week
uproxx.com,Don’t Ever Forget That The Cleveland Browns Are Still The Cleveland Browns
uproxx.com,Watch Ariana Grande Perform ‘God Is A Woman’ With A Big All-Female Orchestra For BBC
uproxx.com,Find Out How Close You Live To The Most Dangerous Volcanoes In The U.S.
uproxx.com,Jerry Rice On The Changing Ways Of The NFL And Why He Never Got Into Coaching
uproxx.com,Mick Jenkins Finds Profound Poetry In Putting Together The ‘Pieces Of A Man’
uproxx.com,Please Stop Scattering The Ashes Of Your Loved Ones At Disneyland
uproxx.com,Chasing Down The Golden Age Of Pirates In Central And South America
uproxx.com,Will Ferrell Went Door To Door In Georgia To Encourage Voters To Support Stacey Abrams
uproxx.com,Watch An 18-Year-Old Mac Miller Laugh And Rap In Previously Unreleased Video Of His First Interview
uproxx.com,$116 Flights To Europe Lead Off These Late Fall Travel Deals
uproxx.com,These Books Will Help You Better Understand The Tree Of Life Synagogue Shooting And Antisemitism In America
uproxx.com,The Best Food Shows On Netflix Streaming Right Now
uproxx.com,Nicki Minaj Offers $100K For Footage Of Her NYFW Fight With Cardi B
uproxx.com,Experts Warn That Goop’s ‘Mother Load’ Vitamin Supplements Could Be Harmful To Pregnant Women
uproxx.com,NBA Power Rankings Week 2: What Is Happening In Washington?
uproxx.com,"An Early, Behind-The-Scenes Look Into The Making Of ‘Ralph Breaks The Internet’"
uproxx.com,"Shabazz Palaces’ Intense Video For ‘Deesse Du Sang’ Is An Abstract, NSFW Assassin’s Tale"
uproxx.com,A Life-Spanning Prince Documentary From A Prince-Approved Director Is Coming To Netflix
uproxx.com,Edgar Wright Listed The Nods To The Original ‘Suspiria’ In His Own Movies
uproxx.com,A New ‘Kanye West’ Demo Titled ‘Idk’ Just Randomly Showed Up On Apple Music
uproxx.com,Shep Smith Contradicts Fox News And President Trump On The Migrant Caravan ‘Invasion’
uproxx.com,All The Best New Rap Albums Released This Month
uproxx.com,Who Won The Latest Round Of The Nicki Minaj And Cardi B Beef?
uproxx.com,"Nikki Bella Says The Divas Era Is Over, But Her Beef With Ronda Rousey Isn’t"
uproxx.com,"Unknown Mortal Orchestra Are Quietly Having An Incredible Year, With Not One But Two Great New Albums"
uproxx.com,Greta Van Fleet’s ‘Anthem Of The Peaceful Army’ Debuts At No. 3 On The ‘Billboard’ Album Chart
uproxx.com,Pharrell Sends Donald Trump A Cease And Desist For Playing ‘Happy’ After The Synagogue Shooting
uproxx.com,"What’s On Tonight: ‘9-1-1’ Gets A Ghost Call, And ‘Arrow’ Faces A New Threat"
uproxx.com,The Best And Worst Of WWE Evolution
uproxx.com,Can ‘Patriot Act With Hasan Minhaj’ Surface In A Crowded Talk TV Landscape?
uproxx.com,Sharon Van Etten Faces The Different Stages Of Her Life In The Fierce ‘Comeback Kid’ Video
uproxx.com,NXT Superstars Won Multiple Championships At EVOLVE 114
uproxx.com,A Beer Lover’s Guide To Rome
uproxx.com,Emma Stone’s Says Wearing A Corset While Making ‘The Favourite’ Made Her Organs Shift
uproxx.com,Cardi B Responds To Nicki Minaj’s $100K Offer: ‘You Lie So Much You Can’t Keep Up With Your Lies’
uproxx.com,Thundercat And BadBadNotGood’s ‘King Of The Hill’ Brings In Brainfeeder’s 10th Anniversary
uproxx.com,"The Best Hulu Original Series Right Now, Ranked"
uproxx.com,"Anderson Paak And Kendrick Lamar Share Their Funky, Action-Packed ‘Tints’ Video"
uproxx.com,Travis Scott Threw His Support Behind Texas Senate Candidate Beto O’Rourke During A Rally In Houston
uproxx.com,Ariana Grande’s First Performance Since Her Breakup With Pete Davidson Is A Stunning ‘Wicked’ Cover
uproxx.com,The Halloween Mac Miller Tribute Benefit Concert Will Be Live Streamed In Full
uproxx.com,Classic Episodes Of ‘Jeopardy!’ Are Coming To Netflix This Tuesday
uproxx.com,The Knicks Brought In Rasheed Wallace To Work With Mitchell Robinson
uproxx.com,Bob Saget Will Star In A ‘More Adult-Oriented’ Version Of ‘America’s Funniest Home Videos’
uproxx.com,LeBron James Responds To Michael Jordan’s ‘GOAT’ Commercial: ‘I’m Ready’
uproxx.com,Klay Thompson Broke Out Of His Slump With 22 First Quarter Points Against The Bulls
uproxx.com,The Full PlayStation Classic Lineup Includes ‘Grand Theft Auto’ And ‘Final Fantasy VII’
uproxx.com,This City Is Handing Out Free Beer And Ice Cream For Cycling
uproxx.com,Cardi B’s Sister Accuses Nicki Minaj Of Leaking Cardi’s Phone Number To Her Fans
uproxx.com,‘Attack On Titan’ Is Getting A Big-Time Hollywood Adaptation By The Director Of ‘It’
uproxx.com,Mississippi State Showed Off An Alternate Helmet That’s One Of The Best In College Football
uproxx.com,The Warriors Erupted For 92 Points In A Half Against The Bulls
uproxx.com,Rams Coach Sean McVay Is Somehow One Of The Favorites To Be The Next Browns Head Coach
uproxx.com,This Vending Machine Will Let You Trade In Your Unwanted Halloween Candy For Reese’s
uproxx.com,Smino Smoothly Announces The Title And Release Date Of His Upcoming Album With A Fire Freestyle
uproxx.com,Klay Thompson Broke Steph Curry’s Record For Threes In A Game With 14 Against The Bulls
uproxx.com,"Larry Drew Says He’s Not The Cavs’ Interim Head Coach, More Like A ‘Substitute Teacher’"
uproxx.com,The Soundtrack To Jim Henson’s ‘Emmet Otter’ Is Being Released For The First Time Ever
uproxx.com,Halsey Battles A Toxic Relationship And A G-Eazy Lookalike In Her New ‘Without Me’ Video
uproxx.com,‘A Quiet Place’ Test Audiences Couldn’t Stop Laughing At John Krasinski Playing The Aliens
uproxx.com,Iceland Airwaves Gets A Co-Sign From The Prime Minister For Their 20th Anniversary
uproxx.com,Try Not To Cry While Watching The Trailer For Netflix's 'Dogs' Documentary Series
uproxx.com,All The Best New Music From This Week That You Need To Hear
uproxx.com,The Browns Have Reportedly Fired Head Coach Hue Jackson
uproxx.com,Michael Moore Has Revealed Alleged Mail Bomber Cesar Sayoc In ‘Fahrenheit 11/9’ Outtakes
uproxx.com,Open Mike Eagle Uses Claymation To Make A Statement In His Surreal ‘Microfiche’ Video
uproxx.com,The Pelicans Leaked Mardi Gras Jerseys Are Perfect
uproxx.com,The Undefeated Bucks And Raptors Will Play Each Other Without Their Top Stars
uproxx.com,The Comedian Who Made ‘The Problem With Apu’ Responds To ‘The Simpsons’ Axing The Character
uproxx.com,John Cena Has Officially Been Replaced For WWE’s Crown Jewel Event
uproxx.com,Three Of North Carolina’s Best Link On The 9th Wonder-Produced ‘Sojourner’ Featuring J. Cole And Rapsody
uproxx.com,A Dead Marvel Villain May Return In ‘Avengers 4’ During A Flashback
uproxx.com,Nikki Bella Revealed Who She’d Hoped To See At Evolution And Her Thoughts On Ronda Rousey’s Cena Insult
uproxx.com,"Robyn Extracts Sweetness From Sadness On Her Sublime New Album, ‘Honey’"
uproxx.com,Kaaboo Is An Eclectic Festival Worth Traveling For
uproxx.com,The Next ‘Purge’ Movie Will Also Likely Be The Final ‘Purge’ Movie
uproxx.com,Megyn Kelly Has Issued An On-Air Apology For Her Controversial Blackface Comments
uproxx.com,Jerry Springer Will Reportedly Star In His Own ‘Judge Jerry’ Court Series
uproxx.com,Mark Hamill Compares Luke Skywalker To A ‘Jedi Junkie’ Who Overdosed On The Force
uproxx.com,The Wachowskis Have Closed Their Production Office Because They Currently Have Nothing In Production
uproxx.com,There’s A Real Titanic II And It Will Defy The Odds By Setting Sail In 2022
