source,title
wallstreetpit.com,AMD: The Surge Isn’t Over
wallstreetpit.com,"Wait, Tesla (TSLA) Stock Is Not Supposed to Gain This Much?!"
wallstreetpit.com,Quantum Algorithm Encodes Life Itself For the First Time Ever
wallstreetpit.com,Netflix (NFLX) Bull has $440 Target Price
wallstreetpit.com,Square’s (SQ) Stock Price Plunge Has Nothing to Do With the Broader Tech Sell-Off
wallstreetpit.com,Qualcomm (QCOM) Reveals Explosive Charges Against Apple
wallstreetpit.com,Top 10 Countries with Largest Gold Reserves
wallstreetpit.com,What is the Yield Curve Forecasting?
wallstreetpit.com,Twitter (TWTR) Stock Hammered After Earnings Miss: Buying Opportunity?
wallstreetpit.com,Nvidia’s Stock (NVDA) Just Got A Rare ‘Double Upgrade’
wallstreetpit.com,"Goldman Slaps Tesla (TSLA) With a Sell Rating, Sees Stock Plunging 30 percent"
wallstreetpit.com,Tesla Bull Has a Quadruple-Digit Price Target (TSLA)
wallstreetpit.com,Tesla (TSLA) Stock in Free Fall Over Musk’s Delisting Plan
wallstreetpit.com,Tesla (TSLA) Stock Soars After Musk’s Surprise SEC Settlement
wallstreetpit.com,Elon Musk’s Bombshell Tweet Puts Tesla (TSLA) In Hot Water
wallstreetpit.com,FANG Stocks Aren’t Gonna Crush It in 2019
wallstreetpit.com,Twitter (TWTR) Stock Plummets As Wall Street Firm Cuts Profit Forecast
wallstreetpit.com,Twitter (TWTR) Stock Jumps After Short-Seller Predicts 62% Spike
wallstreetpit.com,Logic Vanishes In The Musk
wallstreetpit.com,Apple (AAPL) Stock Spikes Following JPMorgan’s Bullish Stance
wallstreetpit.com,Nvidia’s (NVDA) Bleak Outlook Prompts Sharp Stock Reversal
wallstreetpit.com,Can Microsoft’s (MSFT) Impressive Rally Continue or Has Nadella Triggered the End of It?
wallstreetpit.com,Microsoft (MSFT) Could Raise Its Dividend in a Big Way
wallstreetpit.com,Tesla (TSLA): So What’s the Angle Here?
wallstreetpit.com,"Facebook (FB) Stock Crashes, Name Enters Into a Bear Market Territory"
wallstreetpit.com,The Musk Story for Tesla: A Fairy Tale? (TSLA)
wallstreetpit.com,"Tesla’s Cash Burn Slows, Stock Goes Crazy"
wallstreetpit.com,"When the Yield Curve Inverts, Trouble’s Ahead"
wallstreetpit.com,"Alexa, Forget I Just Said That (AMZN)"
wallstreetpit.com,Amazon (AMZN) Nears Trillion Dollar Mark
wallstreetpit.com,Cannabis Goes Mainstream Up North
wallstreetpit.com,"Startup Plans to Reverse Aging in Dogs, Humans Could Be Next"
wallstreetpit.com,Bitcoin’s Hash Rate Is Telling a Bullish Story
wallstreetpit.com,Bitcoin (BTC): We Might Just Be On The Cusp of a Massive Rally
wallstreetpit.com,The Dreaded Inverted Yield Curve
wallstreetpit.com,Google Android: European ‘Techlash’ or Milestone in Antitrust Enforcement?
wallstreetpit.com,"Wait, Facebook (FB) Stock Is Not Supposed to Gain This Much?!"
wallstreetpit.com,Scientists May Have Found A Missing Piece for ‘Artificial Brains’
wallstreetpit.com,World Renowned Futurist Makes Some Pretty Remarkable Predictions About the Future
wallstreetpit.com,Influential Silicon Valley Accelerator Joins Anti-Aging Quest
wallstreetpit.com,Apple’s (AAPL) Massive Growth Continues Unabated
wallstreetpit.com,Ripple CEO: ‘Dozens’ of Banks Expected to Use XRP in 2019
wallstreetpit.com,"Tesla Bull Has $4,000 Target Price (TSLA)"
wallstreetpit.com,Stem Cell Start-up Could Extend Lifespan by Decades
wallstreetpit.com,Ripple (XRP) Slammed With Class-Action Lawsuit Over Alleged SEC Violations
wallstreetpit.com,Ripple Makes Dramatic Move In Mainstream Banking Waters (XRP)
wallstreetpit.com,A Landmark Stem Cell Therapy Shows Striking Results Against Aging
wallstreetpit.com,Gold: Time to Get Contrarian
wallstreetpit.com,"Apple Signals Slowdown to Suppliers, Stock Sinks (AAPL)"
wallstreetpit.com,Tesla (TSLA) Stock Surges On Musk’s Radical Step
wallstreetpit.com,Tesla (TSLA) Stock: What’s Elon Musk Up to?
wallstreetpit.com,Amazon (AMZN) Stock Surges on Massive Earnings Beat
wallstreetpit.com,Investment Giant Reportedly Mulling a Move Into Bitcoin (BTC)
wallstreetpit.com,Scientists Close in on Diabetes Cure Using CRISPR
wallstreetpit.com,Yesterday’s Tech Can Help Restore Supersonic Travel
wallstreetpit.com,Apple’s (AAPL) Market Value Catapults to $1 Trillion
wallstreetpit.com,SpaceX on a Collision Course with the World’s Biggest Telecom and Satellite Companies
wallstreetpit.com,Why This Bull Market Still Has Legs
wallstreetpit.com,NASA’s New Propulsion System Is Breaking Some Important Records
wallstreetpit.com,Noted Economist Sees Bitcoin (BTC) Crashing to Zero
wallstreetpit.com,Tax Reform 2.0: Indexing Capital Gains
wallstreetpit.com,"New Battery Design Could Boost The Range Of Electric Cars To 1,000 Km"
wallstreetpit.com,World’s First Complete Quantum Computer Chip Design Revealed
wallstreetpit.com,The Serious Disadvantages of Bitcoin
wallstreetpit.com,Pentagon Video Suggests We May Not Be Alone In The Universe
wallstreetpit.com,Netflix (NFLX): The Future of Entertainment or House of Cards
wallstreetpit.com,Fasten Your Seatbelt For the Immensely Disruptive Driverless Car Revolution
wallstreetpit.com,SpaceX: Making Asteroid Mining A World-changing Reality
wallstreetpit.com,Automation Could Wipe Out A Third of America’s Workforce in the Next 13 Years
wallstreetpit.com,Scientists Have Discovered A Pathway That Controls Aging
wallstreetpit.com,The First Step Towards Artificial Humans Has Been Made
wallstreetpit.com,SpaceX Heavy Going Into Trans-Mars Heliocentric Orbit
wallstreetpit.com,Amazon Just Found a Way to Let You See Inside the Box Without Opening It (AMZN)
wallstreetpit.com,Facebook’s (FB) Data Scandal Will Leave It Unharmed
wallstreetpit.com,Should Social Media Be Regulated as Common Carriers?
wallstreetpit.com,Tesla (TSLA) Shares Tank on Mounting Model 3 Doubts
wallstreetpit.com,What If China Dumps US Treasury Bonds?
wallstreetpit.com,Marijuana: Abduction In Lieu Of Arrest
wallstreetpit.com,UBI Could Boost Economy by Trillions
wallstreetpit.com,Solid-state Battery Breakthrough Promises One Minute Charge Time
wallstreetpit.com,"How Now, Thou Dow?"
wallstreetpit.com,Amazon Prime Delivery: Would You Trust the Mailman Inside Your Home?
wallstreetpit.com,A Smartphone That’s Unhackable?
wallstreetpit.com,Tesla’s (TSLA) Stock Takes a Beating Following Musk Reversal
wallstreetpit.com,"The New, Cutting Edge Tech That Could Make Fibre Optics Obsolete"
wallstreetpit.com,What is a “Middle-Class House” in California?
wallstreetpit.com,Planet-Sized Waves Have Been Detected Inside The Sun
wallstreetpit.com,Amazon (AMZN) Stock Short Interest Spikes Eclipsing $5 Billion
wallstreetpit.com,A Major Breakthrough in Science Marks the Start of a New Frontier of Genomic Medicine
wallstreetpit.com,NASA Has Discovered Startling Structures On Pluto
wallstreetpit.com,Bitcoin Could Be Bigger Than The Internet
wallstreetpit.com,The Weirdness Of Quantum Physics Just Got Weirder
wallstreetpit.com,Potential New Way to Treat HIV Discovered
wallstreetpit.com,"Price Target Changed: Yahoo (YHOO), Caterpillar (CAT), PayPal (PYPL), Nasdaq (NDAQ), Harley-Davidson (HOG)"
wallstreetpit.com,Bitcoin (BTC) Ends Miserable Week Above Critical Support
wallstreetpit.com,Never Short a Dull Market
wallstreetpit.com,Ripple Going Head-to-Head with Bitcoin. Could it Be the Next Crypto Craze?
wallstreetpit.com,How the Very Rich Legally Avoid Paying Taxes
wallstreetpit.com,Tiny Robots Will Soon Patrol the Human Body From the Inside
wallstreetpit.com,Sea Level Isn’t Just Rising. It’s Rising Frighteningly Faster
