source,title
wnd.com,Trump blames 'fake news media' for bloodshed
wnd.com,Student urinates on outlet trying to set fire to school
wnd.com,Mobster Whitey Bulger killed behind bars
wnd.com,Bang! Ammo maker sues Dick's Sporting Goods
wnd.com,Video: Students say open U.S. border to caravan
wnd.com,"Trump seeks $300,000 from Stormy Daniels"
wnd.com,"Mystery illness: Boy, 2, has arms, legs amputated"
wnd.com,"Lots of scratch: $48,000 for allergy test"
wnd.com,Ben & Jerry's joins 'resistance' movement
wnd.com,Colleges' Halloween warning: No cultural appropriation
wnd.com,The drive
wnd.com,Armed dad stops mass shooting at McDonald's
wnd.com,Family lawyer for 'mail bomber': He might be crazy
wnd.com,Same-sex couple carries same 'miracle' baby
wnd.com,China secretly puts military scientists in Western colleges
wnd.com,Pence stuns Jews with prayers by 'Christian rabbi'
wnd.com,Student's national anthem wows internet
wnd.com,Gunman shoots out windows of GOP office
wnd.com,Trusting people 'helps you live longer'
wnd.com,Sanders rips CNN for 'outrageous' bomb-threat response
wnd.com,Consumer confidence rises to 18-year high
wnd.com,"Warren, Harris facing new ethics complaint"
wnd.com,'Big Bang Theory' asks God to smite Trump
wnd.com,Billionaires chase holy grail of energy
wnd.com,Huckabee highlights pep rally for 2018 midterms
wnd.com,Anti-Trump paper tells voters to 'choke down' Dem senator
wnd.com,The oldest hate
wnd.com,Worst fears about migrant caravan ... likely true
wnd.com,Geraldo walks back 'false flag' claim
wnd.com,'Secular' movement adopts Islamic land-sale ban
wnd.com,Trump looks at ending birthright citizenship
wnd.com,"Feds: 'Sex' means biological sex, not gender ID"
wnd.com,NASA accused of covering up UFO on live feed
wnd.com,Dow tumbles more than 200 led by Boeing
wnd.com,Man in costume shouts 'God isn't real!' into church
wnd.com,Kathy Griffin sells F*** Trump goods on Twitter
wnd.com,Drudge slams Fox for 'bizarre' shooting analysis
wnd.com,Are honorable candidates a thing of the past?
wnd.com,McAuliffe: Hillary 'never going to be on a ballot again'
wnd.com,"San Fran spends $6,300 for each non-citizen voter to sign up"
wnd.com,Is this worse than 1968?
wnd.com,What Jews the world over have in common
wnd.com,"The Pittsburgh synagogue, anti-Semitism and Trump"
wnd.com,It's no accident children are drawn to Satanism
wnd.com,Blaming Jews for the synagogue slaughter
wnd.com,How Google is stealing our liberty
wnd.com,"'Creepy Line' film exposing Google, Facebook now streaming"
wnd.com,West Virginia 7th-graders told to declare submission to Allah
wnd.com,"Illegal fined $280 for killing FBI agent, fire marshal"
wnd.com,FBI witness to Congress: Russia investigation 'abnormal'
wnd.com,Obama secretly sought to give Iran access to U.S. banks
wnd.com,Kavanaugh accuser will likely delay vote
wnd.com,Terrorists ban plastic bags due to 'environmental threat'
wnd.com,"Infamous tarmac meeting set up by Secret Service, FBI"
wnd.com,Supremes to review state's attack on judge over 'marriage'
wnd.com,Another Trump win? 'Death to Khamenei' protests continue in Iran
wnd.com,'People's heads blowing up' at Fox News?
wnd.com,Alabama sues to stop illegals from reshaping Congress
wnd.com,Federal judge: California gun control goes too far
wnd.com,"Obama policies favoring Muslim students must go, feds told"
wnd.com,Defiant Kavanaugh: 'You'll never get me to quit. Never'
wnd.com,Gays married by Ginsburg now accused of soliciting men
wnd.com,Pagan arch returning to Washington as 'symbol of peace'
wnd.com,Snopes 'sneaky liar' about California's anti-Christian plan
wnd.com,Project Veritas unmasks anti-Trump 'deep state' fighter
wnd.com,Chuck Norris blasts pesticides and the death of honeybees
wnd.com,A dress rehearsal for impeachment
wnd.com,O'Rourke campaign asks VFW to remove flags for town hall
wnd.com,Does the pope believe in hell?
wnd.com,Transgender fight confirms Alito's 'bigot' warning in marriage case
wnd.com,Self-described Communist federal worker boasts of hindering president
wnd.com,Here's what U.S. voters really think of illegals voting
wnd.com,"Muslim now spiritual leader to 14,000 U.S. Army soldiers"
wnd.com,"Chuck Norris on suicide, loss of life's meaning"
wnd.com,The clear and present danger of Google-Facebook
wnd.com,Sheriff Joe has 'out-of-the-box' idea to end border crisis
wnd.com,Retired pastor threatened with eviction over Bible study
wnd.com,Planned Parenthood forces cancellation of 'Gosnell' screening
wnd.com,U Texas makes student reflect on 'toxic masculinity' as punishment
wnd.com,1 In 4 college students diagnosed with mental-health condition
wnd.com,Muslims chant 'Allahu akbar' at Vikings stadium
wnd.com,Thousands of Christians defy own churches' 'social justice' campaigns
wnd.com,Nikki Haley blocks newest U.N. attack on Israel
wnd.com,Liberty Counsel warning: California about to ban Bible sales
wnd.com,Facebook caught censoring 'I'm Matt Caldwell. I like guns'
wnd.com,James Dobson announces new public policy center
wnd.com,What's this? A hip new CBS show about God
wnd.com,McCain urged to leave office now
wnd.com,A traffic stop's message for anti-gun activists
wnd.com,'I am Spartacus': Democrat defies Senate rules
wnd.com,The Kavanaugh fight is spiritual warfare
wnd.com,Official claims U.N. regs 'changing the weather'
wnd.com,It begins: Church sued for refusing to host LGBT event
wnd.com,"Trump posts Hillary video advocating for 'strong, prosperous Russia'"
wnd.com,"'Lunacy alert' warns of $1,000 fine for handing out straws"
wnd.com,How deep is the deep state? Look at history
wnd.com,Kavanaugh vs. Ford: The truth may lie in an old fable
wnd.com,Ultimate taboo hits big screen: Sex with children
wnd.com,Ministry launches effort to protect religious freedom in the law
wnd.com,See film about Gaza riots censored by YouTube
