source,title
zerohedge.com,"IBM Bond Yields, Default Risk Spike After Red Hat Deal"
zerohedge.com,The Market Isn't The Economy: A Snapshot From The Depression
zerohedge.com,US Won't Continue Trade Talks Until China Commits To Ending Forced Tech Transfers
zerohedge.com,Photos Show Aide To Saudi Crown Prince Entering Consulate Hours Before Journalist's Disappearance
zerohedge.com,"""They Cut Him Up While He Was Still Alive"": Grisly Details Of Saudi Journalist Killing Emerge"
zerohedge.com,"""National Emergency"" - President Trump To Cut Central American Aid As Mexico Loses Control Of Migrant Army"
zerohedge.com,Saudi Crown Prince Spoke To Khashoggi By Phone Moments Before He Was Killed: Report
zerohedge.com,Jamal Khashoggi: Where The Road to Damascus & The Path to 9/11 Converge
zerohedge.com,"Foreign Banks Are Embracing Russia's Alternative To SWIFT, Moscow Says"
zerohedge.com,"Facebook Sells Disabled Iraq Vet $300,000 In Ads, Then Deletes His Influential Pages"
zerohedge.com,Saudi Royal Family Considering Replacement For Crown Prince bin Salman: Report
zerohedge.com,Wednesday's Rout Was An 8-Sigma Event: The 5th Largest Tail Event In History
zerohedge.com,"As U.S. Polls Tighten, The Signs All Point To Hillary"
zerohedge.com,"""Disappeared"" Interpol Chief Abruptly Resigns After Wife Reveals Chilling Text Message"
zerohedge.com,A $500 Million Bank Heist And Its “Ocean’s Eleven”-Style Schemers Thwarted By An HSBC Teller
zerohedge.com,"""Don't Look Away From Me!"" - Sexual Assault Survivor Accosts Flake After Confirmation Vote News"
zerohedge.com,Netflix Soars After Crushing Subscriber Estimates As It Burns A Record $10 Million Per Day
zerohedge.com,"Kavanaugh ""Gang Bang"" Accuser Savaged By Ex-Weatherman Over ""Penchant For Group Sex"""
zerohedge.com,"The 30-Year Has ""Broken Out"" - Jeff Gundlach Warns Stocks And Bonds Are Going Lower Together"
zerohedge.com,"Michael Is Now A Hurricane, Will Continue To Strengthen As It Approaches Florida Panhandle"
zerohedge.com,"Wikileaks: To Weaken Iran, US Undermined Democratic Elements of Syrian Opposition to Empower Radical Groups"
zerohedge.com,"This Is Why Bonds Are Crashing, According To Bill Gross"
zerohedge.com,"Italy Folds To Europe, Pledges To Shrink Budget Deficit To 2.0%; Euro Surges"
zerohedge.com,"""Women For Kavanaugh"" March On Washington In Support Of Supreme Court Nominee"
zerohedge.com,Saudi Energy Minister Confirms: 'November Output Will Be Slightly Higher Than October'
zerohedge.com,"""Unsafe And Unprofessional"": Chinese Warship Comes Within 45 Yards Of US Destroyer In South China Sea"
zerohedge.com,"China Is Developing Space Lasers To Detect Submarines 1,640 Feet Underwater"
zerohedge.com,"After Embarrassing Defeat, NATO, EU, & The West Try To Alter Reality In Macedonia"
zerohedge.com,Wells Fargo Announces 10% Staff Cuts As CEO Struggles To Impress Analysts
zerohedge.com,"Top FBI Lawyer Flips: Russia Probe Was Handled In ""Abnormal Fashion"" And Rife With ""Political Bias"""
zerohedge.com,Erdogan Believes Saudi Arabia Ordered Brutal Killing Of Missing Dissident At Istanbul Consulate
zerohedge.com,"Trump To Saudi King: ""You Wouldn't Last Two Weeks Without Us"""
zerohedge.com,"US, China Diving Into A New Cold War; Jack Ma Warns: ""When Trade Stops, Sometimes War Starts"""
zerohedge.com,The Next Bond Crisis: Over $1 Trillion In Bonds Risk Cut To Junk Once Cycle Turns
zerohedge.com,"Understanding The Volatility Storm To Come, Part 1: Fragility In The Market's Medium"
zerohedge.com,"IMF Slashes US Growth Outlook, Blames Rates & Trade; Sees Venezuelan Inflation 10-Million-Percent"
zerohedge.com,End-Times Persecution? World's Largest Country Is Destroying 1000s Of Crosses And Bibles
zerohedge.com,Kavanaugh FBI Report Won't Be Released To Public: McConnell
zerohedge.com,US Preparing To Bomb Iran's Nuclear Capabilities As Soon As Next Month: Report
zerohedge.com,Florence May Be Costliest Storm In US History At $170 Billion In Damage
zerohedge.com,Riot Breaks Out In Portland As Antifa Activists Clash With Conservative Marchers
zerohedge.com,"Solomon: DOJ ""Smoking Gun"" Redactions Due To National Embarrassment, Not ""National Security"""
zerohedge.com,"A ""Perfect Storm"" Surrounds One Of The Worst Ebola Outbreaks In History Right Now"
zerohedge.com,"Indonesia Asks Foreign Aid Workers To Leave As Tsunami Death Toll Surpasses 2,000"
zerohedge.com,"China's ""Peace Ark"" Ship Makes Historic Visit To Venezuela After Maduro Visits Beijing"
zerohedge.com,Fresh Reports Of Real Estate Rage Signal Turn In Chinese Housing Market
zerohedge.com,Is The Market Right To Ignore The Latest China Tariffs? One Bank Answers
zerohedge.com,"Bob Lutz: Tesla ""Headed To The Graveyard"" As ""Global Competition Is Coming"""
zerohedge.com,Russia Says Space Station Hole Was Deliberate Sabotage After Formal Investigation
zerohedge.com,"Tech Stocks Erase Powell-Plunge, Dollar Soars On Global Liquidity Panic"
zerohedge.com,"Iran Warns Trump Not To Cut Off Oil Exports, Threatens ""Mother Of All Wars"""
zerohedge.com,"Campus Mob Enraged By ""Confirm Kavanaugh"" Display"
zerohedge.com,"Flip-Flop Flake ""Still Having Issues"" With Kavanaugh Despite ""Thorough"" FBI Report"
zerohedge.com,Democratic Staffer For Sheila Jackson Lee Arrested In GOP Doxing
zerohedge.com,"Dramatic Photos Show Chinese Warship's ""Unsafe And Unprofessional"" Encounter 45 Yards From US Destroyer"
zerohedge.com,Don't Count On The FBI To Clear Up The Kavanaugh-Ford Farce... Its Record Is Flawed
zerohedge.com,US Threatens To Destroy Russian Nuclear-Capable Missile System If Necessary
zerohedge.com,Emmanuel Macron's Popularity Plunges To 29% As Migrant Crisis Worsens
zerohedge.com,Blasey Ford's Kavinaugh Testimony Unravels After Ex-Boyfriend Refutes Key Claims
zerohedge.com,September U.S. Auto Sales Expected To Collapse
zerohedge.com,Canada Has No Gold But A Mountain Of Debt... Things Will End Badly
zerohedge.com,Leaked Photos Show Russian Military Likely Delivered Advanced S-300 To Syria Already
zerohedge.com,"Did 80,000 Americans Really Die From The Flu Or Is This Big Pharma Propaganda?"
zerohedge.com,"Lindsey Graham Blasts Feinstein's ""Despicable Process"" As She Demands FBI Release Scope Of Kavanaugh Probe"
zerohedge.com,"Illinois Lost 1 Resident Every 4.3 Minutes In 2017, Dropped To 6th Most Populous State"
zerohedge.com,"Bill Clinton Notes Cultural Shift In ""What You Can Do To Somebody Against Their Will"""
zerohedge.com,"James Woods Suspended From Twitter Over Satirical Meme That Could ""Impact An Election"""
zerohedge.com,Art Berman: Don't Believe The Hype - Oil Prices Aren't Going Back To $100
zerohedge.com,"Bank Of England Warns ""No Deal"" Brexit Would Lead To Chaos, Crisis ""As Bad As 2008 Crash"""
zerohedge.com,"JPMorgan Downgrades China Stocks, Forecasting ""Full-Blown Trade War"""
zerohedge.com,"Dem Senator Rejects Kavanaugh Presumption Of Innocence: ""We're Not In A Court Of Law"""
zerohedge.com,"Europe Unveils ""Special Purpose Vehicle"" To Bypass SWIFT, Jeopardizing Dollar's Reserve Status"
zerohedge.com,"""It's Like The Zombie Apocalypse"" - Water, Batteries, Flashlights Vanish From Shelves As Carolinas Brace For Florence"
zerohedge.com,"Trump: ""Angry Mob"" of ""Radical Democrats"" Has Become ""Too Extreme And Too Dangerous To Govern"""
zerohedge.com,"""It’s Surreal. We’re In The Matrix"" - Calgary's Newest Mall Is A Ghost Town"
zerohedge.com,"""We're Going To Unmask You"": James O'Keefe Set To Expose Deep State With New Investigation"
zerohedge.com,"Goldman: ""This Is the Largest And Fastest Correlation Change On Record Outside Of 1987"""
zerohedge.com,Chaos Erupts After Massive 7.7 Magnitude Earthquake Rocks Indonesia
zerohedge.com,"'Late Show' Writer Exposes Left's Reality: ""I'm Just Glad We Ruined Kavanaugh's Life"""
zerohedge.com,"The Reason The Solar Observatory Was Closed Is Revealed, And It's As Disturbing As It Is Unbelievable"
zerohedge.com,Yale University Invests In $400 Million Crypto Fund
zerohedge.com,"""Baffling"" Surge In Oman Crude Price Sends Oil Market Into ""Turmoil"""
zerohedge.com,FBI To Wrap Up Kavanaugh Probe On Wednesday: Fox
zerohedge.com,"Robert De Niro Shouts ""F**k Trump"" At Tony Awards, Gets Standing Ovation"
zerohedge.com,Pentagon's Answer To Yemen Atrocities? Train More Saudi Pilots... On US Soil
zerohedge.com,"""SEC May Want To Take A Look"": Facebook Insiders Dumped $4.1 Billion Weeks Ahead Of Record Crash"
zerohedge.com,"Crescat: The Hamstrung Fed, Gold, & The Bursting Of China's ""Mother Of All Credit Bubbles"""
zerohedge.com,FBI Turns Over Completed Kavanaugh Report To White House
zerohedge.com,"Evacuations Ordered As ""Monstrous Hurricane"" Michael Intensifies Into ""Most Powerful Storm In A Decade"
zerohedge.com,"Kavanaugh Mayhem: Two Men Cop To Feeling Christine Ford's Breasts, Contradicting Her Accusation"
zerohedge.com,"IMF's Lagarde Warns ""Clouds On Horizon Have Materialized"", Global Growth To Slow"
zerohedge.com,Beware The Zombies: BIS Warns That Non-Viable Firms Are Crippling Global Growth
zerohedge.com,FBI Has No Plans To Interview Dr. Ford In Kavanaugh Probe: Reports
zerohedge.com,"As China Suffers Its Biggest Bankruptcy Of 2018, The PBOC Finally Panics"
zerohedge.com,Russia Releases Footage Of New Anti-Ship Missiles Pounding Warships
zerohedge.com,Amazon Alone Is Responsible For More Than A Third Of The S&P's Return This Year
zerohedge.com,"""The Threat Is With Us Today"": US Powerless Against Weaponized Drone Attacks, DHS Warns"
zerohedge.com,Senate Passes Sweeping Bill To Combat Opioid Crisis As NYC Overdose Deaths Hit Record High
zerohedge.com,Grassley Refers Potential False Kavanaugh Accuser To FBI/DOJ For Criminal Investigation
zerohedge.com,"Arrests Begin As Protesters Storm Capitol Steps; GOP Leader Declares ""We Will Not Be Bullied"""
