,source,title,is_clickbait
0,csmonitor.com,Melissa McCarthy turns to drama in ‘Can You Ever Forgive Me?’,1
1,csmonitor.com,US sanctions against Hezbollah and Iran hurt Shiite militias,0
2,csmonitor.com,A better way to view the migrant caravan,0
3,csmonitor.com,Four October movies you should see this month,1
4,csmonitor.com,US territory slammed by strongest storm to hit US this year,0
5,csmonitor.com,Symbolic mega-bridge connects Hong Kong to mainland,0
6,csmonitor.com,"As Brazil votes, Bolsonaro fans are hungry for a hero",0
7,csmonitor.com,‘Climate kids’ seek action – and await their day in court,0
8,csmonitor.com,Control of House may hinge on ‘Panera moms’ in the suburbs,0
9,csmonitor.com,What mail bombs say – and don’t say – about political discourse,0
10,csmonitor.com,Malaysia raises concern over plastic waste from developed countries,0
11,csmonitor.com,"Florida man charged in mail-bomb scare, ending nationwide manhunt",0
12,csmonitor.com,Can Idaho wolves shed their 'big bad' reputation?,0
13,csmonitor.com,How a post-Khashoggi US 'correction' on Saudi relations could unfold,0
14,csmonitor.com,African praise of Saudi Arabia highlights diplomatic pressures,0
15,csmonitor.com,"Amid 2018 rancor, O’Rourke’s optimism stood out. But can he keep it civil?",0
16,csmonitor.com,Community building: Chicago experiment links libraries and apartments,0
17,csmonitor.com,"For Iran's women's movement, progress is slow. But it's progress.",0
18,csmonitor.com,Why Americans are talking less and less about ‘love’ and ‘kindness’,1
19,csmonitor.com,Syria frees Japanese journalist after three years captivity,0
20,csmonitor.com,"As caravan wends its way north, Mexico walks a fine line",0
21,csmonitor.com,"Democrats rake in big bucks from small donors, but effect is unpredictable",0
22,csmonitor.com,Evangelical support gives Brazil's Bolsonaro votes in unlikely places,0
23,csmonitor.com,Political violence and its antidote,0
24,csmonitor.com,Trailer parks face rising rents. This one's residents found a way out.,1
25,csmonitor.com,Overdose deaths in US from opioid epidemic levels off,0
26,csmonitor.com,"In China, newly discovered dinosaur bones rewrite history",0
27,csmonitor.com,"Palestinian activist, Ahed Tamimi, takes her cause abroad",0
28,csmonitor.com,"Meanwhile in ... Berlin, three new rabbis have made history",0
29,csmonitor.com,NATO chief doesn't expect arms race despite US threats,0
30,csmonitor.com,Navajo Nation looks to Zumba and taxes to curb obesity,0
31,csmonitor.com,Vulnerable voting machines cause concern in Congo,0
32,csmonitor.com,Iraq tries a new approach to filling cabinet positions: open to all via online platform,0
33,csmonitor.com,Flashbacks from 2016 put Democrats on notice – and on edge,0
34,csmonitor.com,Person detained in connection with mail bombs,0
35,csmonitor.com,"Migrant caravan, increasing in size, treks north through Mexico",0
36,csmonitor.com,Trump threatens to cut Central American aid as caravan approaches US,0
37,csmonitor.com,Rent control on ballot as California seeks a fix for housing costs,0
38,csmonitor.com,"With new evidence, pressure mounts against Saudis after Khashoggi's killing",0
39,csmonitor.com,Human Rights Watch report highlights torture at the hands of Palestinians,0
40,csmonitor.com,How Syrian refugees strain – and strengthen – Jordan,1
41,csmonitor.com,Cities like Buffalo feel brunt of refugee cuts,0
42,csmonitor.com,Contest for GOP House leadership lays bare Republican divisions,0
43,csmonitor.com,Borrowed words spice up English,1
44,csmonitor.com,"After charity sex-abuse scandal in Liberia, a storm of anger, guilt, and grief",0
45,csmonitor.com,Why a nuclear-arms pact can save Europe,0
46,csmonitor.com,"‘Nationalist’: A president takes a mantle, then shows he means it",0
47,csmonitor.com,Florida's tight gubernatorial race gains momentum,0
48,csmonitor.com,'Anne Frank's Diary' is a profoundly moving graphic presentation of the classic,1
49,csmonitor.com,A new candidate class: schoolteachers running for office,0
50,csmonitor.com,A soft way to reform global trade,0
51,csmonitor.com,He’s no saint – but Roger Stone insists he’s innocent of Russia collusion,0
52,csmonitor.com,Risk of a new civil war? Today 'us and them' differs from 1850s.,0
53,csmonitor.com,Election postponed in Kandahar after attack on security meeting,0
54,csmonitor.com,Why tsunamis are so difficult to predict,1
55,csmonitor.com,Will increasingly indoorsy Canadians answer the call of the wild?,1
56,csmonitor.com,"In Alamo redesign, renewed battles over who gets to tell stories of Texas",0
57,csmonitor.com,Readers write: Thoughts on new Heart of the News section,1
58,csmonitor.com,"In China, melting glaciers are a visible reminder of climate change",0
59,csmonitor.com,"In ‘The Guilty,’ a police dispatcher races against time",0
60,csmonitor.com,Identity politics on the ropes in Iraq?,0
61,csmonitor.com,"With new tech and opportunity, African agriculture gets a makeover",0
62,csmonitor.com,States and feds unite to ensure election security in midterms,0
63,csmonitor.com,"Behind affirmative action divide, a common disdain for discrimination",0
64,csmonitor.com,White House strains US-China relations with tough trade and combative words,0
65,csmonitor.com,Poverty plagues forgotten agricultural communities in California,0
66,csmonitor.com,Pope Francis to consider opening the priesthood to married men,0
67,csmonitor.com,Keeping Italy in Europe’s nest,0
68,csmonitor.com,"As large Honduran caravan enters Mexico, Trump warns migrants to turn back",0
69,csmonitor.com,Would US quitting the INF treaty rekindle a big-power arms race?,0
70,csmonitor.com,'The Kindergarten Teacher' is worth seeing for Maggie Gyllenhaal’s performance,0
71,csmonitor.com,"Reporter's Notebook: On edge of Sahara, camel is what's for dinner",0
72,csmonitor.com,King Tut on exhibit as views of antiquities evolve,0
73,csmonitor.com,"Readers write: Scottish phrases, more photos, reading habits, learning about the Amazon",1
74,csmonitor.com,How Stacey Abrams has gotten within one point of Georgia governor’s mansion,0
75,csmonitor.com,'Pride' thrusts Jane Austen into 21-century Bushwick,1
76,csmonitor.com,Offshore drilling to begin in federal Arctic waters off Alaska,0
77,csmonitor.com,Guilty verdicts will help NCAA prosecute unethical recruitment practices,0
78,csmonitor.com,'American Prison' presents a highly disturbing insider's view of a private prison,0
79,csmonitor.com,"After #MeToo, state legislatures make changes",0
80,csmonitor.com,US businesses begin to increase services for deaf people,0
81,csmonitor.com,The Other Side,0
82,csmonitor.com,Getting to know our spirituality,1
83,csmonitor.com,Deep sanity,0
84,csmonitor.com,Rise above political polarization,0
85,csmonitor.com,A Soul-filled life,0
86,csmonitor.com,"Loaves, fish, and … cherry tomatoes",0
87,csmonitor.com,"What are you watching? Readers recommend 'Black Panther,' 'The Treasure of the Sierra Madre'",1
88,csmonitor.com,A superpower we all truly have,1
89,csmonitor.com,"Meanwhile in ... Afghanistan, fans are rejoicing over what’s being called the 'fairy tale' success story of the country’s cricket team",1
90,csmonitor.com,'In the Hurricane's Eye' puts Revolutionary War conflict the Battle of the Chesapeake back in its deserved spotlight,0
91,csmonitor.com,Water pollution threatens Mandaean religious practices in Iraq,0
92,csmonitor.com,New hires reflect NHL's move toward including women,0
93,csmonitor.com,"To fight corruption, Kenyans study integrity",0
94,csmonitor.com,"Miles inland, rural counties still digging out after hurricane Michael",0
95,csmonitor.com,Pompeo in Riyadh as Saudis face increasing backlash over missing journalist,0
96,csmonitor.com,"Fleeing violence, Honduran migrant caravan enters Guatemala en route to US",0
97,csmonitor.com,Venezuelan fans welcome new baseball season amid national crisis,0
98,csmonitor.com,All for one? How key undecided senators may approach Kavanaugh vote,0
99,csmonitor.com,"As affordable housing crisis deepens, states begin to take action",0
