,source,title,is_clickbait
0,dailybuzzlive.com,"Donate a Testicle The payout for this is $35,000",1
1,dailybuzzlive.com,Philip Morris Begins Selling Marlboro “M” Brand Marijuana Cigarettes In Colorado,0
2,dailybuzzlive.com,VAGINA FLAVORED BEER! MADE FROM MODEL’S VAGINAL YEAST!,1
3,dailybuzzlive.com,KFC Allegedly Not Serving Real Chicken The Truth About KFC’s Name Change,1
4,dailybuzzlive.com,Cannibals Arrested in Florida Claim Eating Human Flesh Cures Diabetes and Depression,0
5,dailybuzzlive.com,‘The Baby Muzzle’: A New Japanese Invention For Your Crying Baby,1
6,dailybuzzlive.com,ANOTHER Teen Tragically DIES After Breaking Her Neck From Ice Bucket Challenge,0
7,dailybuzzlive.com,"McDonald’s Removing Big Mac, Apple Pies And Eliminating Large Size Options",0
8,dailybuzzlive.com,"If You’re Italian, German or Irish-American, This is How Your Ancestors Were Treated as Immigrants",1
9,dailybuzzlive.com,Energy Drinks Contain Ingredient Extracted From Bull Urine And Semen,0
10,dailybuzzlive.com,FDA Approved Paint Thinner In Your Kids Cereal,1
11,dailybuzzlive.com,Prehistoric Owl Successfully Cloned In Brazil – Plucks Out Scientists Eyeballs In Attack,0
12,dailybuzzlive.com,Breaking Dawn Pt 3 – Jacob And Renesmee – Next November 14,0
13,dailybuzzlive.com,"Category 6? If Hurricane Irma Becomes The Strongest Hurricane In History, It Could Wipe Entire Cities Off The Map",0
14,dailybuzzlive.com,Man Takes Selfie Right Before A Deadly Shark Attack,0
15,dailybuzzlive.com,8 Beers You Should Stop Drinking IMMEDIATELY!,1
16,dailybuzzlive.com,10 Drugs That Used To Be Legal In The 1920’s,1
17,dailybuzzlive.com,"Killer Turns Abandoned Home Into Haunted House, Uses Real Corpses As Props",0
18,dailybuzzlive.com,"The Girl In The Closet, The Most Horrific Case Of Child Abuse",1
19,dailybuzzlive.com,Iranian Girl Undergoes 50 Surgeries To Look Like Angelina Jolie,1
20,dailybuzzlive.com,Disney Illuminati And Satanic Symbols Exposed!,0
21,dailybuzzlive.com,Monster Energy Using Urea (Cow Urine) Compound As An ‘Energy Booster’ In Drinks,0
22,dailybuzzlive.com,Takis Causing Children to Get Sick With Ulcers And Cancer.,1
23,dailybuzzlive.com,Dead Man Rides Motorcycle At His Own Funeral,0
24,dailybuzzlive.com,13 People Of Walmart Photos That You Will Wish You Never Saw,1
25,dailybuzzlive.com,Worst Roller Coaster Accidents Caught On Video,0
26,dailybuzzlive.com,Close Look At McDonald’s Chicken McNuggets Under A Microscope,0
27,dailybuzzlive.com,Colorado McDonald’s Offers First Marijuana Friendly Smoking Section In Restaurant,0
28,dailybuzzlive.com,72-Year-Old Granny Having A Baby With Her Grandson,1
29,dailybuzzlive.com,Guess What Kids Are Smoking Now To Get High – TWIX Candy Bars,1
30,dailybuzzlive.com,New Government Program Provides FREE GAS CARDS To Welfare Recipients,0
31,dailybuzzlive.com,WARNING! SCAM ALERT: Be On The Look Out For These 2 Men In Walmart Parking Lots,1
32,dailybuzzlive.com,Elementary School Student Expelled For Pimping Female Classmates For “$3 Kisses And $2 Hugs”,0
33,dailybuzzlive.com,See What Happened After This Abused Dog Was Thrown Down A Trash Chute,1
34,dailybuzzlive.com,Woman Takes Flu Vaccine Now She Can’t Walk Forward,0
35,dailybuzzlive.com,76 Year Old Woman Kicked Out Of KFC For Breastfeeding Her 42 Year Old Son,1
36,dailybuzzlive.com,News Helicopter Sucked Into Tornado Caught On Video,0
37,dailybuzzlive.com,What Happens When A Teen At A Rave Decides To Lick A Frog To Get High,0
38,dailybuzzlive.com,10 Times Grandparents Texts Made Everyone Die From Laughter,1
39,dailybuzzlive.com,10 Creepy Sea Creatures You Didn’t Know Existed,1
40,dailybuzzlive.com,What The Average American Will Look Like In 2050,1
41,dailybuzzlive.com,WATCH: 10 Strange Creature Sightings Caught On Video,1
42,dailybuzzlive.com,McDonald’s Reveals ‘Special Sauce’ Ingredients And It Doesn’t Include ‘Semen’,0
43,dailybuzzlive.com,Bacon Wrapped Alligator With A Whole Chicken Stuffed In Its Mouth,0
44,dailybuzzlive.com,The Satanic Truth Behind Starbucks Coffee Logo,0
45,dailybuzzlive.com,This Photo Caused A Man To Divorce His Wife – Share When You See It,1
46,dailybuzzlive.com,FDA Sets Allowable Limits For Bugs In Our Manufactured Foods,0
47,dailybuzzlive.com,The Bizarre Mystery Behind These Bent Trees Is Absolutely Chilling,1
48,dailybuzzlive.com,See Some Of The Most Beautiful Butterflies In the World!,1
49,dailybuzzlive.com,REAL Paranormal Activity – Terrifying Proof,1
50,dailybuzzlive.com,"Eating Dinner That Fights You Back, Live Octopus",1
51,dailybuzzlive.com,"Watch How The $5, $10, $20, $50 Bills Show Twin Towers Collapse",1
52,dailybuzzlive.com,These Signs Are Popping Up At McDonald’s After FDA Cracks Down On Coffee “Additive”,1
53,dailybuzzlive.com,Woman Kills Hitman Hired By Her Husband,0
54,dailybuzzlive.com,Father Injects Infant With HIV To Avoid Paying Child Support,0
55,dailybuzzlive.com,"A Man Saw A Hole In A Rock, What He Found Inside Astounded The Entire World!",1
56,dailybuzzlive.com,"Get PAID To Smoke Marijuana, Find Out How!",1
57,dailybuzzlive.com,"‘Road Rage Lady’ Goes Crazy With Her Kid In The Car, Gets Arrested",0
58,dailybuzzlive.com,Mother Brings Baby Back To Life 2 Hrs After Being Pronounced Dead,0
59,dailybuzzlive.com,HIV/AIDS Infected Needles Being Hidden Under Gas Pumps,0
60,dailybuzzlive.com,"DNA Proved He’s Not The Father, But Courts Say He Still Owes $30,000 In Back Child Support",0
61,dailybuzzlive.com,Woman Finds Camera Recording Her In Walmart Dressing Room,0
62,dailybuzzlive.com,WARNING: Do NOT Use Crest 3D White Toothpaste!,0
63,dailybuzzlive.com,Fifteen Spotted Purple Ladybugs Found On Hawaiian Beach!,0
64,dailybuzzlive.com,Dad Walks In On A Daycare Worker Molesting A 5 Year Old – Worker Claims It Was An “Accident”,0
65,dailybuzzlive.com,Surfer Goes Underwater And Emerges With An Unexpected Creature,0
66,dailybuzzlive.com,10 Of The Most Shocking ‘Last Meals’ Requested On Death Row,1
67,dailybuzzlive.com,"It’s Not Nice To Call People Ugly – But In These 12 Cases, We Had To Make An Exception",1
68,dailybuzzlive.com,Dead And Live Frogs Showing Up In Lettuce Bags In Grocery Stores All Across The U.S.,0
69,dailybuzzlive.com,McDonald’s Chicken Tests Positive For The Prescription Drug Prozac,0
70,dailybuzzlive.com,11 Year Old Shoots Mom’s Abusive Boyfriend Who Stabbed Her Repeatedly,1
71,dailybuzzlive.com,Father Throws 5 Year Old Daughter Off Bridge To Her Death,0
72,dailybuzzlive.com,Reno ‘Ghost Adventures’ Couple Mark and Debbie Constantino Found Dead In Murder-Suicide,0
73,dailybuzzlive.com,AMC to cancel “The Walking Dead”,0
74,dailybuzzlive.com,Dad Gets Revenge On His Daughter’s Bullies By Doing THIS!,1
75,dailybuzzlive.com,Teardrop Memorial: New Jersey Monument For the Victims of 9/11,0
76,dailybuzzlive.com,See What Happens When You Poke A Giant Spider With A Stick,1
77,dailybuzzlive.com,Several Skinned Cats Found In McDonald’s Storage Freezers In New Mexico,0
78,dailybuzzlive.com,"Giant Asteroid Headed Our Way, NASA Says “Hang On For The Bumpy Ride”",0
79,dailybuzzlive.com,"Man Collects 70,000 Beer Cans Inside Home, Carves Tunnels To Travel Through House",0
80,dailybuzzlive.com,Audio Of The Possession Of The REAL Emily Rose,1
81,dailybuzzlive.com,"Count Your Bracelet Lines On Your Wrist, How Many? Here’s What It Means!",1
82,dailybuzzlive.com,Steve Harvey Breaks Down In Tears When He Sees His Birthday Surprise,1
83,dailybuzzlive.com,DUI Checkpoint Video Goes Viral,0
84,dailybuzzlive.com,See Why The GOP Is Trying To Ban Steak And Seafood With Food Stamps – Do You Agree?,1
85,dailybuzzlive.com,"Mom Disciplines Her Daughter For Being A Bully, But It Goes Terribly Wrong!",1
86,dailybuzzlive.com,What These Things Look Like Under A Microscope Might Give You Nightmares,1
87,dailybuzzlive.com,"These News Anchors Clearly Have Dislike For Each Other, And They’re Not Trying To Hide It!",1
88,dailybuzzlive.com,Amazing Photos Of The Rare ‘Super Tide’ In Europe,1
89,dailybuzzlive.com,"Photo Of Cop Macing A Little Girl, When Will Police Abuse Stop",1
90,dailybuzzlive.com,What The Government Doesn’t Want You To Know – iPhone 6 Phones Contaminated With Ebola Virus,1
91,dailybuzzlive.com,See What Happens When This Man Meets His Wife And Child’s Killer,1
92,dailybuzzlive.com,Dad’s Reply To Principal About Kids’ Absence Is The BEST Response EVER!,1
93,dailybuzzlive.com,4 Year Old Boy Describes Heaven Before Tragically Passing Away,0
94,dailybuzzlive.com,Did This Note From A Teacher To Her Student Go Too Far?,1
95,dailybuzzlive.com,"Cop Goes Nuts When Told, “God Bless You”",1
96,dailybuzzlive.com,Bizarre: Girl Killed In Her Sleep From Wearing Earbuds While iPhone Was Charging,1
97,dailybuzzlive.com,A 2 year Old Dies – See How He Was Brought Back To Life 2 Hours Later!,1
98,dailybuzzlive.com,Employee At Golden Corral Exposes Food Stored By Dumpster,0
