,source,title,is_clickbait
0,huffingtonpost.co.uk,Sir Philip Green Says He Will 'Turn Gay' In Extraordinary Tirade Against Reporters,0
1,huffingtonpost.co.uk,Hammond's Climate-Wrecking Budget Jeopardises Our Environmental Future,0
2,huffingtonpost.co.uk,How Spending Time With Music Legend Nile Rodgers Has Made Me Even More Determined For Success,1
3,huffingtonpost.co.uk,Attacks On Rough Sleepers Should Be Classed As Hate Crimes,0
4,huffingtonpost.co.uk,What Angela Merkel’s Departure Means For Germany - And The UK,0
5,huffingtonpost.co.uk,Stacey Dooley Sparks 'Strictly Come Dancing' Injury Fears With Cryptic Instagram Post,0
6,huffingtonpost.co.uk,Investing In Ending Women's Reoffending Would Save Money - And Families,0
7,huffingtonpost.co.uk,"Budget 2018: Spending Cuts Not Being Reversed Despite ‘Austerity Is Over’ Claim, IFS Says",0
8,huffingtonpost.co.uk,'You Are Speshl': 10 Times Kids Made The Cutest Letter Writers Ever,1
9,huffingtonpost.co.uk,Yet Another Reason Why Dogs Are Great – They Can Sniff Out Malaria,1
10,huffingtonpost.co.uk,Bake Off's Terry Pens Heartwarming Letter To Fans Ahead Of Final,0
11,huffingtonpost.co.uk,I Tried Lush Shampoo And Conditioner Bars In Place Of Plastic Bottles For A Fortnight,0
12,huffingtonpost.co.uk,Jo Whiley Admits It Was ‘Hard To Walk Out The Front Door’ After Radio 2 Drivetime Backlash,0
13,huffingtonpost.co.uk,Jeremy Corbyn Tries To 'Floss' And Ends Up Looking A Bit Like Mr Bean,0
14,huffingtonpost.co.uk,Russell Bishop Trial: Mother Weeps As She Recalls The Moment Her Daughter Was Found Dead,1
15,huffingtonpost.co.uk,'Great British Bake Off' Fans Are All Making The Same Joke Ahead Of This Year's Final,1
16,huffingtonpost.co.uk,Morrisons Slammed For Selling Plastic Halloween Apple Bobbing Kits,0
17,huffingtonpost.co.uk,Seann Walsh Dismisses 'I'm A Celebrity' Rumours After 'Strictly Come Dancing' Exit,0
18,huffingtonpost.co.uk,"Strictly's Shirley Ballas Denies She's Engaged, Still Gets Caught Googling Her 'Engagement Ring'",1
19,huffingtonpost.co.uk,Pharrell Williams Sends Donald Trump Cease And Desist After He Used 'Happy' At A Rally On Day Of Synagogue Shooting,0
20,huffingtonpost.co.uk,Man Jailed After Knowingly Infecting Women With HIV,0
21,huffingtonpost.co.uk,How Many Times Can One Plastic Bottle Be Recycled?,1
22,huffingtonpost.co.uk,Theresa May Dismisses Claims She's Gearing Up For Early General Election,0
23,huffingtonpost.co.uk,'Strictly Come Dancing' Week 7 Songs And Dances Confirmed,0
24,huffingtonpost.co.uk,Would You Rename Your Phone To Avoid Unsolicited Dicks Pics? This Woman Did,1
25,huffingtonpost.co.uk,Can You Get IVF For Free On The NHS? It Depends On Where You Live,1
26,huffingtonpost.co.uk,‘The Chase’ Viewers Cry 'Fix' After The Chaser Wins The Show Despite ‘Running Out Of Time’,0
27,huffingtonpost.co.uk,The 'Little Extra' Bits Buried In The Budget You May Have Missed,1
28,huffingtonpost.co.uk,"'Strictly Come Dancing': Seann Walsh's Partner Katya Jones Urges Him To Stick To The Day Job, Following Elimination",0
29,huffingtonpost.co.uk,This Man Saved All The Plastic He Would Have Thrown Away In A Year,1
30,huffingtonpost.co.uk,HuffPost Verdict: A Sticking Plaster Budget For The Bleeding Stumps Of Our Public Services,0
31,huffingtonpost.co.uk,Swim England Removes Swimwear Advice For Women With 'Flabby Stomachs',0
32,huffingtonpost.co.uk,Venice Flooding: 75% Of City Is Under Water As Deadly Storms Kill Six People In Italy,0
33,huffingtonpost.co.uk,500 People With Diabetes Die Prematurely Each Week In England And Wales,0
34,huffingtonpost.co.uk,"When Universal Credit Forces Foodbank Volunteers To Turn To Banks Themselves, Something Must Change",0
35,huffingtonpost.co.uk,Philip Hammond Made A Series Of Jokes In The Budget – And They Completely Bombed,1
36,huffingtonpost.co.uk,"Labour Will Support Philip Hammond's Income Tax Cuts, Says John McDonnell",0
37,huffingtonpost.co.uk,"M&S Dine In Meal Deal For Two Has Been Axed, But Here Are Some Great Alternatives",1
38,huffingtonpost.co.uk,"More Funding For Mental Health Services Is Welcome, But Money Alone Won't Bring About Parity Of Care",0
39,huffingtonpost.co.uk,"If This Is The Beginning Of The End Of Austerity, It Is Not Happening Fast Enough",1
40,huffingtonpost.co.uk,Gig Economy Workers To March Ahead Of Landmark Uber Ruling Today,0
41,huffingtonpost.co.uk,Two Men Assaulted At Stratford Station In Hammer Attack,0
42,huffingtonpost.co.uk,Budget 2018: UK Digital Services Tax Condemned For 'Trivial' Impact,0
43,huffingtonpost.co.uk,I'm Marching With Uber Drivers Today Because Their Fight Is My Fight,1
44,huffingtonpost.co.uk,Liz Truss Sits On Sajid Javid's Knee During Budget Speech Squeeze,0
45,huffingtonpost.co.uk,"It's Cold, It's Dark, But Here Are 15 Reasons To Embrace Shorter Days Now They're Here",1
46,huffingtonpost.co.uk,Your Baby Monitor Is Vulnerable To Hackers – Here's What You Need To Know,1
47,huffingtonpost.co.uk,Budget 2018: These Parts Of The Chancellor's Budget Were Attempts To Win Back The Young,1
48,huffingtonpost.co.uk,Pride Of Britain Awards: 11-Year-Old Transplant Patient Gives Back To Hospital That Saved Her Life,0
49,huffingtonpost.co.uk,‘Strictly’ Result: Seann Walsh Is The Fifth Celebrity To Leave The Competition,0
50,huffingtonpost.co.uk,NHS To Receive £2-Billion-A-Year Cash Injection For Mental Health Services In Autumn Budget,0
51,huffingtonpost.co.uk,Jeremy Hunt Doubles Down On Comparing EU To Soviet Union,0
52,huffingtonpost.co.uk,Budget 2018: What Is The New Digital Services Tax Revealed By 'Fiscal Phil'?,0
53,huffingtonpost.co.uk,London Paddington Rail Chaos As Cable Damage Causes Delays And Overcrowding,0
54,huffingtonpost.co.uk,Moors Murder Victim Pauline Reade Reburied After Police Return Remains,0
55,huffingtonpost.co.uk,10 Best Women's Christmas Jumpers For 2018,1
56,huffingtonpost.co.uk,Self-Confessed Racist Denies He Was Raising A Baby To Be A ‘Miniature Nazi',1
57,huffingtonpost.co.uk,I Went On A Silent Meditation Retreat - This Is What I Learned,1
58,huffingtonpost.co.uk,Nicole Scherzinger Finally Clears Up What She Said To Tess Daly During *That* ‘Strictly’ Live Show Exchange,1
59,huffingtonpost.co.uk,12 Things You Only Know If You're The Parent Of Twins,1
60,huffingtonpost.co.uk,Schizophrenic Patient Who 'Decapitated' Victim Had Been Released After Killing Her Own Mother,1
61,huffingtonpost.co.uk,Philip Hammond Must Not Neglect The Growing Tide Of Self-Employed Workers In Today's Budget,0
62,huffingtonpost.co.uk,Leicester City Owner Vichai Srivaddhanaprabha Confirmed Dead In Helicopter Crash,0
63,huffingtonpost.co.uk,"It’s Not Too Late For Government To Fix Universal Credit, But It Might Be Now Or Never",1
64,huffingtonpost.co.uk,Budget 2018: Philip Hammond Slammed For Giving More Cash To Potholes Than Schools,0
65,huffingtonpost.co.uk,Indonesia Lion Air Plane Crashes Into Sea With 189 On Board,0
66,huffingtonpost.co.uk,13 Of The Best Halloween Films And TV Shows To Netflix And Chills With,1
67,huffingtonpost.co.uk,Window Shopping: 7 Best Vegan Cookbooks To Get You Inspired,1
68,huffingtonpost.co.uk,"Talks On Post-Brexit Flights Have Not Started Yet, Chris Grayling Admits",0
69,huffingtonpost.co.uk,Downing Street Says No-Deal Brexit Won't Cancel Spending Plan - Hours After Philip Hammond Said It Would,0
70,huffingtonpost.co.uk,Universal Credit Is Changing Lives - This Budget Is The Time To Invest In It,1
71,huffingtonpost.co.uk,Gregory Irvin Jailed For Life For Stabbing His Grandmother To Death,0
72,huffingtonpost.co.uk,The Budget Must Address The Social Mobility Crisis Gripping Britain,0
73,huffingtonpost.co.uk,"Sara Cox Confirmed For Radio 2’s Drivetime Show, Replacing Simon Mayo And Jo Whiley",0
74,huffingtonpost.co.uk,Police Are Investigating ‘KKK Costumes’ Worn Outside An Islamic Prayer House,0
75,huffingtonpost.co.uk,Pro-Remain Justine Greening Signals She May Run For Prime Minister,0
76,huffingtonpost.co.uk,"As A Jewish Person, I’m Heartbroken By Pittsburgh But Not Surprised",0
77,huffingtonpost.co.uk,Rotherham: Gang Of Seven Men Found Guilty In Landmark Child Sexual Abuse Case,0
78,huffingtonpost.co.uk,Ex-Soldier Craig Savage Guilty Of Double 'Execution Style' Murder,0
79,huffingtonpost.co.uk,"We Should Stand Against Antisemitism, Islamophobia And All Forms Of Hate Hand In Hand",1
80,huffingtonpost.co.uk,Tunisia Explosion: Woman Blows Herself Up At Shopping Centre – Reports,0
81,huffingtonpost.co.uk,UK Weather: Halloween Trick Or Treaters Warmed To Wrap Up Warm,0
82,huffingtonpost.co.uk,Budget 2018: Stamp Duty To Be Abolished For First-Time Buyers Of Shared-Ownership Homes,0
83,huffingtonpost.co.uk,The Brexit 50p Has Everyone Making The Same Jokes,1
84,huffingtonpost.co.uk,"Pittsburgh Synagogue Shooting Victims Include Two Brothers, A Couple In Their 80s And A 97-Year-Old Woman",0
85,huffingtonpost.co.uk,Olly Murs Reveals His 'X Factor' Experience Left Him In Need Of Therapy,0
86,huffingtonpost.co.uk,Woman Charged With Murder In Connection With North London Stabbing,0
87,huffingtonpost.co.uk,Bradley Wiggins Hails Lance Armstrong As 'Perfect Winner' Of Tour De France,0
88,huffingtonpost.co.uk,EXCLUSIVE: Davina McCall Breaks Silence On 'Big Brother' Axe: 'It Needs Resting For A Little Bit',0
89,huffingtonpost.co.uk,‘Strictly Come Dancing’ Judge Craig Revel Horwood Blasts Tess Daly's ‘Dull Questions’ And Labels Bruno Tonioli An 'Attention Seeker’,0
90,huffingtonpost.co.uk,The Four People In Your Life You Know Have Your Back,1
91,huffingtonpost.co.uk,Strictly Come Dancing's Katya Jones And Seann Walsh Filmed Kissing In Street,0
92,huffingtonpost.co.uk,Meghan Markle And Prince Harry Speak About Pregnancy For First Time Since Announcement,1
93,huffingtonpost.co.uk,Dads Are Proving Piers Morgan Wrong On Papooses And Parenthood With These Amazing Baby Pics,1
94,huffingtonpost.co.uk,James Bond Will 'Probably' Never Be Female As Producer Admits Franchise Isn't Feminist,1
95,huffingtonpost.co.uk,'Strictly Come Dancing': Seann Walsh's Ex Rebecca Humphries Channels Beyoncé In Instagram Post,0
96,huffingtonpost.co.uk,"Ant McPartlin And Ex-Wife Lisa Armstrong Granted Divorce, Nine Months After Split",0
97,huffingtonpost.co.uk,'Inbetweeners' Star James Buckley Says Show Would Offend People If It Aired Today,1
98,huffingtonpost.co.uk,Piers Morgan Goads Susanna Reid And Mocks Ant McPartlin Over NTAs Best Presenter Longlist,0
99,huffingtonpost.co.uk,'Only Fools And Horses' Musical To Open In London In February 2019,0
