,source,title,is_clickbait
0,kotaku.com,Google’s Homepage Is Now A Clever Multiplayer Halloween Game,1
1,kotaku.com,I Like Baseball Now Because It's Just Like Dwarf Fortress,1
2,kotaku.com,Hollywood Is Making An Attack On Titan Movie,1
3,kotaku.com,Prototype Wii Remote From The GameCube Era Sells At Auction,0
4,kotaku.com,No Man's Sky's Latest Update Will Be Underwater,0
5,kotaku.com,A Hotel Strike Was The Talk Of This Year's TwitchCon,1
6,kotaku.com,K-Pop Pick Of The Day: Goodbye,1
7,kotaku.com,The Week In Games: Cosmic Kingdom Wizard Kid,0
8,kotaku.com,"Halloween In Tokyo Descends Into Chaos, Clean-Ups And Arrests",0
9,kotaku.com,Game Historian Explains Blood Testing Devices For Nintendo Handhelds,0
10,kotaku.com,"Nintendo's Biggest Selling Games For Switch, 3DS, Wii U And More As Of Fall 2018",0
11,kotaku.com,Sunday Comics: Candy Bag,0
12,kotaku.com,Our Favorite Cosplay From Anime Fest @ NYCC x Anime Expo 2018,0
13,kotaku.com,"You're Just Not Scary Anymore, Cthulhu",1
14,kotaku.com,Scrabble World Champion Drops 100-Point Word Like It Was No Big Deal,0
15,kotaku.com,This Week In The Business: Do AAA Games Require Crunch?,1
16,kotaku.com,Early Access Means Nothing Anymore,0
17,kotaku.com,Twitch Streamer Locks Himself In A Cage For 30 Days [UPDATE],0
18,kotaku.com,Women On Twitch Go Without Makeup To Support A Fellow Streamer,0
19,kotaku.com,We All Sometimes Struggle With Work-Life Balance,1
20,kotaku.com,Tiny Torbjorn Action Figure Is Just The Right Size,1
21,kotaku.com,PS3 Game Shutting Down Servers Earlier Than Promised,0
22,kotaku.com,K-Pop Pick Of The Day: Cruel Fairy Tale,0
23,kotaku.com,A Visit To TwitchCon's Emote Museum,0
24,kotaku.com,It Takes Two To Cosplay As Doctor Strange,0
25,kotaku.com,"My Misadventures In Fallout 76's Buggy, Bizarre Beta",1
26,kotaku.com,The Vermin Tide,0
27,kotaku.com,Chinese Phone Company Boasts Their New Phone Is Better Than The Switch,0
28,kotaku.com,GOG Account Publishes Yet Another Awful Tweet,0
29,kotaku.com,'Retrogame Roadshow' Highlights Rare Gaming Collectibles,0
30,kotaku.com,More And More Game Makers Are Talking About Crunch,0
31,kotaku.com,Twitch's Casino Section Is Full Of Suspicious Channels,0
32,kotaku.com,Tree Queen,0
33,kotaku.com,K-Pop Pick Of The Day: Voodoo Doll,1
34,kotaku.com,Nike's Got More PlayStation Sneakers Coming,0
35,kotaku.com,You Can Now Officially Get The Steam Achievement For Not Playing A Game For Five Years,1
36,kotaku.com,Teen Developer Makes Game Inspired By '90s Shooters That Came Out Before He Was Born,1
37,kotaku.com,Several Excuses For Why I Am Still Playing Nintendo's Latest Mobile Game,0
38,kotaku.com,"Controversial Streamer Suspended From Twitch, Barred From TwitchCon After 'Harassment'",0
39,kotaku.com,"Well, You Don't See That Very Often",1
40,kotaku.com,Spot What's Wrong With This Japanese TV Screenshot,1
41,kotaku.com,Ask Dr. NerdLove: My Girlfriend's STI Diagnosis Has Me Questioning Everything,1
42,kotaku.com,Guess All These Anime References In This Week's Pokémon Episode,1
43,kotaku.com,Skybound Games 'In Discussions' With Former Telltale Staffers About Completing The Walking Dead,0
44,kotaku.com,This Week In The Business: Buncha Crunch,1
45,kotaku.com,The Unusual Effort That Went Into Creating WarioWare Gold,1
46,kotaku.com,Meltan Revealed To Be The First Mythical Pokémon That Evolves (Into An Absolute Unit),1
47,kotaku.com,The Top PlayStation Trophy Hunter Is Now Bagging 300 Platinums A Year,0
48,kotaku.com,This Anime Image Makes No Sense,1
49,kotaku.com,GameStop Wants People To Switch Their Switch For Another Switch,0
50,kotaku.com,Pachinko Company President Murdered In Japan,0
51,kotaku.com,K-Pop Pick Of The Day: Nobody,1
52,kotaku.com,Dying Genji Obliterates Enemy Team With Their Own Ult,0
53,kotaku.com,Not Here To Win Hearts Or Minds,1
54,kotaku.com,A Stealth Game With A Sneeze-Prone Hero,0
55,kotaku.com,Obama Does Not Care About Pokémon,0
56,kotaku.com,"After Nintendo's Lawsuit Win, Japan's Unofficial Mario Kart Continues",0
57,kotaku.com,A Game About Staying In Bed All Day,1
58,kotaku.com,We Were All Wrong About Mario's Nipples,1
59,kotaku.com,Transformers Change Into Tiny Cheap Collectibles,0
60,kotaku.com,The Week In Games: Cowboy Throne,0
61,kotaku.com,When A Fighting Game Tournament Breaks Out At A Wedding,0
62,kotaku.com,The Internet Reacts To Crunchyroll And Funimation's Break Up,0
63,kotaku.com,In Defense Of Blocking People On Twitter,1
64,kotaku.com,How A Twitch-Owned Wiki May Be Inflating Streamers' Views,0
65,kotaku.com,Two More Gaming Magazines Are Ending,0
66,kotaku.com,"The ""All Your Base"" Game Had 32 Secret Japanese Endings",1
67,kotaku.com,$160 He-Man Figures Are For Grown-Up Masters Of The Universe,1
68,kotaku.com,"A Free Horror Game Collection About Loss, Driving, And Candlekeeping",1
69,kotaku.com,The New Anime That Has Fans Complaining About Animation Quality,1
70,kotaku.com,More Books Should Be Made Into Video Games,1
71,kotaku.com,Welcome To Mushroom Town,0
72,kotaku.com,Seattle Police Launch An Anti-Swatting Program,0
73,kotaku.com,You Should Opt Out Of Discord's New Policy Changes,1
74,kotaku.com,"Welcome To The Thunder Dome, Overwatch",0
75,kotaku.com,"The ""AirDrop Perverts"" On Japanese Trains",0
76,kotaku.com,Sunday Comics: Recruitment Decision,0
77,kotaku.com,Mario Is Dressing Up As Luigi For Halloween,1
78,kotaku.com,Mojo Jojo Cosplay!,0
79,kotaku.com,A Bullet-Hell Shooter About Loving Your Enemy,1
80,kotaku.com,'Shop Contest: Luigi Is Scared,0
81,kotaku.com,The Limited Edition Sega Saturn Themed Music Player,0
82,kotaku.com,YouTube Is Down,0
83,kotaku.com,Windows Will No Longer Interrupt Your Games To Annoy You About Updates,1
84,kotaku.com,Sega Fans Will Get A High End Retro Console Of Their Own,1
85,kotaku.com,Friday 3:40pm,0
86,kotaku.com,Yesterday 2:25pm,0
87,kotaku.com,The Dreamcast 2 Is A Custom-Painted Switch Possessed By The Ghost Of Sega’s Past,0
88,kotaku.com,Microsoft Announces Xbox Game Streaming Service,0
89,kotaku.com,I’m Considering Restarting New Games After An Hour Or Two,0
90,kotaku.com,LEGO Pip-Boy Will Not Survive The Apocalypse,1
91,kotaku.com,Game Developers Say They're Preparing For PSN Name Changes,0
92,kotaku.com,Artificial Intelligence Gets Good At Creating Anime Girls,0
93,kotaku.com,"Many Big Games Now Have Two Release Dates, And The Earlier One Will Cost You",1
94,kotaku.com,PS4 Owners Feel Trolled By The New 6.0 Update,0
95,kotaku.com,Seven Ways To Make The PlayStation Classic Feel Like The Real Thing,1
96,kotaku.com,I'm Deleting This Damn Dragon Game That Keeps Asking For More Of My Money,1
97,kotaku.com,The Games That Inspire Coheed And Cambria's Sci-Fi Saga,1
98,kotaku.com,The Week In Games: Villains Reign,0
99,kotaku.com,"Don't Worry, Switch Online's CRT Filter Isn't Damaging Players' Screens",0
