,source,title,is_clickbait
0,newsmax.com,"Candy With Meth in Ohio Sickens Boy, Mother Says",0
1,newsmax.com,Trump Enacts Anti-opioid Abuse Package in Rare Bipartisan Step,0
2,newsmax.com,NY Times: US Intel Has Evidence of Crown Prince's Involvement in Khashoggi's Death,0
3,newsmax.com,WashPost: Dems Take in Record $1 Billion Haul For Midterms,0
4,newsmax.com,4 Earthquakes Hit in Quick Succession Off Canadian Coast,0
5,newsmax.com,Chelsea Clinton Slams Farrakhan for Comparing Jews to Termites,0
6,newsmax.com,"Dove Awards: Tauren Wells Wins 4, Including New Artist",0
7,newsmax.com,Trump Focuses on Immigration as Main Midterm Issue,0
8,newsmax.com,"US Steel Workers to Get 14 Percent Pay Hike, Biggest Raise in Years",0
9,newsmax.com,Ukrainian Su-27 Fighter Jet Crash Kills USAF Pilot,0
10,newsmax.com,Campaign Rules Needed to Stop Unscrupulous Fundraising Like Avenatti's,0
11,newsmax.com,'Destroyer' Trailer Shows Nicole Kidman's Character Facing Dark Past,0
12,newsmax.com,Trump Threatens Tariffs If Countries Don't Cooperate With US,1
13,newsmax.com,Joe Arpaio Files Libel Suit Against The New York Times,0
14,newsmax.com,'The Conners' Premieres to Barr Blast About Roseanne's Death,0
15,newsmax.com,12 Candidates to Replace Nikki Haley at the UN,0
16,newsmax.com,Indicted Rep. Collins Still Ahead in NY-27,0
17,newsmax.com,Mega Millions Jackpot Soars to $868M After a Winless Tuesday,0
18,newsmax.com,Trump: 'My Biggest Threat Is the Fed',1
19,newsmax.com,Trump Should Consider Nontraditional Choice as Haley's Replacement,0
20,newsmax.com,'History Is Going to Be Made' in New Hampshire House Race,0
21,newsmax.com,WSJ: Uber Valued at Up to $120 Billion in IPO Proposals,0
22,newsmax.com,Trump Threatens to End Aid to Honduras Over Migrant 'Caravan',0
23,newsmax.com,Trump Assassination Attempt by ISIS in Manila Aired by NatGeo,0
24,newsmax.com,"Ford Prepares to Cut 70,000 Salaried Jobs in $11 Billion Restructuring",0
25,newsmax.com,Trump Raises Record Breaking $100 Million for Re-election,0
26,newsmax.com,"Mike Pompeo, Saudi King Talk About Missing Journalist Khashoggi",0
27,newsmax.com,GOP Congressional Candidate Declines Rally With Trump,0
28,newsmax.com,Dollar Tree Stock Soars on Report Icahn Buys Stake,0
29,newsmax.com,"As Cities and Hotel Industry Struggle to Curb Airbnb, Voters Are Pushing Back",0
30,newsmax.com,EMTs Grant Laura Mullins' Dying Wish to See a Lighthouse,0
31,newsmax.com,Iran: Trump's 'Bullying' Won't Lower Crude Oil Prices,0
32,newsmax.com,Iran Media: Militants Abduct 14 Border Guards in the South,0
33,newsmax.com,S&P: China May Have $5.8 Trillion in Hidden Debt With 'Titanic' Risks,0
34,newsmax.com,Top 3 Percent of US Taxpayers Paid Majority of Income Taxes in 2016,0
35,newsmax.com,CNN's Cupp to Avenatti: 'Every Idiotic Thing You Do Just Helps Get Him Re-Elected',1
36,newsmax.com,Trump Signs Bills to Help Patients Stop Overpaying for Drugs,0
37,newsmax.com,General Mills Shares Tumble as Sales Disappoint Amid Lower Demand,0
38,newsmax.com,World's Biggest Traders See Oil at $65-$100 a Barrel Next Year,0
39,newsmax.com,"Sessions: MS-13 Gang, Drug Cartels Among Top Threats to US",0
40,newsmax.com,SoftBank's Saudi Ties Unnerve Investors as Shares Drop 8 Percent,0
41,newsmax.com,"Trump: 'If I Can Test Her Personally,' I'll Donate Warren DNA Money",1
42,newsmax.com,Japan's SoftBank Raises Bet on WeWork With Possible Majority Stake,0
43,newsmax.com,"Decades Later, Calls Come for Delaware's Carper to Resign Over Domestic Violence",0
44,newsmax.com,For Sale to the Highest Bidder: A 12-pound Chunk of the Moon,0
45,newsmax.com,Report: DNC Lawyers Met With FBI Before FISA Warrant,0
46,newsmax.com,NHTSA: Self-Driving Cars May Hit US Roads in Pilot Program,0
47,newsmax.com,Florida Man Arrested After Threatening to Kill Senators Who Oppose Kavanaugh,0
48,newsmax.com,F-22s Left Behind At Florida Base in Better Shape Than Feared After Hurricane,0
49,newsmax.com,WSJ: US Farmers Face Pressure of Resurgent Russian Agriculture,0
50,newsmax.com,Goldman Seeks to Restrain Lending Amid Fears of Consumer Debt,0
51,newsmax.com,Trump's 'America First' Strategy Hurting China's Business,0
52,newsmax.com,"Amazon's HQ2 Going to a City You've Never Heard of, Site Claims",0
53,newsmax.com,Why Do Airlines Allow Support Animals But Not Research Animals?,0
54,newsmax.com,"Collins: Anti-Kavanaugh Crowdfunding Site Tried to 'Buy Votes, Positions'",0
55,newsmax.com,Trump Lauds Tariffs as China Warns It Won't Play Defense on Trade,0
56,newsmax.com,Rand Paul Calls for Halt to US Arms Sales to Saudi Arabia,0
57,newsmax.com,Retiree Tax Surprise From New Law Warned by IRS,0
58,newsmax.com,Report: US Plans Show of Military Force to Deter China,0
59,newsmax.com,Hurricane Florence Expected to Cause at Least $27 Billion in Damages,0
60,newsmax.com,OPEC Cuts Forecast for Global Oil Demand Growth in 2019,0
61,newsmax.com,Fox News Anchor Harris Faulkner Wants SNL's Leslie Jones to Play Her in A Movie,1
62,newsmax.com,Bernie Sanders Rescues Amy Currotto From DC Traffic,1
63,newsmax.com,Turnover Expected Among US Military Generals,0
64,newsmax.com,Red Tide Is Plaguing Beaches on Both of Florida's Coasts,0
65,newsmax.com,What You Need to Know About Sears Bankruptcy Filing,1
66,newsmax.com,Apple Plans Another Death Blow to the Phone Carriers,0
67,newsmax.com,Poll: Celeb Opinions Don't Sway Majority,0
68,newsmax.com,California DMV Voter Registrations May Have Included Non-citizens,0
69,newsmax.com,VA Balks at Request for Docs Tied to Trump Pals' Influence,0
70,newsmax.com,Alamo's Heroes Almost Got Scrubbed in Politically Correct Cleansing by Texas School Board,0
71,newsmax.com,"Dems Trail in Bid to Score Upsets in Texas, Tennessee Senate Races",0
72,newsmax.com,Report: Hispanic Suicide Rate Steady Amid National Rise,0
73,newsmax.com,Bill Would Put Brakes on US States' Rush to Tax Internet Sales,0
74,newsmax.com,Rasmussen Poll: GOP Pulls Even With Dems on Generic Ballot,0
75,newsmax.com,$289M Jury Award in Roundup Cancer Suit Heads to Court,0
76,newsmax.com,Hillary: Cannot Be 'Civil' to Republicans,0
77,newsmax.com,Fragile Pipelines Pose an Increasing Risk in Gas-Hungry US,0
78,newsmax.com,67 Percent of Americans Are Tired of Polarized Politics,0
79,newsmax.com,New Poll Packed Big Punch in Hard-Fought Wash-8 Race,0
80,newsmax.com,Retired U.S. Air Force General Rand Named CEO of Gary Sinise Fdn.,0
81,newsmax.com,CEO Lampert's Plan to Save Sears Would Hand His Hedge Fund $1 Billion,0
82,newsmax.com,"Reports: Amazon HQ2 Team Took Second Tour in Miami, Chicago",0
83,newsmax.com,Trump Deserves to Win Nobel Prize for Economics,0
84,newsmax.com,Sources: NBC 'Counting Down the Days' on Megyn Kelly,0
85,newsmax.com,"Mnuchin, Fed Officials Downplay Market Rout as Selloff Widens",0
86,newsmax.com,"Hurricane Michael Tears Florida Towns Apart, 7 Dead",0
87,newsmax.com,Florence to Distort Economic Data Despite Little Expected Harm,0
88,newsmax.com,"George W. Bush, Mitt Romney Head to Arizona to Back Martha McSally",0
89,newsmax.com,How Long Before Sen. Paul's Fears Are Realized?,0
90,newsmax.com,Melania Trump Won't Attend Kavanaugh Swearing In,0
91,newsmax.com,CBS Poll: Voters Not Swayed by Brett Kavanaugh Result,0
92,newsmax.com,Kim Agrees to Dismantle Main Nuke Site If US Takes Steps Too,0
93,newsmax.com,"ABC News Poll: Trump's Approval Up, But Dems Poised to Take House",0
94,newsmax.com,Ohio Governor's Race Truly a Toss-up in 'Kasich Land',0
95,newsmax.com,Selfie Deaths a Health Problem With More Than 250 Killed,0
96,newsmax.com,CNN Host Rejects Koppel Claim That Ratings Would Sink Without Trump,0
97,newsmax.com,Mark Mobius: China-US Trade War Will Yield 'Blood on the Streets',0
98,newsmax.com,Traders: US to Be Big Winner of New Shipping Rules,0
99,newsmax.com,Retail Icon Sears Preparing to File for Bankruptcy,0
