,source,title,is_clickbait
0,sciencealert.com.au,"Scientists Have Found The Largest Deep-Sea Nursery, With More Than 1000 Octopuses",0
1,sciencealert.com.au,"This Bizarre Form of Ice Grows at Over 1,000 mph, And Now Physicists Know How",1
2,sciencealert.com.au,Infographic: The Most Exciting Science News This Week,1
3,sciencealert.com.au,The USGS Has Just Listed These 18 North American Volcanoes as The Biggest Threats,1
4,sciencealert.com.au,"Apparently, a Replica of The Titanic Will Follow The Original Ship's Route in 2022",1
5,sciencealert.com.au,"This Hidden Oil Spill Has Been Going For 14 Years, And Is About to Overtake The BP Disaster",1
6,sciencealert.com.au,Here's What It Looks Like When a Drone Smashes Into a Plane Wing at 238 Mph,1
7,sciencealert.com.au,"Insects Are Rapidly Disappearing Around The World, Leaving Scientists Horrified",0
8,sciencealert.com.au,Students Opened a Time Capsule From 1993 And It Reveals How Insanely The World Has Changed,1
9,sciencealert.com.au,A $500 Million Museum Just Revealed Its Priceless Dead Sea Scrolls Are Fakes,0
10,sciencealert.com.au,NASA Unveils 21 New Constellations Invisible to The Naked Eye,0
11,sciencealert.com.au,Astronomers Have Found a Massive Galaxy Proto-Supercluster Lurking in The Early Universe,0
12,sciencealert.com.au,"Because of Anti-Vaxxers, 37 People in Europe Have Died of Measles This Year",1
13,sciencealert.com.au,"Apparently, a Replica of The Titanic Will Follow The Original Ship's Route in 2022",1
14,sciencealert.com.au,"Because of Anti-Vaxxers, 37 People in Europe Have Died of Measles This Year",1
15,sciencealert.com.au,Scientists Have Found What They Think Are Incredibly Preserved 120 Million-Year-Old Bird Lungs,1
16,sciencealert.com.au,"This Hidden Oil Spill Has Been Going For 14 Years, And Is About to Overtake The BP Disaster",1
17,sciencealert.com.au,Here's What It Looks Like When a Drone Smashes Into a Plane Wing at 238 Mph,1
18,sciencealert.com.au,A $500 Million Museum Just Revealed Its Priceless Dead Sea Scrolls Are Fakes,0
19,sciencealert.com.au,Scientists Have Found What They Think Are Incredibly Preserved 120 Million-Year-Old Bird Lungs,1
20,sciencealert.com.au,A 150-Year-Old Drug Could Improve One of The Biggest Problems With Radiation Therapy,0
21,sciencealert.com.au,"Insects Are Rapidly Disappearing Around The World, Leaving Scientists Horrified",0
22,sciencealert.com.au,Students Opened a Time Capsule From 1993 And It Reveals How Insanely The World Has Changed,1
23,sciencealert.com.au,A 150-Year-Old Drug Could Improve One of The Biggest Problems With Radiation Therapy,0
24,sciencealert.com.au,NASA Unveils 21 New Constellations Invisible to The Naked Eye,0
25,sciencealert.com.au,Astronomers Have Found a Massive Galaxy Proto-Supercluster Lurking in The Early Universe,0
26,sciencealert.com.au,Looking at a cure for AIDS,0
27,sciencealert.com.au,Students Opened a Time Capsule From 1993 And It Reveals How Insanely The World Has Changed,1
28,sciencealert.com.au,Study links high-energy food and drinks with bowel cancer,0
29,sciencealert.com.au,Solar eruption could help Earth prepare for technology melt-down,0
30,sciencealert.com.au,Do chimps and bonobos go ape when risk goes wrong?,0
31,sciencealert.com.au,An Outback Australian Observatory Detected 20 Mysterious Radio Bursts From Space in Just One Year,0
32,sciencealert.com.au,An Outback Australian Observatory Detected 20 Mysterious Radio Bursts From Space in Just One Year,0
33,sciencealert.com.au,This Crazy Ambitious Timeline Shows When And How Elon Musk And Space X Plan to Colonise Mars,1
34,sciencealert.com.au,This Crazy Ambitious Timeline Shows When And How Elon Musk And Space X Plan to Colonise Mars,1
35,sciencealert.com.au,Did You Pay Attention to Science News This Week? Take Our Super Hard Quiz to Find Out,1
36,sciencealert.com.au,25 Astounding Moon Landing Facts From 'First Man' That Are Actually True,1
37,sciencealert.com.au,25 Astounding Moon Landing Facts From 'First Man' That Are Actually True,1
38,sciencealert.com.au,This Crazy Ambitious Timeline Shows When And How Elon Musk And Space X Plan to Colonise Mars,1
39,sciencealert.com.au,Over 50% of Parents Have This Dangerous And False Belief About The Flu Vaccine,1
40,sciencealert.com.au,Over 50% of Parents Have This Dangerous And False Belief About The Flu Vaccine,1
41,sciencealert.com.au,New type of vaccine could beat all strains of malaria,0
42,sciencealert.com.au,"Australia's on Track to Eliminate Cervical Cancer, The First Country to Ever Do So",0
43,sciencealert.com.au,"You Can Now Buy Fake Martian Dirt to Try Grow Potatoes in It (For Science, Obviously)",1
44,sciencealert.com.au,The World Health Organisation Has Called For a Reduction in C-Sections,0
45,sciencealert.com.au,The World Health Organisation Has Called For a Reduction in C-Sections,0
46,sciencealert.com.au,NASA's New Planet Hunter Has Already Spotted Two Candidates For Earth-Like Alien Worlds,0
47,sciencealert.com.au,Scientists Have Found The Mystery Cause of One of The Biggest Tsunamis Ever Recorded,1
48,sciencealert.com.au,Feeling Overwhelmed by The News? Here Are Some Easy Things You Can Do Right Now to Help The Planet,1
49,sciencealert.com.au,"You Can Now Buy Fake Martian Dirt to Try Grow Potatoes in It (For Science, Obviously)",1
50,sciencealert.com.au,Health Check: the low-down on eating vs juicing fruit and veg,1
51,sciencealert.com.au,Feeling Overwhelmed by The News? Here Are Some Easy Things You Can Do Right Now to Help The Planet,1
52,sciencealert.com.au,Expert: e-waste threatens kids,0
53,sciencealert.com.au,Damaged ants can't recognise foes,0
54,sciencealert.com.au,New laser to detect methane leaks,0
55,sciencealert.com.au,Want to Learn Something New? Here Are 10 Awesome Online Courses You Can Take Right Now For Under $70,1
56,sciencealert.com.au,These 15 Common Misconceptions Will Make You Rethink Dementia And Alzheimer's Disease,1
57,sciencealert.com.au,"For The First Time Ever, Astronomers Have Witnessed The Birth of a Neutron Star Binary",1
58,sciencealert.com.au,Poll: obesity a result of addiction,0
59,sciencealert.com.au,"A Yellowstone Geyser Just Erupted, And Just Look at All The Trash That Exploded in The Air",1
60,sciencealert.com.au,Deforestation reefs' worst threat,0
61,sciencealert.com.au,"Australia's on Track to Eliminate Cervical Cancer, The First Country to Ever Do So",0
62,sciencealert.com.au,These 15 Common Misconceptions Will Make You Rethink Dementia And Alzheimer's Disease,1
63,sciencealert.com.au,"More Than 250 People Worldwide Have Died Taking Selfies, Says Study",0
64,sciencealert.com.au,A Famous 'Nova' Just Turned Out Be Something Totally Unexpected,1
65,sciencealert.com.au,A Famous 'Nova' Just Turned Out Be Something Totally Unexpected,1
66,sciencealert.com.au,These Simple Tips For Storing Fruits And Vegetables Will Help You Keep Them Fresh Longer,1
67,sciencealert.com.au,"For Decades, This Rock Was Used as a Doorstop. Turns Out It's a $100K Meteorite",1
68,sciencealert.com.au,"For Decades, This Rock Was Used as a Doorstop. Turns Out It's a $100K Meteorite",1
69,sciencealert.com.au,We May Have Finally Discovered The First-Ever Moon Outside Our Solar System,1
70,sciencealert.com.au,NASA's New Planet Hunter Has Already Spotted Two Candidates For Earth-Like Alien Worlds,0
71,sciencealert.com.au,Want to Learn Something New? Here Are 10 Awesome Online Courses You Can Take Right Now For Under $70,1
72,sciencealert.com.au,"For The First Time Ever, Astronomers Have Witnessed The Birth of a Neutron Star Binary",1
73,sciencealert.com.au,These Simple Tips For Storing Fruits And Vegetables Will Help You Keep Them Fresh Longer,1
74,sciencealert.com.au,Did You Pay Attention to Science News This Week? Take Our Super Hard Quiz to Find Out,1
75,sciencealert.com.au,Astronomers Just Found a Planet Where Star Trek's Vulcan Was Predicted to Exist,1
76,sciencealert.com.au,Astronomers Just Found a Planet Where Star Trek's Vulcan Was Predicted to Exist,1
77,sciencealert.com.au,"Spiders Have Exploded Over This Greek Town, Coating Everything in a 1,000-Foot Web",0
78,sciencealert.com.au,4 Years From Now a New Star Was Predicted to Appear in Our Sky. But There Was a Typo,1
79,sciencealert.com.au,Observations Confirm Near-Light-Speed Jets in The Afterglow of a Neutron Star Collision,0
80,sciencealert.com.au,We May Have Finally Discovered The First-Ever Moon Outside Our Solar System,1
81,sciencealert.com.au,"1.4 Billion People Worldwide Need to Make This Lifestyle Change, Says WHO",1
82,sciencealert.com.au,This Unprecedented Study Shows How Different Florence Would Be if Not For Climate Change,1
83,sciencealert.com.au,There's Something You Should Know About The 100% Meat 'Pure Carnivore Diet',1
84,sciencealert.com.au,"This New Paper Says Pluto Should Be a Planet After All, And Here's Why",1
85,sciencealert.com.au,"This New Paper Says Pluto Should Be a Planet After All, And Here's Why",1
86,sciencealert.com.au,Weird 'Nuclear Pasta' Could Be The Strongest Material in The Universe,1
87,sciencealert.com.au,Weird 'Nuclear Pasta' Could Be The Strongest Material in The Universe,1
88,sciencealert.com.au,NASA Just Released New Data on Why Earth Wobbles as It Spins on Its Axis,0
89,sciencealert.com.au,NASA Just Released New Data on Why Earth Wobbles as It Spins on Its Axis,0
90,sciencealert.com.au,"7,200-Year-Old Traces of Cheese Have Been Discovered in Cute Animal Pots",0
91,sciencealert.com.au,A Woman Was Struggling to Breathe — Because of a 61-Pound Tumor in Her Uterus,1
92,sciencealert.com.au,These Scientists Predicted The Ghostly Shape of The Sun's Aura a Week Before Last Year's Eclipse,1
