,source,title,is_clickbait
0,talkingpointsmemo.com,GOP State Sen Candidate’s Mailer Shows Jewish Candidate Clutching Cash,0
1,talkingpointsmemo.com,‘Assault On Our Country’: Trump Goes All In On Nativism To Salvage The Midterms,0
2,talkingpointsmemo.com,Land O’Lakes’ Support Of Steve King Melts After White Nationalist Comments,0
3,talkingpointsmemo.com,Today’s Agenda: Plan To End Birthright Citizenship Rears Its Head,0
4,talkingpointsmemo.com,"After Blowback, AP Deletes Tweet Quoting Trump’s False Claim",0
5,talkingpointsmemo.com,"In Bipartisan Rejection, Lawmakers Will Not Appear With Trump In Pittsburgh",0
6,talkingpointsmemo.com,GOP Lawmakers Push Back On Trump’s Plan To Scrap Birthright Citizenship,0
7,talkingpointsmemo.com,Fake Jews,0
8,talkingpointsmemo.com,Won’t Take No For An Answer,0
9,talkingpointsmemo.com,Trump Wants To End Birthright Citizenship By Executive Order,0
10,talkingpointsmemo.com,Nope. The President Can’t End Birthright Citizenship,0
11,talkingpointsmemo.com,Scalise Doesn’t Object To Trump’s Talk Of Ordering End To Birthright Citizenship,0
12,talkingpointsmemo.com,Some Background Reading On Birthright Citizenship,0
13,talkingpointsmemo.com,Pittsburgh Synagogue Shooting Throws A Wrench Into Trump’s Campaign Plans,0
14,talkingpointsmemo.com,GOP’s Latest Campaign Punch On Health Care Relies On Classic Hook: Medicare,0
15,talkingpointsmemo.com,Senior House GOPers Eye Nov 14 For Leadership Elections,0
16,talkingpointsmemo.com,Pittsburgh Mayor Sends Message To Trump: Don’t Come During The Funerals,0
17,talkingpointsmemo.com,Domestic Terror Attacks And Trump’s Response Hang Heavy Over Midterms,0
18,talkingpointsmemo.com,"Rabbi Praying With Pence Called Jesus Messiah, Offends Jewish Denominations",0
19,talkingpointsmemo.com,Mixed Reaction Awaits Trump At Synagogue Scarred By Violence,0
20,talkingpointsmemo.com,US Government-Run Network Pulls Segment Calling Soros ‘Multimillionaire Jew’,0
21,talkingpointsmemo.com,"Heitkamp Shares The Wealth, Sends $2.7M To Other North Dakota Dems",0
22,talkingpointsmemo.com,"Megyn Kelly Resisting NDA, Pushing For Total Remainder Of $69 Million Contract",0
23,talkingpointsmemo.com,Trump Claims Calling Media ‘Enemy Of The People’ Is ‘My Form Of Telling The Truth’,1
24,talkingpointsmemo.com,"Trump Refuses To Be Consoler In Chief, Instead Escalates Attacks On Media",0
25,talkingpointsmemo.com,Fox News Admits ‘No Way’ To Confirm Guest’s Lie That Asylum Seekers Will Bring Smallpox,0
26,talkingpointsmemo.com,Trump: ‘We’re Going To Build Tent Cities’ To ‘Hold’ Those Seeking Asylum,0
27,talkingpointsmemo.com,"Jewish Refugee Agency Target For Far Right, Including Synagogue Gunman",0
28,talkingpointsmemo.com,"Trump Calls Gillum A ‘Thief,’ Implies That He’s Uneducated (He’s Not)",1
29,talkingpointsmemo.com,US Global Media Agency: Anti-Soros Segment ‘Inconsistent’ With Our Ethics,0
30,talkingpointsmemo.com,"Pentagon Sending 5,200 Troops To ‘Harden’ Border Against Migrants",0
31,talkingpointsmemo.com,"Gab, Cesspool Of Hate Where Pittsburgh Shooter Dwelled, Won’t Be Gone For Long",0
32,talkingpointsmemo.com,Bomb Scares Renew Domestic Terrorism Law Debate,0
33,talkingpointsmemo.com,Tester Says Warren’s Ancestry ‘Not Enough To Count’ But Dismisses Issue,0
34,talkingpointsmemo.com,‘It’s OK To Be White’ Signs Appear At Two Vermont Schools,0
35,talkingpointsmemo.com,Four Shots Fired At Empty Florida GOP Office Over The Weekend,0
36,talkingpointsmemo.com,Primer: Rick Scott Restored Voting Rights To Lowest Percentage Of Black Felons In 50 Years,0
37,talkingpointsmemo.com,New Hints That Trump Admin Discussed Controversial Effect Of Census Change,0
38,talkingpointsmemo.com,Journalist Apologizes For Saying Trump Has Radicalized More People Than ISIS,1
39,talkingpointsmemo.com,McCarthy Denounces Synagogue Shooting Days After Anti-Soros Post,0
40,talkingpointsmemo.com,"Asked Why Trump Has Blamed Media For Division, Sanders Blames The Media",1
41,talkingpointsmemo.com,GOP Texas AG’s Indictment Probably Won’t Hurt Him In Midterms,0
42,talkingpointsmemo.com,Fox Contributor: Where Are Condemnations Of Media And Dems ‘For Targeting Trump?’,1
43,talkingpointsmemo.com,North Carolina Student Fatally Shoots Fellow Classmate In Hallway Fight,0
44,talkingpointsmemo.com,Today’s Agenda: The Latest Attack On A Minority Group,0
45,talkingpointsmemo.com,"Tester Ad Features Missing Fingers, Shows How Red-State Dems Still In The Fight",0
46,talkingpointsmemo.com,Groups Mask Partisan Attacks Behind Neutral-Sounding Names In Facebook Ads,0
47,talkingpointsmemo.com,WH Aide Calls For Unity After Shooting While Blasting ‘Outrageous’ Dem Response,0
48,talkingpointsmemo.com,"Cornyn Tweets Pelosi Comment Without Context After Shooting, Prompting Anger",0
49,talkingpointsmemo.com,Boston Gangster James ‘Whitey’ Bulger Found Dead In Prison,0
50,talkingpointsmemo.com,National Republicans Jump Into Two More House Districts Once Considered Safe,0
51,talkingpointsmemo.com,Convicted Anti-Muslim Plotter Wants Leniency Because Of Trump Rhetoric,0
52,talkingpointsmemo.com,"Biggest NJ Paper Advises: ‘Choke It Down, And Vote For Menendez’",0
53,talkingpointsmemo.com,Pelosi Promises Hasty Action On LGBTQ Rights Bill Should Dems Win House,0
54,talkingpointsmemo.com,Reports Of Voter Intimidation At Polling Places In Texas,0
55,talkingpointsmemo.com,Trump Family Sued Over Alleged Participation In Pyramid Scheme,0
56,talkingpointsmemo.com,DOJ Asks SCOTUS To Delay Next Week’s Census Citizenship Trial,0
57,talkingpointsmemo.com,"King: If My Neo-Nazi-Linked European Pals Lived In US, They’d ‘Be Republicans’",0
58,talkingpointsmemo.com,Pro-Trump Gun Store Owner Marshals Voters To Expand Medicaid In Idaho,0
59,talkingpointsmemo.com,Trump Biographer On POTUS Rhetoric: ‘Dog Whistles Are Silent. This Is A Fire Alarm’,1
60,talkingpointsmemo.com,Ben & Jerry’s Hits Back At Trump Admin Policies With Pecan Resist Flavor,0
61,talkingpointsmemo.com,Drudge Blasts ‘Bizarre’ Fox Segment: ‘Check Your Soul In The Makeup Chair!’,1
62,talkingpointsmemo.com,Behold How Frustrated A Judge Is With The DOJ’s Shenanigans In The Big Census Case,1
63,talkingpointsmemo.com,"Gillum Shoots Back At Trump, Says He’s ‘Howling Because He’s Weak’",0
64,talkingpointsmemo.com,"‘MAGA Bomber’ Kept Hit List Of Intended Targets, Officials Say",0
65,talkingpointsmemo.com,Fox’s Kilmeade Frets About ‘Diseases’ That Immigrants Could Bring To America,1
66,talkingpointsmemo.com,Trump’s ‘Executive Time’ Puts Him Totally Out Of Step With Predecessors,0
67,talkingpointsmemo.com,"At Georgetown Prep Reunion, Kavanaugh Welcomed Back With Open Arms",0
68,talkingpointsmemo.com,Butina Gathered Info On US Nonprofits’ Cyberdefenses During Grad School,0
69,talkingpointsmemo.com,Image Of Bloody Fetus Sent To Beto O’Rourke Supporters,0
70,talkingpointsmemo.com,Merkel To Step Down As Party Leader: ‘Time To Start A New Chapter’,0
71,talkingpointsmemo.com,Judicial Watch Atty Running For DC Council Won’t Budge On Chris Farrell,0
72,talkingpointsmemo.com,"New Quinnipiac Poll: O’Rourke Gains 4 Points, Narrows Cruz’s Lead",0
73,talkingpointsmemo.com,Maryland Man Pleads Guilty To Illegally Voting In West Virginia 9 Times,0
74,talkingpointsmemo.com,5 Audiobooks To Prep You For The Midterm Elections,1
75,talkingpointsmemo.com,Nope! White House Falsely Claims Trump Won Popular Vote,0
76,talkingpointsmemo.com,White Woman Fired From Six-Figure Job After Racist Rant At Black Neighbor,0
77,talkingpointsmemo.com,Pence: ‘Important We Don’t Connect’ ‘Evil Acts’ To ‘Public Debate’,1
78,talkingpointsmemo.com,Pence Doubles Down On Claims Of ‘Middle Easterners’ In Caravan,0
79,talkingpointsmemo.com,"Graham Falls In Line, Plans Legislation To Scrap Birthright Citizenship",0
80,talkingpointsmemo.com,"Thousands Of Troops, Up From Initial Estimate Of 800, Could Head To Border",0
81,talkingpointsmemo.com,WH Defends ‘Enemy Of The People’ Label For Media Despite Bombs Sent To CNN,0
82,talkingpointsmemo.com,WH Attacks Dems When Asked If Trump Would Soften Language Against Those Targeted,1
83,talkingpointsmemo.com,Trump To Visit Pittsburgh Tuesday After Shooting Massacre At Synagogue,0
84,talkingpointsmemo.com,GOP Rep. Shuts Down Trump Plan To End Birthright Citizenship: ‘You Can’t End It’,1
85,talkingpointsmemo.com,"Brazil Elects Right Wing President, Stokes Fears Of Civil Liberty Rollbacks",0
86,talkingpointsmemo.com,Yet Another Suspicious Package Addressed To CNN Intercepted,0
87,talkingpointsmemo.com,"After Week Of Domestic Terror Attacks, Trump Chooses To Excoriate Media",0
88,talkingpointsmemo.com,Conway Implies Comedians Making Fun Of Religion To Blame For Violence At Worship Centers,0
89,talkingpointsmemo.com,WH Attacks WaPo For Highlighting Connections Between Trump Rhetoric And Recent Violence,0
90,talkingpointsmemo.com,"WH Condemns ‘Cowards’ Who Sent Explosives To Obama, Clinton, Soros",0
91,talkingpointsmemo.com,Lt. Gov. Mallott’s Shocking Resignation Imperils AK Gov. Walker’s Reelect Bid,0
92,talkingpointsmemo.com,Is Nikki Haley’s Resignation Tied to Khashoggi’s Murder?,0
93,talkingpointsmemo.com,Key Architect Of The GOP Tax Plan Isn’t Talking About It Much On The Trail,1
94,talkingpointsmemo.com,Man Set To Plead Guilty To Sending White Powder To Trump’s Sons,0
95,talkingpointsmemo.com,The Worst Campaign Attack Ads Of 2018 So Far,1
96,talkingpointsmemo.com,New Concrete Blocks Outside NYT Building Part Of ‘Efforts To Enhance Security’,0
97,talkingpointsmemo.com,Heller Sucks Up To Trump At Rally: ‘Everything You Touch Turns To Gold’,1
98,talkingpointsmemo.com,"Trump Won’t Accept Blame If GOP Loses House, Says He’s ‘Helping’ Candidates",0
99,talkingpointsmemo.com,Roberts: Kavanaugh Joining Court Is Like Having A New In-Law At Thanksgiving,0
