,source,title,is_clickbait
0,whatdoesitmean.com,FBI Issues Urgent Global Appeal For Info On Venezuela Bomb Makers Seen At Elite American Universities With Known Chinese Agents,0
1,whatdoesitmean.com,Russian Leaders React With Alarm After Trump Explains Why He Suddenly Boosted Planetary Defense Budget,1
2,whatdoesitmean.com,American People Kept Blinded As Russian Leaders And US Troops Both Agree World War III Is But Months Away,0
3,whatdoesitmean.com,Russian Diplomats Struggle To Find Words After West Attacks Children Fairy Tales While Millions Face Death In Yemen,0
4,whatdoesitmean.com,Demonic Leftist Mobs Move In For Kill Against Trump After Historic Fracture Of Christian Church,0
5,whatdoesitmean.com,Putin Looks To Heaven As Trump-Clinton War Spreads To Saudi Arabia Over Fears Of 9/11 Truth Exposure,0
6,whatdoesitmean.com,Daughter Of CIA Assassin Paymaster Tries To Bring Down Trump Supreme Court Nominee Kavanaugh,0
7,whatdoesitmean.com,"Globalist “ Deep State ” Recoils In Horror As “ Kavanaugh Earthquake ” Destroys Canada, With Brazil Soon To Follow",0
8,whatdoesitmean.com,Fears Raised In Russia After United States Fails Main Treaty Obligation And Sends Its Top Solar Scientists Fleeing Underground,0
9,whatdoesitmean.com,CIA Director Call To Trump And US Senate Leader Throws Judge Kavanaugh Attackers Into Full Blown Panic Meltdown,0
10,whatdoesitmean.com,Democrats Do The Impossible By Actually Forcing The Powerful Bush Family Into Backing Trump In Support Of Supreme Court Nominee Kavanaugh,0
11,whatdoesitmean.com,New York Times Rage Against “ White Women ” Leaves World Stunned After Rape And Murder Of Journalist Unmasking “ Deep State ” Crimes,0
12,whatdoesitmean.com,Fears Of Hillary Clinton Directed “Acid Throwing Attacks” Set To Begin In America Prompts Red Alert Warning To Diplomats,0
13,whatdoesitmean.com,Judge Kavanaugh Charade Gives Cover For CIA Takeover Of US Congress As Soros Leftist Mobs Descend On Washington,0
14,whatdoesitmean.com,American Leftist Fears Of Free Speech Threatens Entire Nation—Let Me Tell You Why,1
15,whatdoesitmean.com,“11 Weeks That Shook The World”—The Endgame Begins!,1
16,whatdoesitmean.com,Kavanaugh Accuser Blasey-Ford Exposed As FBI Operative Working For Former FBI Deputy Director McCabe,0
17,whatdoesitmean.com,Assassin Of Hillary Clinton Email Leaker Seth Rich Gunned Down In Fierce Gun Battle That Leaves 4 Dead,0
18,whatdoesitmean.com,Freemasonic Forces Led By Donald Trump Launch “Soon To Be Deadly” American Coup d'état,0
19,whatdoesitmean.com,"As New “God” Arises, World's Best Minds Warn “End Is Near”",0
20,whatdoesitmean.com,American Radical Leftists Destroy Women Rights For Generation As Kavanaugh Backlash Reverberates Around Globe,0
21,whatdoesitmean.com,European Globalists Cower In Fear After Historic Trump-Quake Leaves Germany In Ruins,0
22,whatdoesitmean.com,Putin Gives Trump Shocking Evidence That Obama-Clinton CIA Director John Brennan Is Longtime Russian Spy,0
23,whatdoesitmean.com,Judge Kavanaugh Attackers Warned Are Now Facing Wrath Of Trump-Led Christian-Nationalist Forces Who Sent Hillary Clinton To Hell,0
24,whatdoesitmean.com,Israeli Special Forces Rush To Protect Wife Of Mysterious FBI Official Targeted For Death,0
25,whatdoesitmean.com,Parliament Of Owls Gives ‘Final Warning’ To America,0
26,whatdoesitmean.com,Obama Orders ‘Arctic Death Camps’ Built To Hold American Traitors,0
27,whatdoesitmean.com,"Top US General Ordered To Finland Receives Final Putin Warning: “Stop World Cup War Now, Or Watch Gates Of Hell Open”",0
28,whatdoesitmean.com,Sealed Indictment Arrest Of Supreme Court Justice Confirms Shocking QAnon Intel—As Mueller Probe Against Trump Warned Ready To Go Down In Flames,0
29,whatdoesitmean.com,US Federal Witness Due To Testify Against Hillary Clinton For Drug Crimes Killed In Massive Explosion,0
30,whatdoesitmean.com,Putin-Trump Begin Emergency Talks After Top US Nuclear Commander Disappears,0
31,whatdoesitmean.com,Putin Orders Special Forces To Protect Greek Leaders Life “At All Costs”,0
32,whatdoesitmean.com,Mexico Warns Trump It Will Flood US With Refugees While Nicaragua Plunges Towards Abyss And Canada Labels United States As “ Failed State ”,0
33,whatdoesitmean.com,Father Of Doctor Treating Hillary Clinton For Dementia Mysteriously Dies,0
34,whatdoesitmean.com,Obama Push For World War III Shocks Putin,0
35,whatdoesitmean.com,Secret Court Nightmare Descends On America As Kavanaugh National Disaster Sends Russian Fleet To Nuclear Launch Points,0
36,whatdoesitmean.com,Obama’s “Master Plan” To Destroy America Revealed By Russia,0
37,whatdoesitmean.com,Putin “Erupts” Over Million Dollar “Spy Payments” To Hillary Clinton,0
38,whatdoesitmean.com,Obama Orders CIA To Disappear His “Love Child” After Mother Assassinated,0
39,whatdoesitmean.com,Turkish Downing Of US Marine Helicopters Killing 12 American Soldiers Stuns Russia,0
40,whatdoesitmean.com,Kremlin War Erupts Over Release Of Top Secret Hillary Clinton Emails,0
41,whatdoesitmean.com,Doomsday Warned Near As CIA Nears Open Civil War Against Freemason Leader Trump,0
42,whatdoesitmean.com,Most Secret Grand Jury In American History Paralyzes Washington With Fear,0
43,whatdoesitmean.com,Concentration Camp Model Created By Hillary Clinton In Africa Warned Is Coming To America,0
44,whatdoesitmean.com,Husband Of Prosecutor Investigating Bill Clinton For Child Sex Charges Gunned Down,0
45,whatdoesitmean.com,"Russia-China Agree On First Strike Targets against West, Estimate 70 Million Dead In 6 Hours",0
46,whatdoesitmean.com,Russian Lawyer Who Met Donald Trump Jr. Survives Murder Plot Linked To US Senator McCain,0
47,whatdoesitmean.com,Russia Proclaims “Season Of Assassins” Has Arrived After Feared CIA Executive Joins Forces With Trump,0
48,whatdoesitmean.com,Russia Deploys Mobile ICBM’s To “Fail Safe” Points As West Begins “False Flag” Attack In Syria,0
49,whatdoesitmean.com,Evidence That 5 Million Americans Have Been “Disappeared” By Obama Shocks Russia,0
50,whatdoesitmean.com,World In Shock After CIA-MI6 Operative Stefan Halper Confirmed As Mole FBI Director Comey Used To Destroy Trump,0
51,whatdoesitmean.com,Obama Topples Top Coup Leader After Washington Gunbattle,0
52,whatdoesitmean.com,Donald Trump Takeover Of Media Giants Leaves American Elites In Terror,0
53,whatdoesitmean.com,Russian Lawyer Who Met Trump Son Had “Torrid Affair” With New York Times Reporter,1
54,whatdoesitmean.com,“Judge Of Heaven” Appearance Stuns Scientists As Pope Moves To Calm Fears,0
55,whatdoesitmean.com,Stunning Experiment Proving God-Human Communication Link Blacklisted In West,0
56,whatdoesitmean.com,Snowden Documents Proving “US-Alien-Hitler” Link Stuns Russia,0
57,whatdoesitmean.com,Top CIA Officer Linked To Hillary Clinton Hit Team Thrown In Mental Ward By Trump Loyalists,0
58,whatdoesitmean.com,6 Children Dead After Trump Sends Brutal Message To CIA: “Your Families Are Next!”,0
59,whatdoesitmean.com,Hillary Clinton “Heart Failure Event” Warned Just Months Away,0
60,whatdoesitmean.com,US Bombs Russian Troops Who Discovered Obama’s Terror Leaders In Tennessee,0
61,whatdoesitmean.com,Obama Warned To Prepare For Hillary Clinton Death,0
62,whatdoesitmean.com,Russian Report States Total Defeat Of US Military Would Take 3 Weeks,0
63,whatdoesitmean.com,Bombshell Revelation Shows Russian Spy Chiefs Joined With Special Counsel Robert Mueller To Trap CIA Operative George Papadopoulos,0
64,whatdoesitmean.com,Russian Special Forces Converge On Massive Alien Spacecraft Debris Field In Iran,0
65,whatdoesitmean.com,Trial Of Most Powerful CIA Spy Ever Captured Pushes US And Turkey To Brink Of Total War,0
66,whatdoesitmean.com,G7 Trump Assassination Fears Rise After Plot To Kill Israeli Leader Leads To Arrest Of White House Defense Official,0
67,whatdoesitmean.com,Turkish President’s Son Who Raped And Murdered American And British Reporters Becomes Fugitive,0
68,whatdoesitmean.com,International Court Readies War Crime Charges Against US After CIA Assassinates Top Prosecutors Son,0
69,whatdoesitmean.com,Russian Lawyer At Heart Of Trump Probe Revealed To Be James Comey’s “FBI Snitch”,0
70,whatdoesitmean.com,"Obama Requests 15,000 Russian Troops For “Upcoming” Disaster",0
71,whatdoesitmean.com,War Crime File Opened Against Obama-Clinton For Backing Murderous Saudi Regime,0
72,whatdoesitmean.com,Thousands Of Russian Troops Rushed To US Northern Border And South America,0
73,whatdoesitmean.com,US Swine Flu Spray Plane Shot Down In China,0
74,whatdoesitmean.com,US Explodes After Russian Company Closes “CIA Backdoor” Embedded In All Microsoft Software,0
75,whatdoesitmean.com,Obama Warned Is Preparing World For Return Of “The Moon God”,0
76,whatdoesitmean.com,Western World Ponders Sorcha Faal “Trance-State” Writings—While Failing To Remember Stephen Hawking Warned It Would Wipe Out Universe,0
77,whatdoesitmean.com,Hillary Clinton Pleads With Top Russian Criminal To Protect Her From Trump Forces Targeting Massive Democratic Party Theft,0
78,whatdoesitmean.com,Shocking Alien Fears Force Pope From Office,0
79,whatdoesitmean.com,Donald Trump Freemasonic Forces Target Marco Rubio-Jeb Bush “Cocaine Empire”,0
80,whatdoesitmean.com,Obama’s “Worst Nightmare” Realized As Chinese Troops Flood Into Syria,0
81,whatdoesitmean.com,Russian Legal Experts Prepare Amusing Document Noting That Trump “Fixer” Michael Cohen Wasn’t Actually Charged With Any Election Crimes,0
82,whatdoesitmean.com,Obama Retreats To Secret Bunker As “Big Event” Draws Near,0
83,whatdoesitmean.com,Bush Family Rushes To Hillary Clinton Side After Top UN Official Set To Testify Against Her Found Dead,0
84,whatdoesitmean.com,Mother Of Obama “Love Child” Gunned Down By Elite Hit Squad,0
85,whatdoesitmean.com,Google Backed ANTIFA Attempt To Assassinate President Trump Captured On Video,0
86,whatdoesitmean.com,Putin Orders Massive Strike Against Saudi Arabia If West Attacks Syria,0
87,whatdoesitmean.com,German Spy Reveals Secret US-Hollow Earth Pact For Global Rule,0
88,whatdoesitmean.com,Obama Orders All On,0
89,whatdoesitmean.com,The Trial Of Hillary Clinton: The Case For Murder Grows,0
90,whatdoesitmean.com,Obama Fears Erupt As Trump Prepares To Declare George Soros National Security Threat,0
91,whatdoesitmean.com,Russian Forces Put On Full Combat Alert After Receiving Warning Rogue US Navy Faction Preparing To Fire On Chinese,0
92,whatdoesitmean.com,Obama Orders Assassination Of Top Mossad Agent In US,0
93,whatdoesitmean.com,Hillary Clinton “Disappearance” Leaves Russian Intelligence Experts Puzzled,0
94,whatdoesitmean.com,Obama Plan To Massacre Americans Chills Russia,0
95,whatdoesitmean.com,NATO Plan For “August War” Against Russia Warned Will Go Nuclear “In Minutes”,0
96,whatdoesitmean.com,Scientists Warn Gulf Of Mexico Sea Floor Fractured “Beyond Repair”,0
97,whatdoesitmean.com,Russian Pedophile Who Sent Pictures To Hillary Clinton Now Linked To FBI Plot Trying To Overthrow President Trump,1
98,whatdoesitmean.com,Zimmerman Show Trial Sends Shockwave Around World,0
99,whatdoesitmean.com,Obama Orders Hillary Clinton Arrest If Trump Assassinated,0
